,0,1,2,3,4,5,6,7,8,9,10,11,12,13,14,15,16,17,18,19,20,21,22,23,24,25,26,27,28
0, 100-Concert Band, Cade Middle School, TEA:, Victoria, Miranda Partida,CC,Varsity ,2018,132560,1,1,1,1,1,1,1,1,C, Honor Roll March (Mark Williams), Autumn Colors  (O'Reilly), Sparks  (Balmages),DATE of EVENT 03/07/2018 ,Region: 14,"1. Avila, Wanda","2. Duran, Roger","3. Mowles, Bobby","1. Avila, Ed","2. Finley, Lance","3. Young, Joe"
1, 100-Concert Band, Cade Middle School, TEA:, Victoria, Miranda Partida / Jennings Barnes,CC,Non-Varsity ,2018,132556,2,2,1,2,1,1,1,1,2, Fortis  (Gazlay), Courtlandt County Festival  (Owens), Royal March (John Kinyon),DATE of EVENT 03/07/2018 ,Region: 14,"1. Avila, Wanda","2. Duran, Roger","3. Mowles, Bobby","1. Avila, Ed","2. Finley, Lance","3. Young, Joe"
2, 100-Concert Band, Howell Middle School, TEA:, Victoria, Paula Smolik,CC,Non-Varsity ,2018,129584,1,1,1,1,1,2,1,1,D, Manchester March (Edmonson), Ghost Ship  (Story), Qin Shi's Stone Army  (Arcari),DATE of EVENT 03/07/2018 ,Region: 14,"1. Avila, Wanda","2. Duran, Roger","3. Mowles, Bobby","1. Avila, Ed","2. Finley, Lance","3. Young, Joe"
3, 100-Concert Band, Howell Middle School, TEA:, Victoria, Paula Smolik,CC,Varsity ,2018,129582,1,1,1,1,1,1,1,1,C, Colonel Bogey (Alford/Williams), Brave Spirit (Standridge), New Horizons  (Corrigan),DATE of EVENT 03/07/2018 ,Region: 14,"1. Avila, Wanda","2. Duran, Roger","3. Mowles, Bobby","1. Avila, Ed","2. Finley, Lance","3. Young, Joe"
4, 100-Concert Band, Patti Welder Middle School, TEA:, Victoria, Deborah Colley,CC,Non-Varsity ,2018,130763,2,1,1,1,1,2,2,2,2, Union March (Rogers), Dorian Chant (Calhoun), Night Fury (Chambers),DATE of EVENT 03/07/2018 ,Region: 14,"1. Avila, Wanda","2. Duran, Roger","3. Mowles, Bobby","1. Avila, Ed","2. Finley, Lance","3. Young, Joe"
5, 100-Concert Band, Patti Welder Middle School, TEA:, Victoria, Deborah Colley,CC,Varsity ,2018,130762,1,1,1,1,2,2,2,2,2, Captain Dane (William Owens), Tanchozuru (Standridge), Fireball (Beck),DATE of EVENT 03/07/2018 ,Region: 14,"1. Avila, Wanda","2. Duran, Roger","3. Mowles, Bobby","1. Avila, Ed","2. Finley, Lance","3. Young, Joe"
6, 100-Concert Band, Stroman Middle School, TEA:, Victoria, Michael Cason / Carlos Gonzalez; Mark Garlitos,CC,Varsity ,2018,133309,1,3,1,1,2,2,2,2,2, Fighting Falcon March (Todd Stalter), Uskudar  (Anon. or Trad./Smith/Story), Danza de Espana  (Chambers),DATE of EVENT 03/07/2018 ,Region: 14,"1. Avila, Wanda","2. Duran, Roger","3. Mowles, Bobby","1. Avila, Ed","2. Finley, Lance","3. Young, Joe"
7, 100-Concert Band, Travis MS, TEA:, Port Lavaca, Chris Hamelwright,CC,Varsity ,2018,130996,1,1,1,1,1,1,1,1,C, Mythos  (Bernotas), In a Quiet Place  (Calhoun), Spania (Shaffer),DATE of EVENT 03/07/2018 ,Region: 14,"1. Avila, Wanda","2. Duran, Roger","3. Mowles, Bobby","1. Avila, Ed","2. Finley, Lance","3. Young, Joe"
8, 100-Concert Band, Travis MS, TEA:, Port Lavaca, Kathryn Myers,CC,Non-Varsity ,2018,131008,2,2,2,2,2,2,1,2, , Royal March (Kinyon), Dorian Chant (Calhoun), Majestica  (Gazlay),DATE of EVENT 03/07/2018 ,Region: 14,"1. Avila, Wanda","2. Duran, Roger","3. Mowles, Bobby","1. Avila, Ed","2. Finley, Lance","3. Young, Joe"
