,Event,School,TEA,City,Directors,Conference,Classification,Year,ID,Stage Judge 1,Stage Judge 2,Stage Judge 3,Stage Final,SR Judge 1,SR Judge 2,SR Judge 3,SR Final,Award,Selection 1,Selection 2,Selection 3,oops
0, 100-Concert Band, A.C. Jones HS, TEA: 13901001, Beeville, Taytum Guzman / Brandon Brumbelow,AAAA,Varsity ,2022,175296,1,1,1,1,1,1,2,1,A, High School Cadets  (Sousa/Foster)," Simple Gifts, Four Shaker Songs - Mvt. II (Ticheli)", Steel  (Standridge),
1, 100-Concert Band, Aransas Pass HS, TEA: 205901, Aransas Pass, Robert Schneider / Ramiro Lichtenberger,AAA,Varsity ,2022,176973,1,1,1,1,1,1,2,1,A, Darklands March (Randall Standridge), As The Last Light Fades (24136)  (Bell)," Moscow, 1941 (15892)  (Balmages)",
2, 100-Concert Band, Bloomington HS, TEA: 235901001, Bloomington, Joshua Ferguson / Evan Woodson,AA,Non-Varsity ,2022,170423,3,3,3,3,1,1,1,1,2, Fighting Falcon March (Todd Stalter), Dance Celebration (647)  (Smith), Dorian Chant (20589) (Calhoun),
3, 100-Concert Band, Blunt MS, TEA: 205901, Corpus Christi, Ramiro Lichtenberger,C,Varsity ,2022,177015,3,2,3,3,1,1,1,1,2, Zig Zag (22324)  (OLoughlin), Armory (19597)  (Standridge), March of the Syncopated Penguins (Rudgers),
4, 100-Concert Band, George West HS, TEA: 149901, George West, Ella Lowrance,AAA,Varsity ,2022,177377,2,3,3,3,3,3,2,3, , Band in the Square on the Fourth of July (La Plante), As Twilight Falls (Sheldon), March of the Irish Guard (Ployhar),
5, 100-Concert Band, Goliad HS, TEA: 08802001, Goliad," Zach McCullough / Jen Bridges, Dawson Leffingwell",AAA,Varsity ,2022,174718,1,1,1,1,1,2,1,1,A, Le Sabre  (Eric Osterling), Colliding Visions (17502) (Balmages), Blue Ridge Saga (James Swearingen),
6, 100-Concert Band, Goliad MS, TEA: 0088902041, Goliad," Jen Bridges / Zach McCullough, Dawson Leffingwell",C,Varsity ,2022,174809,1,1,1,1,1,1,1,1,C, The Lone Eagle March (Edmondson), Conviction (18460)  (Clark), Armory (19597)  (Standridge),
7, 100-Concert Band, Goliad MS, TEA: 088902041, Victoria, Dawson Lee Leffingwell / Jennifer Bridges,C,Non-Varsity ,2022,174808,3,3,3,3,2,3,2,2, ," ""Synergy"" March (William Owens)", Elizabethan Dance (17482)  (Williams), Strength and Honor (24126)  (OLoughlin),
8, 100-Concert Band, Gregory Portland MS, TEA: 205902, Portland, Jeremy Anderson / Ryan Sanders,CCC,Varsity ,2022,171097,1,1,1,1,1,1,1,1,C, March to Castle Rock (Mark Williams), Laniakea (20752)  (Wilds), Galliard (22331)  (Watson),
9, 100-Concert Band, Gregory Portland MS, TEA: 205902, Portland, Ryan Sanders / Jeremy Anderson,CCC,Non-Varsity ,2022,171184,1,1,1,1,1,1,1,1,D, Spitfire (Story), Korean Hill Song (656) (Williams), Armory (19597) (Standridge),
10, 100-Concert Band, Ingleside HS, TEA: 205903, Ingleside, Kenneth Thurman / Dwight Dodd,AAAA,Varsity ,2022,170402,2,1,2,2,2,2,2,2, , Newcastle March (Vinson), In the Shining of the Stars (Sheldon), Two British Folksongs (Del Borgo),
11, 100-Concert Band, Mathis HS, TEA: 205-904, Mathis, Jonas Quintanilla,AAA,Varsity ,2022,172626,3,2,3,3,2,2,2,2, , Joyful Spirit  (Patrick J. Burns), As Twilight Falls (Robert Sheldon), Dreams Of Flying (Paul Clark),
12, 100-Concert Band, Mathis MS, TEA: 205-904-041, Corpus Christi," Mateo Reyes / Christopher Thrash, Jonas Quintanilla",C,Non-Varsity ,2022,171843,4,3,3,3,3,2,2,2, , Rose Hill March (Owens), Acropolis (Putnam), Annunciation (Story),
13, 100-Concert Band, Mathis MS, TEA: 205-904-041, Mathis, Christopher Thrash / Mateo Reyes,C,Varsity ,2022,171950,3,2,3,3,1,2,1,1,2, Espana Cani (Pascual Narro/ arr. Michael Story), Enchanted Island (Steve Rouse), Fortis (Gary Gazlay),
14, 100-Concert Band, Moreno MS, TEA: 013901041, Beeville," Alejandro Martinez / Pamela Langley, Brandon Brumbelow, Taytum Guzman",CC,Non-Varsity ,2022,175392,3,3,3,3,1,2,2,2, , Fortitude (William Owens), Plaza de Toros (20709)  (Story), Exhortation (18190)  (Gazlay),
15, 100-Concert Band, Moreno MS, TEA: 013901041, BEEVILLE," Pamela Langley / Alejandro Martinez, Brandon Brumbelow, Taytum Guzman",CC,Varsity ,2022,174638,1,1,1,1,1,1,2,1,C, March of the Minutemen (John Edmondson), Fortis (17484)  (Gazlay), Colliding Visions (17502) (Balmages),
16, 100-Concert Band, Odem HS, TEA: 205905001, Odem, Nathan Williams / Steven Rash,AAA,Non-Varsity ,2022,175427,2,2,3,2,2,2,1,2, , Pompeii Unearthed (Nowlin), Qin Shis Stone Army (19600)  (Arcari), Armory (19597)  (Standridge),
17, 100-Concert Band, Odem HS, TEA: 205905001, Odem, Steven Rash / Nathan Williams,AAA,Varsity ,2022,175362,1,3,2,2,1,1,1,1,1, Arsenal (Van der Roost), A Tribute to Grainger (711) (play all) (Grainger/Ragsdale), Helios: Dawn of a New Day (24144)  (Sterk),
18, 100-Concert Band, Odem JH, TEA: 205905041, Odem, Nathan Williams / Steven Rash,C,Varsity ,2022,175425,1,2,2,2,1,1,1,1,2, Valdres (Hanssen/Smith), Lost Woods Fantasy (22321)  (Hall), Gothic (24118)  (Arcari),
19, 100-Concert Band, Odem JH, TEA: 205905041, Odem, Steven Rash / Nathan Williams,C,Non-Varsity ,2022,175364,3,3,3,3,2,3,2,2, , March of the Syncopated Penguins (Rudgers), Acropolis (24113)  (Putnam), Dorian Chant (20589)  (Calhoun),
20, 100-Concert Band, Pettus HS, TEA: 013-903, Pettus, Clayton Capello,AA,Non-Varsity ,2022,176806,3,4,4,4,1,2,1,1,2, NewCastle March (Johnnie Vinson), As Twilight Falls  (Robert Sheldon), Atlantis (Anne McGinty),
21, 100-Concert Band, Refugio HS, TEA: 196903, Refugio, TED BUHRTS,AA,Varsity ,2022,178055,3,3,2,3,1,2,1,1,1, Acropolis (24113)  (Putnam), Strength and Honor (24126)  (OLoughlin), March Grandioso (Smith),
22, 100-Concert Band, Refugio JH, TEA: 196903, Refugio, Ted Buhrts,C,Varsity ,2022,178056,3,3,3,3,2,2,1,2, , Acropolis (24113)  (Putnam), Strength and Honor (24126)  (OLoughlin), March Grandioso (Smith),
23, 100-Concert Band, Rockport-Fulton HS, TEA: 004901001, Rockport, Ryan Thornberry / Andrew Weliver,AAAA,Varsity ,2022,177186,1,1,1,1,1,2,1,1,A, Free World (K.L. King), Kindred Spirits (Balmages), Dona Nobis Pacem (Sudduth),
24, 100-Concert Band, Rockport-Fulton MS, TEA: 2130521, Rockport, Andrew Weliver / Ryan Thornberry, Acc:None,CC,Non-Varsity ,2022,177527,1,1,1,1,1,1,1,1,D, Odyssey (18464)  (Branchfield), Armory (19597)  (Standridge), Plaza de Toros (Story)
25, 100-Concert Band, Santa Gertrudis HS, TEA: 137904001, Kingsville, S Mae Trevino Mendez,AAA,Non-Varsity ,2022,176839,1,1,1,1,1,1,1,1,C, St. Petersburg March (Vinson), Sketches of Canada (19608) (play 2 mvts) Mvts 1 & 2 (Story)," Moscow, 1941 (15892)  (Balmages)",
26, 100-Concert Band, Sinton HS, TEA: 205-0906, Sinton, Michael Solis,AAAA,Non-Varsity ,2022,175570,1,2,1,1,2,2,2,2,2, We the People (Swearingen), In The Bleak Midwinter (34)  (Holst/Bullock), Expectations (19603)  (Clark),
27, 100-Concert Band, Sinton HS, TEA: 205-0906, Sinton, Robert Flores,AAAA,Varsity ,2022,175032,1,1,1,1,1,1,1,1,A, Miss Liberty Concert March (King/Swearingen), Deir in De (186)  (Anon. or Trad./Barker), Accolade (18193)  (Himes),
28, 100-Concert Band, Skidmore-Tynan HS, TEA: 013905001, Skidmore, Chris Neal / Jesse Casarez,AAA,Varsity ,2022,176573,1,1,3,1,2,2,2,2,1, The Capitol March (William Foden arr. Todd Stalter), Dance Celebration (647) (Smith), Bazaar (20756)  (Standridge),
29, 100-Concert Band, Smith MS, TEA: 205-0906, Sinton, Michael Solis,CC,Non-Varsity ,2022,175567,3,2,2,2,2,2,2,2, , Infinity  (James Curnow), Sakura (62)  (Traditional/Story), In The Bleak Midwinter (34)  (Holst/Bullock),
30, 100-Concert Band, Smith MS, TEA: 205-0906, Sinton, Robert Flores,CC,Varsity ,2022,175047,1,1,1,1,2,2,1,2,2, Nottingham March (Jerry Williams), Dance Celebration (647)  (Smith), The Spacious Firmament on High (17494)  (Sharp),
31, 100-Concert Band, Taft HS, TEA: 205907001, Taft, Felix Hernandez,AAA,Varsity ,2022,176377,1,1,1,1,1,2,1,1,A, Prestissimo (King/Swearingen), Heavens Light (15874)  (Reineke), Flight of Eagles (99)  (Del Borgo),
32, 100-Concert Band, Taft JH, TEA: 205907, Taft, Joseph Guzman,C,Varsity ,2022,177541,3,3,3,3,1,1,1,1,2, First Light (Frank Ticheli), The Lone Eagle March (John Edmondson), Nottingham Castle (Larry Daehn),
33, 100-Concert Band, Taylor JH, TEA: 785655726, Ingleside, Dwight Dodd,CC,Varsity ,2022,171736,2,1,1,1,1,2,2,2,2, March Primo (Eveland), Gathering In The Glen (652)  (Sweeney), Bazaar (20756)  (Standridge),
34, 100-Concert Band, Three Rivers HS, TEA: 149902, Three Rivers, Meagan Stephens,AA,Varsity ,2022,177461,3,1,1,1,1,2,1,1,A, Darklands March  (Standridge ), Alpine Meadow (17477)  (Hodges), Night Fury (20593)  (Chambers),
35, 100-Concert Band, Tuloso-Midway HS, TEA: 178912, Corpus Christi," Camilo Salinas / Ralph Morales, Sabrina Vanderburg, Antonio De La Rosa, Laura Garcia, Eduardo Chavez",AAAA,Sub Non-Varsity ,2022,177297,3,2,3,3,2,2,1,2, ," ""Synergy March""  (William Owens )", Flight of Eagles (99)  (Del Borgo), Uskudar (16230)  (Anon. or Trad./Smith/Story),
36, 100-Concert Band, Tuloso-Midway HS, TEA: 178912, Corpus Christi," Ralph Morales / Sabrina Vanderburg, Antonio De La Rosa, Laura Lara, Eduardo Chavez & Camilo Salinas",AAAA,Varsity ,2022,176924,1,1,1,1,1,1,1,1,A, Wingfoot (Eveland), Jocuri Poporale Romanesti (Roumanian Folk Dances) (724) (play all) (Bartok/Yo Goto), Dance of the Jesters (16674)  (Tschaikowsky/Cramer),
37, 100-Concert Band, Tuloso-Midway HS, TEA: 178912, Corpus Christi," Sabrina Vanderburg / Ralph Morales, Camilo Salinas, Antonio De La Rosa, Laura Garcia, Eduardo Chavez",AAAA,Non-Varsity ,2022,177425,2,1,1,1,1,1,1,1,C, Beautiful River (18198)  (Lowry/Chambers), Imaginarium (20603)  (Standridge), The Streets of Madrid (Moss),
38, 100-Concert Band, Tuloso-Midway MS, TEA: 1789120417, Corpus Christi," Antonio De La Rosa / Ralph Morales, Sabrina Vanderburg, Laura Lara, Eduardo Chavez, Camilo Salinas",CC,Varsity ,2022,177294,2,2,2,2,1,2,1,1,2, Celtic Echoes (20598)  (Clark), Hypnotic Fireflies (18466)  (Balmages), Darklands March (Standridge),
39, 100-Concert Band, Tuloso-Midway MS, TEA: 1789120417, Corpus Christi," Laura Garcia / Antonio De La Rosa, Camilo Salinas, Eduardo Chavez, Rafael Morales, Sabrina Vanderburg",CC,Non-Varsity ,2022,177293,1,1,1,1,1,1,1,1,D, In the Bleak Midwinter  (Holst/Bullock), Armory (Standridge), Andalucia  (Lopez),
40, 100-Concert Band, West Oso HS, TEA: 178915, Corpus Christi," Carl Melton / David Alvarez, Gabriel Davila",AAAA,Varsity ,2022,174840,1,2,1,1,1,2,1,1,B, Tanchozuru (20595)  (Standridge), The Cottage On The Lake (24140)  (Swearingen), Boomerang March (Hale),
41, 100-Concert Band, West Oso JH, TEA: 178915, Corpus Christi," Gabriel Davila / Carl Melton, David Alvarez",CC,Non-Varsity ,2022,174845,1,1,2,1,1,1,1,1,D, Plaza de Toros (20709)  (Story), Conviction (18460)  (Clark), Integrity March (Owens),
42, 100-Concert Band, Woodsboro HS, TEA: 196902001, Woodsboro, Sherry Marshall,AA,Varsity ,2022,175523,3,3,4,3,2,2,2,2, , Manhattan Beach March (Sousa/ Story), Chester (21257)  (Billings/Osterling), Shadow of the Longship (20754)  (Rath),
