,0,1,2,3,4,5,6,7,8,9,10,11,12,13,14,15,16,17,18,19,20,21,22,23,24,25,26,27,28,29
0, 100-Concert Band, Aransas Pass HS, TEA:, Aransas Pass, Theresa O'Canas,AAA,Varsity ,2009,46114,2,2,1,2,2,2,1,2, , Midway March (Williams/Moss), The Willows of Winter (Brooks)," Moscow, 1941 (Balmages)",DATE of EVENT 04/14/2009 ,Region: 14,1. Ben Chasan,2. Bob Howard,3. John Stuckey,1. Dan Aleman,2. Leo Garza,3. Juan Jose Meave,
1, 100-Concert Band, Ben Bolt HS, TEA:, Ben Bolt, Michael Taylor,A,Varsity ,2009,48121,3,3,4,3,1,2,2,2, , Knights of Dunvegan  (Meyer), Crusade  (Gassi), Mighty Mite (Mesang/O'Loughlin),DATE of EVENT 04/14/2009 ,Region: 14,1. Ben Chasan,2. Bob Howard,3. John Stuckey,1. Dan Aleman,2. Leo Garza,3. Juan Jose Meave,
2, 100-Concert Band, Bloomington HS, TEA:, Bloomington, Gloria Wilhelm / Ms. Ashley Wilhelm,AA,Var-Composite ,2009,49130,3,2,2,2,4,3,3,3, , With Valor and Honor (Williams), Kenya Contrasts  (Himes), Joy (Ticheli),DATE of EVENT 04/14/2009 ,Region: 14,1. Ben Chasan,2. Bob Howard,3. John Stuckey,1. Dan Aleman,2. Leo Garza,3. Juan Jose Meave,
3, 100-Concert Band, Blunt MS, TEA:, Aransas pass, Daci Crockett / Theresa O'Canas, Acc:n/a,CC,Varsity ,2009,46699,3,3,3,3,2,1,2,2, , Modal Song and Dance  (Del Borgo), Ave Verum Corpus  (Mozart/Williams), Silver Eagle March (Feldstein),DATE of EVENT 04/14/2009 ,Region: 14,1. Ben Chasan,2. Bob Howard,3. John Stuckey,1. Dan Aleman,2. Leo Garza,3. Juan Jose Meave
4, 100-Concert Band, George West JH, TEA:, George West, Jim Cordani / Jim Williamson,C,Varsity ,2009,49458,1,1,1,1,1,1,1,1,C, March of the Irish Guard (Ployhar), The Band in the Square on the Fourth of July  (LaPlante), Quintology  (Meyer),DATE of EVENT 04/14/2009 ,Region: 14,1. Ben Chasan,2. Bob Howard,3. John Stuckey,1. Dan Aleman,2. Leo Garza,3. Juan Jose Meave,
5, 100-Concert Band, Goliad Middle School, TEA:, Goliad, Jen Bridges / Larry Barnett,C,Varsity ,2009,46820,2,2,2,2,2,1,2,2, , New South Wales March (Edmondson), Tunbridge Meadows  (Williams), Crusade  (Gassi),DATE of EVENT 04/14/2009 ,Region: 14,1. Ben Chasan,2. Bob Howard,3. John Stuckey,1. Dan Aleman,2. Leo Garza,3. Juan Jose Meave,
6, 100-Concert Band, Ingleside HS, TEA:, Ingleside, Josh Rombs / Jerral Hawes and Juan Ocanas,AAA,Varsity ,2009,45261,2,1,2,2,1,1,1,1,1, Coast Guards March (King/Swearingen), Salvation is Created  (Tschesnokoff/Houseknecht)," Simple Gifts, Four Shaker Songs Mvts 1, 2, 4 (Ticheli)",DATE of EVENT 04/14/2009 ,Region: 14,1. Ben Chasan,2. Bob Howard,3. John Stuckey,1. Dan Aleman,2. Leo Garza,3. Juan Jose Meave,
7, 100-Concert Band, Leon Taylor Jr. High, TEA:, Ingleside, Jerral Hawes / Josh Rombs,CC,Varsity ,2009,48084,3,3,3,3,3,2,3,3, , Royal March (Kinyon), Chester  (Billings/Tolmage/Osterling), La Rejouissance  (Handel/Williams),DATE of EVENT 04/14/2009 ,Region: 14,1. Ben Chasan,2. Bob Howard,3. John Stuckey,1. Dan Aleman,2. Leo Garza,3. Juan Jose Meave,
8, 100-Concert Band, Odem HS, TEA:, Odem, Vince Smith,AA,Varsity ,2009,49280,2,1,3,2,1,2,1,1,1, Alamo  (King /Swearingen), They Led My Lord Away  (Gordon/Allen), Flight of Eagles  (Del Borgo),DATE of EVENT 04/14/2009 ,Region: 14,1. Ben Chasan,2. Bob Howard,3. John Stuckey,1. Dan Aleman,2. Leo Garza,3. Juan Jose Meave,
9, 100-Concert Band, Odem JH, TEA:, Odem, Steven Rash,C,Varsity ,2009,48779,2,3,4,3,2,2,1,2, , Medieval Legend  (Story), While I Watch the Yellow Wheat  (Daehn), March for the 95th (Cummings),DATE of EVENT 04/14/2009 ,Region: 14,1. Ben Chasan,2. Bob Howard,3. John Stuckey,1. Dan Aleman,2. Leo Garza,3. Juan Jose Meave,
10, 100-Concert Band, Odem JH, TEA:, Odem, Vince Smith,C,Non-Varsity ,2009,49284,4,3,3,3,3,1,3,3, , Yorktown March (Edmondson), Ye Banks and Braes O' Bonnie Doon  (Trad./Sweeny), Voodoo Dance  (del Borgo),DATE of EVENT 04/14/2009 ,Region: 14,1. Ben Chasan,2. Bob Howard,3. John Stuckey,1. Dan Aleman,2. Leo Garza,3. Juan Jose Meave,
11, 100-Concert Band, Port Aransas HS, TEA:, Port Aransas, Jim,A,Varsity ,2009,49824,2,1,1,1,1,1,1,1,B, Hola (Marks), Contempo  (Story), Whirlwind  (Blackshaw),DATE of EVENT 04/14/2009 ,Region: 14,1. Ben Chasan,2. Bob Howard,3. John Stuckey,1. Dan Aleman,2. Leo Garza,3. Juan Jose Meave,
12, 100-Concert Band, Refugio HS, TEA:, Refugio, Charles Horton / Marcie Raymond,AA,Varsity ,2009,45920,1,2,2,2,3,2,3,3, , La Rejouissance  (Handel/Williams), Dance Celebration  (Smith), Honor Guard March (Chattaway),DATE of EVENT 04/14/2009 ,Region: 14,1. Ben Chasan,2. Bob Howard,3. John Stuckey,1. Dan Aleman,2. Leo Garza,3. Juan Jose Meave,
13, 100-Concert Band, Sinton High School, TEA:, Sinton, Robert Mendez,Non-Varsity ,2009,45191,2,2,2,2,2,1,1,1,2, Cedar Point March (Gingery), La Rejouissance  (Handel/Williams), Portrait of a Clown  (Ticheli),DATE of EVENT 04/14/2009 ,Region: 14,1. Ben Chasan,2. Bob Howard,3. John Stuckey,1. Dan Aleman,2. Leo Garza,3. Juan Jose Meave,,
14, 100-Concert Band, Sinton HS, TEA:, Sinton, Robert Flores,Varsity ,2009,45104,1,1,1,1,1,1,1,1,A, On Wings of Eagles Concert March (Huckeby)," Moscow, 1941 (Balmages)", Lux Arumque  (Whitacre),DATE of EVENT 04/14/2009 ,Region: 14,1. Ben Chasan,2. Bob Howard,3. John Stuckey,1. Dan Aleman,2. Leo Garza,3. Juan Jose Meave,,
15, 100-Concert Band, Sinton JH, TEA:, Sinton, Robert L. Flores,Varsity ,2009,45182,2,2,1,2,2,1,1,1,2, Rudimentary March (Fagan), Song of Hope  (Swearingen), La Rejouissance  (Handel/Williams),DATE of EVENT 04/14/2009 ,Region: 14,1. Ben Chasan,2. Bob Howard,3. John Stuckey,1. Dan Aleman,2. Leo Garza,3. Juan Jose Meave,,
16, 100-Concert Band, Skidmore-Tynan HS, TEA:, Skidmore, Homer Yzaguirre,AA,Varsity ,2009,49267,2,2,2,2,3,1,2,2, , Gallito (Lope/Weger), The Harmonious Blacksmith  (Handel/Osterling), Blue Ridge Saga  (Swearingen),DATE of EVENT 04/14/2009 ,Region: 14,1. Ben Chasan,2. Bob Howard,3. John Stuckey,1. Dan Aleman,2. Leo Garza,3. Juan Jose Meave,
17, 100-Concert Band, Smith MS, TEA:, Sinton, Robert Mendez,CC,Non-Varsity ,2009,45188,3,3,2,3,3,2,2,2, , Straford March (Higgins), Court Festival (Pearson), Dance Celebration  (Smith),DATE of EVENT 04/14/2009 ,Region: 14,1. Ben Chasan,2. Bob Howard,3. John Stuckey,1. Dan Aleman,2. Leo Garza,3. Juan Jose Meave,
18, 100-Concert Band, Taft HS, TEA:, Taft," Roy Hinojosa / Luis Zepeda, Ramiro Lichtenberger",AA,Varsity ,2009,46077,1,1,1,1,1,1,1,1,A, The High School Cadets March (Sousa), American Riversongs (LePlante), Longford Legend Mv. 2 (Sheldon),DATE of EVENT 04/14/2009 ,Region: 14,1. Ben Chasan,2. Bob Howard,3. John Stuckey,1. Dan Aleman,2. Leo Garza,3. Juan Jose Meave,
19, 100-Concert Band, Taft JH, TEA:, Taft, Ramiro Lichtenberger,C,Varsity ,2009,46052,1,1,2,1,2,2,1,2,2, Mount Royal March (Edmonson), Cascadia Celebration  (Hodges), Pinnacle  (Grice),DATE of EVENT 04/14/2009 ,Region: 14,1. Ben Chasan,2. Bob Howard,3. John Stuckey,1. Dan Aleman,2. Leo Garza,3. Juan Jose Meave,
20, 100-Concert Band, West Oso HS, TEA:, Corpus Christi," Carl Melton / Gabriel Davila, Shawn Athey",AAA,Varsity ,2009,45764,1,1,1,1,3,2,2,2,1, Captain Dane (March) (Owens), Abracadabra  (Ticheli)," Moscow, 1941  (Balmages)",DATE of EVENT 04/14/2009 ,Region: 14,1. Ben Chasan,2. Bob Howard,3. John Stuckey,1. Dan Aleman,2. Leo Garza,3. Juan Jose Meave,
21, 100-Concert Band, West Oso JH, TEA:, Corpus Christi, Gabriel Davila / Shawn Athey,CC,Varsity ,2009,46051,3,3,3,3,4,4,4,4, , Onward and Upward (Concert March) (Owens / Trn), Contempo  (Story), Fire Dance  (Akey),DATE of EVENT 04/14/2009 ,Region: 14,1. Ben Chasan,2. Bob Howard,3. John Stuckey,1. Dan Aleman,2. Leo Garza,3. Juan Jose Meave,
22, 100-Concert Band, Woodsboro HS, TEA:, Woodsboro, Florencio Lara,A, ,2009,42799,4,3,4,4,3,3,2,3, , Valley Forge March (Edmondson), Modal Song and Dance  (Del Borgo), Fugue in Bb Major  (Bach/Daehn),DATE of EVENT 04/14/2009 ,Region: 14,1. Ben Chasan,2. Bob Howard,3. John Stuckey,1. Dan Aleman,2. Leo Garza,3. Juan Jose Meave,
