,0,1,2,3,4,5,6,7,8,9,10,11,12,13,14,15,16,17,18,19,20,21,22,23,24,25,26,27,28
0, 100-Concert Band, Austin Middle School, TEA:, Irving," Jamie Cabot / Sean Morrow, Jon Cabot",CC,Non-Varsity ,2015,106587,2,1,1,1,1,1,1,1,D, Character (Clark), Stratosphere (Beckham/), Fortis (Gazlay/),DATE of EVENT 03/05/2015 ,Region: 20,1. Larry Barton,2. Rylon Guidry,3. Jed Maus,1. Rick Baker,2. Chris Meredith,3. Denise Stitzel
1, 100-Concert Band, Austin Middle School, TEA:, Irving," Jamie Cabot / Sean Morrow, Jon Cabot",CC,Varsity ,2015,99633,1,1,1,1,1,1,1,1,C, Marche Diabolique (Balmages), An Irish Interlude  (Barker/ )," Simple Gifts, Four Shaker Songs (play mvt 1, 2, or 4) (Ticheli/ )",DATE of EVENT 03/05/2015 ,Region: 20,1. Larry Barton,2. Rylon Guidry,3. Jed Maus,1. Rick Baker,2. Chris Meredith,3. Denise Stitzel
2, 100-Concert Band, Bessie Coleman Middle School, TEA:, Cedar Hill, Chris Sample / Nancy Brown,CC,Varsity ,2015,98796,2,2,2,2,3,3,3,3, ," The ""X"" Brigade (Longfield/)", Our Kingsland Spring  (Hazo/ ), Heroes Triumphant  (Owens/ ),DATE of EVENT 03/05/2015 ,Region: 20,1. Larry Barton,2. Rylon Guidry,3. Jed Maus,1. Rick Baker,2. Chris Meredith,3. Denise Stitzel
3, 100-Concert Band, Bowie Middle School, TEA:, Irving, Kyle McKinzey / Sergio Mendez,CC,Varsity ,2015,97641,2,2,3,2,3,3,3,3, , Entry March (McKinzey), In The Bleak Midwinter  (Holst/Bullock), Japanese Pictures  (Mixon/ ),DATE of EVENT 03/05/2015 ,Region: 20,1. Larry Barton,2. Rylon Guidry,3. Jed Maus,1. Rick Baker,2. Chris Meredith,3. Denise Stitzel
4, 100-Concert Band, Bowie Middle School, TEA:, Irving, Sergio Mendez,CC,Non-Varsity ,2015,97291,3,2,3,3,4,3,3,3, , A Victory March (Kyle McKinzey), Atlantis (Anne McGinty), Fortis (Gary Gazlay),DATE of EVENT 03/05/2015 ,Region: 20,1. Larry Barton,2. Rylon Guidry,3. Jed Maus,1. Rick Baker,2. Chris Meredith,3. Denise Stitzel
5, 100-Concert Band, Coppell Middle School North, TEA:, Coppell, Allie Hibert,CC,Non-Varsity ,2015,97693,1,1,1,1,1,1,1,1,D, Alamo March (King/Swearingen)," Simple Gifts, Four Shaker Songs (play at least three mvts) (Ticheli/ )", Flight of Eagles  (Del Borgo/ ),DATE of EVENT 03/05/2015 ,Region: 20,1. Larry Barton,2. Rylon Guidry,3. Jed Maus,1. Rick Baker,2. Chris Meredith,3. Denise Stitzel
6, 100-Concert Band, Coppell Middle School North, TEA:, Coppell, Jeremy Lindquist,CC,Varsity ,2015,97111,1,1,1,1,1,1,1,1,C, Under the Double Eagle March (Wagner/Laurendeau), Second Suite for Band in F Major  (Holst/Fennell), Themes from Green Bushes  (Grainger/Daehn),DATE of EVENT 03/05/2015 ,Region: 20,1. Larry Barton,2. Rylon Guidry,3. Jed Maus,1. Rick Baker,2. Chris Meredith,3. Denise Stitzel
7, 100-Concert Band, Coppell Middle School West, TEA:, Coppell, Greg McCutcheon,CC,Sub Non-Varsity ,2015,98790,2,2,1,2,2,2,1,2, , Spitfire (Story), Courtlandt County Festival  (Owens), Dance Celebration  (Smith),DATE of EVENT 03/05/2015 ,Region: 20,1. Larry Barton,2. Rylon Guidry,3. Jed Maus,1. Rick Baker,2. Chris Meredith,3. Denise Stitzel
8, 100-Concert Band, Coppell Middle School West, TEA:, Coppell, Greg McCutcheon,CC,Varsity ,2015,98789,1,1,1,1,1,1,1,1,C, Kingsfold March (Victor Flowers), Shepherd's Hey  (Grainger/Rogers), Summer Dances  (Balmages/ ),DATE of EVENT 03/05/2015 ,Region: 20,1. Larry Barton,2. Rylon Guidry,3. Jed Maus,1. Rick Baker,2. Chris Meredith,3. Denise Stitzel
9, 100-Concert Band, Coppell Middle School West, TEA:, Coppell, Whitney R. Katz,CC,Non-Varsity ,2015,97399,1,1,1,1,1,1,1,1,D, Spania! (David Shaffer), Colliding Visions (Brian Balmages), Adrenaline Engines (Randall D. Standridge),DATE of EVENT 03/05/2015 ,Region: 20,1. Larry Barton,2. Rylon Guidry,3. Jed Maus,1. Rick Baker,2. Chris Meredith,3. Denise Stitzel
10, 100-Concert Band, Coppell MS East, TEA:, Coppell, Rick Villarreal,CC,Varsity ,2015,98924,1,1,1,1,1,1,1,1,C, Pepita Greus Pasodoble (Pascual Perez Chovi/Gore), Down by the Salley Gardens  (Anon. or Trad./Sweeny), Variations on a Korean Folk Song  (Chance/ ),DATE of EVENT 03/05/2015 ,Region: 20,1. Larry Barton,2. Rylon Guidry,3. Jed Maus,1. Rick Baker,2. Chris Meredith,3. Denise Stitzel
11, 100-Concert Band, Coppell MS East, TEA:, Coppell, Rusty Gray,CC,Non-Varsity ,2015,99625,1,1,1,1,1,1,1,1,D, Captain Dane March (Owens), As Twilight Falls  (Sheldon/ )," Moscow, 1941  (Balmages/ )",DATE of EVENT 03/05/2015 ,Region: 20,1. Larry Barton,2. Rylon Guidry,3. Jed Maus,1. Rick Baker,2. Chris Meredith,3. Denise Stitzel
12, 100-Concert Band, Crockett Middle School, TEA:, Irving, Jay Smith / Gary Reddoch,CC,Varsity ,2015,99506,1,1,1,1,1,1,1,1,C, Spirit of New Orleans (Paul Murtha), New Horizons  (Corrigan/ ), Japanese Pictures  (Mixon/ ),DATE of EVENT 03/05/2015 ,Region: 20,1. Larry Barton,2. Rylon Guidry,3. Jed Maus,1. Rick Baker,2. Chris Meredith,3. Denise Stitzel
13, 100-Concert Band, DeZavala Middle School, TEA:, Irving, Melissa Romano / Alison Maguire-Powell,CC,Varsity ,2015,99249,2,1,2,2,1,1,1,1,2, Heritage Days (John Edmondson), Mosswood Lullaby (Brian Beck), Mythos (Chris Bernotas),DATE of EVENT 03/05/2015 ,Region: 20,1. Larry Barton,2. Rylon Guidry,3. Jed Maus,1. Rick Baker,2. Chris Meredith,3. Denise Stitzel
14, 100-Concert Band, Frank Seale Middle School, TEA:, Midlothian, Courtney Melton / Terry Maxwell,CC,Non-Varsity ,2015,100365,1,1,1,1,2,2,2,2,2, Espana Cani (Narro/Story), Colliding Visions  (Balmages), Our Kingsland Spring  (Hazo),DATE of EVENT 03/05/2015 ,Region: 20,1. Larry Barton,2. Rylon Guidry,3. Jed Maus,1. Rick Baker,2. Chris Meredith,3. Denise Stitzel
15, 100-Concert Band, Frank Seale Middle School, TEA:, Midlothian, Terry Maxwell,CC,Varsity ,2015,100364,1,1,1,1,1,1,1,1,C, Bravura (Duble/ Thurston), La Madre de los Gatos  (Beck/ ), Joy Revisited  (Ticheli/ ),DATE of EVENT 03/05/2015 ,Region: 20,1. Larry Barton,2. Rylon Guidry,3. Jed Maus,1. Rick Baker,2. Chris Meredith,3. Denise Stitzel
16, 100-Concert Band, Houston Middle School, TEA:, Irving, Justin Thomas / Ryan Baxter,CC,Varsity ,2015,100095,2,1,2,2,1,1,1,1,2, Spania (Shaffer), Our Kingsland Spring  (Hazo/ )," Moscow, 1941  (Balmages/ )",DATE of EVENT 03/05/2015 ,Region: 20,1. Larry Barton,2. Rylon Guidry,3. Jed Maus,1. Rick Baker,2. Chris Meredith,3. Denise Stitzel
17, 100-Concert Band, Lady Bird Johnson Middle School, TEA:, Irving, Donald G Jackson / Mrs. Elizabeth Kaloi,CC,Non-Varsity ,2015,100457,3,2,3,3,3,2,3,3, , Dance Celebration  (Smith/ ), Corps of Discovery  (Owens/ ), Fallbrook March (John O'Rielly),DATE of EVENT 03/05/2015 ,Region: 20,1. Larry Barton,2. Rylon Guidry,3. Jed Maus,1. Rick Baker,2. Chris Meredith,3. Denise Stitzel
18, 100-Concert Band, Lady Bird Johnson MS, TEA:, Irving, Elizabeth Sutton,CC,Varsity ,2015,100673,2,2,1,2,2,2,2,2, , Bavarian Trails March (Joseph Compello), Fire Dance (Douglas Akey), Cumberland Cross (Carl Strommen),DATE of EVENT 03/05/2015 ,Region: 20,1. Larry Barton,2. Rylon Guidry,3. Jed Maus,1. Rick Baker,2. Chris Meredith,3. Denise Stitzel
19, 100-Concert Band, Lamar Middle School, TEA:, Irving, Jung Mour / Ellen LeDoux,CC,Varsity ,2015,99923,2,1,2,2,2,2,3,2, , Sparks (Brian Balmages), With LIberty For All (Ken Harris), Heroes Triumphant (William Owens),DATE of EVENT 03/05/2015 ,Region: 20,1. Larry Barton,2. Rylon Guidry,3. Jed Maus,1. Rick Baker,2. Chris Meredith,3. Denise Stitzel
20, 100-Concert Band, Permenter Middle School, TEA:, Cedar Hill, Amy E. Baker / Beth Banks-Baskin,CC,Varsity ,2015,100202,2,2,2,2,2,2,2,2, , Spania Spanish March (Shaffer), Japanese Pictures (Kevin Mixon), Two British Folk Songs (Elliot Del Borgo),DATE of EVENT 03/05/2015 ,Region: 20,1. Larry Barton,2. Rylon Guidry,3. Jed Maus,1. Rick Baker,2. Chris Meredith,3. Denise Stitzel
21, 100-Concert Band, Sam Houston Middle School, TEA:, Irving, Ryan Baxter / Justin Thomas,CC,Non-Varsity ,2015,99991,2,1,2,2,2,3,1,2, , Fields of Glory (Elliot Del Borgo), Mystery Ride  (White/ ), Cahokia  (Spears/ ),DATE of EVENT 03/05/2015 ,Region: 20,1. Larry Barton,2. Rylon Guidry,3. Jed Maus,1. Rick Baker,2. Chris Meredith,3. Denise Stitzel
22, 100-Concert Band, Travis Middle School, TEA:, Irving, Brad Spellicy / Candace Rodriguez,CCC,Varsity ,2015,100443,2,2,3,2,3,4,4,4, , Pride of Sea March (Craig Biondi), Colliding Visions (Balmages/ ), Adrenaline Engines (Standridge),DATE of EVENT 03/05/2015 ,Region: 20,1. Larry Barton,2. Rylon Guidry,3. Jed Maus,1. Rick Baker,2. Chris Meredith,3. Denise Stitzel
23, 100-Concert Band, Walnut Grove Middle School, TEA:, Midlothian, Andrea Tenant,CCC,Non-Varsity A,2015,99084,1,1,1,1,1,1,1,1,D, Valley Forge March (John Edmondson), Kenya Contrasts  (Himes/ ), Two British Folk Songs  (Anon. or Trad./Del Borgo),DATE of EVENT 03/05/2015 ,Region: 20,1. Larry Barton,2. Rylon Guidry,3. Jed Maus,1. Rick Baker,2. Chris Meredith,3. Denise Stitzel
24, 100-Concert Band, Walnut Grove Middle School, TEA:, Midlothian, Angelyn Seppeler,CCC,Varsity ,2015,99078,1,1,1,1,1,1,1,1,C, Rough Riders (Karl L King/Swearingen), Butterfly's Ball (Ryan Fraley), J.S. Jig (Brant Karrick),DATE of EVENT 03/05/2015 ,Region: 20,1. Larry Barton,2. Rylon Guidry,3. Jed Maus,1. Rick Baker,2. Chris Meredith,3. Denise Stitzel
