,Event,School,TEA,City,Directors,Conference,Classification,Year,ID,Stage Judge 1,Stage Judge 2,Stage Judge 3,Stage Final,SR Judge 1,SR Judge 2,SR Judge 3,SR Final,Award,Selection 1,Selection 2,Selection 3
0, 100-Concert Band, Bayside Intermediate, TEA:, League City, Kyle Mapp / Carlos Cabrera,CC,Varsity ,2021,165136,1,1,1,1,1,1,1,1,C, Hoosier Pride (John Edmondson), New Horizons  (Bruce Corrigan), Moscow 1941 (Brian Balmages)
1, 100-Concert Band, Brookside Intermediate School, TEA:, Friendswood, Andie Troutman / Jennifer Rogers,CCC,Varsity ,2021,165033,1,1,1,1,1,1,1,1,C, The Streets of Madrid (Moss), Danza de Espana  (Chambers), Bazaar  (Standridge)
2, 100-Concert Band, Clear Lake Intermediate School, TEA:, Houston," Doug Parmer / Chris Davis, Andrew Keller",CC,Varsity ,2021,165847,1,1,1,1,1,1,1,1,C, Bonds of Unity March (King/Swearingen), Festival of Flight  (Weller)," Moscow, 1941  (Balmages)"
3, 100-Concert Band, Creekside, TEA:, League City, Ana Tran / Thomas Macias,CC,Varsity ,2021,165306,2,1,1,1,1,1,1,1,C, Newcastle March (Johnnie Vinson), Japanese Pictures  (Mixon), Into the Arctic  (Balmages)
4, 100-Concert Band, LEAGUE CITY INTERMEDIATE, TEA:, LEAGUE CITY, Rick Brockway,CCC,Varsity ,2021,164609,1,1,1,1,1,1,1,1,C, The Thunderer (Sousa/Brion & Schissel), Appalachian Morning  (Sheldon), Conviction (Clark)
5, 100-Concert Band, Seabrook Intermediate, TEA:, Seabrook, Austin Tran / Matthew McCoy,CC,Varsity ,2021,165137,1,2,1,1,1,1,1,1,C, Marche Diabolique (Balmages), Tudor Sketches (play mvts 1 & 2 or mvts 2 & 3) (Owens), La Madre de los Gatos (Beck)
6, 100-Concert Band, Space Center Intermediate, TEA:, Houston, Bernadette Walls / Dylan Dann,CCC,Non-Varsity ,2021,165809,1,1,1,1,1,1,1,1,D, Infinity March  (James Curnow), Dance Celebration  (Smith), Big Sky Round-Up  (Sheldon)
7, 100-Concert Band, Victory Lakes Intermediate School, TEA:, League City," Bennett Parsons / Travis Howell, Keoni Cunningham, Jon Witmer",CCC,Varsity ,2021,164991,1,1,1,1,1,1,1,1,C, Kingsfold March (Victor Flowers), Summer Resounding (Brian Balmages), Brave Spirit (Randall Standridge)
8, 100-Concert Band, Westbrook Intermediate, TEA:, Friendswood, Jane Maloy / Martin Andrada,CCC,Varsity ,2021,165214,2,1,1,1,1,1,1,1,C, Peacemaker March (King/Swearingen), Sunchaser  (Chambers), Ghost Fleet  (Sheldon)
