,Event,School,TEA,City,Directors,Conference,Classification,Year,ID,Stage Judge 1,Stage Judge 2,Stage Judge 3,Stage Final,SR Judge 1,SR Judge 2,SR Judge 3,SR Final,Award,Selection 1,Selection 2,Selection 3
0, 100-Concert Band, High School, TEA:, Atlanta, Keith Sanders,AAA,Varsity ,2008,38224,1,1,1,1,1,1,1,1,A, The Gladiator's Farewell (Blankenburg), Old Scottish Melody  (Wiley), Glengarry Way  (Strommen)
1, 100-Concert Band, Liberty-Eylau H.S., TEA:, Texarkana, Stephanie Blackwell,AAA,Varsity ,2008,35505,3,4,2,3,2,2,3,2, , Nobles of the Mystic Shrine (Sousa/Bullock), Deir in De  (Anon. or Trad./Barker), Cajun Folk Songs  (Ticheli)
2, 100-Concert Band, Mt. Vernon HS, TEA:, Mt. Vernon, Tanya S. Eckstein,AAA,Varsity ,2008,40712,3,2,3,3,3,2,2,2, , Hosts of Freedom (King/Paynter), Blacksmith Variations  (Mahaffey), Connemara Sketches  (Osborne)
3, 100-Concert Band, Pittsburg High School, TEA:, Pittsburg, Jason Steele,AAA,Varsity ,2008,42142,1,1,1,1,1,2,1,1,A, The Battle of Shiloh (Barnhouse / Paynter), Old Scottish Melody  (Wiley), Pablo!  (Meyer)
4, 100-Concert Band, Pleasant Grove High School, TEA:, Texarkana, Arnie Lawson,AAA,Varsity ,2008,40139,1,1,1,1,1,1,1,1,B, Ricercare  (Stamp), Chorale and Shaker Dance  (Zdechlik), Brighton Beach March ()
5, 100-Concert Band, Sabine High School, TEA:, Gladewater, Bobby Richardson,AAA,Varsity ,2008,42299,2,2,2,2,1,1,1,1,1, The Pathfinder Of Panama (Sousa/Dvorak), Molly On The Shore  (Grainger/Rogers/SMC), Concert Variations  (Smith)
6, 100-Concert Band, Spring Hill HS, TEA:, Longview, Randy Kiser,AAA,Varsity ,2008,41896,1,1,1,1,1,1,1,1,A, Don Ricardo (Gabriel Musella), The Fire of Eternal Glory  (Shostakovich/Rhea), Pablo!  (Meyer)
