,0,1,2,3,4,5,6,7,8,9,10,11,12,13,14,15,16,17,18,19,20,21,22,23,24,25,26,27,28
0, 100-Concert Band, Highland Middle School, TEA:, Fort Worth, Missy Danforth,CC,Varsity ,2021,164505,1,1,1,1,1,1,1,1,C, Mystery Bay March (Steve Hodges), Mythos (Chris Bernotas), Portsmouth Reflections (Michael Oare),DATE of EVENT 03/31/2021 ,Region: 30,1. Denise Stitzel,2. Danny Prado,3. Stephen Lisko,1. Christin Bunch,2. Eddie Russell,3. Justin Wood
1, 100-Concert Band, Keller Middle - Bear Creek Intermediate, TEA:, Keller," Jed Maus / Alexander Johnson, Kevin Cantu",CCC,Varsity ,2021,163897,1,1,1,1,1,1,1,1,C, Gladiator March (Sousa), Trittico Movement I (Nelhybel), Ave Maria (Biebl/Cameron),DATE of EVENT 03/31/2021 ,Region: 30,1. Denise Stitzel,2. Danny Prado,3. Stephen Lisko,1. Christin Bunch,2. Eddie Russell,3. Justin Wood
2, 100-Concert Band, Vista Ridge Middle School, TEA:, Fort Worth," Jennifer Alcocer / Emily Edwards, Jordan Canales, Ben Moore",CC,Varsity ,2021,162131,1,1,1,1,1,1,1,1,C, Sparks  (Balmages), Legend of Knife River  (Bulla), St. Petersburg March (Johnnie Vinson),DATE of EVENT 03/31/2021 ,Region: 30,1. Denise Stitzel,2. Danny Prado,3. Stephen Lisko,1. Christin Bunch,2. Eddie Russell,3. Justin Wood
3, 100-Concert Band, Wayside Middle School, TEA:, Fort Worth," Ben Shaffer / Taylor Gaskins, Stuart Spoon",CC,Varsity ,2021,163605,1,1,1,1,1,1,1,1,C, Copper Creek March (John Edmondson), Colliding Visions  (Balmages), Pinnacle  (Grice),DATE of EVENT 03/31/2021 ,Region: 30,1. Denise Stitzel,2. Danny Prado,3. Stephen Lisko,1. Christin Bunch,2. Eddie Russell,3. Justin Wood
4, 100-Concert Band, Wayside Middle School, TEA:, Fort Worth," Taylor Gaskins / Dr. Benjamin Shaffer, Stuart Spoon",CC,Non-Varsity ,2021,163617,2,2,1,2,2,1,1,1,2, Fighting Falcon March (Todd Stalter), For King and Crown  (Branchfield), Night Fury  (Chambers),DATE of EVENT 03/31/2021 ,Region: 30,1. Denise Stitzel,2. Danny Prado,3. Stephen Lisko,1. Christin Bunch,2. Eddie Russell,3. Justin Wood
5, 100-Concert Band, Willkie MS (EMS-ISD), TEA:, Fort Worth, Cara Shaffer / Karri Boyd,CC,Varsity ,2021,163604,DNA,DNA,DNA,DNA,DNA,DNA,DNA,DNA, , Andalucia (Lopez), Colliding Visions (Balmages), Qin Shi's Stone Army (Arcari / Fischer),DATE of EVENT 03/31/2021 ,Region: 30,1. Denise Stitzel,2. Danny Prado,3. Stephen Lisko,1. Christin Bunch,2. Eddie Russell,3. Justin Wood
