,0,1,2,3,4,5,6,7,8,9,10,11,12,13,14,15,16,17,18,19,20,21,22,23,24,25,26,27,28,29
0, 100-Concert Band, A+ Academy Secondary, TEA:, Dallas, Sheri Gomez,AAA,Var-Composite ,2018,129174,2,3,2,2,3,3,3,3, , March from First Suite for Military Band (Gustav Holst/Michael Story), The Red Balloon  (Anne McGinty), Cumberland Cross  (Carl Strommen),DATE of EVENT 04/17/2018 ,Region: 20,1. James Bode,2. Scott McPhetrige,3. Jim Perry,1. Cynthia Costello,2. Tony Valverde,3. John Young,
1, 100-Concert Band, Adamson HS, TEA:, Dallas, Aaron Crawford,AAAAA,Non-Varsity ,2018,135239,2,2,3,2,5,5,5,5, , Brandy Station March (John Edmondson), As Twilight Falls (Robert Sheldon), Nottingham Castle (Larry Daehn),DATE of EVENT 04/17/2018 ,Region: 20,1. James Bode,2. Scott McPhetrige,3. Jim Perry,1. Cynthia Costello,2. Tony Valverde,3. John Young,
2, 100-Concert Band, Adamson HS, TEA:, Dallas, Joseph Reichert,AAAAA,Varsity ,2018,128215,3,2,3,3,3,3,3,3, , Brighton Beach March (William Latham), Concord (Claire Grundman), Foundry (John Mackey),DATE of EVENT 04/17/2018 ,Region: 20,1. James Bode,2. Scott McPhetrige,3. Jim Perry,1. Cynthia Costello,2. Tony Valverde,3. John Young,
3, 100-Concert Band, Bryan Adams High School, TEA:, Dallas, Dolores Perkins,AAAAA,Varsity ,2018,137934,2,2,2,2,1,2,2,2, , Freedom City (Karl King), Shadow Rituals  (Markowski), Fantasy on a Fiddle Tune  (La Plante),DATE of EVENT 04/17/2018 ,Region: 20,1. James Bode,2. Scott McPhetrige,3. Jim Perry,1. Cynthia Costello,2. Tony Valverde,3. John Young,
4, 100-Concert Band, Cedar Hill High School, TEA:, CEDAR HILL, An'Cheyl Davis,AAAAAA,Sub Non-Varsity ,2018,136024,1,1,1,1,3,3,3,3,2, Allied Honor (King/Swearingen), Little Suite for Band (play all) (Standridge), Crystalline  (Clark),DATE of EVENT 04/17/2018 ,Region: 20,1. James Bode,2. Scott McPhetrige,3. Jim Perry,1. Cynthia Costello,2. Tony Valverde,3. John Young,
5, 100-Concert Band, Cedar Hill High School, TEA:, Cedar Hill," Derrick Walker / William Young, Alexander Riggins, An'cheyl Davis",AAAAAA,Non-Varsity ,2018,134587,1,1,1,1,1,1,1,1,C, La Tregenda (Puccini/Beck), Brookshire Suite  (Barnes), The Chimes of Liberty (Goldman),DATE of EVENT 04/17/2018 ,Region: 20,1. James Bode,2. Scott McPhetrige,3. Jim Perry,1. Cynthia Costello,2. Tony Valverde,3. John Young,
6, 100-Concert Band, Cedar Hill High School, TEA:, Cedar Hill," William Young / Derrick Walker, Alexander Riggins and An'Chel Davis",AAAAAA,Varsity ,2018,134879,2,1,1,1,2,1,3,2,1, In the Center Ring  (Sheldon), Suite Divertimento  (Gilbert), American Hymn Song Suite Mvt. 4 ( March On Wilson)  (Dewayne Milburn ),DATE of EVENT 04/17/2018 ,Region: 20,1. James Bode,2. Scott McPhetrige,3. Jim Perry,1. Cynthia Costello,2. Tony Valverde,3. John Young,
7, 100-Concert Band, Conrad High School, TEA:, Dallas, Tyrone Jones,AAAAA,Non-Varsity ,2018,134712,2,3,2,2,4,3,3,3, , Winchester March (John Edmonson), Allegretto from Symphony No. 7  (Beethoven/Longfield), Nottingham Castle  (Daehn),DATE of EVENT 04/17/2018 ,Region: 20,1. James Bode,2. Scott McPhetrige,3. Jim Perry,1. Cynthia Costello,2. Tony Valverde,3. John Young,
8, 100-Concert Band, David W. Carter HS, TEA:, Dallas, Christopher Young / Tony Galbreath,AAAA,Varsity ,2018,139368,3,3,2,3,3,4,3,3, , The Alamo March (King), Declaration Overature (Smith), Benediction  (Stevens),DATE of EVENT 04/17/2018 ,Region: 20,1. James Bode,2. Scott McPhetrige,3. Jim Perry,1. Cynthia Costello,2. Tony Valverde,3. John Young,
9, 100-Concert Band, Ennis High School, TEA:, Ennis, Brian Cupp,AAAAA,Sub Non-Varsity A,2018,138464,1,2,1,1,3,3,3,3,2, Big Four March (Karl L. King/ James Swearingen), The Tears of Arizona  (Balmages), Tanchozuru  (Standridge),DATE of EVENT 04/17/2018 ,Region: 20,1. James Bode,2. Scott McPhetrige,3. Jim Perry,1. Cynthia Costello,2. Tony Valverde,3. John Young,
10, 100-Concert Band, Ennis High School, TEA:, Ennis, Charles Rockwell,AAAAA,Non-Varsity ,2018,138491,1,1,1,1,1,2,2,2,2, Symbol Of Honor (Ted Mesang), Choreography  (Sheldon), Dedicatory Overture  (Williams),DATE of EVENT 04/17/2018 ,Region: 20,1. James Bode,2. Scott McPhetrige,3. Jim Perry,1. Cynthia Costello,2. Tony Valverde,3. John Young,
11, 100-Concert Band, Ennis High School, TEA:, Ennis, Gary Goodwin,AAAAA,Varsity ,2018,138452,1,1,1,1,1,1,1,1,A, Florentiner March (Fucik/Fennell), Molly On The Shore  (Grainger/Rogers/SMC)," English Dances, Set 1  (Arnold/Johnstone)",DATE of EVENT 04/17/2018 ,Region: 20,1. James Bode,2. Scott McPhetrige,3. Jim Perry,1. Cynthia Costello,2. Tony Valverde,3. John Young,
12, 100-Concert Band, F.D.Roosevelt High School, TEA:, Dallas, Kermit W Gray Jr. / William Robertson,AAAA,Non-Varsity ,2018,138146,3,2,2,2,4,4,4,4, , Accolade (Himes), Colliding Visions (Balmages), Activity March  (Bennett/Clark ),DATE of EVENT 04/17/2018 ,Region: 20,1. James Bode,2. Scott McPhetrige,3. Jim Perry,1. Cynthia Costello,2. Tony Valverde,3. John Young,
13, 100-Concert Band, Ferris High School, TEA:, Ferris, Evan Dabbs,AAAA,Non-Varsity ,2018,137586,2,2,2,2,1,2,2,2, , New Horizons  (Corrigan), Songs Of The Whalemen  (Del Borgo), Fleur-de-lis (March) (Sandy Feldstein & Larry Clark),DATE of EVENT 04/17/2018 ,Region: 20,1. James Bode,2. Scott McPhetrige,3. Jim Perry,1. Cynthia Costello,2. Tony Valverde,3. John Young,
14, 100-Concert Band, Ferris High School, TEA:, Ferris," Jennifer Kofahl / Evan Dabbs, Margaret Granado, Marshall Gonzales",AAAA,Varsity ,2018,137559,1,1,1,1,1,1,2,1,A, St. Petersburg March (Johnnie Vinson), Blue and Green Music  (Hazo), Imaginarium (Randall D. Standridge),DATE of EVENT 04/17/2018 ,Region: 20,1. James Bode,2. Scott McPhetrige,3. Jim Perry,1. Cynthia Costello,2. Tony Valverde,3. John Young,
15, 100-Concert Band, H. Grady Spruce High School, TEA:, Dallas, Matthew Sheppard,AAAAA,Non-Varsity ,2018,135058,1,1,1,1,3,2,2,2,2, Cajun Folk Songs  (Ticheli), Japanese Pictures  (Mixon), Suncrest (Concert March) (Rick Kirby),DATE of EVENT 04/17/2018 ,Region: 20,1. James Bode,2. Scott McPhetrige,3. Jim Perry,1. Cynthia Costello,2. Tony Valverde,3. John Young,
16, 100-Concert Band, Highland Park High School, TEA:, Dallas, Corey Parks / James LaBrecque,AAAAA,Non-Varsity ,2018,129516,1,1,1,1,1,1,1,1,C, America Exultant (Henry Fillmore)," Prelude, Siciliano and Rondo (play Siciliano & Rondo) (Arnold/Paynter)", Symphonic Dance No. 3 (Fiesta)  (Williams),DATE of EVENT 04/17/2018 ,Region: 20,1. James Bode,2. Scott McPhetrige,3. Jim Perry,1. Cynthia Costello,2. Tony Valverde,3. John Young,
17, 100-Concert Band, Highland Park High School, TEA:, Dallas, Reagan Brumley,AAAAA,Varsity ,2018,129480,1,1,1,1,1,1,1,1,A, Golden Jubilee (Sousa/Fennell), The Night Garden (John Mackey)," Toccata Marziale (new addition arr by Battisti available, full score) (Vaughan Williams)",DATE of EVENT 04/17/2018 ,Region: 20,1. James Bode,2. Scott McPhetrige,3. Jim Perry,1. Cynthia Costello,2. Tony Valverde,3. John Young,
18, 100-Concert Band, Hillcrest High School, TEA:, Dallas, Adam Brian Smith / Dr. S. Won,AAAAA,Varsity ,2018,135467,1,2,3,2,2,2,2,2, , Omaha Beach March (John Edmondson), American Riversongs (Pierre La Plante)," I Vow To Thee, My Country and Flourish For Wind Band (Ralph Vaughan Williams)",DATE of EVENT 04/17/2018 ,Region: 20,1. James Bode,2. Scott McPhetrige,3. Jim Perry,1. Cynthia Costello,2. Tony Valverde,3. John Young,
19, 100-Concert Band, James Madison High School, TEA:, Dallas, Herbers Sanders / N/A, Acc:N/A,AAA,Non-Varsity ,2018,137943,3,3,4,3,5,4,4,4, , Pinnacle of Distinction March (Larry Clark), Atlantis (), Canterbury Coronation (),DATE of EVENT 04/17/2018 ,Region: 20,1. James Bode,2. Scott McPhetrige,3. Jim Perry,1. Cynthia Costello,2. Tony Valverde,3. John Young
20, 100-Concert Band, Kimball HS, TEA:, Dallas, Abe Williams,AAAAA,Non-Varsity A,2018,137911,3,3,4,3,3,3,3,3, , Fidelity March (Karl L. King), English Folk Song Suite - Movement II - Intermezzo_  (Vaughan Williams), Shepherd's Hey (Grainger/Rogers),DATE of EVENT 04/17/2018 ,Region: 20,1. James Bode,2. Scott McPhetrige,3. Jim Perry,1. Cynthia Costello,2. Tony Valverde,3. John Young,
21, 100-Concert Band, L. G. Pinkston High school, TEA:, Dallas, Osley Cook / Joseph Goff,AAAA,Non-Varsity ,2018,134085,2,2,2,2,2,1,2,2, , Newcastle March (Johnnie Vinson), Two British Folk Songs  (Del Borgo), Broken Bow  (Strommen),DATE of EVENT 04/17/2018 ,Region: 20,1. James Bode,2. Scott McPhetrige,3. Jim Perry,1. Cynthia Costello,2. Tony Valverde,3. John Young,
22, 100-Concert Band, Lancaster High Shcool, TEA:, Lancaster," Adrian Bonner / Louis Thomas , Larry Brown",AAAAA,Varsity ,2018,138532,2,3,3,3,5,4,4,4, , Miss Liberty March (Karl L. King), Irish Tune (from County Derry)  (Grainger/Rogers/SMC), On a Hymnsong of Philip Bliss  (Holsinger),DATE of EVENT 04/17/2018 ,Region: 20,1. James Bode,2. Scott McPhetrige,3. Jim Perry,1. Cynthia Costello,2. Tony Valverde,3. John Young,
23, 100-Concert Band, Life School of Waxahachie HS, TEA:, Waxahachie, Ashley Burton / None, Acc:None,AAAA,Non-Varsity ,2018,128929,3,2,3,3,2,2,2,2, , Knights of Dunvegan (Meyer), Crescent Meadow (Romeyn), Barbarossa (Himes),DATE of EVENT 04/17/2018 ,Region: 20,1. James Bode,2. Scott McPhetrige,3. Jim Perry,1. Cynthia Costello,2. Tony Valverde,3. John Young
24, 100-Concert Band, Midlothian Heritage HS, TEA:, Midlothian, Keith Davis / Jesus Perez,AAAA,Varsity ,2018,132581,1,1,1,1,1,1,1,1,A, The Liberty Bell (Sousa/Brion&Schissel), Lincolnshire Posy (Grainger/Fennell), Toccata for Band  (Erickson),DATE of EVENT 04/17/2018 ,Region: 20,1. James Bode,2. Scott McPhetrige,3. Jim Perry,1. Cynthia Costello,2. Tony Valverde,3. John Young,
25, 100-Concert Band, Midlothian High School, TEA:, Midlothian, Alex Badour,AAAAA,Non-Varsity ,2018,138202,1,1,1,1,1,1,1,1,C, Bullets and Bayonets (Sousa/Fennell), Imaginarium  (Standridge), English Country Settings  (La Plante),DATE of EVENT 04/17/2018 ,Region: 20,1. James Bode,2. Scott McPhetrige,3. Jim Perry,1. Cynthia Costello,2. Tony Valverde,3. John Young,
26, 100-Concert Band, Midlothian High School, TEA:, Midlothian, Larry Doran / Alex Badour and Daniel Hawkins,AAAAA,Varsity ,2018,137964,1,1,1,1,1,1,1,1,A, March Op. 99 (Sergei Prokofieff arr. Yoder), Overture to Candide (Leonard Bernstein), Blue Shades (Frank Ticheli),DATE of EVENT 04/17/2018 ,Region: 20,1. James Bode,2. Scott McPhetrige,3. Jim Perry,1. Cynthia Costello,2. Tony Valverde,3. John Young,
27, 100-Concert Band, Moises E. Molina High School, TEA:, Dallas, Charles Hernandez,AAAAA,Varsity ,2018,136407,2,3,3,3,3,3,3,3, , Alamo March (King/Swearingen), Rhosymedre  (Vaughan Williams/Beeler), Joy Revisited  (Ticheli),DATE of EVENT 04/17/2018 ,Region: 20,1. James Bode,2. Scott McPhetrige,3. Jim Perry,1. Cynthia Costello,2. Tony Valverde,3. John Young,
28, 100-Concert Band, North Dallas High School, TEA:, Dallas, Jesse Warmanen,AAAAA,Non-Varsity ,2018,133950,2,2,2,2,4,4,4,4, , Champions of Freedom (Harris), Connemara Sketches (Osborne), Shepherd's Hey  (Traditional/Roszell),DATE of EVENT 04/17/2018 ,Region: 20,1. James Bode,2. Scott McPhetrige,3. Jim Perry,1. Cynthia Costello,2. Tony Valverde,3. John Young,
29, 100-Concert Band, Red Oak High School, TEA:, Red Oak, Joshua Perry,AAAAA,Non-Varsity ,2018,128848,1,1,1,1,2,1,2,2,2, Pentland Hills (Howe), A Festival Prelude  (Reed), Ghost Fleet  (Sheldon),DATE of EVENT 04/17/2018 ,Region: 20,1. James Bode,2. Scott McPhetrige,3. Jim Perry,1. Cynthia Costello,2. Tony Valverde,3. John Young,
30, 100-Concert Band, Red Oak High School, TEA:, Red Oak, Steven Moss,AAAAA,Varsity ,2018,128420,1,1,1,1,1,1,1,1,A, English Folk Song Suite (play one mvt) (Vaughan Williams), Hymn to a Blue Hour  (Mackey), First Suite in Eb for Military Band  (Holst/Matthews/Fennell),DATE of EVENT 04/17/2018 ,Region: 20,1. James Bode,2. Scott McPhetrige,3. Jim Perry,1. Cynthia Costello,2. Tony Valverde,3. John Young,
31, 100-Concert Band, Samuell HS, TEA:, Dallas, Thaddeus Webb,AAAAA,Non-Varsity ,2018,138411,2,2,2,2,2,3,3,3, , Winchester March (Edmondson), Stratosphere  (Beckham), Pavane  (Ravel/Smith),DATE of EVENT 04/17/2018 ,Region: 20,1. James Bode,2. Scott McPhetrige,3. Jim Perry,1. Cynthia Costello,2. Tony Valverde,3. John Young,
32, 100-Concert Band, Seagoville High School, TEA:, Dallas, Duane Esbrand,AAAAA,Non-Varsity ,2018,138177,2,3,2,2,5,5,5,5, , The Streets of Madrid (John Moss), Colliding Visions  (Balmages), Wildwind Overture  (Kinyon),DATE of EVENT 04/17/2018 ,Region: 20,1. James Bode,2. Scott McPhetrige,3. Jim Perry,1. Cynthia Costello,2. Tony Valverde,3. John Young,
33, 100-Concert Band, South Oak Cliff High School, TEA:, Dallas, Lance Williams / Mr. Markel Hall and Mr. Kenneth Clark,AAAAA,Non-Varsity ,2018,138221,2,1,1,1,3,4,4,4,2, Barnum and Bailey's Favorite (Karl King/Jerry Brubaker), Black Is the Color... (Robert Sheldon), Joy (Frank Ticheli),DATE of EVENT 04/17/2018 ,Region: 20,1. James Bode,2. Scott McPhetrige,3. Jim Perry,1. Cynthia Costello,2. Tony Valverde,3. John Young,
34, 100-Concert Band, Sunset HS, TEA:, Dallas, Darwin Lewis / Rametria Smith,AAAAA,Non-Varsity ,2018,135560,3,2,2,2,2,3,3,3, , Utah Beach (Concert March) (John Edmondson), Innisfree  (Strommen), Russian Folk Song Suite  (Lyadov/Calhoun),DATE of EVENT 04/17/2018 ,Region: 20,1. James Bode,2. Scott McPhetrige,3. Jim Perry,1. Cynthia Costello,2. Tony Valverde,3. John Young,
35, 100-Concert Band, Sunset HS, TEA:, Dallas, Rametria Smith,AAAAA,Varsity ,2018,135903,2,1,1,1,1,1,1,1,A, El Capitan (John Philip Sousa), Arirang and Akatonbo  (Yamada/Koh), San Antonio Dances (play one mvt) (Ticheli),DATE of EVENT 04/17/2018 ,Region: 20,1. James Bode,2. Scott McPhetrige,3. Jim Perry,1. Cynthia Costello,2. Tony Valverde,3. John Young,
36, 100-Concert Band, Thomas Jefferson High School, TEA:, Dallas, Roberto Romano,AAAAA,Varsity ,2018,133627,1,2,1,1,2,1,2,2,1, Alamo March  (King), Ave Maria  (Biebl/Cameron), Ghost Fleet  (Sheldon),DATE of EVENT 04/17/2018 ,Region: 20,1. James Bode,2. Scott McPhetrige,3. Jim Perry,1. Cynthia Costello,2. Tony Valverde,3. John Young,
37, 100-Concert Band, Waxahachie High School, TEA:, Waxahachie," Rich Armstrong / Courtney Melton, Justin Bell, Paul Jaso",AAAAA,Sub Non-Varsity ,2018,132149,1,1,1,1,1,1,1,1,C, Escapada  (David Moore), Slavonic Dance No. 8  (Dvorak/Balent), Imaginarium  (Standridge),DATE of EVENT 04/17/2018 ,Region: 20,1. James Bode,2. Scott McPhetrige,3. Jim Perry,1. Cynthia Costello,2. Tony Valverde,3. John Young,
38, 100-Concert Band, Waxahachie High School, TEA:, Waxahachie," Rich Armstrong / Justin Bell, Courtney Melton, Paul Jaso",AAAAA,Varsity ,2018,132150,1,1,1,1,1,1,1,1,A, Nobles of the Mystic Shrine (John Phillip Sousa/Frederick Fennell), The Night Garden (John Mackey), Finale (from Symphony No. 1 in g minor)  (Kalinnikov/Bainum),DATE of EVENT 04/17/2018 ,Region: 20,1. James Bode,2. Scott McPhetrige,3. Jim Perry,1. Cynthia Costello,2. Tony Valverde,3. John Young,
39, 100-Concert Band, Waxahachie High School, TEA:, Waxahachie," Rich Armstrong / Justin Bell, Courtney Melton, Paul Jaso",AAAAA,Non-Varsity ,2018,132148,1,1,1,1,1,1,1,1,C, March of the Belgian Parachutists (Leemans/Bourgeois), Glaciers  (Director), Puszta  (Van der Roost),DATE of EVENT 04/17/2018 ,Region: 20,1. James Bode,2. Scott McPhetrige,3. Jim Perry,1. Cynthia Costello,2. Tony Valverde,3. John Young,
40, 100-Concert Band, Wilmer Hutchins HS, TEA:, Dallas, Carlton D. Cooper / LeManuel Williams, Acc:N/A,AAAA,Non-Varsity ,2018,136547,3,3,2,3,2,2,2,2, , March Grandioso (Roland Seitz), With Quiet Courage (Larry Daehn), Kentucky 1800  (Grundman),DATE of EVENT 04/17/2018 ,Region: 20,1. James Bode,2. Scott McPhetrige,3. Jim Perry,1. Cynthia Costello,2. Tony Valverde,3. John Young
41, 100-Concert Band, Wilson HS, TEA:, Dallas, Chris Evetts / Travis Fife,AAAAA,Non-Varsity ,2018,134562,2,2,2,2,1,2,1,1,2, Prestissimo (King), Heaven's Light  (Reineke), Russian Sailor's Dance  (Gliere/Williams),DATE of EVENT 04/17/2018 ,Region: 20,1. James Bode,2. Scott McPhetrige,3. Jim Perry,1. Cynthia Costello,2. Tony Valverde,3. John Young,
42, 100-Concert Band, Wilson HS, TEA:, Dallas, Chris Evetts / Travis Fife,AAAAA,Varsity ,2018,128913,1,1,1,1,1,1,1,1,A, Prestissimo (King), Arabian Dances  (Balmages), Incantation and Dance  (Chance),DATE of EVENT 04/17/2018 ,Region: 20,1. James Bode,2. Scott McPhetrige,3. Jim Perry,1. Cynthia Costello,2. Tony Valverde,3. John Young,
