,0,1,2,3,4,5,6,7,8,9,10,11,12,13,14,15,16,17,18,19,20,21,22,23,24,25,26,27,28
0, 100-Concert Band, Argyle High School, TEA:, Argyle, Kathy Johnson / Michael Lemish,AAA,Varsity ,2009,45109,1,1,1,1,1,1,1,1,A, Festive Overture  (Shostakovich/Hunsberger), Irish Tune (from County Derry and Shepherd's Hey)  (Grainger), The Gallant Seventh (Sousa/Bourgeois),DATE of EVENT 04/02/2009 ,Region: 2,1. Danny Prado - Grapevine,2. Darrington White - Tolar,3. Brandon Brewer - Princeton,1. Bob Vetter - Waco,2. Brian Tillman - San Angelo,3. Travis Hobson - Wall
1, 100-Concert Band, Argyle High School, TEA:, Argyle, Kathy Johnson / Michael Lemish,AAA,Non-Varsity ,2009,45107,1,1,1,1,1,1,1,1,C, Emblem of Unity (J.J. Richards/Swearingen), West Highlands Sojourn  (Robert Sheldon), Our Kingsland Spring  (Hazo),DATE of EVENT 04/02/2009 ,Region: 2,1. Danny Prado - Grapevine,2. Darrington White - Tolar,3. Brandon Brewer - Princeton,1. Bob Vetter - Waco,2. Brian Tillman - San Angelo,3. Travis Hobson - Wall
2, 100-Concert Band, Aubrey High School, TEA:, Aubrey," Ron Chapman / Chris Davis, Nikki Cook",AA,Varsity ,2009,46416,1,1,1,1,1,1,1,1,A, The Belle of Chicago (Sousa / Gore), West Highlands Sojourn (Mvts 1 and 2) (Sheldon), English Folk Song Suite (Seventeen Come Sunday) (Vaughan Williams),DATE of EVENT 04/02/2009 ,Region: 2,1. Danny Prado - Grapevine,2. Darrington White - Tolar,3. Brandon Brewer - Princeton,1. Bob Vetter - Waco,2. Brian Tillman - San Angelo,3. Travis Hobson - Wall
3, 100-Concert Band, Boyd High School, TEA:, Boyd, Russ Brown,AA,Varsity ,2009,43233,2,1,1,1,1,1,1,1,B, Big Four March (King/Swearingen), A Childhood Hymn  (Holsinger)," Moscow, 1941  (Balmages)",DATE of EVENT 04/02/2009 ,Region: 2,1. Danny Prado - Grapevine,2. Darrington White - Tolar,3. Brandon Brewer - Princeton,1. Bob Vetter - Waco,2. Brian Tillman - San Angelo,3. Travis Hobson - Wall
4, 100-Concert Band, Castleberry High School, TEA:, Fort Worth, Dave Daniel,AAA,Varsity ,2009,45705,1,1,1,1,1,1,1,1,A, Skyline March (Hodges), Salvation is Created  (Tschesnokoff/Houseknecht), American Folk Rhapsody No. 2  (Grundman),DATE of EVENT 04/02/2009 ,Region: 2,1. Danny Prado - Grapevine,2. Darrington White - Tolar,3. Brandon Brewer - Princeton,1. Bob Vetter - Waco,2. Brian Tillman - San Angelo,3. Travis Hobson - Wall
5, 100-Concert Band, Castleberry High School, TEA:, Fort Worth, Wes Griffin / Dave Daniel,AAA,Non-Varsity ,2009,47214,2,2,1,2,1,1,2,1,2, General Lee (King), Kenya Contrasts  (Himes), Pevensey Castle  (Sheldon),DATE of EVENT 04/02/2009 ,Region: 2,1. Danny Prado - Grapevine,2. Darrington White - Tolar,3. Brandon Brewer - Princeton,1. Bob Vetter - Waco,2. Brian Tillman - San Angelo,3. Travis Hobson - Wall
6, 100-Concert Band, Chico High School, TEA:, Chico, Joshua Skipper,AA,Non-Varsity ,2009,45234,4,3,5,4,2,2,3,2, , Battle Creek March (Mark Williams), Atlantis  (McGinty), Dance Celebration  (Smith),DATE of EVENT 04/02/2009 ,Region: 2,1. Danny Prado - Grapevine,2. Darrington White - Tolar,3. Brandon Brewer - Princeton,1. Bob Vetter - Waco,2. Brian Tillman - San Angelo,3. Travis Hobson - Wall
7, 100-Concert Band, Lake Worth High School, TEA:, Fort Worth, Colin Kading,AAA,Varsity ,2009,47781,2,2,2,2,1,1,1,1,1, Gallant Marines (King/Swearingen), Down by the Salley Gardens  (Anon. or Trad./Sweeny), Country Gardens  (Grainger/Sousa/Brion/Schissel),DATE of EVENT 04/02/2009 ,Region: 2,1. Danny Prado - Grapevine,2. Darrington White - Tolar,3. Brandon Brewer - Princeton,1. Bob Vetter - Waco,2. Brian Tillman - San Angelo,3. Travis Hobson - Wall
8, 100-Concert Band, Ponder High School, TEA:, , BARRY R WALTERS,AA,Non-Varsity A,2009,45503,3,3,3,3,1,1,2,1,2, Blue Ridge Saga  (Swearingen), Flight of Eagles  (Del Borgo), ROUGH-RIDERS MARCH (),DATE of EVENT 04/02/2009 ,Region: 2,1. Danny Prado - Grapevine,2. Darrington White - Tolar,3. Brandon Brewer - Princeton,1. Bob Vetter - Waco,2. Brian Tillman - San Angelo,3. Travis Hobson - Wall
