,0,1,2,3,4,5,6,7,8,9,10,11,12,13,14,15,16,17,18,19,20,21,22,23,24,25,26,27,28
0, 100-Concert Band, A & M Consolidated High School, TEA:, College Station, Matt Wood / Steve Fry,AAAAA,Non-Varsity ,2020,158402, , , , , , , , , , Precision March (Bennett/Clark), Joy (15824)  (Ticheli), Contempo (16202)  (Story),DATE of EVENT 03/26/2020 ,Region: 8,1. t,2. b,3. d,1. t,2. b,3. d
1, 100-Concert Band, A&M Consolidated High School, TEA:, College Station, Steve Fry / Matt Wood,AAAAA,Varsity ,2020,158052, , , , , , , , , , Molly On The Shore (735)  (Grainger/Rogers/SMC), In the Center Ring (16683)  (Sheldon), The Earle of Oxford's March (Gordon Jacob),DATE of EVENT 03/26/2020 ,Region: 8,1. t,2. b,3. d,1. t,2. b,3. d
2, 100-Concert Band, Bryan High School, TEA:, Bryan, Breanna Osbourn / Laura Grems,AAAAAA,Varsity ,2020,155635, , , , , , , , , , The Slavic Woman's Farewell (Agapkin/Rhea), Bandancing (15837)  (Stamp), Undertow (17456)  (Mackey),DATE of EVENT 03/26/2020 ,Region: 8,1. t,2. b,3. d,1. t,2. b,3. d
3, 100-Concert Band, Bryan High School, TEA:, Bryan," Laura Grems / Bre Osbourn, Marie DeBellis",AAAAAA,Non-Varsity ,2020,160355, , , , , , , , , , March Slav (Tchaikovsky/Freshner), Hypnotic Fireflies (18466) (Balmages), Brave Spirit (19611)  (Standridge),DATE of EVENT 03/26/2020 ,Region: 8,1. t,2. b,3. d,1. t,2. b,3. d
4, 100-Concert Band, College Station High School, TEA:, College Station, Jon Seale / Michael Dixon,AAAAA,Varsity ,2020,157405, , , , , , , , , , The Falls (21571)  (Galante), October (722)  (Whitacre), Midway March (John Williams/Paul Lavender),DATE of EVENT 03/26/2020 ,Region: 8,1. t,2. b,3. d,1. t,2. b,3. d
5, 100-Concert Band, College Station High School, TEA:, College Station, Michael Dixon / Jon Seale,AAAAA,Sub Non-Varsity ,2020,157404, , , , , , , , , , Action Front March (Knoener), Into the Arctic (20710)  (Balmages), Scenes from the American West (21581) (play at least 2 mvts.) (Wilds),DATE of EVENT 03/26/2020 ,Region: 8,1. t,2. b,3. d,1. t,2. b,3. d
6, 100-Concert Band, College Station High School, TEA:, College Station, Michael Dixon / Jon Seale,AAAAA,Non-Varsity ,2020,157400, , , , , , , , , , Kiefer's Special (Kiefer/Rhae), Redemption (18479)  (Galante), A Longford Legend (409) (play all) (Sheldon),DATE of EVENT 03/26/2020 ,Region: 8,1. t,2. b,3. d,1. t,2. b,3. d
7, 100-Concert Band, Rudder High School, TEA:, Bryan, James Benton,AAAAA,Varsity ,2020,157069, , , , , , , , , , Azalea City March (R. Alan Carter), La Tregenda (18482)  (Puccini/Beck), Cajun Folk Songs (290)  (Ticheli),DATE of EVENT 03/26/2020 ,Region: 8,1. t,2. b,3. d,1. t,2. b,3. d
