,0,1,2,3,4,5,6,7,8,9,10,11,12,13,14,15,16,17,18,19,20,21,22,23,24,25,26,27,28
0, 100-Concert Band, Alvin Junior High School, TEA:, Alvin, Kevin Collins / Kyle Norman,CC,Non-Varsity ,2015,100755,2,2,2,2,2,2,3,2, ," ""Synergy"" March (William Owens)", Dance Celebration (Robert W. Smith), Fortis (Gary Gazlay),DATE of EVENT 04/09/2015 ,Region: 17,1. Jerald Dillard,2. Sharoin Kalisik,3. Sandra Bow Brunskill,1. Jill Yancey,2. John Gossett,3. Dr. Mary Ellen Cavitt
1, 100-Concert Band, Angleton Junior High, TEA:, Angleton, Wayne Steinke,CCC,Non-Varsity ,2015,105856,2,2,2,2,1,1,1,1,2, Kitty Hawk March (John Edmondson), Uskudar  (Anon. or Trad./Smith/Story), Summit Fanfare  (Owens/ ),DATE of EVENT 04/09/2015 ,Region: 17,1. Jerald Dillard,2. Sharoin Kalisik,3. Sandra Bow Brunskill,1. Jill Yancey,2. John Gossett,3. Dr. Mary Ellen Cavitt
2, 100-Concert Band, Austin Middle School, TEA:, Galveston, Austin Brake / Bill Zauner,CC,Non-Varsity ,2015,104760,2,2,2,2,1,1,2,1,2, Crown Point March (Pearson), The Red Balloon  (McGinty), Pevensey Castle (Sheldon),DATE of EVENT 04/09/2015 ,Region: 17,1. Jerald Dillard,2. Sharoin Kalisik,3. Sandra Bow Brunskill,1. Jill Yancey,2. John Gossett,3. Dr. Mary Ellen Cavitt
3, 100-Concert Band, Bayside Intermediate, TEA:, League City, Mark Walls,CC,Non-Varsity ,2015,101250,2,2,1,2,2,1,1,1,2, Lexington March  (Edmondson ), Sea Song Trilogy  (McGinty ), Colliding Visions  (Balmages ),DATE of EVENT 04/09/2015 ,Region: 17,1. Jerald Dillard,2. Sharoin Kalisik,3. Sandra Bow Brunskill,1. Jill Yancey,2. John Gossett,3. Dr. Mary Ellen Cavitt
4, 100-Concert Band, Berry Miller Junior High, TEA:, Pearland," Bennett Parsons / Chris Bennett, Heather Massey",CCC,Sub Non-Varsity ,2015,100822,1,1,2,1,1,1,1,1,D, Moutain Brook March  (Douglas Akey ), Exhortation  (Gazlay/ ), Conviction  (Clark/ ),DATE of EVENT 04/09/2015 ,Region: 17,1. Jerald Dillard,2. Sharoin Kalisik,3. Sandra Bow Brunskill,1. Jill Yancey,2. John Gossett,3. Dr. Mary Ellen Cavitt
5, 100-Concert Band, Berry Miller Junior High, TEA:, Pearland," Heather Massey / Christopher Bennett, Bennett Parsons",CCC,Non-Varsity ,2015,100871,1,1,1,1,1,1,1,1,D, Spirit of Liberty (Owens), Joy  (Ticheli/ ), Japanese Pictures  (Mixon/ ),DATE of EVENT 04/09/2015 ,Region: 17,1. Jerald Dillard,2. Sharoin Kalisik,3. Sandra Bow Brunskill,1. Jill Yancey,2. John Gossett,3. Dr. Mary Ellen Cavitt
6, 100-Concert Band, Brookside Intermediate, TEA:, Friendswood, Jennifer Rogers / Andie Troutman,CC,Non-Varsity ,2015,105019,1,2,1,1,1,1,2,1,D, Penguins on Parade (Lowden), Odyssey  (Branchfield/ ), Fortis  (Gazlay/ ),DATE of EVENT 04/09/2015 ,Region: 17,1. Jerald Dillard,2. Sharoin Kalisik,3. Sandra Bow Brunskill,1. Jill Yancey,2. John Gossett,3. Dr. Mary Ellen Cavitt
7, 100-Concert Band, Clear Creek Intermediate, TEA:, League City, Adam Brinkman / Melissa Hargrave,CC,Non-Varsity ,2015,101059,DNA,DNA,DNA,DNA,DNA,DNA,DNA,DNA, , Dance Celebration  (Smith/ ), The Spacious Firmament on High  (Sharp/ ), Mount Vernon (Concert March) (Story/),DATE of EVENT 04/09/2015 ,Region: 17,1. Jerald Dillard,2. Sharoin Kalisik,3. Sandra Bow Brunskill,1. Jill Yancey,2. John Gossett,3. Dr. Mary Ellen Cavitt
8, 100-Concert Band, Clear Lake Intermediate School, TEA:, Houston," Ana A Hernandez / Teri Brockway, Doug Parmer, Nancy Nelson",CCC,Sub Non-Varsity ,2015,103414,1,1,1,1,1,1,1,1,D, Spitfire  (Story), Courtlandt County Festival (Owens), Fortis  (Gazlay/ ),DATE of EVENT 04/09/2015 ,Region: 17,1. Jerald Dillard,2. Sharoin Kalisik,3. Sandra Bow Brunskill,1. Jill Yancey,2. John Gossett,3. Dr. Mary Ellen Cavitt
9, 100-Concert Band, Clear Lake Intermediate, TEA:, Houston," Doug Parmer / Teri Brockway, Ana Hernandez, Nancy Nelson",CCC,Non-Varsity ,2015,102567,1,1,1,1,1,1,1,1,D, Spania (Shaffer), Serengeti Dreams  (Smith/), Japanese Pictures  (Mixon/ ),DATE of EVENT 04/09/2015 ,Region: 17,1. Jerald Dillard,2. Sharoin Kalisik,3. Sandra Bow Brunskill,1. Jill Yancey,2. John Gossett,3. Dr. Mary Ellen Cavitt
10, 100-Concert Band, Clute Intermediate School, TEA:, Clute, David Box,CC,Non-Varsity ,2015,102013,3,3,3,3,3,3,3,3, , March of the Cardinals (Douglas A Bradley), As Twilight Falls (Robert Sheldon), Atlantis (Anne McGinty),DATE of EVENT 04/09/2015 ,Region: 17,1. Jerald Dillard,2. Sharoin Kalisik,3. Sandra Bow Brunskill,1. Jill Yancey,2. John Gossett,3. Dr. Mary Ellen Cavitt
11, 100-Concert Band, Creekside, TEA:, League City, Loren Gray / Archie Cassidy,CC,Non-Varsity ,2015,103544,2,2,2,2,1,2,1,1,2, Colliding Visions  (Balmages/ ), Shepherd's Hey  (Traditional/Roszell), Call to Duty (Gene Milford),DATE of EVENT 04/09/2015 ,Region: 17,1. Jerald Dillard,2. Sharoin Kalisik,3. Sandra Bow Brunskill,1. Jill Yancey,2. John Gossett,3. Dr. Mary Ellen Cavitt
12, 100-Concert Band, Fairview Junior High, TEA:, Alvin, Bryant Aynes / Katie Batchelor and Andres Aya,CC,Non-Varsity ,2015,103516,1,1,1,1,1,2,1,1,D, American Spirit March (Higgins), Fortis  (Gazlay), Odyssey  (Branchfield),DATE of EVENT 04/09/2015 ,Region: 17,1. Jerald Dillard,2. Sharoin Kalisik,3. Sandra Bow Brunskill,1. Jill Yancey,2. John Gossett,3. Dr. Mary Ellen Cavitt
13, 100-Concert Band, Friendswood Junior High, TEA:, Friendswood, Jason Abbott,CCC,Non-Varsity ,2015,100862,1,1,1,1,1,1,1,1,D, Winchester March (John Edmondson), Blue Ridge Reel  (Balmages/ ), Japanese Pictures  (Mixon/ ),DATE of EVENT 04/09/2015 ,Region: 17,1. Jerald Dillard,2. Sharoin Kalisik,3. Sandra Bow Brunskill,1. Jill Yancey,2. John Gossett,3. Dr. Mary Ellen Cavitt
14, 100-Concert Band, Friendswood Junior High, TEA:, Friendswood, Thomas Landfried,CCC,Sub Non-Varsity ,2015,100857,1,1,1,1,1,1,1,1,D, Kingsbury March (Chuck Elledge and Bruce Pearson), Big Sky Round-Up  (Sheldon/ ), Fortis  (Gazlay/ ),DATE of EVENT 04/09/2015 ,Region: 17,1. Jerald Dillard,2. Sharoin Kalisik,3. Sandra Bow Brunskill,1. Jill Yancey,2. John Gossett,3. Dr. Mary Ellen Cavitt
15, 100-Concert Band, Lake Jackson Intermediate, TEA:, Lake Jackson, Amy Laney,CCC,Non-Varsity ,2015,102967,2,2,2,2,2,1,2,2, , Three Rivers March (Steve Hodges), Two British Folk Songs  (Anon. or Trad./Del Borgo), Adrenaline Engines  (Standridge/ ),DATE of EVENT 04/09/2015 ,Region: 17,1. Jerald Dillard,2. Sharoin Kalisik,3. Sandra Bow Brunskill,1. Jill Yancey,2. John Gossett,3. Dr. Mary Ellen Cavitt
16, 100-Concert Band, League City Intermediate, TEA:, League City, Amy Cupitt,CC,Non-Varsity ,2015,104951,1,1,1,1,1,1,1,1,D, Mt. Ranier March (Molter), Dance Celebration  (Smith/ ), Atlantis  (McGinty/ ),DATE of EVENT 04/09/2015 ,Region: 17,1. Jerald Dillard,2. Sharoin Kalisik,3. Sandra Bow Brunskill,1. Jill Yancey,2. John Gossett,3. Dr. Mary Ellen Cavitt
17, 100-Concert Band, McAdams Junior High, TEA:, Dickinson, Mary Santarelli,CCC,Sub Non-Varsity ,2015,102804,1,1,1,1,1,1,1,1,D, Good Neighbors March (John Edmondson), Summit Fanfare  (Owens/ ), Majestica  (Gazlay/ ),DATE of EVENT 04/09/2015 ,Region: 17,1. Jerald Dillard,2. Sharoin Kalisik,3. Sandra Bow Brunskill,1. Jill Yancey,2. John Gossett,3. Dr. Mary Ellen Cavitt
18, 100-Concert Band, McAdams Junior High, TEA:, Dickinson, Robert Baker,CCC,Non-Varsity ,2015,102731,1,1,1,1,1,1,1,1,D, Matrix March (Huckeby), The Steppes of Russia  (Del Borgo/ ), Heroes Triumphant  (Owens/ ),DATE of EVENT 04/09/2015 ,Region: 17,1. Jerald Dillard,2. Sharoin Kalisik,3. Sandra Bow Brunskill,1. Jill Yancey,2. John Gossett,3. Dr. Mary Ellen Cavitt
19, 100-Concert Band, McAdams Junior High, TEA:, Dickinson, Robert Baker / Mary Santarelli,CCC,Sub Non-Varsity B,2015,102732,1,1,2,1,2,2,2,2,2, Sousa's Cadets (Sousa/Loest), Theme and Variations  (Broege/ ), Little Brazil Suite  (Balent/ ),DATE of EVENT 04/09/2015 ,Region: 17,1. Jerald Dillard,2. Sharoin Kalisik,3. Sandra Bow Brunskill,1. Jill Yancey,2. John Gossett,3. Dr. Mary Ellen Cavitt
20, 100-Concert Band, Nolan Ryan Junior High, TEA:, Pearland, Freddy Patrick,CCC,Non-Varsity ,2015,104090,1,2,2,2,1,1,1,1,2, Pride of the Regiment (Seward), Quintology  (Meyer/ ), Mosswood Lullaby  (Beck/ ),DATE of EVENT 04/09/2015 ,Region: 17,1. Jerald Dillard,2. Sharoin Kalisik,3. Sandra Bow Brunskill,1. Jill Yancey,2. John Gossett,3. Dr. Mary Ellen Cavitt
21, 100-Concert Band, Nolan Ryan Junior High, TEA:, Pearland, Hannah Colvin,CCC,Sub Non-Varsity ,2015,104086,2,2,1,2,1,1,1,1,2, Matrix March (Huckeby), Mystery Ride  (White/ ), Courtlandt County Festival  (Owens/ ),DATE of EVENT 04/09/2015 ,Region: 17,1. Jerald Dillard,2. Sharoin Kalisik,3. Sandra Bow Brunskill,1. Jill Yancey,2. John Gossett,3. Dr. Mary Ellen Cavitt
22, 100-Concert Band, Pearland Junior High East, TEA:, Pearland, Jason Hargrave,CCC,Non-Varsity ,2015,103308,1,2,2,2,1,1,1,1,2, Lexington March (Edmondson), New Horizons  (Corrigan/ )," Moscow, 1941  (Balmages/ )",DATE of EVENT 04/09/2015 ,Region: 17,1. Jerald Dillard,2. Sharoin Kalisik,3. Sandra Bow Brunskill,1. Jill Yancey,2. John Gossett,3. Dr. Mary Ellen Cavitt
23, 100-Concert Band, Pearland Junior High South, TEA:, Pearland, Ashley Clift,CCC,Non-Varsity ,2015,102248,2,2,1,2,1,1,1,1,2, Bunker Hill March (John Edmondson), Kenya Contrasts  (Himes/ ), Summit Fanfare  (Owens/ ),DATE of EVENT 04/09/2015 ,Region: 17,1. Jerald Dillard,2. Sharoin Kalisik,3. Sandra Bow Brunskill,1. Jill Yancey,2. John Gossett,3. Dr. Mary Ellen Cavitt
24, 100-Concert Band, Pearland Junior High South, TEA:, Pearland, Nick Miller,CCC,Sub Non-Varsity ,2015,102249,2,1,2,2,2,2,3,2, ," ""Synergy"" March (William Owens)", Nottingham Castle  (Daehn/ ), The Spacious Firmament on High  (Sharp/ ),DATE of EVENT 04/09/2015 ,Region: 17,1. Jerald Dillard,2. Sharoin Kalisik,3. Sandra Bow Brunskill,1. Jill Yancey,2. John Gossett,3. Dr. Mary Ellen Cavitt
25, 100-Concert Band, Pearland Junior High West, TEA:, Pearland, Jessica Steiner,CCC,Non-Varsity ,2015,101574,2,1,2,2,1,1,1,1,2, Lexington March (Edmondson), Kenya Contrasts  (Himes), Mythos  (Bernotas),DATE of EVENT 04/09/2015 ,Region: 17,1. Jerald Dillard,2. Sharoin Kalisik,3. Sandra Bow Brunskill,1. Jill Yancey,2. John Gossett,3. Dr. Mary Ellen Cavitt
26, 100-Concert Band, Pearland Junior High West, TEA:, Pearland, Karen Young,CCC,Sub Non-Varsity ,2015,101575,1,2,2,2,1,1,1,1,2, Infinity (Concert March) (Curnow), Summit Fanfare (Owens), Serengeti Dreams (Smith),DATE of EVENT 04/09/2015 ,Region: 17,1. Jerald Dillard,2. Sharoin Kalisik,3. Sandra Bow Brunskill,1. Jill Yancey,2. John Gossett,3. Dr. Mary Ellen Cavitt
27, 100-Concert Band, Rodeo Palms Junior High, TEA:, Manvel, Brian Wood,CC,Non-Varsity ,2015,104959,2,2,3,2,2,2,3,2, , Freedom's March (Swearingen), Fortis  (Gazlay/ ), Japanese Pictures  (Mixon/ ),DATE of EVENT 04/09/2015 ,Region: 17,1. Jerald Dillard,2. Sharoin Kalisik,3. Sandra Bow Brunskill,1. Jill Yancey,2. John Gossett,3. Dr. Mary Ellen Cavitt
28, 100-Concert Band, Scott Collegiate Academy, TEA:, Galveston, James Zauner / Austin Brake,CC,Non-Varsity A,2015,104968,3,3,3,3,3,4,3,3, , Little Brazil Suite  (Balent/ ), Shepherd's Hey  (Traditional/Roszell), Colonel Bogey (Kenneth Alford/ Arr. Mark Williams),DATE of EVENT 04/09/2015 ,Region: 17,1. Jerald Dillard,2. Sharoin Kalisik,3. Sandra Bow Brunskill,1. Jill Yancey,2. John Gossett,3. Dr. Mary Ellen Cavitt
29, 100-Concert Band, Seabrook Intermediate, TEA:, Seabrook, Matthew McCoy / Kevin Hutchins,CCC,Non-Varsity A,2015,104990,3,3,3,3,3,3,3,3, , Union March (Rogers), Crusade (Gassi), Little Brazil Suite (Balent),DATE of EVENT 04/09/2015 ,Region: 17,1. Jerald Dillard,2. Sharoin Kalisik,3. Sandra Bow Brunskill,1. Jill Yancey,2. John Gossett,3. Dr. Mary Ellen Cavitt
30, 100-Concert Band, Space Center Intermediate, TEA:, Houston, Kate Raney,CCC,Non-Varsity ,2015,105640,2,2,2,2,1,2,1,1,2, The Lone Eagle March (Edmondson), Dance Celebration  (Smith/ ), Mythos  (Bernotas/ ),DATE of EVENT 04/09/2015 ,Region: 17,1. Jerald Dillard,2. Sharoin Kalisik,3. Sandra Bow Brunskill,1. Jill Yancey,2. John Gossett,3. Dr. Mary Ellen Cavitt
31, 100-Concert Band, Victory Lakes Intermediate, TEA:, League City, Izaak Diefenbach,CCC,Non-Varsity ,2015,104934,3,3,3,3,3,3,3,3, , Forward March (Murtha), Voodoo Dance (Del Borgo), Dance Celebration  (Smith),DATE of EVENT 04/09/2015 ,Region: 17,1. Jerald Dillard,2. Sharoin Kalisik,3. Sandra Bow Brunskill,1. Jill Yancey,2. John Gossett,3. Dr. Mary Ellen Cavitt
32, 100-Concert Band, Westbrook Intermediate, TEA:, Friendswood, Edgar Johnson,CCC,Non-Varsity ,2015,105198,1,2,2,2,1,1,1,1,2, Eagle Command March (Quincy C. Hilliard), Sakura (Michael Story), Sea Song Trilogy (Anne McGenty),DATE of EVENT 04/09/2015 ,Region: 17,1. Jerald Dillard,2. Sharoin Kalisik,3. Sandra Bow Brunskill,1. Jill Yancey,2. John Gossett,3. Dr. Mary Ellen Cavitt
