,0,1,2,3,4,5,6,7,8,9,10,11,12,13,14,15,16,17,18,19,20,21,22,23,24,25,26,27,28
0, 100-Concert Band, Columbia High School, TEA:, West Columbia, Chris Schramme,AAA,Non-Varsity ,2011,61493,2,2,2,2,2,1,1,1,2, Summit March (Bennet/Clark), Brother James' Air  (Wagner), Contempo  (Story),DATE of EVENT 03/10/2011 ,Region: 13,1. Stacy Gist,2. Stephen Krupicka,3. Robert Littlefield,1. Eddie Benitez,2. David Edge,3. Virginia Olsovsky
1, 100-Concert Band, Columbia High School, TEA:, West Columbia, Randy D. Marble,AAA,Varsity ,2011,61476,2,2,1,2,1,1,1,1,1, Alamo March (King/Swearingen), Voices of the Sky  (Hazo), Abracadabra  (Ticheli),DATE of EVENT 03/10/2011 ,Region: 13,1. Stacy Gist,2. Stephen Krupicka,3. Robert Littlefield,1. Eddie Benitez,2. David Edge,3. Virginia Olsovsky
2, 100-Concert Band, East Bernard High School, TEA:, East Bernard, L. Chris Arrowood,AA,Varsity ,2011,61800,2,2,1,2,2,2,3,2, , Hoch: und Deutichmeister: Marsch (Ertl/Rundel), Deir in De  (Anon. or Trad./Barker), Flight of Eagles  (Del Borgo),DATE of EVENT 03/10/2011 ,Region: 13,1. Stacy Gist,2. Stephen Krupicka,3. Robert Littlefield,1. Eddie Benitez,2. David Edge,3. Virginia Olsovsky
3, 100-Concert Band, Edna High School, TEA:, Edna, Bobby Mowles,AA,Varsity ,2011,62246,1,1,2,1,2,2,2,2,1, Rough Riders (King/Swearingen), Kenya Contrasts  (Himes), Journey Down Niagara  (Tucker),DATE of EVENT 03/10/2011 ,Region: 13,1. Stacy Gist,2. Stephen Krupicka,3. Robert Littlefield,1. Eddie Benitez,2. David Edge,3. Virginia Olsovsky
4, 100-Concert Band, Ganado High School, TEA:, Ganado, Patrick Flaniken / Brandi Ramdohr,A,Varsity ,2011,62139,1,1,1,1,1,1,1,1,A, Peacemaker (Karl King/James Swearingen), Two British Folk Songs  (Anon. or Trad./Del Borgo), Journey Down Niagara  (Tucker),DATE of EVENT 03/10/2011 ,Region: 13,1. Stacy Gist,2. Stephen Krupicka,3. Robert Littlefield,1. Eddie Benitez,2. David Edge,3. Virginia Olsovsky
5, 100-Concert Band, Industrial High School, TEA:, Vanderbilt, Stephen Henry / Stacy Hudson,AA,Varsity ,2011,62106,1,1,1,1,1,1,1,1,A, El Gato Salveje (Robert E. Foster), Salvation is Created  (Tschesnokoff/Houseknecht), American Riversongs  (La Plante),DATE of EVENT 03/10/2011 ,Region: 13,1. Stacy Gist,2. Stephen Krupicka,3. Robert Littlefield,1. Eddie Benitez,2. David Edge,3. Virginia Olsovsky
6, 100-Concert Band, Palacios High School, TEA:, Palacios, Jim Popham / Michael Schurtz,AAA,Varsity ,2011,61753,2,2,2,2,2,2,2,2, , Alamo March (Karl King), Ghost Fleet  (Sheldon), Kenya Contrasts  (Himes),DATE of EVENT 03/10/2011 ,Region: 13,1. Stacy Gist,2. Stephen Krupicka,3. Robert Littlefield,1. Eddie Benitez,2. David Edge,3. Virginia Olsovsky
