,Event,School,TEA,City,Directors,Conference,Classification,Year,ID,Stage Judge 1,Stage Judge 2,Stage Judge 3,Stage Final,SR Judge 1,SR Judge 2,SR Judge 3,SR Final,Award,Selection 1,Selection 2,Selection 3,oops
0, 100-Concert Band, A. P. Solis Middle School, TEA: 108902045, Donna, Jose L Barrera Jr,CC,Non-Varsity ,2022,173012,1,2,1,1,1,1,1,1,D, The Black Hawk March (Jack Bullock), Armory (19597)  (Standridge), Vulcans Forge (24127)  (Roszell),
1, 100-Concert Band, B. Garza Middle School, TEA: 447440, Weslaco, Ernesto Ortiz,CCC,Varsity ,2022,170550,1,2,1,1,1,2,2,2,2, The Thunderer (Sousa/Story), Colliding Visions (17502)  (Balmages), Night Fury (20593)  (Chambers),
2, 100-Concert Band, Berta Cabaza Middle School, TEA: 031-912-041, San Benito, James R Spence,CC,Non-Varsity ,2022,174835,1,2,1,1,1,1,1,1,D, Fortitude (Owens), Distant Horizons (Sweeney), Great Beginnings (Kamuf),
3, 100-Concert Band, Besteiro MS, TEA: 031-901-048, Brownsville, Clarissa Salinas,CC,Varsity ,2022,172544,1,2,1,1,1,1,1,1,C, Honor March (Sandy Feldstein & Larry Clark), Theme and Variations (6)  (Broege), Colliding Visions (17502)  (Balmages),
4, 100-Concert Band, Carlos F. Truan STEAM Academy, TEA: 108903, EDCOUCH," Alma Arellano / Phillip Purvey, Adrian Garcia, Cristian Tanguma, Joel Cazares", Acc:n/a,CC,Varsity ,2022,174204,1,2,1,1,1,1,1,1,C, Paso Flamenco (Victor Lopez), Ghost Ship (18462)  (Story), Red Giant (22327)  (Vargas)
5, 100-Concert Band, Coakley Middle School, TEA: 1191255, Harlingen, Lehi Sanchez,CC,Varsity ,2022,175401,1,2,1,1,1,1,1,1,C, Wedgwood March (William Owens), Colliding Visions  (Brian Balmages), Armory (Randall Standridge),
6, 100-Concert Band, Cuellar Middle School, TEA: 1336603, Weslaco, Olivia Aguayo,CC,Varsity ,2022,171353,1,1,1,1,2,2,3,2,2, A Summers Knight (24122)  (Terry), Qin Shi's Stone Army (Arcari), Infinity March (Curnow),
7, 100-Concert Band, D. M. Sauceda Middle School, TEA: 108902047, Donna, Gustavo E. Villegas Jr.,CC,Non-Varsity ,2022,172386,1,2,1,1,1,1,1,1,D, Pinnacle of Distinction (Larry Clark), Colliding Visions (17502)  (Balmages), Majestica (17490)  (Gazlay),
8, 100-Concert Band, Edward Manzano Middle School, TEA: 031-901-055, Brownsville, Ernest Cantu,CC,Varsity ,2022,172222,1,1,1,1,1,1,1,1,C, March Primo (Dennis Eveland), Serengeti Dreams (648)  (Smith), Armory (19597)  (Standridge),
9, 100-Concert Band, Faulk Middle School, TEA: 031-901-043, Brownsville, Jason Villarreal,CCC,Varsity ,2022,172619,1,1,1,1,1,1,1,1,C, Forward March (Paul Murtha), Pavane (142)  (Ravel/Smith), Abracadabra (15823)  (Ticheli),
10, 100-Concert Band, Filemon B. Vela Middle School, TEA: 031-901-047, Brownsville, Mario Sarmiento,CC,Varsity ,2022,177016,1,1,1,1,1,1,1,1,C, Peacemaker (Karl L. King), On a Hymnsong of Philip Bliss (233)  (Holsinger), Rikudim (423)  (Van der Roost),
11, 100-Concert Band, Garcia Middle School, TEA: 031-901-053, Brownsville, Kevin Garcia,CCC,Varsity ,2022,175227,1,1,1,1,1,1,1,1,C, Guardians of Liberty  (Paul Murtha ), Theme and Variations  (Timothy Broege), Night Fury  (Carol Brittin Chambers),
12, 100-Concert Band, Gutierrez Middle School of Art's and Science, TEA: 031903044, Harlingen, William Bennett,CC,Varsity ,2022,169533,1,2,1,1,1,1,1,1,C, El Conquistador (WIlliam Owens), The Tears of Arizona (20591)  (Balmages), Red Giant (22327)  (Vargas),
13, 100-Concert Band, Liberty Memorial Middle School, TEA: 031906042, Los Fresnos, Bernie Alejandro,CC,Varsity ,2022,172230,1,2,1,1,1,1,1,1,C, Photo Finish! (Swearingen), Dancing Kites (19598)  (Bernotas), Sketches of Canada (19608) (play 2 mvts) (Story),
14, 100-Concert Band, Los Cuates Middle School, TEA: 031906041, Los Fresnos, Criselda Marroquin Morrell,CC,Varsity ,2022,175749,1,1,1,1,1,1,1,1,C, Capture the Moment (William Owens), Throne of Swords (24123)  (Miller), Night Fury (20593)  (Chambers),
15, 100-Concert Band, Lucio Middle School, TEA: 031-901-051, Brownsville, Genesis Blanco Carpio,CC,Varsity ,2022,172542,1,2,1,1,1,1,2,1,C, Gateway March (Osterling), In The Bleak Midwinter (Holst/Bullock), Japanese Pictures (Mixon),
16, 100-Concert Band, Mary Hoge Middle School, TEA: 1106109, Weslaco, Natalie Sanchez,CC,Varsity ,2022,173894,1,2,1,1,1,1,1,1,C, Musicmakers March (Lavender/Sweeney), Alman (Morley/De Stefano), Zig Zag (O'Loughlin),
17, 100-Concert Band, Memorial Middle School, TEA: 031-903, Harlingen, Julissa Garcia,CC,Non-Varsity ,2022,173435,1,1,1,1,1,1,1,1,D, Pride Of The Regiment (Nancy H. Seward), In The Bleak Midwinter (Jack Bullock), Japanese Pictures (Kevin Mixon),
18, 100-Concert Band, Miller Jordan Middle School, TEA: 031912, San Benito, Alejandro Martinez / Rudy Gonzalez,CC,Non-Varsity A,2022,175592,1,2,1,1,2,1,1,1,D, Starsplitter Fanfare (Balmages), Theme and Variations (Broege), Acropolis (Putnam),
19, 100-Concert Band, Moises Vela MS School, TEA: 031903045, Harlingen, Erika R Uribe / Estella Monasmith,CC,Varsity ,2022,167616,1,1,1,1,1,1,1,1,C, Fortitude ( Owens), Danza de Espana (19602) (Chambers), Steel (18213)  (Standridge),
20, 100-Concert Band, Oliveira Middle School, TEA: 031-901-045, Brownsville, Gaspar Garcia,CCC,Varsity ,2022,176072,1,1,1,1,1,1,1,1,C, March of the Belgian Paratroopers  (Pierre/ J. Swearingen), Salvation is Created (294)  (Tschesnokoff/Houseknecht), Lightning Field (19613)  (Mackey),
21, 100-Concert Band, Perkins Middle School, TEA: 031-901-046, Brownsville, Joe Martinez,CC,Varsity ,2022,175700,1,2,1,1,2,2,2,2,2, March Grandioso (Seitz/Smith), Courtlandt County Festival (15820)  (Owens), Mystery Ride (18192)  (White),
22, 100-Concert Band, Port Isabel Jr. High School, TEA: 031-909, Port Isabel, Diana Pena,CC,Varsity ,2022,172447,1,1,1,1,1,1,1,1,C, Newcastle March (Johnnie Vinson), Danza de Espana (19602)  (Chambers), Armory (19597)  (Standridge),
23, 100-Concert Band, Resaca Middle School, TEA: 1498141, Los Fresnos, Abel Alejandro Gomez / Javier Moran Jr. and Brian Kuntz,CC,Varsity ,2022,175406,1,2,1,1,1,1,2,1,C, The Black Hawk March (Jack Bullock), Danza de Espana (19602)  (Chambers), Bazaar (20756)  (Standridge),
24, 100-Concert Band, Rio Hondo Middle School, TEA: 031-911, Rio Hondo, Pablo Mariscal,CC,Varsity ,2022,174185,2,2,1,2,1,1,1,1,2, Manhattan Beach (Sousa/Story), Pevensey Castle (60)  (Sheldon), Into the Arctic (20710)  (Balmages),
25, 100-Concert Band, San Benito Riverside Middle School, TEA: 0430, San Benito," Eugenio Castellanos Jr / Manuel Cerda, & Raul Garza",CC,Non-Varsity ,2022,174431,1,2,1,1,1,1,1,1,D," ""Synergy"" March (Owens)", Vulcan's Forge (Roszell), The Oncoming Storm (Rogers),
26, 100-Concert Band, Sgt. Manuel Chacon Middle School, TEA: 108907, mercedes, Nancy Coronado,CC,Non-Varsity ,2022,174255,1,2,1,1,1,1,1,1,D, Excitation March  (Rob Grice ), Vulcans Forge (24127)  (Roszell), Acropolis (24113)  (Putnam),
27, 100-Concert Band, Stell Middle School, TEA: 031-901-044, Brownsville, Benita Trevino,CC,Varsity ,2022,172279,1,1,1,1,1,1,1,1,C, Pride of the Regiment (Nancy Seward), As Twilight Falls (Robert Sheldon), Armory (Randall D. Standridge),
28, 100-Concert Band, Stillman Middle School, TEA: 031-901-054, Brownsville, Victor G Franco,CCC,Varsity ,2022,174967,1,1,1,1,1,1,1,1,C, Wedgwood March (William Owens), As Twilight Falls (17497)  (Sheldon), Into the Arctic (20710)  (Balmages),
29, 100-Concert Band, Todd Middle School, TEA: 108902048, Donna, Hector Molina,CC,Non-Varsity ,2022,175589,1,1,1,1,2,1,1,1,D, Serengeti Dreams (648)  (Smith), Vulcans Forge (24127)  (Roszell), Recognition March (Clark),
30, 100-Concert Band, Vernon World Languages Academy Middle School, TEA: 031903, Harlingen, Michael Ramirez,CC,Varsity ,2022,176629,1,2,1,1,1,1,1,1,C, Courage March (Larry Clark), As Twilight Falls (17497)  (Sheldon), Japanese Pictures (18467)  (Mixon),
31, 100-Concert Band, Veterans Middle School, TEA: 108902046, Donna, Amanda Chamberlain,CC,Non-Varsity ,2022,174095,1,2,1,1,1,1,1,1,D, Honor March (Sandy Feldstein/Larry Clark), Vulcans Forge (24127)  (Roszell), The Oncoming Storm (22320)  (Rogers),
32, 100-Concert Band, W.B. Green JH, TEA: 031905, La Feria, Raul Garate Jr,CC,Non-Varsity ,2022,174785,1,2,1,1,1,1,1,1,D, March For Freedom (Swearingen), Dance Celebration (647)  (Smith), Armory (19597)  (Standridge),
