,0,1,2,3,4,5,6,7,8,9,10,11,12,13,14,15,16,17,18,19,20,21,22,23,24,25,26,27,28,29
0, 100-Concert Band, Blanco ISD, TEA:, BLANCO, Jonathan VanOmmeren / Mackenzie Lane,AAA,Varsity ,2021,161995,1,1,1,1,1,1,1,1,B, Kinderlou (Carter), As Twilight Falls  (Sheldon), Blue Ridge Reel  (Balmages),DATE of EVENT 03/11/2021 ,Region: 12,1. Charles Aguillon,2. Jim Keltner,3. Joey Lucita,1. Penny Compton,2. Jonathan Rickman,3. Robert Rubio,
1, 100-Concert Band, Blanco ISD, TEA:, BLANCO, Mackenzie Lane / Jonathan Vanommeren,C,Varsity ,2021,162211,1,1,1,1,1,1,1,1,C, At The Water`s Edge  (Romeyn), Dancing Kites  (Bernotas), Spitfire Concert March (Michael Story),DATE of EVENT 03/11/2021 ,Region: 12,1. Charles Aguillon,2. Jim Keltner,3. Joey Lucita,1. Penny Compton,2. Jonathan Rickman,3. Robert Rubio,
2, 100-Concert Band, Mountain Valley MS, TEA:, Canyon Lake," Danette Conard / Robert DeLong, Caleb Hoffmann", Acc:N/A,CC,Non-Varsity ,2021,162481,1,2,2,2,1,1,1,1,2, Spitfire (Concert March) (Story), Summit Fanfare (Owens), Dorian Chant (Calhoun),DATE of EVENT 03/11/2021 ,Region: 12,1. Charles Aguillon,2. Jim Keltner,3. Joey Lucita,1. Penny Compton,2. Jonathan Rickman,3. Robert Rubio
3, 100-Concert Band, New Braunfels MS, TEA:, New Braunfels, Catherine Alvarado / Haley Wares,CCC,Non-Varsity ,2021,163026,DNA,DNA,DNA,DNA,DNA,DNA,DNA,DNA, , Greenway March (Ralph and Jack Hale), Conviction (Clark/), Skylight (Hodges/),DATE of EVENT 03/11/2021 ,Region: 12,1. Charles Aguillon,2. Jim Keltner,3. Joey Lucita,1. Penny Compton,2. Jonathan Rickman,3. Robert Rubio,
4, 100-Concert Band, New Braunfels MS, TEA:, New Braunfels, Dolores Jimenez,CCC,Varsity ,2021,162954,1,1,1,1,1,1,1,1,C, Couragre March (Bennett/Clark), Colliding Visions (Balmages/), Spirit of an Eagle (Clark/),DATE of EVENT 03/11/2021 ,Region: 12,1. Charles Aguillon,2. Jim Keltner,3. Joey Lucita,1. Penny Compton,2. Jonathan Rickman,3. Robert Rubio,
5, 100-Concert Band, Oak Run MS, TEA:, New Braunfels, Anna Zientek / Christopher Alvarado/Adriian Esquivel,CC,Varsity ,2021,162522,DNA,DNA,DNA,DNA,DNA,DNA,DNA,DNA, , Spania (David Shaffer), Colliding Visions  (Balmages), Red Giant  (Vargas),DATE of EVENT 03/11/2021 ,Region: 12,1. Charles Aguillon,2. Jim Keltner,3. Joey Lucita,1. Penny Compton,2. Jonathan Rickman,3. Robert Rubio,
6, 100-Concert Band, Oak Run MS, TEA:, New Braunfels," Chris Alvarado / Anna Zientek, Adrian Esquivel",CC,Non-Varsity ,2021,162916,DNA,DNA,DNA,DNA,DNA,DNA,DNA,DNA, , Summit March (Bennett/Clark), Sea Song Trilogy  (McGinty), Heroes Triumphant  (Owens),DATE of EVENT 03/11/2021 ,Region: 12,1. Charles Aguillon,2. Jim Keltner,3. Joey Lucita,1. Penny Compton,2. Jonathan Rickman,3. Robert Rubio,
