,Event,School,TEA,City,Directors,Conference,Classification,Year,ID,Stage Judge 1,Stage Judge 2,Stage Judge 3,Stage Final,SR Judge 1,SR Judge 2,SR Judge 3,SR Final,Award,Selection 1,Selection 2,Selection 3
0, 100-Concert Band, Clack Middle School, TEA:, Abilene, Bob Anderson,CC,Varsity ,2008,40435,2,2,2,2,2,2,2,2, , Monterey March (La Plante), Fa Una Canzona  (Vecchi/Daehn), Quintology  (Meyer)
1, 100-Concert Band, Craig Middle School, TEA:," Abilene,", Cecil Darby,CC,Non-Varsity ,2008,38400,2,2,1,2,2,1,2,2, , Military Escort  (Harold Bennett/Clark), La Volta (Byrd/Fenske), Pinnacle (Rob Grice)
2, 100-Concert Band, Madison Middle School, TEA:, Abilene, Mitchell Etter,CC,Non-Varsity ,2008,40327,2,1,2,2,2,2,2,2, , Valley Forge March  (Edmondson ), Two English Dances  (Anon. or Trad./O'Reilly), Modal Song and Dance  (Del Borgo)
3, 100-Concert Band, Madison Middle School, TEA:, Abilene, Paula McGrew,CC,Varsity ,2008,40322,1,1,1,1,2,2,2,2,2, Newcastle March (Vinson), Legend of Knife River  (Bulla), Two British Folk Songs  (Anon. or Trad./Del Borgo)
4, 100-Concert Band, Mann Middle School, TEA:, Abilene, Curtis Oakley,CC,Varsity ,2008,36203,3,3,3,3,2,2,2,2, , Joy  (Ticheli), Crest of Nobility  (Sheldon), Miss Liberty March (King/Swearingen)
5, 100-Concert Band, Snyder Junior High, TEA:, Snyder, Michael Stittsworth,CC,Varsity ,2008,40357,1,1,2,1,2,2,2,2,2, Knights of the Royal Realm (Robert W. Smith), A Childhood Hymn  (Holsinger), Medieval Legend  (Story)
6, 100-Concert Band, Sweetwater Middle School, TEA:, Sweetwater, Lynette Huck,CC,Varsity ,2008,37134,1,1,2,1,1,1,1,1,C, Lone Eagle March (John Edmondson), Quintology  (Meyer), Pinnacle  (Grice)
7, 100-Concert Band, Wylie Middle School, TEA:, Abilene, Jeannie Lunney,CC,Varsity ,2008,38744,1,1,1,1,1,1,1,1,C, Peacemaker March (King/Swearingen), Our Kingsland Spring  (Hazo)," Moscow, 1941  (Balmages)"
8, 100-Concert Band, Wylie Middle School, TEA:, Abilene, Luke McMillan,CC,Non-Varsity ,2008,38836,1,1,1,1,2,2,2,2,2, March of the Minutemen (John Edmondson), Little Brazil Suite  (Balent), Atlantis  (McGinty)
