,0,1,2,3,4,5,6,7,8,9,10,11,12,13,14,15,16,17,18,19,20,21,22,23,24,25,26,27,28
0, 100-Concert Band, Bellville Junior High, TEA:, Bellville," Aaron Rettig / Kenny Peters, KC Stockman",CC,Varsity ,2021,163040,2,1,1,1,1,1,1,1,C, Bridgewater March (Hodges), Expectations (Clark), Red Giant (Vargas),DATE of EVENT 04/13/2021 ,Region: 27,1. Ryan Agard,2. Carl Idlebird,3. JD Janda,1. n/a,2. n/a,3. n/a
1, 100-Concert Band, Bellville Junior High School, TEA:, Bellville," KC Max Stockman / Aaron Rettig, Kenny Peters",CC,Non-Varsity ,2021,163043,1,1,2,1,1,1,1,1,D, Ming Court (Pitter), Atlantis (McGinty), Cadet's Cavalcade (Joseph Compello),DATE of EVENT 04/13/2021 ,Region: 27,1. Ryan Agard,2. Carl Idlebird,3. JD Janda,1. n/a,2. n/a,3. n/a
2, 100-Concert Band, Brenham Junior High School, TEA:, Brenham, Joshua Turnipseed,CCC,Non-Varsity ,2021,162391,2,1,2,2,2,1,1,1,2, March of the Syncopated Penguins (Rudgers), Elizabethan Dance  (Williams), Exhortation  (Gazlay),DATE of EVENT 04/13/2021 ,Region: 27,1. Ryan Agard,2. Carl Idlebird,3. JD Janda,1. n/a,2. n/a,3. n/a
3, 100-Concert Band, Brenham Junior High, TEA:, Brenham, Karla Rettig,CCC,Varsity ,2021,162390,1,1,1,1,1,1,1,1,C, Vivo! Galop (William H. Kiefer/Andrew Glover), Tanchozuru (Randall D. Standridge), Four Short Festive Dances (Dennis Eveland),DATE of EVENT 04/13/2021 ,Region: 27,1. Ryan Agard,2. Carl Idlebird,3. JD Janda,1. n/a,2. n/a,3. n/a
4, 100-Concert Band, Navasota Junior High, TEA:, Navasota, Dylan Williams,CC,Varsity ,2021,162558,2,2,1,2,3,3,2,3, , March of the Champions (Loest), First Light (Ticheli), Dance Celebration (Smith),DATE of EVENT 04/13/2021 ,Region: 27,1. Ryan Agard,2. Carl Idlebird,3. JD Janda,1. n/a,2. n/a,3. n/a
5, 100-Concert Band, Royal Middle School, TEA:, Brookshire, Adolfo Garca / Gary Miller Jr.,CC,Non-Varsity ,2021,162381,2,3,3,3,2,2,3,2, , Nottingham March (Jerry Williams), Dance Celebration (Robert W. Smith), Fortis (Gary Gazlay),DATE of EVENT 04/13/2021 ,Region: 27,1. Ryan Agard,2. Carl Idlebird,3. JD Janda,1. n/a,2. n/a,3. n/a
6, 100-Concert Band, Sealy JH, TEA:, Sealy, Sterling Burton,CC,Varsity ,2021,162552,1,1,1,1,1,2,1,1,C, Grand Galop (Circus March) (Vinson/), Loch Lomond (Black/), Armory (Standridge/),DATE of EVENT 04/13/2021 ,Region: 27,1. Ryan Agard,2. Carl Idlebird,3. JD Janda,1. n/a,2. n/a,3. n/a
