,0,1,2,3,4,5,6,7,8,9,10,11,12,13,14,15,16,17,18,19,20,21,22,23,24,25,26,27,28
0, 100-Concert Band, Iraan Sheffield HS, TEA:, Iraan, Veronica Tagle,AA,Var-Composite ,2016,111727,2,2,2,2,1,2,2,2, , Conquista (Shaffer), Phantom Ship  (Del Borgo/ ), Adrenaline Engines  (Standridge/ ),DATE of EVENT 03/22/2016 ,Region: 6,1. See original event,2. See original event,3. See original event,1. See original event,2. See original event,3. See original event
1, 100-Concert Band, Kermit HS, TEA:, Kermit, Timothy Hickman / Jason Watkins,AAA,Varsity ,2016,112041,3,2,2,2,2,2,2,2, , Spirit of New Orleans (Murtha), Our Kingsland Spring  (Hazo/ ), Little Suite for Band (play all) (Standridge/ ),DATE of EVENT 03/22/2016 ,Region: 6,1. See original event,2. See original event,3. See original event,1. See original event,2. See original event,3. See original event
2, 100-Concert Band, Monahans HS, TEA:, Monahans," Michael Munoz / Julie Munoz, Austin Billett",AAAA,Non-Varsity ,2016,111847,2,1,1,1,1,2,2,2,2, The Brandenburg March (Vinson), Pioneer Songs  (Daehn/ ), Black Forest Overture  (Sweeney/ ),DATE of EVENT 03/22/2016 ,Region: 6,1. See original event,2. See original event,3. See original event,1. See original event,2. See original event,3. See original event
3, 100-Concert Band, Monahans HS, TEA:, Monahans," Michael Munoz / Julie Munoz, Austin Billett",AAAA,Varsity ,2016,111846,1,2,1,1,1,1,1,1,B, Salvation is Created  (Tschesnokoff/Houseknecht), Fantasy on an Early American Marching Tune  (Sheldon/ ), British Eighth (Elliott/Hillard),DATE of EVENT 03/22/2016 ,Region: 6,1. See original event,2. See original event,3. See original event,1. See original event,2. See original event,3. See original event
4, 100-Concert Band, Reagan County MS, TEA:, Big Lake," Christopher Cooper / Adrian Alonso, Nikki Moore",C,Varsity ,2016,112141,2,1,2,2,3,2,2,2, , March of the Hyperion Guards (Sheldon), Dance Celebration  (Smith/ ), Starship  (O'Reilly/ ),DATE of EVENT 03/22/2016 ,Region: 6,1. See original event,2. See original event,3. See original event,1. See original event,2. See original event,3. See original event
