,0,1,2,3,4,5,6,7,8,9,10,11,12,13,14,15,16,17,18,19,20,21,22,23,24,25,26,27,28
0, 100-Concert Band, Como-Pickton Middle School, TEA: 112908, Lindale, Cody Vorwerk / Scott Thompson,C,Varsity ,2022,175481,2,3,3,3,2,2,2,2, , Southampton March (Robert Sheldon), Acropolis (24113)  (Putnam), Zig Zag (22324)  (OLoughlin),DATE of EVENT 03/31/2022 ,Region: 4,1. Mark Conaway,2. Gary Jordan,3. Denny Whitley,1. Josh King,2. Rachel Schotchmer,3. Craig Haynie
1, 100-Concert Band, Elysian Fields Middle School, TEA: 102906041, Elysian Fields, Tiffany Tanuyan / Jeremy Hendrix,C,Varsity ,2022,172220,2,2,1,2,2,2,1,2, , The Thunderer March (Shaffer), Lost Woods Fantasy (Hall), Bazaar (Standridge),DATE of EVENT 03/31/2022 ,Region: 4,1. Mark Conaway,2. Gary Jordan,3. Denny Whitley,1. Josh King,2. Rachel Schotchmer,3. Craig Haynie
2, 100-Concert Band, Gilmer Junior High, TEA: 230902041, Gilmer, Sarah Thompson,CC,Non-Varsity ,2022,174978,1,1,1,1,1,1,1,1,D, General Grant March (King), Bazaar  (Standridge), Pinnacle  (Grice),DATE of EVENT 03/31/2022 ,Region: 4,1. Mark Conaway,2. Gary Jordan,3. Denny Whitley,1. Josh King,2. Rachel Schotchmer,3. Craig Haynie
3, 100-Concert Band, Gilmer Junior High, TEA: 230902041, Gilmer, Chris Witt,CC,Varsity ,2022,174979,1,1,1,1,1,1,1,1,C, Activity March (Bennett/Clark), Colliding Visions  (Balmages), Tanchozuru  (Standridge),DATE of EVENT 03/31/2022 ,Region: 4,1. Mark Conaway,2. Gary Jordan,3. Denny Whitley,1. Josh King,2. Rachel Schotchmer,3. Craig Haynie
4, 100-Concert Band, Gladewater Middle School, TEA: 092-901, Gladewater," Rhett Pilcher / Jeff Smith, Joshlyn Marsh, Mitchell Smith",C,Varsity ,2022,174810,1,1,2,1,1,1,1,1,C, Activity March (Larry Clark), Atlantis (45)  (McGinty), Night Fury (20593)  (Chambers),DATE of EVENT 03/31/2022 ,Region: 4,1. Mark Conaway,2. Gary Jordan,3. Denny Whitley,1. Josh King,2. Rachel Schotchmer,3. Craig Haynie
5, 100-Concert Band, Kilgore Middle School, TEA: 92902, Kilgore," Tiffany McWilliams / Don Gamble, Cliffton Walker, Laney Hamner",CC,Non-Varsity ,2022,175382,2,3,2,2,2,2,2,2, , Spitfire  (Story), Dorian Chant (20589)  (Calhoun), Nottingham Castle (12)  (Daehn),DATE of EVENT 03/31/2022 ,Region: 4,1. Mark Conaway,2. Gary Jordan,3. Denny Whitley,1. Josh King,2. Rachel Schotchmer,3. Craig Haynie
6, 100-Concert Band, Kilgore Middle School, TEA: 92902, Kilgore," Don Gamble / Cliffton Walker, Laney Hamner, Tiffany McWilliams",CC,Varsity ,2022,175358,1,2,1,1,1,2,2,2,2, Winchester March (Edmonson), Annunciation (24114)  (Story), Lions Gate (22318)  (Sheldon),DATE of EVENT 03/31/2022 ,Region: 4,1. Mark Conaway,2. Gary Jordan,3. Denny Whitley,1. Josh King,2. Rachel Schotchmer,3. Craig Haynie
7, 100-Concert Band, Marshall ISD, TEA: 102902, Marshall, Carlos Maldonado / Callie DeJesus,CCC,Varsity ,2022,174794,1,1,1,1,1,1,1,1,C, Fanfare for a New Age (16229)  (Story), The Tears of Arizona (20591)  (Balmages), Valley Forge (KING/SWEARINGEN),DATE of EVENT 03/31/2022 ,Region: 4,1. Mark Conaway,2. Gary Jordan,3. Denny Whitley,1. Josh King,2. Rachel Schotchmer,3. Craig Haynie
8, 100-Concert Band, Marshall Junior High, TEA: 102902, Marshall, Callie Marita DeJesus / Carlos Maldonado,CCC,Non-Varsity ,2022,174795,1,2,2,2,1,1,1,1,2, Marchus Maximus (Michael Story), Conviction (18460)  (Clark), Majestica (17490)  (Gazlay),DATE of EVENT 03/31/2022 ,Region: 4,1. Mark Conaway,2. Gary Jordan,3. Denny Whitley,1. Josh King,2. Rachel Schotchmer,3. Craig Haynie
9, 100-Concert Band, Mineola Middle School, TEA: 250903041, Mineola, Dagoberto Gonzalez,C,Varsity ,2022,169498,1,1,1,1,1,1,1,1,C, Matrix March (Ed Huckeby), Egyptique (19576)  (Owens), Tanchozuru (20595)  (Standridge),DATE of EVENT 03/31/2022 ,Region: 4,1. Mark Conaway,2. Gary Jordan,3. Denny Whitley,1. Josh King,2. Rachel Schotchmer,3. Craig Haynie
10, 100-Concert Band, Mineola Middle School, TEA: 250903041, Mineola, Dagoberto Gonzalez / Austin Brannon,C,Non-Varsity ,2022,169461,1,1,2,1,1,1,1,1,D, March Primo (Dennis Eveland), Odyssey (18464) (Branchfield), Plaza de Toros (20709( (Story),DATE of EVENT 03/31/2022 ,Region: 4,1. Mark Conaway,2. Gary Jordan,3. Denny Whitley,1. Josh King,2. Rachel Schotchmer,3. Craig Haynie
11, 100-Concert Band, New Diana High School, TEA: 2300906001, Diana," Lance Boland / Gary Fort, Ethan Ainsworth",AAA,Varsity ,2022,174902,1,1,1,1,1,1,1,1,C, Activity March (Bennett/Clark), Maesong (15819) (Owens), Plaza de Toros (20709) (Story),DATE of EVENT 03/31/2022 ,Region: 4,1. Mark Conaway,2. Gary Jordan,3. Denny Whitley,1. Josh King,2. Rachel Schotchmer,3. Craig Haynie
12, 100-Concert Band, Pine Tree Junior High School, TEA: 092904041, Longview, Leslie Loanzon,CCC,Varsity ,2022,174705,2,2,1,2,1,1,1,1,2, Coast Guards March (King/Swearingen), Pioneer Songs (Daehn), Joy (Ticheli),DATE of EVENT 03/31/2022 ,Region: 4,1. Mark Conaway,2. Gary Jordan,3. Denny Whitley,1. Josh King,2. Rachel Schotchmer,3. Craig Haynie
13, 100-Concert Band, Pine Tree Junior High, TEA: 092904041, Longview, Jared Cronk,CCC,Non-Varsity ,2022,174721,3,2,2,2,2,1,1,1,2, Plaza de Toros  (Story), Colliding Visions (Balmages), Danza de Espana  (Chambers),DATE of EVENT 03/31/2022 ,Region: 4,1. Mark Conaway,2. Gary Jordan,3. Denny Whitley,1. Josh King,2. Rachel Schotchmer,3. Craig Haynie
14, 100-Concert Band, Quitman Junior High, TEA: 250904001, Quitman, Darren Castilaw / Michael Barron and Chace LeBlanc,C,Non-Varsity ,2022,175204,3,2,3,3,1,1,2,1,2, Kitty Hawk March (Edmondson), Ming Court (Pitter), Fortis (Gazlay),DATE of EVENT 03/31/2022 ,Region: 4,1. Mark Conaway,2. Gary Jordan,3. Denny Whitley,1. Josh King,2. Rachel Schotchmer,3. Craig Haynie
15, 100-Concert Band, Sabine Middle School, TEA: 1510538, Gladewater," Chance James / Rance Hawthorne, Brandon Duecker",C,Varsity ,2022,172999,1,1,1,1,1,1,1,1,D, Land of Liberty ( Swearingen ), Colliding Visions  (Balmages ), Plaza de Toros  (Story ),DATE of EVENT 03/31/2022 ,Region: 4,1. Mark Conaway,2. Gary Jordan,3. Denny Whitley,1. Josh King,2. Rachel Schotchmer,3. Craig Haynie
16, 100-Concert Band, Spring Hill Junior High, TEA: 092907, Longview," Kirk Wells / Michael Moody, Alexa Silver, and Terence Lloyd",CC,Varsity ,2022,174926,1,1,1,1,1,1,1,1,C, Excelsior! (Owens)," Moscow, 1941 (Balmages)", La Madre de los Gatos (Beck),DATE of EVENT 03/31/2022 ,Region: 4,1. Mark Conaway,2. Gary Jordan,3. Denny Whitley,1. Josh King,2. Rachel Schotchmer,3. Craig Haynie
17, 100-Concert Band, Spring Hill, TEA: 092907, Longview," Alexa Silver / Kirk Wells, Terence Lloyd, Michael Moody",CC,Non-Varsity ,2022,174981,1,1,1,1,1,1,1,1,D, Summit March (Bennett/Clark), Colliding Visions  (Balmages), Tanchozuru  (Standridge),DATE of EVENT 03/31/2022 ,Region: 4,1. Mark Conaway,2. Gary Jordan,3. Denny Whitley,1. Josh King,2. Rachel Schotchmer,3. Craig Haynie
18, 100-Concert Band, Sulphur Springs Middle School, TEA: 112-901, Sulphur Springs, Brittany Robinett,CCC,Varsity ,2022,174767,1,1,1,1,1,1,1,1,C, Peacemaker (K.L. King), Lullaby in the Mirror (20763)  (Saucedo), American Riversongs (246)  (La Plante),DATE of EVENT 03/31/2022 ,Region: 4,1. Mark Conaway,2. Gary Jordan,3. Denny Whitley,1. Josh King,2. Rachel Schotchmer,3. Craig Haynie
19, 100-Concert Band, Sulphur Springs Middle School, TEA: 112-901, Sulphur Springs, Zachary Griffin,CCC,Non-Varsity ,2022,174774,1,1,1,1,1,1,1,1,D, Lone Eagle March (Edmondson), Distant Horizons (66)  (Sweeney), Japanese Pictures (18467)  (Mixon),DATE of EVENT 03/31/2022 ,Region: 4,1. Mark Conaway,2. Gary Jordan,3. Denny Whitley,1. Josh King,2. Rachel Schotchmer,3. Craig Haynie
20, 100-Concert Band, Union Grove Junior High, TEA: 230908041, Gladewater, Jonathan Stafford,C,Varsity ,2022,174986,1,1,1,1,1,1,1,1,C, Captain Dane March (Owens), Japanese Pictures  (Mixon), Odyssey  (Branchfield),DATE of EVENT 03/31/2022 ,Region: 4,1. Mark Conaway,2. Gary Jordan,3. Denny Whitley,1. Josh King,2. Rachel Schotchmer,3. Craig Haynie
21, 100-Concert Band, Waskom Middle School, TEA: 102903041, Marshall, Jeremy Gressman,C,Non-Varsity ,2022,175949,DNA,DNA,DNA,DNA,DNA,DNA,DNA,DNA, , Union March  (Mekel Rogers), Great Beginnings (24119)  (Kamuf), Strength and Honor (24126)  (OLoughlin),DATE of EVENT 03/31/2022 ,Region: 4,1. Mark Conaway,2. Gary Jordan,3. Denny Whitley,1. Josh King,2. Rachel Schotchmer,3. Craig Haynie
22, 100-Concert Band, White Oak Middle School, TEA: 0?92908, White Oak, RANDY LEE WHATLEY,C,Varsity ,2022,176037,1,1,1,1,1,1,1,1,C, Winchester March (Edmondson), Serengeti Dreams (648)  (Smith), Japanese Pictures (18467) (Mixon),DATE of EVENT 03/31/2022 ,Region: 4,1. Mark Conaway,2. Gary Jordan,3. Denny Whitley,1. Josh King,2. Rachel Schotchmer,3. Craig Haynie
23, 100-Concert Band, White Oak Middle School, TEA: 092908, White Oak, Jacob Ramos,C,Non-Varsity ,2022,176048,1,1,1,1,1,1,1,1,D, Lexington March (Edmondson), Qin Shis Stone Army (19600)  (Arcari), Pinnacle (638)  (Grice),DATE of EVENT 03/31/2022 ,Region: 4,1. Mark Conaway,2. Gary Jordan,3. Denny Whitley,1. Josh King,2. Rachel Schotchmer,3. Craig Haynie
