,0,1,2,3,4,5,6,7,8,9,10,11,12,13,14,15,16,17,18,19,20,21,22,23,24,25,26,27,28
0, 100-Concert Band, Kilgore High School, TEA:, Kilgore, Mitchell Smith,AAAA,Varsity ,2007,29235,2,2,2,2,2,2,3,2, , Salute to Washington (Kiefer), Deir in De  (Barker (arr)), Sarabande and Polka  ( Arnold/Paynter),DATE of EVENT 04/12/2007 ,Region: 4,1. Rusty Lay,2. Rob Towell,3. Larry Tucker,1. Val Rose,2. Jim McGahee,3. Ralph Zamarippa
1, 100-Concert Band, Kilgore ISD, TEA:, Kilgore, Don Hardin,AAAA,Non-Varsity ,2007,34024,2,3,2,2,3,2,2,2, , March of the Irish Guard (Ployhar), Pinnacle  (Grice), Knights of Dunvegan  (Meyer),DATE of EVENT 04/12/2007 ,Region: 4,1. Rusty Lay,2. Rob Towell,3. Larry Tucker,1. Val Rose,2. Jim McGahee,3. Ralph Zamarippa
2, 100-Concert Band, Marshall High School, TEA:, Marshall, Anthony Robinson,AAAA,Varsity ,2007,28545,2,1,1,1,1,2,1,1,SSB, The Trombone King (Karl King), Irish Tune from County Derry  (Grainger/Rogers/SMC), Canarios Fantasia  (Akey),DATE of EVENT 04/12/2007 ,Region: 4,1. Rusty Lay,2. Rob Towell,3. Larry Tucker,1. Val Rose,2. Jim McGahee,3. Ralph Zamarippa
3, 100-Concert Band, Mt. Pleasant High School, TEA:, Mt. Pleasant, Jonna Ditto,AAAA,Non-Varsity ,2007,31474,3,3,3,3,3,3,2,3, , Omaha Beach March (John Edmondson), An Irish Interlude  (Barker), Kenya Contrasts  (Himes),DATE of EVENT 04/12/2007 ,Region: 4,1. Rusty Lay,2. Rob Towell,3. Larry Tucker,1. Val Rose,2. Jim McGahee,3. Ralph Zamarippa
4, 100-Concert Band, Mt. Pleasant High School, TEA:, Mt. Pleasant, Richard Eckstein,AAAA,Varsity ,2007,31469,2,1,2,2,1,1,1,1,PL1, Washington Post March (John Philip Sousa/Frederick Fennell ), Salvation is Created  (Tschesnokoff/Houseknecht)," Slavonic Dance #1, op. 46  (Dvorak/Longfield)",DATE of EVENT 04/12/2007 ,Region: 4,1. Rusty Lay,2. Rob Towell,3. Larry Tucker,1. Val Rose,2. Jim McGahee,3. Ralph Zamarippa
5, 100-Concert Band, North Lamar, TEA:, Paris, Randy Jones,AAAA,Varsity ,2007,32599,1,1,1,1,1,1,1,1,SSA, The Circus Bee March (Fillmore/Foster)," Symphony in Bb (Mvt. 1) (Hindemith, )", Four Scottish Dances (Arnold/Paynter),DATE of EVENT 04/12/2007 ,Region: 4,1. Rusty Lay,2. Rob Towell,3. Larry Tucker,1. Val Rose,2. Jim McGahee,3. Ralph Zamarippa
6, 100-Concert Band, Paris High School, TEA:, Paris, Charles Grissom,AAAA,Varsity ,2007,33743,1,1,1,1,2,1,2,2,PL1, Puenteareas (Soutullo/Weger), October  (Whitacre), A Longford Legend  (Sheldon),DATE of EVENT 04/12/2007 ,Region: 4,1. Rusty Lay,2. Rob Towell,3. Larry Tucker,1. Val Rose,2. Jim McGahee,3. Ralph Zamarippa
7, 100-Concert Band, Pine Tree High School, TEA:, Longview, Glenn Wells,AAAA,Varsity ,2007,32860,1,1,1,1,1,1,1,1,SSA," March--""Seventeen Come Sunday"" (R. Vaughan Williams)", English Country Settings (La Plante), Havendance (Holsinger),DATE of EVENT 04/12/2007 ,Region: 4,1. Rusty Lay,2. Rob Towell,3. Larry Tucker,1. Val Rose,2. Jim McGahee,3. Ralph Zamarippa
8, 100-Concert Band, Pine Tree High School, TEA:, Longview, Michael Moody,AAAA,Non-Varsity ,2007,33309,1,1,1,1,1,1,1,1,SSC, Pan American (King), An Irish Interlude  (Barker), Three Folk Miniatures  (Jutras (arr)),DATE of EVENT 04/12/2007 ,Region: 4,1. Rusty Lay,2. Rob Towell,3. Larry Tucker,1. Val Rose,2. Jim McGahee,3. Ralph Zamarippa
9, 100-Concert Band, Sulphur Springs High School, TEA:, Sulphur Springs, Charles McCauley,AAAA,Varsity ,2007,32624,2,1,1,1,1,1,1,1,SSA, Quality Plus (Jewell), As Summer Was Just Beginning  (Daehn), Pablo!  (Meyer),DATE of EVENT 04/12/2007 ,Region: 4,1. Rusty Lay,2. Rob Towell,3. Larry Tucker,1. Val Rose,2. Jim McGahee,3. Ralph Zamarippa
10, 100-Concert Band, Sulphur Springs High School, TEA:, Sulphur Springs, Steve Proctor,AAAA,Non-Varsity ,2007,32636,2,2,1,2,3,2,2,2, , General Grant (King), Barbarossa  (Himes), Fire Dance  (Akey),DATE of EVENT 04/12/2007 ,Region: 4,1. Rusty Lay,2. Rob Towell,3. Larry Tucker,1. Val Rose,2. Jim McGahee,3. Ralph Zamarippa
11, 100-Concert Band, Texas High School, TEA:, Texarkana, Steve Bennett,AAAA,Non-Varsity ,2007,30943,1,1,1,1,2,2,1,2,PL2, Freedom City (K. L. King), Prospect (Pierre La Plante), Flight of Eagles (Elliot Del Borgo),DATE of EVENT 04/12/2007 ,Region: 4,1. Rusty Lay,2. Rob Towell,3. Larry Tucker,1. Val Rose,2. Jim McGahee,3. Ralph Zamarippa
12, 100-Concert Band, Texas High, TEA:, Texarkana, Buddy Deese,AAAA,Varsity ,2007,30933,1,2,1,1,1,1,1,1,SSA, The Gladiator's Farewell (H.L. Blankenburg), Spoon River (Grainger/Sheldon), Chorale and Shaker Dance (John Zdechlik),DATE of EVENT 04/12/2007 ,Region: 4,1. Rusty Lay,2. Rob Towell,3. Larry Tucker,1. Val Rose,2. Jim McGahee,3. Ralph Zamarippa
