,0,1,2,3,4,5,6,7,8,9,10,11,12,13,14,15,16,17,18,19,20,21,22,23,24,25,26,27,28
0, 100-Concert Band, Arbor Creek MS, TEA:, Carrollton, Kim Beene,CC,Varsity ,2021,165615,1,1,1,1,1,1,1,1,C, Brighton Beach (Latham), West Highlands Sojourn (Sheldon/), J. S. Jig (Karrick/),DATE of EVENT 04/23/2021 ,Region: 2,1. GREG DICK,2. SUSAN SCARBOROUGH,3. DAVID PUCKETT,1. BETHANN ADAMS,2. RANDY VAUGHN,3. RODNEY KLETT
1, 100-Concert Band, Argyle Middle School, TEA:, Argyle," Evan Fletcher / Bojan Gutic, Michael Lemish, Jason Bird, James McNair, Asa Burk",CCC,Varsity ,2021,166058,1,1,1,1,1,1,1,1,C, High School Cadets (Sousa), Kenya Contrasts (Himes), Iroquois Sunrise (Rudgers),DATE of EVENT 04/23/2021 ,Region: 2,1. GREG DICK,2. SUSAN SCARBOROUGH,3. DAVID PUCKETT,1. BETHANN ADAMS,2. RANDY VAUGHN,3. RODNEY KLETT
2, 100-Concert Band, Briarhill Middle School, TEA:, Highland village, Kevin Graham / Brittney Rupp,CC,Varsity ,2021,165548,1,1,1,1,1,1,1,1,C, Valley Forge March (Edmondson), Danza de Espana  (Chambers), Serengeti Dreams  (Smith),DATE of EVENT 04/23/2021 ,Region: 2,1. GREG DICK,2. SUSAN SCARBOROUGH,3. DAVID PUCKETT,1. BETHANN ADAMS,2. RANDY VAUGHN,3. RODNEY KLETT
3, 100-Concert Band, Creek Valley MS, TEA:, Carrollton, Kim Cooley,CC,Varsity ,2021,164943,1,1,1,1,1,1,1,1,C, Mister Joe (Bennett/Clark), Our Kingsland Spring (Hazo/), Sparks (Balmages/),DATE of EVENT 04/23/2021 ,Region: 2,1. GREG DICK,2. SUSAN SCARBOROUGH,3. DAVID PUCKETT,1. BETHANN ADAMS,2. RANDY VAUGHN,3. RODNEY KLETT
4, 100-Concert Band, DeLay MS, TEA:, Lewisville, David DeSoto,CCC,Varsity ,2021,165593,1,1,1,1,1,1,2,1,C, Plaza de Toros (Story/), Lion`s Gate (Sheldon/), Marzo Zingaro (Standridge/),DATE of EVENT 04/23/2021 ,Region: 2,1. GREG DICK,2. SUSAN SCARBOROUGH,3. DAVID PUCKETT,1. BETHANN ADAMS,2. RANDY VAUGHN,3. RODNEY KLETT
5, 100-Concert Band, Downing Middle School, TEA:, Flower Mound, Mary Clardy,CC,Non-Varsity ,2021,165652,1,1,1,1,1,1,1,1,D, Infinity  (Curnow), Dancing Kites  (Bernotas), Armory  (Standridge),DATE of EVENT 04/23/2021 ,Region: 2,1. GREG DICK,2. SUSAN SCARBOROUGH,3. DAVID PUCKETT,1. BETHANN ADAMS,2. RANDY VAUGHN,3. RODNEY KLETT
6, 100-Concert Band, Durham Middle School, TEA:, Lewisville, Ellie Murphy,CC,Varsity ,2021,165227,2,1,2,2,2,2,2,2, , Under The Bell Tower March (David Mairs), Joy (Frank Ticheli), Red Giant (Jorge Vargas),DATE of EVENT 04/23/2021 ,Region: 2,1. GREG DICK,2. SUSAN SCARBOROUGH,3. DAVID PUCKETT,1. BETHANN ADAMS,2. RANDY VAUGHN,3. RODNEY KLETT
7, 100-Concert Band, Forestwood Middle School, TEA:, Flower Mound, Michael Roberts,CC,Varsity ,2021,163167,1,1,1,1,1,1,1,1,C, Red Cape (Spanish March) (James Meredith), Tudor Sketches (play mvts 1 & 2 or mvts 2 & 3) (Owens), Bazaar  (Standridge),DATE of EVENT 04/23/2021 ,Region: 2,1. GREG DICK,2. SUSAN SCARBOROUGH,3. DAVID PUCKETT,1. BETHANN ADAMS,2. RANDY VAUGHN,3. RODNEY KLETT
8, 100-Concert Band, Gene Pike MS, TEA:, Justin, Jack Forbis,CCC,Varsity ,2021,163839,2,1,1,1,1,1,1,1,C, El Zorro Rojo (Randall Standridge), In A Quiet Place (Bill Calhoun), Red Giant (Jorge L. Vargas),DATE of EVENT 04/23/2021 ,Region: 2,1. GREG DICK,2. SUSAN SCARBOROUGH,3. DAVID PUCKETT,1. BETHANN ADAMS,2. RANDY VAUGHN,3. RODNEY KLETT
9, 100-Concert Band, Griffin MS, TEA:, The Colony, Leigh Ann McClain,CC,Varsity ,2021,163307,1,1,1,1,2,1,1,1,C, Portsmouth Reflections (Oare/), La Fiesta Brava (John Edmondson), Red Giant (Vargas/),DATE of EVENT 04/23/2021 ,Region: 2,1. GREG DICK,2. SUSAN SCARBOROUGH,3. DAVID PUCKETT,1. BETHANN ADAMS,2. RANDY VAUGHN,3. RODNEY KLETT
10, 100-Concert Band, Hedrick Middle School, TEA:, Lewisville, Nathan Cooley / Claire Dixon,CC,Varsity ,2021,165541,1,1,1,1,1,1,1,1,C, La Muleta Viciosa (Nelson), Irish Air and Dance  (Story), Travelin Music  (LaPlante),DATE of EVENT 04/23/2021 ,Region: 2,1. GREG DICK,2. SUSAN SCARBOROUGH,3. DAVID PUCKETT,1. BETHANN ADAMS,2. RANDY VAUGHN,3. RODNEY KLETT
11, 100-Concert Band, Huffines Middle School, TEA:, Lewisville, Richard Stephens,CC,Varsity ,2021,164013,1,1,1,1,1,1,2,1,C, Espanola (Lopez), Two British Folk Songs  (Del Borgo), Blue Ridge Reel  (Balmages),DATE of EVENT 04/23/2021 ,Region: 2,1. GREG DICK,2. SUSAN SCARBOROUGH,3. DAVID PUCKETT,1. BETHANN ADAMS,2. RANDY VAUGHN,3. RODNEY KLETT
12, 100-Concert Band, Killian MS, TEA:, Lewisville, Rob Chilton,CCC,Varsity ,2021,162461,1,1,1,1,1,1,1,1,C, Valley Forge March (Edmondson)," Moscow, 1941 (Balmages)", Summit Fanfare (Owens),DATE of EVENT 04/23/2021 ,Region: 2,1. GREG DICK,2. SUSAN SCARBOROUGH,3. DAVID PUCKETT,1. BETHANN ADAMS,2. RANDY VAUGHN,3. RODNEY KLETT
13, 100-Concert Band, Lakeview MS, TEA:, The Colony, Chris Anderson,CC,Varsity ,2021,163927,1,1,2,1,3,2,3,3,2, Plaza de Toros (Story), Ming Court (Pitter), Courtlandt County Festival (Owens),DATE of EVENT 04/23/2021 ,Region: 2,1. GREG DICK,2. SUSAN SCARBOROUGH,3. DAVID PUCKETT,1. BETHANN ADAMS,2. RANDY VAUGHN,3. RODNEY KLETT
14, 100-Concert Band, Lamar MS, TEA:, Flower Mound," Joshua Duermeyer / Matt Ball, Kennan Wylie",CC,Varsity ,2021,165317,1,1,1,1,1,1,1,1,C, March of the Dragons (Mike Collins-Dowden), Japanese Pictures (Mixon/), Storm Mountain Jubilee (Strommen),DATE of EVENT 04/23/2021 ,Region: 2,1. GREG DICK,2. SUSAN SCARBOROUGH,3. DAVID PUCKETT,1. BETHANN ADAMS,2. RANDY VAUGHN,3. RODNEY KLETT
15, 100-Concert Band, Leo Adams MS, TEA:, Haslet," Alycia Bingaman / Stephanie Northam, Nicole Loyd, Matt Moore",CCC,Varsity ,2021,165923,1,1,1,1,1,1,1,1,C, Alamo March (King), La Madre de los Gatos  (Beck), The Old Red Mill  (Karrick),DATE of EVENT 04/23/2021 ,Region: 2,1. GREG DICK,2. SUSAN SCARBOROUGH,3. DAVID PUCKETT,1. BETHANN ADAMS,2. RANDY VAUGHN,3. RODNEY KLETT
16, 100-Concert Band, McKamy Middle School, TEA:, Flower Mound, Russell Cote / Lindsay Abbott,CC,Varsity ,2021,165200,1,1,1,1,1,1,1,1,C, Excelsior! Concert March (William Owens), Down by the Salley Gardens  (Anon. or Trad./Sweeney), Pinnacle  (Rob Grice),DATE of EVENT 04/23/2021 ,Region: 2,1. GREG DICK,2. SUSAN SCARBOROUGH,3. DAVID PUCKETT,1. BETHANN ADAMS,2. RANDY VAUGHN,3. RODNEY KLETT
17, 100-Concert Band, Medlin Middle School, TEA:, Trophy Club," Ashley Coleman / Ethan Munger, John Bingaman",CCC,Varsity ,2021,165515,2,1,1,1,1,1,1,1,C, Excelsior (William Owens), The Battle Pavane  (Susato/Margolis), Japanese Pictures  (Mixon),DATE of EVENT 04/23/2021 ,Region: 2,1. GREG DICK,2. SUSAN SCARBOROUGH,3. DAVID PUCKETT,1. BETHANN ADAMS,2. RANDY VAUGHN,3. RODNEY KLETT
18, 100-Concert Band, Shadow Ridge MS, TEA:, Flower Mound, Ross Patterson / Adrienne Schuster,CC,Varsity ,2021,165788,1,1,1,1,1,1,1,1,C, Armenian Rhapsody (Vinson), Butterfly`s Ball (Fraley), March of the Trolls (Grieg/Beck),DATE of EVENT 04/23/2021 ,Region: 2,1. GREG DICK,2. SUSAN SCARBOROUGH,3. DAVID PUCKETT,1. BETHANN ADAMS,2. RANDY VAUGHN,3. RODNEY KLETT
19, 100-Concert Band, Tidwell Middle School, TEA:, Roanoke, Renee Quinlan,CCC,Varsity ,2021,166153,2,1,1,1,1,1,1,1,C, El Zorro Rojo (Standridge), American Riversongs (La Plante), Hypnotic Fireflies (Balmages),DATE of EVENT 04/23/2021 ,Region: 2,1. GREG DICK,2. SUSAN SCARBOROUGH,3. DAVID PUCKETT,1. BETHANN ADAMS,2. RANDY VAUGHN,3. RODNEY KLETT
