,Event,School,TEA,City,Directors,Conference,Classification,Year,ID,Stage Judge 1,Stage Judge 2,Stage Judge 3,Stage Final,SR Judge 1,SR Judge 2,SR Judge 3,SR Final,Award,Selection 1,Selection 2,Selection 3
0, 100-Concert Band, A.P. Solis Middle School, TEA:, Donna, Moises Garza,CC,Non-Varsity A,2018,135257,1,1,1,1,1,1,1,1,D, Infinity Concert March (James Curnow), Atlantis (Anne McGinty), Courtlandt County Festival  (William Owens)
1, 100-Concert Band, B. Garza Middle School, TEA:, La Feria, Cecilia Perez,CCC,Non-Varsity ,2018,128613,2,2,2,2,1,1,1,1,2, Infinity March (James Curnow), Crusade  (Gassi), Phantom Ship  (Del Borgo)
2, 100-Concert Band, Berta Cabaza Middle School, TEA:, San Benito, David Jimenez,CC,Sub Non-Varsity A,2018,137423,2,2,1,2,2,2,2,2, , Musicmakers March (Lavender/Sweeny), Sakura  (Story), The Spacious Firmament on High  (Sharp)
3, 100-Concert Band, Berta Cabaza Middle School, TEA:, San Benito, Lauren Garza,CC,Non-Varsity A,2018,137424,2,1,1,1,1,1,1,1,D, Macarena (Monterde/Story), In the Bleak Midwinter (Holst/Bullock), Iroquois Sunrise (Rudgers)
4, 100-Concert Band, Carlos F. Truan, TEA:," Elsa, TX"," Adrian Luis Garcia / Alma Arellano, Joel Cazarez, Anthony Gonzalez, Nickolas Agado, Aaron Sandoval",CC,Non-Varsity ,2018,135866,2,2,2,2,1,1,1,1,2, Laredo (John Higgins), Courtlandt County Festival (William Owens), Ming Court (Donald Pitter)
5, 100-Concert Band, Central Middle School, TEA:, Weslaco, Michael Perez,CC,Non-Varsity ,2018,136794,2,3,2,2,2,2,2,2, , Infinity March (Curnow), Atlantis  (McGinty), Crusade  (Gassi)
6, 100-Concert Band, Coakley Middle School, TEA:, Harlingen, Lehi Sanchez,CC,Non-Varsity ,2018,132989,1,2,1,1,2,1,1,1,D, Meadowland March (John O'Reilly), Crusade (Vince Gassi), Egyptique (William Owens)
7, 100-Concert Band, Cuellar Middle School, TEA:, Weslaco, Victoria Garza,CC,Non-Varsity ,2018,135870,4,4,3,4,2,3,2,2, , Skylight  (Hodges), Corps of Discovery  (Owens), March Primo (Eveland)
8, 100-Concert Band, D.M. Sauceda Middle School, TEA:, Donna, Daniel Saldana,CC,Non-Varsity ,2018,137929,1,2,2,2,2,2,2,2, , Fortitude (William Owens), Odyssey (Aric Branchfield), Qin Shi's Stone Army (Tyler Arcari)
9, 100-Concert Band, Edward Manzano Middle School, TEA:, Brownsville, David Martinez,CC,Non-Varsity ,2018,133131,1,1,1,1,1,1,1,1,D, Andalucia (V. Lopez), In The Bleak Midwinter  (Holst/Bullock), Uskudar  (Anon. or Trad./Smith/Story)
10, 100-Concert Band, Edward Manzano Middle School, TEA:, Brownsville, Rob McBee,CC,Sub Non-Varsity ,2018,133126,1,1,1,1,2,1,2,2,2, Integrity March (William Owens), Sakura  (Story), Nottingham Castle  (Daehn)
11, 100-Concert Band, Filemon B. Vela Middle School, TEA:, Brownsville, Miguel Garza,CC,Non-Varsity A,2018,136480,1,1,1,1,1,1,1,1,D, Lake Station March (Owens), Ballet of Spring (Ballet du printemps)  (O'Connor), Japanese Pictures  (Mixon)
12, 100-Concert Band, Garcia Middle School, TEA:, Brownsville, Joe Salazar,CCC,Non-Varsity ,2018,136163,2,2,2,2,2,2,2,2, , Wedgwood March (William Owens), Theme and Variations (Timothy Broege), Atlantis (Anne McGinty)
13, 100-Concert Band, Gutierrez Middle School, TEA:, Harlingen, Heliodoro Bravo,CC,Non-Varsity ,2018,132086,1,1,2,1,1,1,1,1,D, Wingate March (O'Reilly), Sakura  (Story), Dorian Chant  (Calhoun)
14, 100-Concert Band, Liberty Memorial Middle School, TEA:, Los Fresno, Cristina Vastano,CC,Non-Varsity ,2018,132902,2,2,2,2,2,1,2,2, , Guardians Of Liberty (Paul Murtha), Gathering In The Glen (Michael Sweeney), Dance Celebration (Robert Smith)
15, 100-Concert Band, Los Cuates Middle School, TEA:, Los Fresnos, Bryan Morrell,CC,Non-Varsity ,2018,132814,1,1,1,1,1,1,1,1,D, Circus Time (Daniel Shaffer), Early One Morning  (Stubbs), Night Fury  (Chambers)
16, 100-Concert Band, Los Cuates Middle School, TEA:, Los Fresnos, Jerry Morales,CC,Sub Non-Varsity ,2018,132820,1,1,1,1,1,1,1,1,D, The Thunderer (Sousa/Story), Elizabethan Dance  (Williams), Conviction  (Clark)
17, 100-Concert Band, Lucio Middle School, TEA:, Brownsville, Benita Trevino,CC,Sub Non-Varsity ,2018,133360,1,1,2,1,2,3,2,2,2, Integrity March (William Owens), Dance Celebration  (Smith), Sakura  (Story)
18, 100-Concert Band, Lucio Middle School, TEA:, Brownsville," David Ramirez / Matthew Lorick, Benita Trevino, Leilani Ramirez",CC,Non-Varsity A,2018,135930,1,1,1,1,1,2,1,1,D, Bridgeway March (Hilliard), Nottingham Castle  (Daehn), Ghost Ship  (Story)
19, 100-Concert Band, Lyford Middle School, TEA:, Lyford, Victoria Vasquez-Gonzalez,C,Non-Varsity ,2018,137897,2,3,2,2,1,1,1,1,2, Conviction  (Clark), Nottingham Castle  (Daehn), Onward and Upward (Owens)
20, 100-Concert Band, Mary Hoge Middle School, TEA:, Weslaco, Jesus Gallegos,CCC,Non-Varsity ,2018,137276,2,2,2,2,2,2,2,2, , Andalucia (Victor Lopez), Majestica (Gary Gazlay), Atlantis (Anne McGinty)
21, 100-Concert Band, Memorial Middle School, TEA:, Harlingen, Michael R Ramirez,CC,Non-Varsity ,2018,135291,1,1,1,1,1,1,1,1,D, Rose Hill March (William Owens), Elizabethan Dance  (Williams), Crusade  (Gassi)
22, 100-Concert Band, Miller Jordan Middle School, TEA:, San Benito, Alejandro Martinez / Rudy Gonzalez,CC,Non-Varsity ,2018,137456,1,2,2,2,1,2,2,2, , Synergy March (William Owens), Sakura (Michael Story), Court Festival (Bruce Pearson)
23, 100-Concert Band, Moises Vela Middle School, TEA:, Harlingen, Erika R Uribe,CC,Non-Varsity ,2018,136999,1,1,1,1,1,1,1,1,D, Excitation March (Grice), Sakura  (Story), Courtlandt County Festival  (Owens)
24, 100-Concert Band, Myra Green Middle School, TEA:, Raymondville, Adonnis Hernandez,CC,Non-Varsity ,2018,133516,1,1,1,1,1,1,1,1,D, Onward and Upward  (William Owens ), Sakura  (Story), Dance Celebration  (Smith)
25, 100-Concert Band, Oliveira Middle School, TEA:, BROWNSVILLE, Jose Manzano,CCC,Non-Varsity ,2018,135420,1,1,1,1,1,1,1,1,D, Bridgeway March (Quincy Hilliard), Summit Fanfare  (Owens), Night Fury  (Chambers)
26, 100-Concert Band, Perkins Middle School, TEA:, Brownsville, Jennifer Garcia,CC,Non-Varsity ,2018,135402,2,2,2,2,2,1,2,2, , Union March (M. Rogers), Canon of Peace  (Jennings), Night Fury  (Chambers)
27, 100-Concert Band, Port Isabel Jr. High School, TEA:, Port Isabel, Diana Pena,CC,Non-Varsity ,2018,135550,1,1,1,1,1,1,1,1,D, Honor March (Feldstein/Clark), In The Bleak Midwinter  (Holst/Bullock), Ghost Ship  (Story)
28, 100-Concert Band, Port Isabel Junior High School, TEA:, Port Isabel, Clarissa Salinas,CC,Sub Non-Varsity ,2018,135846,2,2,2,2,1,1,2,1,2, Onward and Upward (William Owens), Theme and Variations  (Broege), Dance Celebration  (Smith)
29, 100-Concert Band, Resaca Middle School, TEA:, Los Fresnos, John C Randolph,CC,Non-Varsity ,2018,135990,1,1,2,1,1,2,2,2,2, Union March (Mekel Rogers), Sakura  (Story), Fortis  (Gazlay)
30, 100-Concert Band, Rio Hondo JH, TEA:, Rio Hondo, Boris Libson III,CC,Non-Varsity ,2018,135114,2,2,1,2,1,2,1,1,2, Dance Celebration  (Smith), Two Minute Symphony  (Margolis), Kitty Hawk March (Edmonson)
31, 100-Concert Band, San Benito Riverside MS, TEA:, San Benito, Manuel Cerda III,CC,Non-Varsity ,2018,136985,2,3,2,2,2,3,2,2, , Pride Of America March (William Owens), Sakura  (Story), Armory  (Standridge)
32, 100-Concert Band, Sgt. Manuel Chacon Middle School, TEA:, Mercedes, Nancy Coronado / Guy Mckinney,CC,Non-Varsity ,2018,134789,2,1,1,1,2,2,2,2,2, Synergy March  (William Owens ), Elizabethan Dance  (Williams), Sakura  (Story)
33, 100-Concert Band, Stell Middle School, TEA:, Brownsville, Carlos E Perez,CCC,Non-Varsity ,2018,134432,2,1,2,2,2,2,2,2, , Distant Horizons (Michael Sweeney), Dance Celebration (Robert W. Smith), Synergy March (William Owens)
34, 100-Concert Band, Stillman Middle School, TEA:, Brownsville, Margot Meave,CCC,Non-Varsity ,2018,136502,1,1,1,1,1,1,1,1,D, Fortitude (Concert March) (William Owens), Tears of Arizona (Brian Balmages), Night Fury (Carol Brittin Chambers)
35, 100-Concert Band, Todd Middle School, TEA:," Donna,", Giselle Cavazos,CC,Non-Varsity ,2018,134308,1,1,1,1,1,1,1,1,D, Dorian Chant  (Calhoun), Skylight  (Hodges), Recognition March  (Larry Clark )
36, 100-Concert Band, Vernon Middle School, TEA:, Harlingen, Ricky Guevara,CC,Non-Varsity ,2018,132514,1,1,1,1,2,2,2,2,2, Rose Hill March  (William Owens), Dorian Chant (Bill Calhoun), Dance Celebration (Robert W. Smith)
37, 100-Concert Band, W.B. Green JH, TEA:, La Feria, Raul Garate Jr,CC,Sub Non-Varsity ,2018,137049,2,1,2,2,1,2,2,2, , March of the Champions (Timothy Loest), Courtlandt County Festival  (Owens), Serengeti Dreams  (Smith)
38, 100-Concert Band, W.B. Green JH, TEA:, La Feria, Jaime Flores,CC,Sub Non-Varsity B,2018,137161,2,2,2,2,2,2,3,2, , Infinity (Concert March) (James Curnow), Two Minute Symphony  (Margolis), The Spacious Firmament on High  (Sharp)
39, 100-Concert Band, W.B. Green JH, TEA:, La Feria, Jaime Flores,CC,Non-Varsity ,2018,137153,1,1,1,1,1,1,1,1,D, Fighting Falcon March (Todd Stalter), Plaza de Toros  (Story), Night Fury  (Chambers)
