,Event,School,TEA,City,Directors,Conference,Classification,Year,ID,Stage Judge 1,Stage Judge 2,Stage Judge 3,Stage Final,SR Judge 1,SR Judge 2,SR Judge 3,SR Final,Award,Selection 1,Selection 2,Selection 3
0, 100-Concert Band, Bosqueville High School, TEA:, Waco, James Beeson,C,Varsity ,2020,161486, , , , , , , , , , Vikings Victorious (Sharp), Majestica (17490)  (Gazlay), Danza de Espana (19602)  (Chambers)
1, 100-Concert Band, Fairfield Junior High, TEA:, Fairfield," Gust Witt / Bill Large, Russell Holland",CC,Non-Varsity ,2020,161474, , , , , , , , , , March of the Irish Guard (Ployhar), Gathering In The Glen (652)  (Sweeney), Egyptique (19576)  (Owens)
2, 100-Concert Band, Fairfield Junior High, TEA:, Fairfield," Russell Holland / Bill Large, Gust Witt",CC,Sub Non-Varsity ,2020,161473, , , , , , , , , , Saratoga March (Holland), Night Fury (Chambers), Plaza de Toros (Story)
3, 100-Concert Band, Fairfield junior high, TEA:, Fairfield, William Large,CC,Varsity ,2020,161443, , , , , , , , , , Cambrian March (Russell Holland), Japanese Festival (33)  (Hilliard), La Rejouissance (118)  (Handel/Williams)
4, 100-Concert Band, Italy High School, TEA:, Italy, Rebecca Kimmons Choate / Fredy Gonzalez,C,Varsity ,2020,155500, , , , , , , , , , Cold Brook March (O'Reilly), Night Fury (20593)  (Chambers), Corps of Discovery (17481)  (Owens)
5, 100-Concert Band, Itasca Middle School, TEA:, Itasca, Amanda Jeansonne / Patrick Middleton,C,Varsity ,2020,161528, , , , , , , , , , Monmouth March (Larry Clark), Serengeti Dreams (648)  (Smith), Qin Shis Stone Army (19600)  (Arcari)
6, 100-Concert Band, West High School, TEA:, West," Mark Dorsey / Leah Jones, Matt Olmstead",C,Non-Varsity ,2020,157227, , , , , , , , , , Crown Point March  (Bruce Pearson), Little Brazil Suite (15861)  (Balent), Dance Celebration (647)  (Smith)
7, 100-Concert Band, West Middle School, TEA:, West," Leah Jones / Mark Dorsey, Matt Olmstead",C,Varsity ,2020,157016, , , , , , , , , , Pompeii Unearthed Concert March (Ryan Nowlin), Big Sky Round-Up (17480)  (Sheldon), Uskudar (16230)  (Anon. or Trad./Smith/Story)
8, 100-Concert Band, Whitney Middle School, TEA:, Whitney, Elizabeth Martinez / Josh Nowlin,C,Varsity ,2020,159976, , , , , , , , , , The Big Circus March (Foster), Tanchozuru (Standridge), Sunchaser (Chambers)
