,0,1,2,3,4,5,6,7,8,9,10,11,12,13,14,15,16,17,18,19,20,21,22,23,24,25,26,27,28,29
0, 100-Concert Band, Arlington Heights HS, TEA:, Fort Worth, David Wiebers,AAAAA,Varsity ,2018,135926,1,1,1,1,2,2,2,2,1, March of the Dwarfs (Grieg/Story), La Madre de los Gatos  (Beck), Metal  (Balmages),DATE of EVENT 04/03/2018 ,Region: 5,1. Bill Centera,2. Bill Marrocco,3. Cindy Mikel,1. Terry Maxwell/Mike Lipe,2. Mark Poole,3. Danny Prado,
1, 100-Concert Band, Arlington High School, TEA:, Arlington," Michael Hejny / Nathan Burum, Brian Lowe, Nathan Hervey",AAAAAA,Varsity ,2018,136484,1,1,1,1,1,1,1,1,A, March from the Symphonic Metamorphosis (Hindemith), Elsa's Procession to the Cathedral (Wagner/Calliliet), Angels in the Architecture  (Ticheli),DATE of EVENT 04/03/2018 ,Region: 5,1. Bill Centera,2. Bill Marrocco,3. Cindy Mikel,1. Terry Maxwell/Mike Lipe,2. Mark Poole,3. Danny Prado,
2, 100-Concert Band, Arlington High School, TEA:, Arlington," Nathan Burum / Michael Hejny, Nathan Hervey, Brian Lowe",AAAAAA,Non-Varsity ,2018,130107,1,1,1,1,1,1,1,1,C, Amparito Roca (), In the Center Ring (Sheldon)," Prelude, Siciliano and Rondo (Arnold/Paynter)",DATE of EVENT 04/03/2018 ,Region: 5,1. Bill Centera,2. Bill Marrocco,3. Cindy Mikel,1. Terry Maxwell/Mike Lipe,2. Mark Poole,3. Danny Prado,
3, 100-Concert Band, Arlington High School, TEA:, Arlington," Nathan Hervey / Michael hejny, Nathan Burum, Brian Lowe",AAAAAA,Sub Non-Varsity ,2018,137244,1,1,1,1,1,1,2,1,C, Valley Forge March (King/Swearingen), Flight of Eagles  (Del Borgo), Brave Spirit  (Standridge),DATE of EVENT 04/03/2018 ,Region: 5,1. Bill Centera,2. Bill Marrocco,3. Cindy Mikel,1. Terry Maxwell/Mike Lipe,2. Mark Poole,3. Danny Prado,
4, 100-Concert Band, Benbrook MS-HS, TEA:, Benbrook, Marcus Bryant,AAAA,Non-Varsity ,2018,133356,1,1,2,1,1,1,1,1,C, Procession of the Sorcerers (Buckley), Lullaby to the Moon  (Balmages), Abracadabra  (Ticheli),DATE of EVENT 04/03/2018 ,Region: 5,1. Bill Centera,2. Bill Marrocco,3. Cindy Mikel,1. Terry Maxwell/Mike Lipe,2. Mark Poole,3. Danny Prado,
5, 100-Concert Band, Bowie High School, TEA:, Arlington, Rumaldo Solis,AAAAAA,Varsity ,2018,135750,1,1,1,1,1,1,1,1,A, Glory of the Yankee Navy March (Sousa/Fennell), Trittico  (Nelhybel), Ave Maria  (Biebl/Cameron),DATE of EVENT 04/03/2018 ,Region: 5,1. Bill Centera,2. Bill Marrocco,3. Cindy Mikel,1. Terry Maxwell/Mike Lipe,2. Mark Poole,3. Danny Prado,
6, 100-Concert Band, Carter-Riverside HS, TEA:, Ft Worth, Cody Haddock / Rosendo Sanchez,AAAAA,Varsity ,2018,134234,1,1,1,1,2,2,2,2,1, Glaciers  (Director), Summer Resounding  (Balmages), Our Heritage March (King/arr. Swearingen),DATE of EVENT 04/03/2018 ,Region: 5,1. Bill Centera,2. Bill Marrocco,3. Cindy Mikel,1. Terry Maxwell/Mike Lipe,2. Mark Poole,3. Danny Prado,
7, 100-Concert Band, Diamond Hill-Jarvis HS, TEA:, Fort Worth, Adam Lara,AAAA,Varsity ,2018,137010,2,1,2,2,3,3,3,3, , Amparito Roca (Texidor/Fagan), Accolade  (Himes), Choreography  (Sheldon),DATE of EVENT 04/03/2018 ,Region: 5,1. Bill Centera,2. Bill Marrocco,3. Cindy Mikel,1. Terry Maxwell/Mike Lipe,2. Mark Poole,3. Danny Prado,
8, 100-Concert Band, Dunbar HS, TEA:, Fort worth, David Rhone / Chis Mitchell & Kendal McKenzie,AAAA,Non-Varsity ,2018,136335,2,2,3,2,2,2,2,2, , Summit March (Larry Clark), Down a Country Lane (Copland/Patterson), Blue Ridge Saga (Swearingen),DATE of EVENT 04/03/2018 ,Region: 5,1. Bill Centera,2. Bill Marrocco,3. Cindy Mikel,1. Terry Maxwell/Mike Lipe,2. Mark Poole,3. Danny Prado,
9, 100-Concert Band, Eastern Hills HS, TEA:, Fort Worth, Derek Smilowski / David Carlsen,AAAAA,Non-Varsity ,2018,137009,2,2,3,2,3,3,3,3, , The Battle Pavane  (Susato/Margolis), Two British Folk Songs  (Del Borgo), The River Kwai March (Arnold/Longfield),DATE of EVENT 04/03/2018 ,Region: 5,1. Bill Centera,2. Bill Marrocco,3. Cindy Mikel,1. Terry Maxwell/Mike Lipe,2. Mark Poole,3. Danny Prado,
10, 100-Concert Band, James Bowie High School, TEA:, Arlington, Rachel Annese Friedman,AAAAAA,Non-Varsity ,2018,135745,1,1,1,1,1,1,2,1,C, The Billboard March (Klohr/Balent), Shine (Markowski), Dolce and Dance (Fagan),DATE of EVENT 04/03/2018 ,Region: 5,1. Bill Centera,2. Bill Marrocco,3. Cindy Mikel,1. Terry Maxwell/Mike Lipe,2. Mark Poole,3. Danny Prado,
11, 100-Concert Band, Juan Seguin HS, TEA:, Arlington," Phillip Cadenhead / Grady Niblo, Angel Briseno",AAAAA,Varsity ,2018,136002,1,1,2,1,1,1,2,1,A, El Relicario (Pailla/Longfield), Dublin Dances  (Van der Roost), Summer Dances  (Balmages),DATE of EVENT 04/03/2018 ,Region: 5,1. Bill Centera,2. Bill Marrocco,3. Cindy Mikel,1. Terry Maxwell/Mike Lipe,2. Mark Poole,3. Danny Prado,
12, 100-Concert Band, Lake Ridge High School, TEA:, Mansfield," Alberto Ocasio / Brad Bonebrake, Ben Scearce",AAAAA,Sub Non-Varsity ,2018,136599,1,1,1,1,1,2,1,1,C, El Relicario (Padilla/Longfield), American Riversongs  (La Plante), Songs of Old Kentucky  (Karrick),DATE of EVENT 04/03/2018 ,Region: 5,1. Bill Centera,2. Bill Marrocco,3. Cindy Mikel,1. Terry Maxwell/Mike Lipe,2. Mark Poole,3. Danny Prado,
13, 100-Concert Band, Lake Ridge High School, TEA:, Mansfield," Alberto Ocasio / Brad Bonebrake, Ben Scearce",AAAAA,Non-Varsity ,2018,136591,1,1,1,1,1,1,1,1,C, Army of the Nile (Alford/Fennell), Concord  (Grundman), Vesuvius  (Ticheli),DATE of EVENT 04/03/2018 ,Region: 5,1. Bill Centera,2. Bill Marrocco,3. Cindy Mikel,1. Terry Maxwell/Mike Lipe,2. Mark Poole,3. Danny Prado,
14, 100-Concert Band, Lake Ridge High School, TEA:, Mansfield," Brad Bonebrake / Alberto Ocasio, Ben Scearce",AAAAA,Varsity ,2018,136539,1,1,1,1,1,1,1,1,A, Who's Who in Navy Blue (Sousa/Byrne), Molly On The Shore  (Grainger/Rogers/SMC), Southern Harmony (play all) (Grantham),DATE of EVENT 04/03/2018 ,Region: 5,1. Bill Centera,2. Bill Marrocco,3. Cindy Mikel,1. Terry Maxwell/Mike Lipe,2. Mark Poole,3. Danny Prado,
15, 100-Concert Band, Lamar High School, TEA:, Arlington, Alan Lang,AAAAAA,Varsity ,2018,134097,1,1,1,1,1,1,2,1,A, Entry March of the Boyars (Halvorsen/Fennell), Glaciers  (Director), Give Us This Day (play all) (Maslanka),DATE of EVENT 04/03/2018 ,Region: 5,1. Bill Centera,2. Bill Marrocco,3. Cindy Mikel,1. Terry Maxwell/Mike Lipe,2. Mark Poole,3. Danny Prado,
16, 100-Concert Band, Lamar High School, TEA:, Arlington, Alan Lang / Jarred Carlton,AAAAAA,Sub Non-Varsity ,2018,134095,1,2,2,2,3,3,3,3, , Newcastle March (Vinson), Little Suite for Band (play all) (Standridge), Knights of Dunvegan  (Meyer),DATE of EVENT 04/03/2018 ,Region: 5,1. Bill Centera,2. Bill Marrocco,3. Cindy Mikel,1. Terry Maxwell/Mike Lipe,2. Mark Poole,3. Danny Prado,
17, 100-Concert Band, Lamar High School, TEA:, Arlington, Jarred Carlton,AAAAAA,Non-Varsity ,2018,134629,2,2,1,2,2,2,2,2, , Steel  (Standridge), A Longford Legend Mvt. 1&2 (Sheldon), Mighty Mite (Mesang/O'Loughlin),DATE of EVENT 04/03/2018 ,Region: 5,1. Bill Centera,2. Bill Marrocco,3. Cindy Mikel,1. Terry Maxwell/Mike Lipe,2. Mark Poole,3. Danny Prado,
18, 100-Concert Band, Legacy High School, TEA:, Mansfield, Adam Hoffmann,AAAAA,Varsity ,2018,136890,1,1,1,1,1,1,1,1,A, Children's March (Percy Grainger/Ed. Mark Rogers), Jocuri Poporale Romanesti (Bartok/Goto), Blue Shades (Ticheli),DATE of EVENT 04/03/2018 ,Region: 5,1. Bill Centera,2. Bill Marrocco,3. Cindy Mikel,1. Terry Maxwell/Mike Lipe,2. Mark Poole,3. Danny Prado,
19, 100-Concert Band, Legacy High School, TEA:, Mansfield, Adam Hoffmann / Andrew Nance,AAAAA,Non-Varsity ,2018,136897,1,1,1,1,1,1,1,1,C, Columbian March (King/Milford), A Longford Legend (Robert Sheldon), Steel (Randall D. Standridge),DATE of EVENT 04/03/2018 ,Region: 5,1. Bill Centera,2. Bill Marrocco,3. Cindy Mikel,1. Terry Maxwell/Mike Lipe,2. Mark Poole,3. Danny Prado,
20, 100-Concert Band, Mansfield High School, TEA:, Mansfield, David Dunbar,AAAAAA,Sub Non-Varsity ,2018,136618,1,1,1,1,1,2,2,2,2, Mighty Mite (Mesang/O'Loughlin), Sundance  (Strommen), Imaginarium  (Standridge),DATE of EVENT 04/03/2018 ,Region: 5,1. Bill Centera,2. Bill Marrocco,3. Cindy Mikel,1. Terry Maxwell/Mike Lipe,2. Mark Poole,3. Danny Prado,
21, 100-Concert Band, Mansfield High School, TEA:, Mansfield, David Dunbar,AAAAAA,Non-Varsity ,2018,136614,1,1,1,1,1,1,1,1,C, Marche Des Parachutistes Belges (Leemans/Wiley), Euphoria  (Frantzen)," Carmina Burana Mvt. 1, 8, 9, 10, 13 (Orff/Krance)",DATE of EVENT 04/03/2018 ,Region: 5,1. Bill Centera,2. Bill Marrocco,3. Cindy Mikel,1. Terry Maxwell/Mike Lipe,2. Mark Poole,3. Danny Prado,
22, 100-Concert Band, Mansfield High School, TEA:, Mansfield, Will Ludlow,AAAAAA,Varsity ,2018,130184,1,1,1,1,1,1,1,1,A, Finale (from Symphony No. 2)  (Ives/Elkus), Cuban Overture (Gershwin/ Rogers), The Thunder (Sousa),DATE of EVENT 04/03/2018 ,Region: 5,1. Bill Centera,2. Bill Marrocco,3. Cindy Mikel,1. Terry Maxwell/Mike Lipe,2. Mark Poole,3. Danny Prado,
23, 100-Concert Band, Martin High School, TEA:, Arlington," Brad McCann / Robert McDaniel, Joseph Manzo, Moises Carmona-Morales",AAAAAA,Varsity ,2018,133176,1,1,1,1,1,1,1,1,A, Sensemaya (POP) (Revueltas/Bencriscutto), Symphony for Band (play at least one mvt) Mvt. 1 (Gould), Commando March (Barber),DATE of EVENT 04/03/2018 ,Region: 5,1. Bill Centera,2. Bill Marrocco,3. Cindy Mikel,1. Terry Maxwell/Mike Lipe,2. Mark Poole,3. Danny Prado,
24, 100-Concert Band, Martin High School, TEA:, Arlington," Joseph Manzo / Brad McCann, Robert McDaniel",AAAAAA,Sub Non-Varsity ,2018,135691,1,1,2,1,2,1,2,2,2, Newcastle March (Vinson), The Harmonious Blacksmith  (Handel/Osterling), Sketches of Canada (play all) (Story),DATE of EVENT 04/03/2018 ,Region: 5,1. Bill Centera,2. Bill Marrocco,3. Cindy Mikel,1. Terry Maxwell/Mike Lipe,2. Mark Poole,3. Danny Prado,
25, 100-Concert Band, Martin High School, TEA:, Arlington," Robert McDaniel / Brad McCann, Joseph Manzo",AAAAAA,Non-Varsity ,2018,133177,1,1,1,1,1,1,1,1,C, Immer Fesch! (Eilenberg/ed. Watson), Voices of the Sky (Hazo), Brook Green Suite (Holst/arr. Curnow),DATE of EVENT 04/03/2018 ,Region: 5,1. Bill Centera,2. Bill Marrocco,3. Cindy Mikel,1. Terry Maxwell/Mike Lipe,2. Mark Poole,3. Danny Prado,
26, 100-Concert Band, North Side HS, TEA:, Fort Worth, Evan Dorbandt,AAAAA,Non-Varsity ,2018,132806,1,1,1,1,2,2,2,2,2, Big Four March (Karl King/Swearingen), Japanese Pictures (Kevin Mixon), Tanchozuru (Randall Standridge),DATE of EVENT 04/03/2018 ,Region: 5,1. Bill Centera,2. Bill Marrocco,3. Cindy Mikel,1. Terry Maxwell/Mike Lipe,2. Mark Poole,3. Danny Prado,
27, 100-Concert Band, Paschal HS, TEA:, Fort Worth, Bryan Wright,AAAAAA,Varsity ,2018,131384,1,1,1,1,1,1,1,1,A, Joyce's 71st NY Regiment March (Boyer-Lake), Prelude in Dorian Mode  (de Cabezon/Grainger), Three Dance Episodes (POP) (Bernstein/Stith/Lavender),DATE of EVENT 04/03/2018 ,Region: 5,1. Bill Centera,2. Bill Marrocco,3. Cindy Mikel,1. Terry Maxwell/Mike Lipe,2. Mark Poole,3. Danny Prado,
28, 100-Concert Band, Paschal HS, TEA:, Fort Worth, Elizabeth Lentz,AAAAAA,Non-Varsity ,2018,136090,1,1,1,1,1,1,2,1,C, Freedom City March (King), A Quiet Music  (Wagner), The Jig is Up  (Kallman),DATE of EVENT 04/03/2018 ,Region: 5,1. Bill Centera,2. Bill Marrocco,3. Cindy Mikel,1. Terry Maxwell/Mike Lipe,2. Mark Poole,3. Danny Prado,
29, 100-Concert Band, Paschal HS, TEA:, Fort Worth, Matt Sawyer,AAAAAA,Sub Non-Varsity A,2018,134382,1,1,1,1,2,2,3,2,2, Miss Liberty March (Karl L. King), Crystalline  (Clark), A Walk in the Morning Sun  (La Plante),DATE of EVENT 04/03/2018 ,Region: 5,1. Bill Centera,2. Bill Marrocco,3. Cindy Mikel,1. Terry Maxwell/Mike Lipe,2. Mark Poole,3. Danny Prado,
30, 100-Concert Band, Polytechnic HS, TEA:, Fort Worth, Albert Canales,AAAAA,Varsity ,2018,136896,2,1,1,1,4,3,3,3,1, Ghost Fleet  (Sheldon), Trombone King (K.L. King/ J.P. Paynter), Imaginarium (Standridge),DATE of EVENT 04/03/2018 ,Region: 5,1. Bill Centera,2. Bill Marrocco,3. Cindy Mikel,1. Terry Maxwell/Mike Lipe,2. Mark Poole,3. Danny Prado,
31, 100-Concert Band, Sam Houston High School, TEA:, Arlington, Arun Bhatt / Jillian Adams/Jesus Martinez,AAAAAA,Sub Non-Varsity A,2018,136473,2,3,2,2,3,3,3,3, , St. Petersburg March (Vinson), Spirit of an Eagle  (Clark), Arabian Dances  (Balmages),DATE of EVENT 04/03/2018 ,Region: 5,1. Bill Centera,2. Bill Marrocco,3. Cindy Mikel,1. Terry Maxwell/Mike Lipe,2. Mark Poole,3. Danny Prado,
32, 100-Concert Band, Sam Houston High School, TEA:, Arlington, Arun Bhatt / Jillian Adams/Jesus Martinez,AAAAAA,Varsity ,2018,136472,2,2,1,2,2,2,2,2, , March of the Trolls (Grieg/Beck), Summer Dances  (Balmages), Vesuvius  (Ticheli),DATE of EVENT 04/03/2018 ,Region: 5,1. Bill Centera,2. Bill Marrocco,3. Cindy Mikel,1. Terry Maxwell/Mike Lipe,2. Mark Poole,3. Danny Prado,
33, 100-Concert Band, Sam Houston High School, TEA:, Arlington," Jillian Adams / Arun Bhatt, Jesus Martinez",AAAAAA,Non-Varsity ,2018,136477,3,2,2,2,3,3,3,3, , Darklands March  (Randall D. Standridge), Contempo (Michael Story), Overture for Winds (Charles Carter),DATE of EVENT 04/03/2018 ,Region: 5,1. Bill Centera,2. Bill Marrocco,3. Cindy Mikel,1. Terry Maxwell/Mike Lipe,2. Mark Poole,3. Danny Prado,
34, 100-Concert Band, Seguin High School, TEA:, Arlington," Grady Niblo / Phillip Cadenhead, Angel Briseno",AAAAA,Non-Varsity ,2018,135476,2,1,1,1,2,2,3,2,2, Excelsior (Owens), Greenwillow Portrait  (Williams), Sparks  (Balmages),DATE of EVENT 04/03/2018 ,Region: 5,1. Bill Centera,2. Bill Marrocco,3. Cindy Mikel,1. Terry Maxwell/Mike Lipe,2. Mark Poole,3. Danny Prado,
35, 100-Concert Band, South Hills HS, TEA:, Fort Worth, Brent Schooley / Garrett Adams,AAAAA,Non-Varsity ,2018,129527,1,1,1,1,2,1,1,1,C, Cumberland Cross  (Strommen), River of Dreams  (Lopez), Gallant Marines (King/Swearingen),DATE of EVENT 04/03/2018 ,Region: 5,1. Bill Centera,2. Bill Marrocco,3. Cindy Mikel,1. Terry Maxwell/Mike Lipe,2. Mark Poole,3. Danny Prado,
36, 100-Concert Band, Southwest HS, TEA:, Fort Worth," Christa White / Jeff DeMaagd, Henry McCoy, Manny Flores, Brandon Smith",AAAAA,Sub Non-Varsity ,2018,137199,1,1,2,1,3,2,3,3,2, Arch of Triumph (Vinson), Tunbridge Meadows  (Williams), Lightning Field  (Mackey),DATE of EVENT 04/03/2018 ,Region: 5,1. Bill Centera,2. Bill Marrocco,3. Cindy Mikel,1. Terry Maxwell/Mike Lipe,2. Mark Poole,3. Danny Prado,
37, 100-Concert Band, Southwest HS, TEA:, Fort Worth," Henry McCoy / Jeff DeMaagd, Christa White, Manny Flores, Brandon Smith",AAAAA,Non-Varsity ,2018,137205,1,1,1,1,2,2,2,2,2, Peace Jubilee (King), On a Hymnsong of Philip Bliss  (Holsinger), Variations on a Korean Folk Song  (Chance),DATE of EVENT 04/03/2018 ,Region: 5,1. Bill Centera,2. Bill Marrocco,3. Cindy Mikel,1. Terry Maxwell/Mike Lipe,2. Mark Poole,3. Danny Prado,
38, 100-Concert Band, Southwest HS, TEA:, Fort Worth," Jeff DeMaagd / Henry McCoy, Christa White, Manny Flores, Brandon Smith",AAAAA,Varsity ,2018,137193,1,1,1,1,1,1,1,1,A," No. 5 March of the Mogul Emperors from ""Crown of India Suite"" (Elgar/Winterbottom)", O Magnum Mysterium  (Lauridsen/Reynolds), Redline Tango  (Mackey),DATE of EVENT 04/03/2018 ,Region: 5,1. Bill Centera,2. Bill Marrocco,3. Cindy Mikel,1. Terry Maxwell/Mike Lipe,2. Mark Poole,3. Danny Prado,
39, 100-Concert Band, Summit High School, TEA:, Arlington," Chris Kanicki / Cris Garcia, Shawn Hart",AAAAA,Varsity ,2018,136881,1,1,1,1,1,1,1,1,A, Esprit De Corps (Jager), A Hymn for The Lost And The Living  (Ewazen), Finale (from Symphony in f minor No. 4)  (Tchaikovsky/Safranek),DATE of EVENT 04/03/2018 ,Region: 5,1. Bill Centera,2. Bill Marrocco,3. Cindy Mikel,1. Terry Maxwell/Mike Lipe,2. Mark Poole,3. Danny Prado,
40, 100-Concert Band, Summit High School, TEA:, Arlington, Cris Garcia,AAAAA,Sub Non-Varsity ,2018,136980,1,1,1,1,1,2,2,2,2, Von Grrrhart's 613th Regimental March (Holsinger), Irish Air and Dance  (Story), Steel  (Standridge),DATE of EVENT 04/03/2018 ,Region: 5,1. Bill Centera,2. Bill Marrocco,3. Cindy Mikel,1. Terry Maxwell/Mike Lipe,2. Mark Poole,3. Danny Prado,
41, 100-Concert Band, Summit High School, TEA:, Arlington, Cris Garcia,AAAAA,Non-Varsity ,2018,136975,1,1,1,1,1,1,1,1,C, Amparito Roca (Texidor/Winter), A Longford Legend (play all) (Sheldon), Machu Picchu - City in the Sky  (Yagisawa),DATE of EVENT 04/03/2018 ,Region: 5,1. Bill Centera,2. Bill Marrocco,3. Cindy Mikel,1. Terry Maxwell/Mike Lipe,2. Mark Poole,3. Danny Prado,
42, 100-Concert Band, Timberview High School, TEA:, Arlington," Bryan Teague / Eric Mullins, Daniel Neimeyer",AAAAA,Non-Varsity ,2018,137186,1,1,2,1,2,2,2,2,2, Darklands March (Standridge), Crystalline (Clark), Danza de Espana (Chambers),DATE of EVENT 04/03/2018 ,Region: 5,1. Bill Centera,2. Bill Marrocco,3. Cindy Mikel,1. Terry Maxwell/Mike Lipe,2. Mark Poole,3. Danny Prado,
43, 100-Concert Band, Timberview High School, TEA:, Arlington, Eric Mullins / Daniel Neimeyer,AAAAA,Varsity ,2018,137150,1,1,1,1,1,1,1,1,A, Pentland Hills March (Howe), Sheltering Sky  (Mackey), The Hounds of Spring  (Reed),DATE of EVENT 04/03/2018 ,Region: 5,1. Bill Centera,2. Bill Marrocco,3. Cindy Mikel,1. Terry Maxwell/Mike Lipe,2. Mark Poole,3. Danny Prado,
44, 100-Concert Band, Trimble Tech HS, TEA:, Fort worth, Earnest Colvin,AAAAA,Varsity ,2018,136554,1,1,1,1,1,1,1,1,A, Nocturne Op.9 No.2 (Scriabin/Reed), Shadow Rituals  (Michael Markowski), Puenteareas (R. Soutullo),DATE of EVENT 04/03/2018 ,Region: 5,1. Bill Centera,2. Bill Marrocco,3. Cindy Mikel,1. Terry Maxwell/Mike Lipe,2. Mark Poole,3. Danny Prado,
45, 100-Concert Band, Western Hills HS, TEA:, Fort Worth, Jessica Piechotta / Meggan Hinds, Acc:N/A,AAAAA,Non-Varsity ,2018,136957,2,1,2,2,3,3,3,3, , El Relicario (Padilla/Story), Tanchozuru (Standridge), Contempo  (Story),DATE of EVENT 04/03/2018 ,Region: 5,1. Bill Centera,2. Bill Marrocco,3. Cindy Mikel,1. Terry Maxwell/Mike Lipe,2. Mark Poole,3. Danny Prado
46, 100-Concert Band, Western Hills HS, TEA:, Fort Worth, Meggan Hinds / Jessica Piechotta, Acc:N/A,AAAAA,Varsity ,2018,136953,1,1,1,1,1,1,1,1,A, Burma Patrol (King/Swearingen), Down a Country Lane (Copland/Patterson), Early Light  (Bremer),DATE of EVENT 04/03/2018 ,Region: 5,1. Bill Centera,2. Bill Marrocco,3. Cindy Mikel,1. Terry Maxwell/Mike Lipe,2. Mark Poole,3. Danny Prado
47, 100-Concert Band, Wyatt HS, TEA:, Fort Worth, Hollis Gordon / Marcus Brookins,AAAAA,Non-Varsity ,2018,136294,1,1,1,1,1,2,3,2,2, Coast Guards Concert March (Karl King), Deir in De  (Anon. or Trad./Barker), American Folk Rhapsody No. 2  (Grundman),DATE of EVENT 04/03/2018 ,Region: 5,1. Bill Centera,2. Bill Marrocco,3. Cindy Mikel,1. Terry Maxwell/Mike Lipe,2. Mark Poole,3. Danny Prado,
