,0,1,2,3,4,5,6,7,8,9,10,11,12,13,14,15,16,17,18,19,20,21,22,23,24,25,26,27,28
0, 100-Concert Band, Aransas Pass HS, TEA:, Aransas Pass, Michael Phelan,AAA,Varsity ,2006,25469,3,3,2,3,3,3,3,3, , St. Petersburg March (Vinson)," Castle, Loch and Heath (Ployhar)", Shenandoah (Ticheli),DATE of EVENT 04/12/2006 ,Region: 14,1. Paul Fullerton,2. James Keltner,3. Richard Kole,1. Nancy Shepard,2. Larry Wolf,3. Jorge Ybarra
1, 100-Concert Band, Banquete HS, TEA:, Banquete, Jim Culpepper,AA,Varsity ,2006,25395,1,1,1,1,2,2,2,2,P1, Castlewood March (Hale), Fire Dance (Akey), Knights of Dunvegan (Meyer),DATE of EVENT 04/12/2006 ,Region: 14,1. Paul Fullerton,2. James Keltner,3. Richard Kole,1. Nancy Shepard,2. Larry Wolf,3. Jorge Ybarra
2, 100-Concert Band, Ben Bolt-Palito Blanco HS, TEA:, Ben Bolt, Paul Saenz,A,Varsity ,2006,25586,2,1,2,2,1,2,1,1,P1, Gallant Marines (King/Swearingen), Pinnacle (Grice), Blue Ridge Saga (Swearingen),DATE of EVENT 04/12/2006 ,Region: 14,1. Paul Fullerton,2. James Keltner,3. Richard Kole,1. Nancy Shepard,2. Larry Wolf,3. Jorge Ybarra
3, 100-Concert Band, Bishop HS, TEA:, Bishop," Henock Osio, Jr.",AA,Varsity ,2006,24797,1,1,1,1,1,1,1,1,SWA, Peacemaker (King), On a Hymnsong of Philip Bliss (Holsinger), Westridge Overture (Barnes),DATE of EVENT 04/12/2006 ,Region: 14,1. Paul Fullerton,2. James Keltner,3. Richard Kole,1. Nancy Shepard,2. Larry Wolf,3. Jorge Ybarra
4, 100-Concert Band, Falfurrias HS, TEA:, Falfurrias, Roel Saenz,AAA,Varsity ,2006,23934,2,2,1,2,1,1,1,1,P1, British Eighth March (Elliott/Hilliard), Polly Oliver (Root), English Folk Song Suite-Mvt. #3 (Vaughn Williams),DATE of EVENT 04/12/2006 ,Region: 14,1. Paul Fullerton,2. James Keltner,3. Richard Kole,1. Nancy Shepard,2. Larry Wolf,3. Jorge Ybarra
5, 100-Concert Band, Freer HS, TEA:, Freer, Pat Ruiz,AA,Varsity ,2006,25457,1,1,2,1,1,3,2,2,P1, March to Castle Rock (Hodges), Sinfonia VI: The Four Elements (Mvts 3 & 4) (Broege), Pinnacle (Grice),DATE of EVENT 04/12/2006 ,Region: 14,1. Paul Fullerton,2. James Keltner,3. Richard Kole,1. Nancy Shepard,2. Larry Wolf,3. Jorge Ybarra
6, 100-Concert Band, George West High School, TEA:, George West, James E. Williamson,AA,Varsity ,2006,25230,1,2,2,2,1,2,1,1,P1, Rough Riders Galop (King), Blue Ridge Saga (Swearingen), Heatherwood Portrait (Barnes),DATE of EVENT 04/12/2006 ,Region: 14,1. Paul Fullerton,2. James Keltner,3. Richard Kole,1. Nancy Shepard,2. Larry Wolf,3. Jorge Ybarra
7, 100-Concert Band, Hebbronville HS, TEA:, Hebbronville, Ed Trevino,AA,Non-Varsity ,2006,26152,2,1,2,2,3,1,1,1,P2, Pinnacle (Grice), A Childhood Hymn (Holsinger), Big Circus March (Foster),DATE of EVENT 04/12/2006 ,Region: 14,1. Paul Fullerton,2. James Keltner,3. Richard Kole,1. Nancy Shepard,2. Larry Wolf,3. Jorge Ybarra
8, 100-Concert Band, Hebbronville HS, TEA:, Hebbronville, Ray Garza,AA,Varsity ,2006,24329,1,1,1,1,1,1,1,1,SWA, Laredo (A Paso Doble) (Williams), They Led My Lord Away (Gordon/Allen), Flight of Eagles (Del Borgo),DATE of EVENT 04/12/2006 ,Region: 14,1. Paul Fullerton,2. James Keltner,3. Richard Kole,1. Nancy Shepard,2. Larry Wolf,3. Jorge Ybarra
9, 100-Concert Band, Ingleside HS, TEA:, Ingleside, Jim Powell,AAA,Varsity ,2006,25621,1,2,2,2,2,2,2,2, , March from Second Suite in F (Holst), On A Hymnsong of Philip Bliss (Holsinger), Incantation and Dance (Chance),DATE of EVENT 04/12/2006 ,Region: 14,1. Paul Fullerton,2. James Keltner,3. Richard Kole,1. Nancy Shepard,2. Larry Wolf,3. Jorge Ybarra
10, 100-Concert Band, Kaufer HS, TEA:, Riviera, Arthur Sholtis,AA,Varsity ,2006,22475,2,1,2,2,2,3,2,2, , Fire Dance (Akey), Under An Irish Sky (Neeck), March to Castle Rock (Hodges),DATE of EVENT 04/12/2006 ,Region: 14,1. Paul Fullerton,2. James Keltner,3. Richard Kole,1. Nancy Shepard,2. Larry Wolf,3. Jorge Ybarra
11, 100-Concert Band, Mathis HS, TEA:, Mathis, Daniel D. Rodriguez,AAA,Non-Varsity ,2006,23752,2,3,1,2,2,3,3,3, , Vikings Victorious (Sharp), Sea Song Trilogy (McGinty), Two British Folk Songs (Del Borgo (arr)),DATE of EVENT 04/12/2006 ,Region: 14,1. Paul Fullerton,2. James Keltner,3. Richard Kole,1. Nancy Shepard,2. Larry Wolf,3. Jorge Ybarra
12, 100-Concert Band, Mathis HS, TEA:, Mathis, Eddie Benitez,AAA,Varsity ,2006,21984,1,1,1,1,1,1,1,1,SWA," West Highlands Sojourn (Mvt. 1,2) (Sheldon)", On a Hymnsong of Philip Bliss (Holsinger), Moorside March from A Moorside Suite (Holst/Curnow),DATE of EVENT 04/12/2006 ,Region: 14,1. Paul Fullerton,2. James Keltner,3. Richard Kole,1. Nancy Shepard,2. Larry Wolf,3. Jorge Ybarra
13, 100-Concert Band, Odem HS, TEA:, Odem, Scott Roberts,AA,Non-Varsity ,2006,25533,3,3,3,3,1,1,2,1,P2, Reflections (Swearingen), Crest of Nobility (Sheldon), El Goucho (Mesang),DATE of EVENT 04/12/2006 ,Region: 14,1. Paul Fullerton,2. James Keltner,3. Richard Kole,1. Nancy Shepard,2. Larry Wolf,3. Jorge Ybarra
14, 100-Concert Band, Odem HS, TEA:, Odem, Vincent Smith,AA,Varsity ,2006,23229,3,2,3,3,2,3,2,2, , French National Defile' (Shaffer), Songs Of The Whalemen (Del Borgo), As Summer Was Just Beginning (Daehn),DATE of EVENT 04/12/2006 ,Region: 14,1. Paul Fullerton,2. James Keltner,3. Richard Kole,1. Nancy Shepard,2. Larry Wolf,3. Jorge Ybarra
15, 100-Concert Band, Orange Grove HS, TEA:, Orange Grove, Emerico Perez,AAA,Non-Varsity ,2006,23451,1,2,1,1,2,2,1,2,P2, Kilkenny Brigade (Ployhar), Yorkshire Ballad (Barnes), Flight of Eagles (Del Borgo),DATE of EVENT 04/12/2006 ,Region: 14,1. Paul Fullerton,2. James Keltner,3. Richard Kole,1. Nancy Shepard,2. Larry Wolf,3. Jorge Ybarra
16, 100-Concert Band, Orange Grove HS, TEA:, Orange Grove, Eric Winterbottom,AAA,Varsity ,2006,25216,2,2,2,2,1,1,2,1,P1, Americans We (Fillmore/Fennell), Ghost Fleet (Sheldon), American Civil War Fantasy (Bilik),DATE of EVENT 04/12/2006 ,Region: 14,1. Paul Fullerton,2. James Keltner,3. Richard Kole,1. Nancy Shepard,2. Larry Wolf,3. Jorge Ybarra
17, 100-Concert Band, Pettus HS, TEA:, Pettus, Jim Perkins,A,Varsity ,2006,24573,3,3,3,3,3,2,2,2, , Valley Forge March (King/Swearingen), Bach Chorale and March (Bach/Wilson), Glen Canyon Overture (Edmondson),DATE of EVENT 04/12/2006 ,Region: 14,1. Paul Fullerton,2. James Keltner,3. Richard Kole,1. Nancy Shepard,2. Larry Wolf,3. Jorge Ybarra
18, 100-Concert Band, Port Aransas HS, TEA:, Port Aransas, Jim Cole,A,Varsity ,2006,25529,2,2,1,2,2,1,1,1,P1, Normandy Beach (Edmondson), Pinnacle (Grice), Flight of Eagles (Del Borgo),DATE of EVENT 04/12/2006 ,Region: 14,1. Paul Fullerton,2. James Keltner,3. Richard Kole,1. Nancy Shepard,2. Larry Wolf,3. Jorge Ybarra
19, 100-Concert Band, Premont HS, TEA:, Premont, Hector M. Cantu,AA,Varsity ,2006,25773,1,3,3,3,3,2,3,3, , Norland March (Edmondson), A Childhood Hymn (Holsinger), Stratosphere (Beckham),DATE of EVENT 04/12/2006 ,Region: 14,1. Paul Fullerton,2. James Keltner,3. Richard Kole,1. Nancy Shepard,2. Larry Wolf,3. Jorge Ybarra
20, 100-Concert Band, San Diego HS, TEA:, San Diego, John A. Vela,AAA,Varsity ,2006,23883,2,2,2,2,2,1,2,2, , On a Hymnsong of Philip Bliss (Holsinger), Chant and Jubilo (McBeth), Rio Bravo (Edmondson),DATE of EVENT 04/12/2006 ,Region: 14,1. Paul Fullerton,2. James Keltner,3. Richard Kole,1. Nancy Shepard,2. Larry Wolf,3. Jorge Ybarra
21, 100-Concert Band, Sinton HS, TEA:, Sinton, Robert Flores,AAA,Varsity ,2006,25364,1,1,2,1,1,1,1,1,SWA, The Thunderer March (Sousa/Holcombe), In The Shining Of The Stars (Sheldon), Concert Variations (Smith),DATE of EVENT 04/12/2006 ,Region: 14,1. Paul Fullerton,2. James Keltner,3. Richard Kole,1. Nancy Shepard,2. Larry Wolf,3. Jorge Ybarra
22, 100-Concert Band, Sinton HS, TEA:, Sinton, Robert Mendez,AAA,Non-Varsity ,2006,25368,1,2,3,2,1,2,1,1,P2, Rudimentary March (Fagan), Song of Hope (Swearingen), Fire Dance (Akey),DATE of EVENT 04/12/2006 ,Region: 14,1. Paul Fullerton,2. James Keltner,3. Richard Kole,1. Nancy Shepard,2. Larry Wolf,3. Jorge Ybarra
23, 100-Concert Band, Skidmore-Tynan HS, TEA:, Skidmore, Florencio Lara,AA,Varsity ,2006,25203,1,2,3,2,3,3,3,3, , March To Nowhere (Nelhybel), Fughetta (Handel/Conley), The Battle of Jericho (Spinney),DATE of EVENT 04/12/2006 ,Region: 14,1. Paul Fullerton,2. James Keltner,3. Richard Kole,1. Nancy Shepard,2. Larry Wolf,3. Jorge Ybarra
24, 100-Concert Band, Taft HS, TEA:, Taft, Ramiro Lichtenberger,AA,Non-Varsity ,2006,22152,3,2,2,2,2,3,2,2, , Liberty March (Edmonson), In The Bleak Midwinter (Holst/Bullock), Sea Song Trilogy (McGinty),DATE of EVENT 04/12/2006 ,Region: 14,1. Paul Fullerton,2. James Keltner,3. Richard Kole,1. Nancy Shepard,2. Larry Wolf,3. Jorge Ybarra
25, 100-Concert Band, Taft HS, TEA:, Taft, Roy Hinojosa,AA,Varsity ,2006,22068,1,1,1,1,1,1,1,1,SWA, Immer Fesch (Eilenberg), The Battle of Jericho (Spinney), Vesuvius (Ticheli),DATE of EVENT 04/12/2006 ,Region: 14,1. Paul Fullerton,2. James Keltner,3. Richard Kole,1. Nancy Shepard,2. Larry Wolf,3. Jorge Ybarra
26, 100-Concert Band, Three Rivers HS, TEA:, Three Rivers, Bill Kester,AA,Varsity ,2006,25426,3,3,1,3,3,4,3,3, , Crest of Nobility (Sheldon), The Coldstream Guards (Del Borgo), Fire Dance (Akey),DATE of EVENT 04/12/2006 ,Region: 14,1. Paul Fullerton,2. James Keltner,3. Richard Kole,1. Nancy Shepard,2. Larry Wolf,3. Jorge Ybarra
27, 100-Concert Band, West Oso HS, TEA:, Corpus Christi, Carl Melton,AAA,Varsity ,2006,25710,3,1,1,1,3,4,3,3,P1, Guardians of Liberty (Murtha), Encanto (Smith), Rhythm Machine (Broege),DATE of EVENT 04/12/2006 ,Region: 14,1. Paul Fullerton,2. James Keltner,3. Richard Kole,1. Nancy Shepard,2. Larry Wolf,3. Jorge Ybarra
28, 100-Concert Band, Woodsboro HS, TEA:, Woodsboro, Arturo Galindo,A,Varsity ,2006,25220,3,3,2,3,2,3,3,3, , Russian Sailor's Dance (Gliere/Williams), Distant Horizons (Sweeney), U.S.S. Hornet (March) (Fagan),DATE of EVENT 04/12/2006 ,Region: 14,1. Paul Fullerton,2. James Keltner,3. Richard Kole,1. Nancy Shepard,2. Larry Wolf,3. Jorge Ybarra
29, 100-Concert Band, Zapata HS, TEA:, Zapata, Amado Martinez,AAA,Varsity ,2006,25572,2,1,2,2,1,1,1,1,P1, An American Elegy (Ticheli), Chant and Jubilo (McBeth), Valdres (Concert March) (Hanssen/Curnow),DATE of EVENT 04/12/2006 ,Region: 14,1. Paul Fullerton,2. James Keltner,3. Richard Kole,1. Nancy Shepard,2. Larry Wolf,3. Jorge Ybarra
