,0,1,2,3,4,5,6,7,8,9,10,11,12,13,14,15,16,17,18,19,20,21,22,23,24,25,26,27,28
0, 100-Concert Band, Austin Middle School, TEA:, Amarillo, Rosalinda Morales,CC,Varsity ,2011,65225,3,4,3,3,2,3,2,2, , Glenwood March (Gorham), Knights of Dunvegan  (Meyer), Serengeti Dreams  (Smith),DATE of EVENT 04/14/2011 ,Region: 1,1. Paul Worosello,2. Lonnie Baker,3. Bonnie Anderson,1. James Nance,2. Carroll Rhodes,3. Keith Dye
1, 100-Concert Band, Bonham MS, TEA:, Amarillo, Mike Ellis,CC,Varsity ,2011,67279,1,1,1,1,1,1,1,1,C, Imperial (Karl King), Comets In Winter Sky  (McCarthy),  Songs of Old Kentucky  (Karrick),DATE of EVENT 04/14/2011 ,Region: 1,1. Paul Worosello,2. Lonnie Baker,3. Bonnie Anderson,1. James Nance,2. Carroll Rhodes,3. Keith Dye
2, 100-Concert Band, Booker MS, TEA:, Booker, Patrick Pantleo,C,Non-Varsity ,2011,67982,3,3,3,3,1,1,2,1,2, Infinity (James Curnow), Theme and Variations  (Broege), Dance Celebration  (Smith),DATE of EVENT 04/14/2011 ,Region: 1,1. Paul Worosello,2. Lonnie Baker,3. Bonnie Anderson,1. James Nance,2. Carroll Rhodes,3. Keith Dye
3, 100-Concert Band, Borger Middle School, TEA:, Borger, James Carter,CC,Non-Varsity ,2011,67478,1,1,1,1,1,1,1,1,D, Sweetwater March (Cotter), Courtlandt County Festival  (Owens), Serengeti Dreams  (Smith),DATE of EVENT 04/14/2011 ,Region: 1,1. Paul Worosello,2. Lonnie Baker,3. Bonnie Anderson,1. James Nance,2. Carroll Rhodes,3. Keith Dye
4, 100-Concert Band, Borger Middle School, TEA:, Borger, Nick Mears,CC,Varsity ,2011,67488,1,1,1,1,1,1,1,1,C," Moscow, 1941  (Balmages)", Abracadabra  (Ticheli), Mount Vernon March (Edmondson),DATE of EVENT 04/14/2011 ,Region: 1,1. Paul Worosello,2. Lonnie Baker,3. Bonnie Anderson,1. James Nance,2. Carroll Rhodes,3. Keith Dye
5, 100-Concert Band, Bowie Middle School, TEA:, Amarillo, Neil Barbaro,CCC,Varsity ,2011,67209,4,4,4,4,2,3,3,3, , Dolce and Dance  (Fagan), Mosaic  (Paulus), Monterey March  (La Plante),DATE of EVENT 04/14/2011 ,Region: 1,1. Paul Worosello,2. Lonnie Baker,3. Bonnie Anderson,1. James Nance,2. Carroll Rhodes,3. Keith Dye
6, 100-Concert Band, Bushland Middle School, TEA:, Bushland, joe woolsey / Gregg Diamond,C,Varsity ,2011,67679,1,1,1,1,1,1,1,1,C, Rio Colorado (Gene Williams), Spring Song  (Nowak), Voodoo Dance  (del Borgo),DATE of EVENT 04/14/2011 ,Region: 1,1. Paul Worosello,2. Lonnie Baker,3. Bonnie Anderson,1. James Nance,2. Carroll Rhodes,3. Keith Dye
7, 100-Concert Band, Canadian Middle School, TEA:, Canadian," Bryce W. Victory / Will Brewer, Sarah Brewer",C,Varsity ,2011,67348,2,1,2,2,1,1,1,1,2, Integrity March (William Owens), Stratosphere  (Beckham), Soldiers' Processsion and Sword Dance  (Margolis),DATE of EVENT 04/14/2011 ,Region: 1,1. Paul Worosello,2. Lonnie Baker,3. Bonnie Anderson,1. James Nance,2. Carroll Rhodes,3. Keith Dye
8, 100-Concert Band, Canyon JH, TEA:, Canyon, David Lough,CCC,Non-Varsity ,2011,67454,2,1,2,2,1,1,1,1,2, El Conquistador (William Owens), Scarborough Fair  (Moss), American Folk Tune Adventure  (Gorham),DATE of EVENT 04/14/2011 ,Region: 1,1. Paul Worosello,2. Lonnie Baker,3. Bonnie Anderson,1. James Nance,2. Carroll Rhodes,3. Keith Dye
9, 100-Concert Band, Canyon JH, TEA:, Canyon," Lesley Zorn / David Lough, Mike Sheffield, and Luis Hernandez",CCC,Varsity ,2011,67421,1,1,1,1,1,1,1,1,C, Crystals  (Duffy), On a Hymnsong of Philip Bliss  (Holsinger), The Chimes of Liberty (Custer/Goldman),DATE of EVENT 04/14/2011 ,Region: 1,1. Paul Worosello,2. Lonnie Baker,3. Bonnie Anderson,1. James Nance,2. Carroll Rhodes,3. Keith Dye
10, 100-Concert Band, Childress ISD, TEA:, Childress, Kyle McDonald,AA,Varsity ,2011,65253,2,3,3,3,1,2,1,1,2, Dance Celebration  (Smith), Atlantis  (McGinty), Laredo (Higgins),DATE of EVENT 04/14/2011 ,Region: 1,1. Paul Worosello,2. Lonnie Baker,3. Bonnie Anderson,1. James Nance,2. Carroll Rhodes,3. Keith Dye
11, 100-Concert Band, Clarendon J.H., TEA:, Clarendon, Scott Strobel / Megan Boone,C,Varsity ,2011,68195,2,2,2,2,1,1,1,1,2, Cold Brook March (John O'Reilly), Canon of Peace  (Jennings), Theme and Variations  (Broege),DATE of EVENT 04/14/2011 ,Region: 1,1. Paul Worosello,2. Lonnie Baker,3. Bonnie Anderson,1. James Nance,2. Carroll Rhodes,3. Keith Dye
12, 100-Concert Band, Crockett Middle School, TEA:, Amarillo, Brad Hart,CC,Varsity ,2011,68165,1,1,1,1,1,1,1,1,C, Butterfly's Ball (Fraley), Our Kingsland Spring (Hazo), March of the Beltones (Mosley),DATE of EVENT 04/14/2011 ,Region: 1,1. Paul Worosello,2. Lonnie Baker,3. Bonnie Anderson,1. James Nance,2. Carroll Rhodes,3. Keith Dye
13, 100-Concert Band, de Zavala Middle School, TEA:, Amarillo, Britni Nuckols,C,Non-Varsity ,2011,67946,3,2,3,3,1,1,1,1,2, Dance Celebration  (Smith), Two Minute Symphony  (Margolis), Activity March (Bennett/Clark),DATE of EVENT 04/14/2011 ,Region: 1,1. Paul Worosello,2. Lonnie Baker,3. Bonnie Anderson,1. James Nance,2. Carroll Rhodes,3. Keith Dye
14, 100-Concert Band, Dumas Junior High, TEA:, Dumas," Rebecca Carter / Rudy Sanchez, Scott Myers",CC,Non-Varsity ,2011,65903,2,3,2,2,1,1,2,1,2, Westwind Concert March (Hinds), Chester  (Billings/Tolmage/Osterling), Ballet of Spring (Ballet du printemps)  (O'Connor),DATE of EVENT 04/14/2011 ,Region: 1,1. Paul Worosello,2. Lonnie Baker,3. Bonnie Anderson,1. James Nance,2. Carroll Rhodes,3. Keith Dye
15, 100-Concert Band, Dumas Junior High, TEA:, Dumas," Rebecca Carter / Scott Myers, Rudy Sanchez",CC,Varsity ,2011,65180,2,1,1,1,1,1,2,1,C, New Castle March (Vinson), Joy  (Ticheli), Serengeti Dreams  (Smith),DATE of EVENT 04/14/2011 ,Region: 1,1. Paul Worosello,2. Lonnie Baker,3. Bonnie Anderson,1. James Nance,2. Carroll Rhodes,3. Keith Dye
16, 100-Concert Band, Fannin MS, TEA:, Amarillo, Bruce Hurley,Varsity ,2011,67830,3,2,4,3,3,2,3,3, , The Big Circus March (Robert E. Foster), Dance Celebration (W. Smith), Barbarossa (William Himes),DATE of EVENT 04/14/2011 ,Region: 1,1. Paul Worosello,2. Lonnie Baker,3. Bonnie Anderson,1. James Nance,2. Carroll Rhodes,3. Keith Dye,
17, 100-Concert Band, Hereford Jr. High, TEA:, Texas, Mike Bryant,CC,Varsity ,2011,63838,1,1,1,1,1,1,1,1,C, Captain Dane March (William Owens), Crusade  (Gassi), Australian Folk Fantasy  (Williams),DATE of EVENT 04/14/2011 ,Region: 1,1. Paul Worosello,2. Lonnie Baker,3. Bonnie Anderson,1. James Nance,2. Carroll Rhodes,3. Keith Dye
18, 100-Concert Band, Highland Park MS, TEA:, Amarillo, Nicole Shanks,C,Varsity ,2011,65668,3,2,2,2,1,1,1,1,2, New South Wales March (John Edmondson), Maesong  (Owens), Voodoo Dance  (del Borgo),DATE of EVENT 04/14/2011 ,Region: 1,1. Paul Worosello,2. Lonnie Baker,3. Bonnie Anderson,1. James Nance,2. Carroll Rhodes,3. Keith Dye
19, 100-Concert Band, Houston MS, TEA:, Amarillo, Suzanne Pecht,CC,Varsity ,2011,67873,1,2,2,2,1,2,1,1,2, Rough Riders (King/Swearingen), Legend of Knife River  (Bulla),  Sparks  (Balmages),DATE of EVENT 04/14/2011 ,Region: 1,1. Paul Worosello,2. Lonnie Baker,3. Bonnie Anderson,1. James Nance,2. Carroll Rhodes,3. Keith Dye
20, 100-Concert Band, Houston MS, TEA:, Amarillo, Suzanne Pecht,CC,Non-Varsity ,2011,67872,3,3,2,3,1,1,1,1,2, Nottingham Castle  (Daehn), Courtlandt County Festival  (Owens), Forward March (Murtha),DATE of EVENT 04/14/2011 ,Region: 1,1. Paul Worosello,2. Lonnie Baker,3. Bonnie Anderson,1. James Nance,2. Carroll Rhodes,3. Keith Dye
21, 100-Concert Band, Kress HS, TEA:, Kress, Greg Garrison,A,Non-Varsity C,2011,66578,3,4,4,4,2,2,3,2, , Kensington March (John Edmondson), Theme and Variations  (Broege), Atlantis  (McGinty),DATE of EVENT 04/14/2011 ,Region: 1,1. Paul Worosello,2. Lonnie Baker,3. Bonnie Anderson,1. James Nance,2. Carroll Rhodes,3. Keith Dye
22, 100-Concert Band, Mann MS, TEA:, Amarillo, Terry Baker,CC,Varsity ,2011,67525,2,2,1,2,1,1,2,1,2, Yorktown March (John Edmonson), Pavane  (Ravel/Smith), Fire Dance  (Akey),DATE of EVENT 04/14/2011 ,Region: 1,1. Paul Worosello,2. Lonnie Baker,3. Bonnie Anderson,1. James Nance,2. Carroll Rhodes,3. Keith Dye
23, 100-Concert Band, Memphis Middle School, TEA:, Memphis, Cindy Brown / Duncan Brown,Varsity ,2011,63744,1,2,1,1,1,1,1,1,C, Command March (John Edmondson), Sea Song Trilogy (Anne McGinty), Cascadia Celebration  (Steve Hodges),DATE of EVENT 04/14/2011 ,Region: 1,1. Paul Worosello,2. Lonnie Baker,3. Bonnie Anderson,1. James Nance,2. Carroll Rhodes,3. Keith Dye,
24, 100-Concert Band, Pampa Junior High, TEA:, Pampa, Joe Barrow / Melissa Barrow,CC,Non-Varsity ,2011,64844,1,1,1,1,1,1,1,1,D, Freedom's March (Swearingen), Two English Dances  (Anon. or Trad./O'Reilly), Voodoo Dance  (del Borgo),DATE of EVENT 04/14/2011 ,Region: 1,1. Paul Worosello,2. Lonnie Baker,3. Bonnie Anderson,1. James Nance,2. Carroll Rhodes,3. Keith Dye
25, 100-Concert Band, Pampa Junior High, TEA:, Pampa, Meghan Lockwood / Melissa Barrow,CC,Varsity ,2011,67276,1,1,1,1,1,1,1,1,C, Plaza De Toros (Mark Williams), Maesong  (Owens), Greenbrier Legacy  (Oare),DATE of EVENT 04/14/2011 ,Region: 1,1. Paul Worosello,2. Lonnie Baker,3. Bonnie Anderson,1. James Nance,2. Carroll Rhodes,3. Keith Dye
26, 100-Concert Band, Panhandle Jr. High School, TEA:, Panhandle, Robert Chapleau / Eric Rath,C,Varsity ,2011,66478,2,2,2,2,1,1,1,1,2, Acclaim March (Larry Clark), Stratosphere  (Beckham), Serengeti Dreams  (Smith),DATE of EVENT 04/14/2011 ,Region: 1,1. Paul Worosello,2. Lonnie Baker,3. Bonnie Anderson,1. James Nance,2. Carroll Rhodes,3. Keith Dye
27, 100-Concert Band, Perryton Junior High, TEA:, Perryton, Jon-Micheal Clifton / Andrew Fowler,CC,Varsity ,2011,64996,4,3,3,3,2,2,2,2, , Liberty March (Edmondson), Two British Folk Songs  (Anon. or Trad./Del Borgo), Kenya Contrasts  (Himes),DATE of EVENT 04/14/2011 ,Region: 1,1. Paul Worosello,2. Lonnie Baker,3. Bonnie Anderson,1. James Nance,2. Carroll Rhodes,3. Keith Dye
28, 100-Concert Band, Shamrock HS, TEA:, Shamrock, Steven M Wilkinson,A,Var-Composite ,2011,65954,3,4,2,3,2,1,1,1,1, Pride of the Band Brigade (Seward), English Folk Suite  (Del Borgo), The Band in the Square on the Fourth of July  (LaPlante),DATE of EVENT 04/14/2011 ,Region: 1,1. Paul Worosello,2. Lonnie Baker,3. Bonnie Anderson,1. James Nance,2. Carroll Rhodes,3. Keith Dye
29, 100-Concert Band, Stratford Jr. High School, TEA:, Stratford, Jim Parham / Kevin Coons,C,Varsity ,2011,63645,2,1,1,1,1,1,1,1,C, Fire Dance  (Akey), Madrigal for Band  (McGinty), March Royale (Mark Williams),DATE of EVENT 04/14/2011 ,Region: 1,1. Paul Worosello,2. Lonnie Baker,3. Bonnie Anderson,1. James Nance,2. Carroll Rhodes,3. Keith Dye
30, 100-Concert Band, Travis Middle School, TEA:, Amarillo, Ismael Alfaro,CC,Varsity ,2011,66469,3,3,3,3,4,4,4,4, , Conquista (Spanish March)  (Shaffer), Journey Down Niagara  (Tucker), Uskudar  (Anon. or Trad./Smith/Story),DATE of EVENT 04/14/2011 ,Region: 1,1. Paul Worosello,2. Lonnie Baker,3. Bonnie Anderson,1. James Nance,2. Carroll Rhodes,3. Keith Dye
31, 100-Concert Band, Travis Middle School, TEA:, Amarillo, Ismael Alfaro,CC,Non-Varsity ,2011,66468,4,4,4,4,2,2,3,2, , Brandy Station March (Edmondson), Sakura  (Story), Two Minute Symphony  (Margolis),DATE of EVENT 04/14/2011 ,Region: 1,1. Paul Worosello,2. Lonnie Baker,3. Bonnie Anderson,1. James Nance,2. Carroll Rhodes,3. Keith Dye
32, 100-Concert Band, Tulia ISD, TEA:, Tulia, Julie Barnard / Brandon Haynes,C,Varsity ,2011,65495,2,2,2,2,1,1,1,1,2, In a French Garden  (Meyer), American Riversongs  (La Plante), Newcastle March (Vinson),DATE of EVENT 04/14/2011 ,Region: 1,1. Paul Worosello,2. Lonnie Baker,3. Bonnie Anderson,1. James Nance,2. Carroll Rhodes,3. Keith Dye
33, 100-Concert Band, Tulia ISD, TEA:, Tulia, Julie Barnard / Brandon Haynes,C,Non-Varsity ,2011,65494,1,2,2,2,1,1,1,1,2, American Folk Tune Adventure  (Gorham), Joy  (Ticheli), Greenway March (Ralph and Jack Hale),DATE of EVENT 04/14/2011 ,Region: 1,1. Paul Worosello,2. Lonnie Baker,3. Bonnie Anderson,1. James Nance,2. Carroll Rhodes,3. Keith Dye
34, 100-Concert Band, West Texas Middle School, TEA:, Stinnett, Kathy McEntyre / David McEntyre,C,Varsity ,2011,67780,1,1,1,1,1,1,1,1,C, Spania (Shaffer), Courtlandt County Festival  (Owens), Stratosphere  (Beckham),DATE of EVENT 04/14/2011 ,Region: 1,1. Paul Worosello,2. Lonnie Baker,3. Bonnie Anderson,1. James Nance,2. Carroll Rhodes,3. Keith Dye
35, 100-Concert Band, Westover Park JH, TEA:, Amarillo, Jesse,CCC,Non-Varsity ,2011,66907,2,2,2,2,1,1,1,1,2, Ballet of Spring (Ballet du printemps)  (O'Connor), Courtlandt County Festival  (Owens), Kingsbury March (Elledge & Pearson),DATE of EVENT 04/14/2011 ,Region: 1,1. Paul Worosello,2. Lonnie Baker,3. Bonnie Anderson,1. James Nance,2. Carroll Rhodes,3. Keith Dye
36, 100-Concert Band, Westover Park JH, TEA:, Amarillo," Wendy Denning / Jesse Switzer, David Wright, Anthony Gilreath, Ginger Denney",CCC,Varsity ,2011,68189,1,1,1,1,1,1,1,1,C, Mighty Mite (Mesang/O'Loughlin), In a French Garden  (Meyer), Highland Legend  (Moss),DATE of EVENT 04/14/2011 ,Region: 1,1. Paul Worosello,2. Lonnie Baker,3. Bonnie Anderson,1. James Nance,2. Carroll Rhodes,3. Keith Dye
37, 100-Concert Band, Westover Park JH, TEA:, Amarillo," Wendy Denning / Jesse Switzer, David Wright, Anthony Gilreath, Ginger Denney",CCC,Varsity ,2011,66909, , , , , , , , , , Mighty Mite (Mesang/O'Loughlin), In A French Garden (Meyer), Highland Legend (Moss),DATE of EVENT 04/14/2011 ,Region: 1,1. Paul Worosello,2. Lonnie Baker,3. Bonnie Anderson,1. James Nance,2. Carroll Rhodes,3. Keith Dye
38, 100-Concert Band, Wheeler Middle School, TEA:, Wheeler, Andrew Hatch / Tim Martin,C,Non-Varsity ,2011,67981,3,3,2,3,2,1,1,1,2, Fallbrook March (John O'reilly), Theme and Variations  (Broege), Atlantis (McGinty),DATE of EVENT 04/14/2011 ,Region: 1,1. Paul Worosello,2. Lonnie Baker,3. Bonnie Anderson,1. James Nance,2. Carroll Rhodes,3. Keith Dye
39, 100-Concert Band, White Deer Elementary/ Jr High School, TEA:, White Deer, Mel,C,Non-Varsity A,2011,65613,4,4,4,4,1,2,2,2, , Laredo (Concert March) (Higgins), Sakura  (Story), Two Minute Symphony (Margolis),DATE of EVENT 04/14/2011 ,Region: 1,1. Paul Worosello,2. Lonnie Baker,3. Bonnie Anderson,1. James Nance,2. Carroll Rhodes,3. Keith Dye
