,Event,School,TEA,City,Directors,Conference,Classification,Year,ID,Stage Judge 1,Stage Judge 2,Stage Judge 3,Stage Final,SR Judge 1,SR Judge 2,SR Judge 3,SR Final,Award,Selection 1,Selection 2,Selection 3,oops
0, 100-Concert Band, Aguirre, TEA:, Houston, Robert Sturdy / Brittany Gaedchens,CCC,Varsity ,2018,137396,1,1,1,1,1,1,1,1,C, Big Circus March (Foster), Shepherd's Hey  (Traditional/Roszell), La Madre de los Gatos  (Beck),
1, 100-Concert Band, Aguirre, TEA:, Houston, Robert Sturdy / Brittany Gaedchens,CCC,Sub Non-Varsity ,2018,137387,2,3,2,2,1,2,2,2, , Synergy March (Owens), Little Brazil Suite  (Balent), Elizabethan Dance  (Williams),
2, 100-Concert Band, Anthony Aguirre Middle School, TEA:, Houston, Brittany Gaedchens / Robert Sturdy,CCC,Non-Varsity ,2018,137384,1,1,1,1,1,1,1,1,D, Spitfire (Michael Story), Qin Shi's Stone Army  (Arcari), Serengeti Dreams  (Smith),
3, 100-Concert Band, Barbers Hill Middle School South, TEA:, Mont Belvieu," Andrew Kier / Jaime Yim-Talbert, Lisa Stone",CC,Sub Non-Varsity ,2018,135443,2,1,1,1,2,1,2,2,2, Infinity Concert March (James Curnow), Night Fury (Carol Brittin Chambers), Dark Matter (Nathan Daughtrey),
4, 100-Concert Band, Barbers Hill MS North, TEA:, Baytown, Amy Wagner / Cliff Horn,CC,Non-Varsity A,2018,138151,1,1,2,1,2,3,2,2,2, Jaguar (Eric Osterling), Dance Celebration  (Smith), Odyssey  (Branchfield),
5, 100-Concert Band, Barbers Hill MS North, TEA:, Mont Belvieu," Cliff Horn / Amy Wagner, Sebastian Lopez",CC,Varsity ,2018,138104,1,1,1,1,1,1,1,1,C, Champions of Freedom (Ken Harris), Serengeti Dreams  (Smith), Our Kingsland Spring  (Hazo),
6, 100-Concert Band, Barbers Hill MS South, TEA:, Mont Belvieu, Jaime Yim-Talbert / Lisa Stone,CC,Varsity ,2018,138643,1,1,1,1,1,1,1,1,C, The Red Cape (Meredith), A Joyful Journey  (Sheldon), Black Forest Overture  (Sweeney),
7, 100-Concert Band, Barbers Hill MS South, TEA:, Mont Belvieu, Lisa Stone / Jaime Yim-Talbert,CC,Non-Varsity ,2018,139053,1,2,1,1,1,1,1,1,D, Castlewood March (Ralph and Jack Hale), Sea Song Trilogy  (McGinty), Fortis  (Gazlay),
8, 100-Concert Band, Baytown Middle School, TEA:, Baytown, Sarah Hernandez / Taylor Kollmeier,CC,Varsity ,2018,136724,2,2,1,2,1,1,2,1,2, Espana Cani (Narro/Story), Our Kingsland Spring (Samuel R. Hazo), Fireball! (Beck),
9, 100-Concert Band, Baytown Middle School, TEA:, Baytown, Taylor Kollmeier / Sarah Hernandez,CC,Non-Varsity ,2018,137207,1,2,1,1,1,1,1,1,D, Valley Forge March (John Edmondson), Irish Air and Dance  (Story), Armory  (Standridge),
10, 100-Concert Band, Berry Miller Junior High School, TEA:, Pearland, Chris Bennett / Heather Massey & Blake Lein,CCC,Varsity ,2018,136800,1,1,1,1,1,1,1,1,C, Children's March (Percy Grainger/Douglas Wagner)," Five English Folk Songs (play 1st & last mvts, plus at least one additional mvt) (Vaughan Williams/Feldman)", Variations on a Korean Folk Song  (Chance),
11, 100-Concert Band, Berry Miller Junior High, TEA:, Pearland," Blake Lein / Christopher Bennett, Heather Massey",CCC,Sub Non-Varsity ,2018,137345,1,1,1,1,1,1,1,1,D, Fortitude Concert March  (William Owens), Danza de Espana  (Chambers), Tanchozuru  (Standridge),
12, 100-Concert Band, Berry Miller Junior High, TEA:, Pearland," Heather Massey / Chris Bennett, Blake Lein",CCC,Non-Varsity ,2018,136998,1,1,1,1,1,1,1,1,D, Excelsior! Concert March (William Owens), Sketches of Canada (play all) (Story), Into the Artic  (Balmages),
13, 100-Concert Band, Beverly Hills Intermediate, TEA:, Houston, Dan Mullen / Wes Hardy,CCC,Varsity ,2018,135628,1,1,2,1,2,1,2,2,2, Regimental Honor (Moss), Fantasy on an Early American Marching Tune  (Sheldon), La Madre de los Gatos  (Beck),
14, 100-Concert Band, Beverly Hills Intermediate, TEA:, Houston, Wes Hardy / Dan Mullen,CCC,Non-Varsity ,2018,136111,2,2,2,2,1,1,1,1,2, Valley Vista March (Hodges), Korean Hill Song  (Williams), Fortis  (Gazlay),
15, 100-Concert Band, Bondy Intermediate, TEA:, Pasadena, David Lea / Russell Bowlin,CCC,Non-Varsity ,2018,136164,1,1,2,1,1,1,1,1,D, The Red Cape (Spanish March) (Meredith), Egyptique  (Owens), Armory  (Standridge),
16, 100-Concert Band, Bondy Intermediate, TEA:, Pasadena, Russell Bowlin / David Lea,CCC,Sub Non-Varsity ,2018,136034,3,2,3,3,1,2,2,2, , Union March (Rogers), Qin Shi's Stone Army  (Arcari), Plaza de Toros  (Story),
17, 100-Concert Band, Bondy Intermediate, TEA:, Pasadena, Russell Bowlin / David Lea,CCC,Varsity ,2018,136033,2,2,2,2,1,2,1,1,2, La Madre de los Gatos  (Beck), As Twilight Falls  (Sheldon), The Boom Boom Galop (Standridge),
18, 100-Concert Band, Bonnette MS, TEA:, Deer Park, Trenton Petry / Emmy Johnston,CC,Varsity ,2018,137350,1,1,1,1,1,1,1,1,C, Spania (David Shaffer), Egyptique  (Owens), Danza de Espana  (Chambers),
19, 100-Concert Band, Cedar Bayou Junior School, TEA:, Baytown," Cliff Brown / David Watson, Dwight Watson",CCC,Varsity ,2018,136383,1,2,2,2,2,3,2,2, , Fleur-de-lis March (Sandy Feldstein & Larry Clark), Our Kingsland Spring  (Hazo), Tanchozuru  (Standridge),
20, 100-Concert Band, Cedar Bayou Junior School, TEA:, Baytown, Dwight Watson / David Watson and Cliff Brown,CCC,Non-Varsity ,2018,136387,1,1,1,1,1,1,1,1,D, Brandy Station March (John Edmondson), Fortis  (Gazlay), Armory  (Standridge),
21, 100-Concert Band, Deepwater MS, TEA:, Pasadena, Jeff Murphy / Zachary Alcantara,CC,Varsity ,2018,138006,2,2,1,2,2,2,2,2, , Laredo concert march (John Higgins), Expectations  (Clark), Uskudar  (Anon. or Trad./Smith/Story),
22, 100-Concert Band, Deepwater MS, TEA:," Pasadena, TX", Zachary Alcantara / Jeff Murphy,CC,Non-Varsity ,2018,138734,3,3,3,3,2,3,3,3, , Dance Celebration  (Smith), Exhortation  (Gazlay), Spitfire (Story),
23, 100-Concert Band, Deer Park MS, TEA:, Deer Park, David Dobson / Jacquie Vargas,CC,Varsity ,2018,137077,2,1,2,2,1,1,1,1,2, Cold Brook March (John O'Reilly), Serengeti Dreams  (Smith), Colliding Visions  (Balmages),
24, 100-Concert Band, Deer Park MS, TEA:, Deer Park, Jacquie Vargas / David Dobson,CC,Non-Varsity ,2018,137134,3,3,4,3,2,2,3,2, , Glenwood March (David Gorham), Uskudar (Smith/Story), Night Fury (Chambers),
25, 100-Concert Band, Fairmont Junior High, TEA:, Pasadena, Lesley Zorn,CC,Varsity ,2018,137962,2,2,2,2,1,1,1,1,2, Marche Diabolique (Brian Balmages), Shepherd's Hey  (Traditional/Roszell), Armory  (Standridge),
26, 100-Concert Band, Gentry Junior School, TEA:, Baytown," Roderick Barron / Nathan Kim, Zeb Moore",CCC,Non-Varsity ,2018,135413,2,2,2,2,1,2,2,2, , Two English Dances  (Anon. or Trad./O'Reilly), In The Bleak Midwinter  (Holst/Bullock), March for a Norwegian Penguin (Douglas E. Wagner),
27, 100-Concert Band, Gentry Junior School, TEA:, Baytown," Zeb Moore / Rod Barron, Nathan Kim",CCC,Varsity ,2018,138440,2,2,2,2,3,3,3,3, , As Twilight Falls  (Sheldon), Joy  (Ticheli), Kitty Hawk March (Ed Huckeby),
28, 100-Concert Band, Highlands Jr. School, TEA:, Highlands, Manuel Garza,CCC,Varsity ,2018,137718,1,1,1,1,2,2,3,2,2, Honor Guard March (Jay Chattaway), As Twilight Falls (Robert Sheldon), Japanese Pictures (Kevin Mixon),
29, 100-Concert Band, Highlands Jr. School, TEA:, Highlands," Von Silverberg / Manuel Garza, Leslie Moore",CCC,Non-Varsity ,2018,138090,2,2,2,2,2,2,3,2, , Union March (Mekel Rodgers), Dorian Chant (Bill Calhoun), Odyssey (Aric Branchfield),
30, 100-Concert Band, Horace Mann Junior School, TEA:, Baytown, Brian Matocha / Jose M. Chaidez,CCC,Varsity ,2018,136888,1,1,1,1,2,1,1,1,C, Rough Riders (King/Swearinger), Rippling Watercolors  (Balmages), Abracadabra  (Ticheli),
31, 100-Concert Band, Horace Mann Junior School, TEA:, Baytown, Kevin,CCC,Non-Varsity C,2018,137092,1,2,1,1,2,2,3,2,2, Crown Point March (Bruce Pearson), Mystery Ride  (White), Egyptique  (Owens),
32, 100-Concert Band, Jackson Intermediate, TEA:, Pasadena, James Meador / James Meador/Nathan Poteet,CC,Non-Varsity ,2018,135995,1,2,1,1,2,1,2,2,2, Monterey March (La Plante), In a Quiet Place  (Calhoun), Pevensey Castle  (Sheldon),
33, 100-Concert Band, Jackson Intermediate, TEA:, Pasadena, James Meador / Nathan Poteet/James Meador,CC,Sub Non-Varsity ,2018,135996,3,3,2,3,1,2,1,1,2, Synergy March (Owens), Canon of Peace  (Jennings), Dorian Chant  (Calhoun),
34, 100-Concert Band, Johnson JH, TEA:, Channelview, Jeri Collins / Mark Santos,CCC,Sub Non-Varsity ,2018,138851,3,3,3,3,3,3,3,3, , Glenwood March (Gorham), Dance Celebration  (Smith), Plaza de Toros  (Story),
35, 100-Concert Band, Johnson JH, TEA:, Channelview, Jeri Collins / Mark Santos,CCC,Non-Varsity ,2018,133148,1,1,1,1,1,1,1,1,D, Fighting Falcon March (Todd Stalter), The Spacious Firmament on High  (Sharp), Night Fury  (Chambers),
36, 100-Concert Band, Johnson MS, TEA:, Channelview, Mark Santos / Jeri Collins, Acc:N/A,CCC,Varsity ,2018,135655,1,1,1,1,2,3,2,2,2, Pride of the Regiment (Nancy H. Seward), As Twilight Falls  (Sheldon), Shepherd's Hey  (Traditional/Roszell)
37, 100-Concert Band, La Porte MS, TEA:, La Porte, Stephanie Boothman,CC,Varsity ,2018,138890,2,1,1,1,1,1,1,1,C, Normandy Beach (John Edmondson), Homeward Bound  (Keen/Althouse/Karrick), West Highlands Sojourn (Sheldon),
38, 100-Concert Band, Lomax MS, TEA:, La Porte, Kevin Poe,CC,Varsity ,2018,138584,1,1,1,1,1,1,1,1,C, Pinnacle of Distinction (March) (Larry Clark), Sparks  (Balmages), Fantasy on a Fiddle Tune  (La Plante),
39, 100-Concert Band, Miller MS, TEA:, Pasadena, Charlie Herrera,CCC,Varsity ,2018,135063,1,1,1,1,2,3,2,2,2, Spirit of New Orleans (Murtha), Japanese Pictures  (Mixon), Quintology  (Meyer),
40, 100-Concert Band, Miller MS, TEA:, Pasadena, David Barbick,CCC,Non-Varsity ,2018,135651,1,1,1,1,1,1,1,1,D, Fighting Falcon March (Todd Stalter), Qin Shi's Stone Army  (Arcari), Storm Mountain Jubilee  (Strommen),
41, 100-Concert Band, Park View Intermediate, TEA:, Pasadena, Garrett Sanborne / John Muir,CC,Non-Varsity ,2018,136007,4,4,3,4,2,2,3,2, , Spitfire March (Michael Story), Dance Celebration  (Smith), Majestica  (Gazlay),
42, 100-Concert Band, Park View Intermediate, TEA:, Pasadena, John Muir / Garrett Sanborne,CC,Varsity ,2018,135662,2,2,2,2,1,1,3,1,2, Activity March (Bennett/Clark), Expectations  (Clark), Iroquois Sunrise  (Rudgers),
43, 100-Concert Band, Pearland Junior High East, TEA:, Pearland, Jason Hargrave,CCC,Varsity ,2018,138603,1,1,1,1,2,2,2,2,2, Marche Des Parachutistes Belges (Leemans/Wiley), Shepherd's Hey  (Grainger/Rogers), Glaciers  (Director),
44, 100-Concert Band, Pearland Junior High East, TEA:, Pearland, Priscilla Bell,CCC,Sub Non-Varsity ,2018,136756,1,1,1,1,1,2,1,1,D, Night Fury  (Chambers), Dorian Chant  (Calhoun), Fortitude (Owens),
45, 100-Concert Band, Pearland Junior High East, TEA:, Pearland, Tessa Gartin,CCC,Non-Varsity ,2018,137944,1,1,1,1,1,1,1,1,D, Valley Vista March (Steve Hodges), Japanese Pictures  (Mixon), New Horizons  (Corrigan),
46, 100-Concert Band, Pearland Junior High South, TEA:, Pearland, Ashley Clift,CCC,Non-Varsity ,2018,137730,1,2,1,1,1,1,1,1,D, Bunker Hill March (John Edmondson), Cascadia Celebration  (Hodges), Armory  (Standridge),
47, 100-Concert Band, Pearland Junior High South, TEA:, Pearland, Brandon J. Linder,CCC,Varsity ,2018,137734,1,1,1,1,2,2,2,2,2, Rough Riders (King/Swearingen), American Riversongs  (La Plante), Brave Spirit  (Standridge),
48, 100-Concert Band, Pearland Junior High South, TEA:, Pearland, Nick Miller,CCC,Sub Non-Varsity ,2018,137733,1,2,2,2,2,2,2,2, , Synergy March (William Owens), Serengeti Dreams  (Smith), The Band in the Square on the Fourth of July  (La Plante),
49, 100-Concert Band, Pearland Junior High West, TEA:, Pearland," Curtis Amrein / Meredith Bates Bishop, Jessica Steiner",CCC,Sub Non-Varsity ,2018,137948,1,1,1,1,1,1,1,1,D, Matrix March (Huckeby), Courtlandt County Festival  (Owens), Conviction  (Clark),
50, 100-Concert Band, Pearland Junior High West, TEA:, Pearland," Jessica Steiner / Meredith Bates Bishop, Curtis Amrein",CCC,Non-Varsity ,2018,137949,1,2,1,1,1,1,1,1,D, The Big Circus March (Foster), Blue Ridge Reel  (Balmages), New Horizons  (Corrigan),
51, 100-Concert Band, Pearland West Junior High, TEA:, Pearland," Meredith Bates Bishop / Jessica Steiner, Curtis Amrein",CCC,Varsity ,2018,137947,1,1,1,1,1,1,1,1,C, Brighton Beach  (Latham), Variations on Scarborough Fair  (Custer), Greek Folk Song Suite  (Cesarini),
52, 100-Concert Band, Queens Intermediate, TEA:, Houston, Kenneth Fanti / Michael Capritto,CC,Varsity ,2018,135776,1,1,1,1,1,1,1,1,C, Champions of Freedom (Harris), Canticle  (Wagner), Fireball!  (Beck),
53, 100-Concert Band, Queens Intermediate, TEA:, Houston, Michael Capritto / Kenneth Fanti,CC,Non-Varsity ,2018,135779,1,1,1,1,1,2,2,2,2, Patriots on Parade (Harris), Dance Celebration  (Smith), Conviction  (Clark),
54, 100-Concert Band, San Jacinto Intermediate, TEA:, Pasadena, Alfred Medina / Spencer Morris,CC,Varsity ,2018,136071,2,2,1,2,2,2,2,2, , Marchus Maximus (Story), Fortis  (Gazlay), Danza de Espana  (Chambers),
55, 100-Concert Band, San Jacinto Intermediate, TEA:, Pasadena, Spencer Morris / Alfred Medina,CC,Non-Varsity ,2018,136078,1,3,1,1,2,1,2,2,2, Stratford March (Higgins), Qin Shi's Stone Army  (Arcari), Majestica  (Gazlay),
56, 100-Concert Band, South Houston Intermediate, TEA:, South Houston, Paul Daniel,CC,Non-Varsity ,2018,135952,3,1,1,1,2,3,2,2,2, Infinity (Concert March) (Curnow), Dorian Chant  (Calhoun), Elizabethan Dance  (Williams),
57, 100-Concert Band, South Houston Intermediate, TEA:, South Houston, Tim Lynn,CC,Varsity ,2018,135942,1,1,1,1,1,1,1,1,C, El Relicario (Padilla), Sketches of Canada (play 2 mvts) Mvts I & III (Story), Tanchozuru  (Standridge),
58, 100-Concert Band, Southmore Intermediate, TEA:, Pasadena, Jonathon Anderson / Vanessa Sanchez,CCC,Varsity ,2018,135936,1,1,2,1,3,3,4,3,2, The Lone Eagle March (John Edmonson), Down by the Salley Gardens (Anon. or Trad./Sweeney), Into the Artic  (Balmages),
59, 100-Concert Band, Southmore Intermediate, TEA:, Pasadena, Vanessa Sanchez / Jon Anderson,CCC,Non-Varsity ,2018,136973,2,2,2,2,1,2,3,2, , Battle Creek March (Williams), Dance Celebration  (Smith), Wildwind Overture  (Kinyon),
60, 100-Concert Band, Thompson Intermediate, TEA:, Houston, Caleb Lopez / Greg Siegrist,CCC,Varsity ,2018,137418,3,2,2,2,2,4,3,3, , Banner Year  (Harris), Contempo  (Story), Two British Folk Songs  (Del Borgo),
61, 100-Concert Band, Thompson Intermediate, TEA:, Houston, Gregory Siegrist / Caleb Lopez,CCC,Non-Varsity ,2018,137484,2,2,2,2,1,2,2,2, , Integrity March (Owens), Plaza de Toros  (Story), Dance Celebration  (Smith),
