,0,1,2,3,4,5,6,7,8,9,10,11,12,13,14,15,16,17,18,19,20,21,22,23,24,25,26,27,28
0, 100-Concert Band, Bonham Middle School, TEA:, Amarillo," Rachael Whipple / Scott Myers, Mike Ellis",CC,Varsity ,2020,160852, , , , , , , , , , March of the Buccaneers (Victor Flowers), Hypnotic Fireflies (Brain Balmages), Tanchozuru (Randall D. Standridge),DATE of EVENT 04/22/2020 ,Region: 1,1. TBA,2. TBA,3. TBA,1. TBA,2. TBA,3. TBA
1, 100-Concert Band, Borger Middle School, TEA:, Borger, Nick Mears,CC,Varsity ,2020,161112, , , , , , , , , ," Moscow, 1941 (15892)  (Balmages)", Japanese Pictures (18467)  (Mixon), Lexington March (Edmondson),DATE of EVENT 04/22/2020 ,Region: 1,1. TBA,2. TBA,3. TBA,1. TBA,2. TBA,3. TBA
2, 100-Concert Band, Bowie Middle School, TEA:, Amarillo, Alisha Caldwell,CCC,Sub Non-Varsity ,2020,158700, , , , , , , , , , The Gladiator (John Philip Sousa/Arr. Michael Story), Dance Celebration (Robert W. Smith), Armory (Randall Standridge),DATE of EVENT 04/22/2020 ,Region: 1,1. TBA,2. TBA,3. TBA,1. TBA,2. TBA,3. TBA
3, 100-Concert Band, Bowie Middle School, TEA:, Amarillo," Alisha Caldwell / Kyle McDonald, Jesse Finney",CCC,Varsity ,2020,158701, , , , , , , , , , Alamo (March) (Karl King/Arr. James Swearingen), Little Suite for Band (play all) (Randall Standridge), La Madre de los Gatos (Brian Beck),DATE of EVENT 04/22/2020 ,Region: 1,1. TBA,2. TBA,3. TBA,1. TBA,2. TBA,3. TBA
4, 100-Concert Band, Bowie Middle School, TEA:, Amarillo," Jesse Finney / Alisha Caldwell, Kyle McDonald",CCC,Non-Varsity ,2020,160521, , , , , , , , , , March of the Chinchillas (Paul), Japanese Pictures (18467)  (Mixon), Colliding Visions (17502)  (Balmages),DATE of EVENT 04/22/2020 ,Region: 1,1. TBA,2. TBA,3. TBA,1. TBA,2. TBA,3. TBA
5, 100-Concert Band, Bushland Middle School, TEA:, Bushland," Alec Bennington / Gregg Diamond, Victoria Kreutzer",C,Var-Composite ,2020,159170, , , , , , , , , , A March on the Kings Highway (Pierre La Plante), In a French Garden (Richard Meyer), Tanchozuru (Randall Standridge),DATE of EVENT 04/22/2020 ,Region: 1,1. TBA,2. TBA,3. TBA,1. TBA,2. TBA,3. TBA
6, 100-Concert Band, Bushland Middle School, TEA:, Bushland, Victoria Kreutzer,C,Non-Varsity ,2020,159377, , , , , , , , , , Dorian Chant (20589)  (Calhoun), Summit Fanfare (17493)  (Owens), Qin Shis Stone Army (19600)  (Arcari),DATE of EVENT 04/22/2020 ,Region: 1,1. TBA,2. TBA,3. TBA,1. TBA,2. TBA,3. TBA
7, 100-Concert Band, Canadian Middle School, TEA:, Canadian, Daisy Edwards / James Edwards,C,Varsity ,2020,161209, , , , , , , , , , Monterey March (Pierre La Plante), Egyptique (19576)  (Owens), Fortis (17484)  (Gazlay),DATE of EVENT 04/22/2020 ,Region: 1,1. TBA,2. TBA,3. TBA,1. TBA,2. TBA,3. TBA
8, 100-Concert Band, Canyon JH, TEA:, Canyon," Eric Rath / Eric Perez, Mike Sheffield, Luis Hernandez",CC,Non-Varsity ,2020,160985, , , , , , , , , ," Andalucia (Lopez, Victor)", With Uncommon Valor (21568)  (Stalter), Fireball! (19604)  (Beck),DATE of EVENT 04/22/2020 ,Region: 1,1. TBA,2. TBA,3. TBA,1. TBA,2. TBA,3. TBA
9, 100-Concert Band, Canyon JH, TEA:, Canyon," Eric Rath / Eric Perez, Mike Sheffield, Luis Hernandez",CC,Varsity ,2020,160984, , , , , , , , , , March of the Shadows (Haley Woodrow), Tonadillas Suite (18481)  (Granados/Ford), Swirling Prisms (20755)  (Balmages),DATE of EVENT 04/22/2020 ,Region: 1,1. TBA,2. TBA,3. TBA,1. TBA,2. TBA,3. TBA
10, 100-Concert Band, Canyon JH, TEA:, Canyon," Eric Rath / Luis Hernandez, David Lough, Mike Sheffield",CC,Sub Non-Varsity ,2020,160986, , , , , , , , , , Plaza de Toros (20709)  (Story), Elizabethan Dance (17482)  (Williams), Summit Fanfare (17493)  (Owens),DATE of EVENT 04/22/2020 ,Region: 1,1. TBA,2. TBA,3. TBA,1. TBA,2. TBA,3. TBA
11, 100-Concert Band, Childress Junior High, TEA:, Childfress, Robert Frick,C,Varsity ,2020,161160, , , , , , , , , , Plaza de Toros (20709)  (Story), Courtlandt County Festival (15820)  (Owens), Reveille March (Ferguson),DATE of EVENT 04/22/2020 ,Region: 1,1. TBA,2. TBA,3. TBA,1. TBA,2. TBA,3. TBA
12, 100-Concert Band, Dalhart Junior High, TEA:, Dalhart, Irene Durbak / Joshua Bell,CC,Var-Combined ,2020,158395, , , , , , , , , ," All for One, One for All (March) (Carol Brittin Chambers)", Expectations (Larry Clark), Qin Shi's Stone Army (Tyler Arcari),DATE of EVENT 04/22/2020 ,Region: 1,1. TBA,2. TBA,3. TBA,1. TBA,2. TBA,3. TBA
13, 100-Concert Band, de Zavala Middle School, TEA:, Amarillo," Britni Nuckols / Justin Nuckols, David Spence",C,Varsity ,2020,159400, , , , , , , , , , Fireball! (19604)  (Beck), Hsien (19606)  (Fox), Aquia Landing (Murtha),DATE of EVENT 04/22/2020 ,Region: 1,1. TBA,2. TBA,3. TBA,1. TBA,2. TBA,3. TBA
14, 100-Concert Band, Dumas Jr High, TEA:, Dumas, James Carter,CC,Varsity ,2020,161201, , , , , , , , , , Monterey March (LaPLante), Tanchozuru (20595)  (Standridge), Spirit of an Eagle (17515)  (Clark),DATE of EVENT 04/22/2020 ,Region: 1,1. TBA,2. TBA,3. TBA,1. TBA,2. TBA,3. TBA
15, 100-Concert Band, Dumas Jr High, TEA:, Dumas," Neil Reed / James Carter, Rebecca Carter, Zach Sedlacek",CC,Non-Varsity ,2020,161202, , , , , , , , , , Fighting Falcon March (Stalter), Courtlandt County Festival (15820)  (Owens), Armory (19597)  (Standridge),DATE of EVENT 04/22/2020 ,Region: 1,1. TBA,2. TBA,3. TBA,1. TBA,2. TBA,3. TBA
16, 100-Concert Band, Hereford JH, TEA:, Hereford," Jonathan Cantu / Clint Larsson, Robert Hinds, Christy Henson, John Stacy",CC,Varsity ,2020,160913, , , , , , , , , , The Big Circus March (Robert E. Foster), Expectations (19603)  (Clark), Japanese Pictures (18467)  (Mixon),DATE of EVENT 04/22/2020 ,Region: 1,1. TBA,2. TBA,3. TBA,1. TBA,2. TBA,3. TBA
17, 100-Concert Band, Hereford Jr. High, TEA:, Hereford," Clint Larsson / Jonathan Cantu, Robert Hinds, Christy Henson, John Stacy",CC,Non-Varsity ,2020,160943, , , , , , , , , , Mountainbrook March (Akey), Mystery Ride (18192)  (White), Fortis (17484)  (Gazlay),DATE of EVENT 04/22/2020 ,Region: 1,1. TBA,2. TBA,3. TBA,1. TBA,2. TBA,3. TBA
18, 100-Concert Band, Highland Park Middle School, TEA:, AMARILLO, James Capes,CC,Varsity ,2020,161047, , , , , , , , , , Summit Fanfare (17493)  (Owens), Ghost Ship (18462)  (Story), Infinity (Concert March) (James Curnow),DATE of EVENT 04/22/2020 ,Region: 1,1. TBA,2. TBA,3. TBA,1. TBA,2. TBA,3. TBA
19, 100-Concert Band, Horace Mann Middle School, TEA:, Amarillo," Terry Baker / Ismael Alfaro, Aaron Rhynes",CC,Varsity ,2020,161513, , , , , , , , , , Monterey March (La Plante), Into the Arctic (20710)  (Balmages), Armory (19597)  (Standridge),DATE of EVENT 04/22/2020 ,Region: 1,1. TBA,2. TBA,3. TBA,1. TBA,2. TBA,3. TBA
20, 100-Concert Band, Pampa Junior High, TEA:, Pampa," Andrew Sedlacek / Sedlacek, Katie; Stout, Daniel; Benton, John",CC,Non-Varsity A,2020,161093, , , , , , , , , , Courtlandt County Festival (15820)  (Owens), Dance Celebration (647)  (Smith), Forward March! (Paul Murtha),DATE of EVENT 04/22/2020 ,Region: 1,1. TBA,2. TBA,3. TBA,1. TBA,2. TBA,3. TBA
21, 100-Concert Band, Pampa Junior High, TEA:, Pampa," Andrew Sedlacek / Sedlacek, Katie; Stout, Daniel; Benton, John",CC,Varsity ,2020,161092, , , , , , , , , , Tanchozuru (20595)  (Standridge), New Horizons (18469)  (Corrigan), Captain Dane (William Owens),DATE of EVENT 04/22/2020 ,Region: 1,1. TBA,2. TBA,3. TBA,1. TBA,2. TBA,3. TBA
22, 100-Concert Band, Panhandle Jr. High School, TEA:, Panhandle, Sarah Summersgill / Herbert Herrera,C,Varsity ,2020,161239, , , , , , , , , , Nottingham Castle (Daehn), The Lone Eagle March (John Edmondson/Hal Leonard Corporation), Uskudar (Smith/Story),DATE of EVENT 04/22/2020 ,Region: 1,1. TBA,2. TBA,3. TBA,1. TBA,2. TBA,3. TBA
23, 100-Concert Band, River Road Middle School, TEA:, AMARILLO, Chance Houston / Dustin Olson,C,Non-Varsity A,2020,157191, , , , , , , , , , Infinity March (James Curnow), Dance Celebration (647)  (Smith), Courtlandt County Festival (15820)  (Owens),DATE of EVENT 04/22/2020 ,Region: 1,1. TBA,2. TBA,3. TBA,1. TBA,2. TBA,3. TBA
24, 100-Concert Band, Sanford-Fritch Junior High, TEA:, Fritch, Jamie Lynn Cook / Anthony Lucas,C,Varsity ,2020,161244, , , , , , , , , , Testament! (William Owens), Sakura (Michael Story), Dance Celebration (Robert W. Smith ),DATE of EVENT 04/22/2020 ,Region: 1,1. TBA,2. TBA,3. TBA,1. TBA,2. TBA,3. TBA
25, 100-Concert Band, Stratford Jr. High School, TEA:, Stratford, Bryce W Victory / Alan Gregory,C,Var-Composite ,2020,161453, , , , , , , , , , Lexington March (Edmondson), Atlantis (45)  (McGinty), First Light (18461)  (Ticheli),DATE of EVENT 04/22/2020 ,Region: 1,1. TBA,2. TBA,3. TBA,1. TBA,2. TBA,3. TBA
26, 100-Concert Band, Travis Middle School, TEA:, Amarillo," Maritza Mendoza / Ismael Alfaro, Aaron Rhynes, Isaac Gutierrez",CCC,Non-Varsity ,2020,161070, , , , , , , , , , Synergy March  (William Owens ), Sakura  (Michael Story ), Dance Celebration  (Robert W. Smith ),DATE of EVENT 04/22/2020 ,Region: 1,1. TBA,2. TBA,3. TBA,1. TBA,2. TBA,3. TBA
27, 100-Concert Band, Travis Middle School, TEA:, Amarillo," Maritza Mendoza / Ismael Alfaro, Aaron Rhynes, Isaac Gutierrez",CCC,Varsity ,2020,161029, , , , , , , , , , The Red Cape  (James Meredith ), The Rowan Tree  (Randall D. Standridge ), Moscow 1941  (Brian Balmages ),DATE of EVENT 04/22/2020 ,Region: 1,1. TBA,2. TBA,3. TBA,1. TBA,2. TBA,3. TBA
28, 100-Concert Band, Tulia Junior High, TEA:, Tulia," Erik Lerma / Derek Omar Vasquez, Betheny Thompson",C,Varsity ,2020,160894, , , , , , , , , , Laredo Concert March (Higgins), Maesong (Owens), Plaza de Toros (Story),DATE of EVENT 04/22/2020 ,Region: 1,1. TBA,2. TBA,3. TBA,1. TBA,2. TBA,3. TBA
29, 100-Concert Band, Westover Park Junior High School, TEA:, Amarillo, Andres Prieto,CCC,Non-Varsity ,2020,158131, , , , , , , , , , Monterey March (Pierre La Plante)," As Twilight Falls (Robert Sheldon, op. 156)", Sketches of Canada (play all) (Michael Story (ASCAP)),DATE of EVENT 04/22/2020 ,Region: 1,1. TBA,2. TBA,3. TBA,1. TBA,2. TBA,3. TBA
30, 100-Concert Band, Westover Park Junior High School, TEA:, Amarillo, Anthony Gilreath,CCC,Varsity ,2020,158140, , , , , , , , , , VALDRES Norwegian March (Johannes Hanssen/Merlin Patterson), Fantasy On A Theme By Samuel Barber (from The School for Scandal Overture) (Samuel Barber/Richard L. Saucedo), Summer Dances (Brian Balmages (ASCAP)),DATE of EVENT 04/22/2020 ,Region: 1,1. TBA,2. TBA,3. TBA,1. TBA,2. TBA,3. TBA
31, 100-Concert Band, Westover Park Junior High School, TEA:, Amarillo, Anthony Gilreath,CCC,Sub Non-Varsity ,2020,158137, , , , , , , , , , Majestic March (Paul Lavender), Sakura (Cherry Blossoms) (Mike Story), Ghost Ship (Michael Story (ASCAP)),DATE of EVENT 04/22/2020 ,Region: 1,1. TBA,2. TBA,3. TBA,1. TBA,2. TBA,3. TBA
