,0,1,2,3,4,5,6,7,8,9,10,11,12,13,14,15,16,17,18,19,20,21,22,23,24,25,26,27,28
0, 100-Concert Band, Dekaney HS, TEA:, Houston, Chase Giddings / Paul Fletes,AAAAAA,Sub Non-Varsity ,2021,167297,1,1,1,1,1,1,1,1,C, The Bandmasters March (Putnam), Slane (arr. Wagner), Danza de Espana (Chambers),DATE of EVENT 04/30/2021 ,Region: 33,1. Mark Edenfield,2. Wade McDonald,3. Richard Crain,1. Mark Edenfield,2. Wade McDonald,3. Richard Crain
1, 100-Concert Band, Dekaney HS, TEA:, Houston, Trent E Cooper / Chase Giddings,AAAAAA,Varsity ,2021,167301,1,1,1,1,1,1,1,1,B, Pineapple Poll (play at least two mvts) (Sullivan/Mackerras/Duthoit), Polovetsian Dances  (Borodin/Hindsley), Semper Fidelis (John Philip Sousa),DATE of EVENT 04/30/2021 ,Region: 33,1. Mark Edenfield,2. Wade McDonald,3. Richard Crain,1. Mark Edenfield,2. Wade McDonald,3. Richard Crain
2, 100-Concert Band, Spring High School, TEA:, Spring," Terri Risinger Clemons / Jason Andrew Smith, Austin Swack",AAAAAA,Sub Non-Varsity ,2021,167097,1,1,1,1,1,1,1,1,C, Dalarna Shuffle (Jay Dawson), The Seal Lullaby  (Whitacre), Imaginarium  (Standridge),DATE of EVENT 04/30/2021 ,Region: 33,1. Mark Edenfield,2. Wade McDonald,3. Richard Crain,1. Mark Edenfield,2. Wade McDonald,3. Richard Crain
3, 100-Concert Band, Spring High School, TEA:, Spring," Terri Risinger Clemons / Jason Andrew Smith, Austin Swack",AAAAAA,Varsity ,2021,167096,1,1,1,1,1,1,1,1,B, Overture to Candide  (Bernstein/Grundman or Beeler), Homage to Bharat (Reflections of India)  (Balmages), Lola Flores (Sadel and Tucci),DATE of EVENT 04/30/2021 ,Region: 33,1. Mark Edenfield,2. Wade McDonald,3. Richard Crain,1. Mark Edenfield,2. Wade McDonald,3. Richard Crain
4, 100-Concert Band, Westfield HS, TEA:, Houston, Scott Norman,AAAAAA,Non-Varsity ,2021,167340,1,1,1,1,1,1,1,1,C, Glaciers  (Director), Sun Dance  (Ticheli), The Thunderer (Sousa/Bocook),DATE of EVENT 04/30/2021 ,Region: 33,1. Mark Edenfield,2. Wade McDonald,3. Richard Crain,1. Mark Edenfield,2. Wade McDonald,3. Richard Crain
