,0,1,2,3,4,5,6,7,8,9,10,11,12,13,14,15,16,17,18,19,20,21,22,23,24,25,26,27,28
0, 100-Concert Band, Alan B. Shepard M.S., TEA:, San Antonio, Lisa Wilburn,CC,Varsity ,2015,97331,1,1,1,1,1,1,1,1,C, March from First Suite for Military Band (Gustav Holst), Blue Ridge Rhapsody  (Kinyon/ ), Heroes Triumphant  (Owens/ ),DATE of EVENT 03/06/2015 ,Region: 11,1. x,2. x,3. x,1. x,2. x,3. x
1, 100-Concert Band, Brentwood Middle School, TEA:, San Antonio, Shellie Davila,CC,Non-Varsity ,2015,100460,2,2,2,2,3,3,2,3, , Wingate March (John O'Reilly), Fire Dance  (Akey/ ), Ghost Ship  (Story/ ),DATE of EVENT 03/06/2015 ,Region: 11,1. x,2. x,3. x,1. x,2. x,3. x
2, 100-Concert Band, Brentwood Middle School, TEA:, San Antonio, Shellie Davila,CC,Varsity ,2015,100459,1,2,2,2,3,3,3,3, , Thunder Bay March (John O'Reilly)," Moscow, 1941  (Balmages/ )", Majestica  (Gazlay/ ),DATE of EVENT 03/06/2015 ,Region: 11,1. x,2. x,3. x,1. x,2. x,3. x
3, 100-Concert Band, Dwight Middle School, TEA:, San Antonio, Timothy Gonzalez,CC,Non-Varsity ,2015,97527,2,2,3,2,2,2,3,2, , Infinity (Concert March) (James Curnow), The Spacious Firmament on High  (Sharp/ ), Sea Song Trilogy  (McGinty/ ),DATE of EVENT 03/06/2015 ,Region: 11,1. x,2. x,3. x,1. x,2. x,3. x
4, 100-Concert Band, E.T. Wrenn MS, TEA:, San Antonio, Reuben Presas,CC,Varsity ,2015,100708,1,2,2,2,3,3,2,3, , Wedgewood March (William Owens), Irish Air and Dance (Michael Story), Fortis (Gary Gazlay),DATE of EVENT 03/06/2015 ,Region: 11,1. x,2. x,3. x,1. x,2. x,3. x
5, 100-Concert Band, Gus Garcia Middle School, TEA:, San Antonio, Don Marchand,CC,Varsity ,2015,99901,2,2,2,2,1,2,2,2, , Nottingham Castle  (Daehn/ ), Two British Folk Songs  (Anon. or Trad./Del Borgo), Infinity March (James Curnow),DATE of EVENT 03/06/2015 ,Region: 11,1. x,2. x,3. x,1. x,2. x,3. x
6, 100-Concert Band, Harlandale Middle School, TEA:, San Antonio, Victor Alvarado / Gloria P. Rodriguez,CC,Varsity ,2015,99572,1,1,1,1,1,1,1,1,C, Nottingham March (Jerry Williams), Maesong  (Owens/ ), New Horizons  (Corrigan/ ),DATE of EVENT 03/06/2015 ,Region: 11,1. x,2. x,3. x,1. x,2. x,3. x
7, 100-Concert Band, Jourdanton Junior High School, TEA:, Jourdanton," Ryan Lovell / Mr. Tunde Onibudo, Mr. Nicholas Flores",C,Non-Varsity ,2015,99375,2,3,3,3,3,2,2,2, , Joy  (Ticheli/ ), In a French Garden  (Meyer/ ), Big Leagues (Reynolds),DATE of EVENT 03/06/2015 ,Region: 11,1. x,2. x,3. x,1. x,2. x,3. x
8, 100-Concert Band, Jourdanton Junior High School, TEA:, Jourdanton," Babatunde Onibudo / Mr. Ryan Lovell, Mr. Nicholas Flores",C,Varsity ,2015,99366,1,1,1,1,1,1,1,1,C, Overture for Winds  (Carter/ ), Balladair  (Erickson/ ), Our Heritage March (King/Swearingen),DATE of EVENT 03/06/2015 ,Region: 11,1. x,2. x,3. x,1. x,2. x,3. x
9, 100-Concert Band, Kazen Middle School, TEA:, San Antonio, Nick Serenil,CC,Varsity ,2015,100132,1,1,1,1,1,1,1,1,C, Macarena (Monterde/Story), Atlantis  (McGinty/ ), Japanese Pictures  (Mixon/ ),DATE of EVENT 03/06/2015 ,Region: 11,1. x,2. x,3. x,1. x,2. x,3. x
10, 100-Concert Band, Kingsborough MS, TEA:, San Antonio, Alfred Flores / Juan Carlos Ruiz,CC,Varsity ,2015,98543,1,2,1,1,1,2,1,1,C, 100 Pipers March (Ployhar), Two English Dances  (Anon. or Trad./O'Reilly), Joy  (Ticheli/ ),DATE of EVENT 03/06/2015 ,Region: 11,1. x,2. x,3. x,1. x,2. x,3. x
11, 100-Concert Band, Leal Middle School, TEA:, San Antonio, Chris Barrera / Kailey Parker,CC,Varsity ,2015,99784,2,1,2,2,1,2,1,1,2, Fortis  (Gazlay/ ), Adrenaline Engines (Standridge/ ), March of Freedom (Edmondson),DATE of EVENT 03/06/2015 ,Region: 11,1. x,2. x,3. x,1. x,2. x,3. x
12, 100-Concert Band, Leal Middle School, TEA:, San Antonio, Kailey Parker / Christopher Barrera,CC,Non-Varsity ,2015,99785,2,2,1,2,2,2,2,2, , Mount Vernon March (Edmondson), Conviction  (Clark), Summit Fanfare  (Owens),DATE of EVENT 03/06/2015 ,Region: 11,1. x,2. x,3. x,1. x,2. x,3. x
13, 100-Concert Band, Medina Valley Middle School, TEA:, San Antonio," Sara Pempsell / Brittany Graham, Thomas Galvez, and Carlos Jimenez",CCC,Varsity ,2015,98772,1,1,2,1,2,1,1,1,C, Excelsior! Concert March (William Owens), Crescent Meadow  (Romeyn/ ), Blue Ridge Reel  (Balmages/ ),DATE of EVENT 03/06/2015 ,Region: 11,1. x,2. x,3. x,1. x,2. x,3. x
14, 100-Concert Band, Medina Valley MS, TEA:, Castroville," Brittany Graham / Beth Pempsell, Thomas Galvez, Carlos Jimenez",CCC,Non-Varsity A,2015,98844,1,2,2,2,3,2,2,2, , Infinity March  (James Curnow), Cahokia (Spears/ ), Big Sky Round-Up  (Sheldon/ ),DATE of EVENT 03/06/2015 ,Region: 11,1. x,2. x,3. x,1. x,2. x,3. x
15, 100-Concert Band, Pleasanton Jr. High, TEA:, Pleasanton," Daniel Rodriguez / Elissa Rodriguez, Sarah Yarnell, Ralph Unger",CC,Varsity ,2015,97620,2,2,2,2,1,1,1,1,2, Rolling Thunder March (Henry Fillmore/ edited by Fennell), On a Hymnsong of Philip Bliss  (Holsinger/ ), Serenade and Dances  (Sudduth/ ),DATE of EVENT 03/06/2015 ,Region: 11,1. x,2. x,3. x,1. x,2. x,3. x
16, 100-Concert Band, Pleasanton Junior High School, TEA:, Pleasanton," Elissa Yvette Rodriguez / Sarah E. Yarnell, Daniel Rodriguez, Ralph Unger",CC,Non-Varsity ,2015,97757,1,1,2,1,1,1,1,1,D, Kitty Hawk March  (Edmondson), Nottingham Castle  (Daehn/ ), Contempo  (Story/ ),DATE of EVENT 03/06/2015 ,Region: 11,1. x,2. x,3. x,1. x,2. x,3. x
17, 100-Concert Band, Poteet ISD, TEA:, Poteet, W. Roger Munoz / Eduardo Solis,CC,Varsity ,2015,99877,3,3,3,3,4,3,3,3, , The Streets of Madrid (John Moss), Shepherd's Hey  (Traditional/Roszell), Adrenaline Engines  (Standridge/ ),DATE of EVENT 03/06/2015 ,Region: 11,1. x,2. x,3. x,1. x,2. x,3. x
18, 100-Concert Band, Robert C. Zamora, TEA:, San Antonio, Chad Britt,CC,Varsity ,2015,99542,3,3,3,3,4,2,3,3, , Kitty Hawk March (John Edmondson), Dance Celebration  (Smith), Kenya Contrasts  (Himes),DATE of EVENT 03/06/2015 ,Region: 11,1. x,2. x,3. x,1. x,2. x,3. x
19, 100-Concert Band, Terrell Wells MS, TEA:, San Antonio, David M. Rodriguez / Eric Garza,CC,Varsity ,2015,99789,1,1,1,1,3,2,2,2,2, A March On The King's Highway (La Plante), In a Quiet Place  (Calhoun/ ), A Joyful Journey  (Sheldon/ ),DATE of EVENT 03/06/2015 ,Region: 11,1. x,2. x,3. x,1. x,2. x,3. x
