,Event,School,TEA,City,Directors,Conference,Classification,Year,ID,Stage Judge 1,Stage Judge 2,Stage Judge 3,Stage Final,SR Judge 1,SR Judge 2,SR Judge 3,SR Final,Award,Selection 1,Selection 2,Selection 3
0, 100-Concert Band, Bowie Middle School, TEA:, Bowie, Lonnie Baker,C,Varsity ,2005,17868,2,1,1,1,1,1,1,1,SWC, Winchester March (Edmondson), Soldiers' Procession and Sword Dance (Margolis), Kenya Contrasts (Himes)
1, 100-Concert Band, Bridgeport Middle School, TEA:, Bridgeport, Brian Beeson,CC,Non-Varsity ,2005,17585,2,2,2,2,1,1,1,1,PL2, Atlantis (McGinty), Liturgical Fanfare (Smith), American Dream March (Harris)
2, 100-Concert Band, Bridgeport Middle School, TEA:, Bridgeport, Jeffrey A. James,CC,Varsity ,2005,14528,2,2,2,2,2,3,3,3, , Bayview March (David Gorham), Kenya Contrasts (Himes), Two Minute Symphony (Margolis)
3, 100-Concert Band, Decatur Middle School, TEA:, Decatur, Eric McNiel,CC,Varsity ,2005,17243,1,1,1,1,1,1,2,1,SWC, Aldergate March (Ralph and Jack Hale), A Childhood Hymn (Holsinger), Fire Dance (Akey)
4, 100-Concert Band, Gainesville Junior High, TEA:, Gainesville, Clifton Washek,CC,Varsity ,2005,14790,3,1,1,1,2,3,2,2,PL2, March of the Irish Guard (James Ployhar), In The Bleak Midwinter (Holst/Bullock), Australian Folk Fantasy (Williams)
5, 100-Concert Band, Graham Junior High, TEA:, Graham, Hugh Grubbs,CC,Non-Varsity ,2005,11060,4,3,2,3,2,3,2,2, , Freedom's March (Swearingen), Modal Song and Dance (Del Borgo), Atlantis (McGinty)
6, 100-Concert Band, Graham Junior High, TEA:, Graham, Hugh Grubbs,CC,Varsity ,2005,11029,3,3,2,3,3,3,2,3, , The Rifle Regiment (Sousa/Contorno), Crest of Nobility (Sheldon), Liturgical Fanfare (Smith)
7, 100-Concert Band, Henrietta Junior High, TEA:, Henrietta, Kevin Gilpatrick,C,Varsity ,2005,16835,2,2,2,2,2,2,2,2, , Olympic Spirit March (Ralph Gingery), Modal Song and Dance (Del Borgo), Fire Dance (Akey)
8, 100-Concert Band, Muenster JH, TEA:, Muenster, Melissa Zamzow,C,Non-Varsity ,2005,17479,3,3,3,3,2,2,2,2, , Theme and Variations (Broege), Atlantis (McGinty), Forward March (Murtha)
