,0,1,2,3,4,5,6,7,8,9,10,11,12,13,14,15,16,17,18,19,20,21,22,23,24,25,26,27,28
0, 100-Concert Band, Clear Creek Intermediate, TEA:, League City, Chad Bowen / Kyle Norman,CC,Non-Varsity A,2021,164827,1,1,1,1,1,2,1,1,D, Activity March (Bennett), Danza de Espana (Chambers/), Fortis (Gazlay/),DATE of EVENT 04/10/2021 ,Region: 17,1. Susan Patterson,2. Jill Yancey,3. Jim Shaw,1. Greg Countryman,2. Matt Fehl,3. Julie Amos
1, 100-Concert Band, Clear Lake Intermediate School, TEA:, Houston," Christopher Davis / Doug Parmer, Andrew Keller",CC,Non-Varsity ,2021,165854,1,2,1,1,1,1,1,1,D, Night Fury  (Chambers), Ming Court  (Pitter), Spitfire March (Michael Story),DATE of EVENT 04/10/2021 ,Region: 17,1. Susan Patterson,2. Jill Yancey,3. Jim Shaw,1. Greg Countryman,2. Matt Fehl,3. Julie Amos
2, 100-Concert Band, Creekside, TEA:, League City, Thomas Macias / Ana Tran,CC,Non-Varsity ,2021,165477,1,1,1,1,1,2,2,2,2, March of the Robot Brigade (Bernotas), Sakura (Arr. Story), Elizabethan Dance (Williams),DATE of EVENT 04/10/2021 ,Region: 17,1. Susan Patterson,2. Jill Yancey,3. Jim Shaw,1. Greg Countryman,2. Matt Fehl,3. Julie Amos
3, 100-Concert Band, League City Intermediate, TEA:, Houston, Jimmy Tran,CCC,Non-Varsity A,2021,164855,1,1,2,1,1,1,1,1,D, Let the Flag of Freedom Wave (James Swearingen), Dance Celebration  (Smith), Plaza de Toros  (Story),DATE of EVENT 04/10/2021 ,Region: 17,1. Susan Patterson,2. Jill Yancey,3. Jim Shaw,1. Greg Countryman,2. Matt Fehl,3. Julie Amos
4, 100-Concert Band, Seabrook Intermediate, TEA:, Seabrook, Matthew McCoy / Austin Tran,CCC,Non-Varsity A,2021,165086,2,1,1,1,1,1,1,1,D, March to Buckingham Palace (Rogers), Big Sky Round Up (Sheldon), Russian Sailor''s Dance (Gliere/Williams),DATE of EVENT 04/10/2021 ,Region: 17,1. Susan Patterson,2. Jill Yancey,3. Jim Shaw,1. Greg Countryman,2. Matt Fehl,3. Julie Amos
5, 100-Concert Band, Victory Lakes Intermediate School, TEA:, League City, Travis Howell / Bennett Parsons,CCC,Non-Varsity ,2021,165047,1,1,1,1,2,2,2,2,2, Plaza de Toros (Story), Fortitude (Owens), Bazaar (Standridge),DATE of EVENT 04/10/2021 ,Region: 17,1. Susan Patterson,2. Jill Yancey,3. Jim Shaw,1. Greg Countryman,2. Matt Fehl,3. Julie Amos
6, 100-Concert Band, Westbrook Intermediate School, TEA:, Friendswood, Martin Andrada / Jane Maloy,CCC,Non-Varsity ,2021,164810,1,1,1,1,1,1,1,1,D, Land of Liberty Concert March (Swearingen), Conviction  (Clark), Zig Zag  (O'Loughlin),DATE of EVENT 04/10/2021 ,Region: 17,1. Susan Patterson,2. Jill Yancey,3. Jim Shaw,1. Greg Countryman,2. Matt Fehl,3. Julie Amos
