,0,1,2,3,4,5,6,7,8,9,10,11,12,13,14,15,16,17,18,19,20,21,22,23,24,25,26,27,28
0, 100-Concert Band, Audie Murphy Middle School, TEA:, Alamo, Joseph Torres,CCC,Varsity ,2015,99723,1,1,1,1,1,1,1,1,C, Big Four March (Karl L. King), A Childhood Hymn  (Holsinger/ ), Crest of Nobility  (Sheldon/ ),DATE of EVENT 03/05/2015 ,Region: 15,1. Maria Coronado,2. Mark Buley,3. Jeremy Spicer,1. Eddie Benitez,2. William McKinney,3. David Solis
1, 100-Concert Band, Barrientes Middle School, TEA:, Edinburg, Saul Regalado,CCC,Varsity ,2015,98932,1,1,1,1,1,1,1,1,C, Mighty Mite (Ted Mesang), A Childhood Hymn (David Holsinger), Abracadabra (Frank Ticheli),DATE of EVENT 03/05/2015 ,Region: 15,1. Maria Coronado,2. Mark Buley,3. Jeremy Spicer,1. Eddie Benitez,2. William McKinney,3. David Solis
2, 100-Concert Band, Barrientes MS, TEA:, Edinburg, Emmanuel Garcia,CCC,Non-Varsity ,2015,98921,1,1,1,1,1,1,1,1,D, Union March (Mekel Rogers), Russian Sailor's Dance (Reinhold Gliere/ arr. Mark Williams), Odyssey (Aric Branchfield),DATE of EVENT 03/05/2015 ,Region: 15,1. Maria Coronado,2. Mark Buley,3. Jeremy Spicer,1. Eddie Benitez,2. William McKinney,3. David Solis
3, 100-Concert Band, Barrientes MS, TEA:, Edinburg, Shari Martinez,CCC,Sub Non-Varsity ,2015,98764,1,1,1,1,1,1,1,1,D," ""Synergy"" March (William Owens)", The Two-Minute Symphony (Bob Margolis), Elizabethan Dance (Mark Williams),DATE of EVENT 03/05/2015 ,Region: 15,1. Maria Coronado,2. Mark Buley,3. Jeremy Spicer,1. Eddie Benitez,2. William McKinney,3. David Solis
4, 100-Concert Band, ED: Garza MS, TEA:, Edinburg, Delia Quilantan,CCC,Varsity ,2015,98038,2,2,2,2,1,1,2,1,2, March of Honor (John Edmondson), Colliding Visions  (Balmages/ ), Kenya Contrasts  (Himes/ ),DATE of EVENT 03/05/2015 ,Region: 15,1. Maria Coronado,2. Mark Buley,3. Jeremy Spicer,1. Eddie Benitez,2. William McKinney,3. David Solis
5, 100-Concert Band, ED: Harwell MS, TEA:, Edinburg, Dan Jeter,CCC,Varsity ,2015,97537,2,2,2,2,2,3,2,2, , Bayview March (Gorham), Joy  (Ticheli/ ), Legend of Knife River  (Bulla/ ),DATE of EVENT 03/05/2015 ,Region: 15,1. Maria Coronado,2. Mark Buley,3. Jeremy Spicer,1. Eddie Benitez,2. William McKinney,3. David Solis
6, 100-Concert Band, ED: Harwell MS, TEA:, Edinburg, Dan Jeter,CCC,Non-Varsity ,2015,97536,2,2,3,2,2,3,2,2, , Infinity Concert March (Curnow), Heroes Triumphant  (Owens/ ), Atlantis  (McGinty/ ),DATE of EVENT 03/05/2015 ,Region: 15,1. Maria Coronado,2. Mark Buley,3. Jeremy Spicer,1. Eddie Benitez,2. William McKinney,3. David Solis
7, 100-Concert Band, ED: Longoria MS, TEA:, Edinburg, Alfonso,CC,Non-Varsity ,2015,100263,1,1,1,1,1,2,1,1,D, Ifinity (Curnow), Sakura (Story), Odyssey (Branchfield),DATE of EVENT 03/05/2015 ,Region: 15,1. Maria Coronado,2. Mark Buley,3. Jeremy Spicer,1. Eddie Benitez,2. William McKinney,3. David Solis
8, 100-Concert Band, ED: Longoria MS, TEA:, Edinburg, Joe H. Garcia,CC,Varsity ,2015,98433,1,1,1,1,1,1,1,1,C, Allied Honor (Karl L. King/James Swearingen), Blue And Green Music (Samuel R. Hazo), Glaciers (Scott Director),DATE of EVENT 03/05/2015 ,Region: 15,1. Maria Coronado,2. Mark Buley,3. Jeremy Spicer,1. Eddie Benitez,2. William McKinney,3. David Solis
9, 100-Concert Band, ED: South MS, TEA:, Edinburg, Daniel Carrera,CCC,Varsity ,2015,99423,1,1,1,1,1,1,1,1,C, The Big Circus March (Foster), Mosswood Lullaby  (Beck/ ), Contempo  (Story/ ),DATE of EVENT 03/05/2015 ,Region: 15,1. Maria Coronado,2. Mark Buley,3. Jeremy Spicer,1. Eddie Benitez,2. William McKinney,3. David Solis
10, 100-Concert Band, ED: South MS, TEA:, Edinburg, Norma Fuentes,CCC,Non-Varsity ,2015,99427,1,1,1,1,1,1,1,1,D, Infinity (Curnow), Courtlandt County Festival  (Owens/ ), Dance Celebration  (Smith/ ),DATE of EVENT 03/05/2015 ,Region: 15,1. Maria Coronado,2. Mark Buley,3. Jeremy Spicer,1. Eddie Benitez,2. William McKinney,3. David Solis
11, 100-Concert Band, Edinburg Memorial MS, TEA:, Edinburg, Brian Sexton,CCC,Varsity ,2015,101095,2,2,2,2,2,2,2,2, , Crown of Glory (Coronation March) (Robert W. Smith), Colliding Visions  (Balmages/ ), Adrenaline Engines  (Standridge/ ),DATE of EVENT 03/05/2015 ,Region: 15,1. Maria Coronado,2. Mark Buley,3. Jeremy Spicer,1. Eddie Benitez,2. William McKinney,3. David Solis
12, 100-Concert Band, Edinburg Memorial MS, TEA:, Edinburg, Eduardo Ruiz Jr,CCC,Non-Varsity ,2015,99797,2,2,2,2,2,1,1,1,2, Exhortation  (Gazlay/ ), Elizabethan Dance  (Williams/ ), Union March (Mekel Rogers),DATE of EVENT 03/05/2015 ,Region: 15,1. Maria Coronado,2. Mark Buley,3. Jeremy Spicer,1. Eddie Benitez,2. William McKinney,3. David Solis
13, 100-Concert Band, Edinburg: Brewster Middle School, TEA:, Edinburg, Luis Reyes,C,Varsity ,2015,97420,2,2,2,2,1,1,1,1,2, Japanese Festival  (Hilliard), Fire Dance  (Akey), El Toro (Griffin),DATE of EVENT 03/05/2015 ,Region: 15,1. Maria Coronado,2. Mark Buley,3. Jeremy Spicer,1. Eddie Benitez,2. William McKinney,3. David Solis
14, 100-Concert Band, Garza MS, TEA:, Edinburg, Robert Henry,CCC,Non-Varsity ,2015,98418,2,3,3,3,2,1,1,1,2, Kitty Hawk March (Ed Huckeby), Theme and Variations  (Broege/ ), Prelude and March  (Margolis/ ),DATE of EVENT 03/05/2015 ,Region: 15,1. Maria Coronado,2. Mark Buley,3. Jeremy Spicer,1. Eddie Benitez,2. William McKinney,3. David Solis
15, 100-Concert Band, HGO: Diaz JH, TEA:, Hidalgo, Julie P. Wilson,CC,Varsity ,2015,96807,1,1,1,1,1,1,1,1,C, Steel  (Standridge/ ), As Twilight Falls  (Sheldon/ ), Project (Harold Bennett),DATE of EVENT 03/05/2015 ,Region: 15,1. Maria Coronado,2. Mark Buley,3. Jeremy Spicer,1. Eddie Benitez,2. William McKinney,3. David Solis
16, 100-Concert Band, HGO: Ida Diaz, TEA:, Hidalgo, Maximo Gutierrez,CC,Non-Varsity ,2015,97907,1,2,1,1,2,1,1,1,D, Kitty Hawk March (Edmonson), Courtlandt County Festival  (Owens/ ), Phantom Ship  (Del Borgo/ ),DATE of EVENT 03/05/2015 ,Region: 15,1. Maria Coronado,2. Mark Buley,3. Jeremy Spicer,1. Eddie Benitez,2. William McKinney,3. David Solis
17, 100-Concert Band, Kennedy Middle School, TEA:, Pharr, Allyson M. Mendoza / Eugenio Castellanos,CC,Varsity ,2015,99521,2,2,2,2,2,2,3,2, , Lexington March (John Edmondson), Serengeti Dreams  (Smith/ ), Two British Folk Songs  (Anon. or Trad./Del Borgo),DATE of EVENT 03/05/2015 ,Region: 15,1. Maria Coronado,2. Mark Buley,3. Jeremy Spicer,1. Eddie Benitez,2. William McKinney,3. David Solis
18, 100-Concert Band, Mc: Brown MS, TEA:, McAllen, Belinda Rosa,CC,Non-Varsity ,2015,99219,1,2,2,2,1,2,1,1,2, Nottingham Castle  (Daehn/ ), Wildwind Overture  (Kinyon/ ), Fighting Falcon March (Stalter),DATE of EVENT 03/05/2015 ,Region: 15,1. Maria Coronado,2. Mark Buley,3. Jeremy Spicer,1. Eddie Benitez,2. William McKinney,3. David Solis
19, 100-Concert Band, Mc: Brown MS, TEA:, McAllen, Elizabeth Gomez,CC,Varsity ,2015,98169,1,1,1,1,1,1,1,1,C, The Band in the Square on the Fourth of July  (LaPlante/ ), Japanese Pictures  (Mixon/ ), Vally Forge March (John Edmondson),DATE of EVENT 03/05/2015 ,Region: 15,1. Maria Coronado,2. Mark Buley,3. Jeremy Spicer,1. Eddie Benitez,2. William McKinney,3. David Solis
20, 100-Concert Band, Mc: Cathey MS, TEA:, McAllen, Aracely Rodriguez,CCC,Non-Varsity A,2015,96844,2,3,3,3,1,2,2,2, , Royal March (Kinyon), Chester (Billings/Osterling), Fire Dance (Akey),DATE of EVENT 03/05/2015 ,Region: 15,1. Maria Coronado,2. Mark Buley,3. Jeremy Spicer,1. Eddie Benitez,2. William McKinney,3. David Solis
21, 100-Concert Band, Mc: De Leon MS, TEA:, McAllen, Kerri K. Adame,CC,Non-Varsity ,2015,96735,1,1,1,1,2,2,1,1,2, The Honor Roll (Robert Longfield), Atlantis  (McGinty/ ), Two Minute Symphony  (Margolis/ ),DATE of EVENT 03/05/2015 ,Region: 15,1. Maria Coronado,2. Mark Buley,3. Jeremy Spicer,1. Eddie Benitez,2. William McKinney,3. David Solis
22, 100-Concert Band, Mc: De Leon MS, TEA:, Mcallen, Rommel Rodriguez,CC,Varsity ,2015,96817,1,1,1,1,1,1,2,1,C, Downing Street March (Barry Kopetz), Courtlandt County Festival  (Owens ), Kenya Contrasts  (Himes/ ),DATE of EVENT 03/05/2015 ,Region: 15,1. Maria Coronado,2. Mark Buley,3. Jeremy Spicer,1. Eddie Benitez,2. William McKinney,3. David Solis
23, 100-Concert Band, Mc: Fossum MS, TEA:, McAllen, Robet Hochstetler,CC,Varsity ,2015,99654,1,1,1,1,1,1,1,1,C, Make Way for Melody (Leon V. Metcalf / arr. Lautie Lafferty), Colliding Visions  (Brian Balmages), Adrenaline Engines (Randall D. Standridge/ ),DATE of EVENT 03/05/2015 ,Region: 15,1. Maria Coronado,2. Mark Buley,3. Jeremy Spicer,1. Eddie Benitez,2. William McKinney,3. David Solis
24, 100-Concert Band, MC: Cathey MS, TEA:, McAllen, Jon Kingston,CCC,Varsity ,2015,96845,2,1,2,2,1,1,1,1,2, El Conquistador (William Owens), Shepherd's Hey  (Traditional/Roszell), Two British Folk Songs  (Anon. or Trad./Del Borgo),DATE of EVENT 03/05/2015 ,Region: 15,1. Maria Coronado,2. Mark Buley,3. Jeremy Spicer,1. Eddie Benitez,2. William McKinney,3. David Solis
25, 100-Concert Band, Mc: Lincoln MS, TEA:, McAllen, Joy Morales,CC,Non-Varsity ,2015,97130,2,1,1,1,2,2,1,2,2, Wildwind Overture  (Kinyon/ ), Theme and Variations  (Broege/ ), American Spirit March (Higgins),DATE of EVENT 03/05/2015 ,Region: 15,1. Maria Coronado,2. Mark Buley,3. Jeremy Spicer,1. Eddie Benitez,2. William McKinney,3. David Solis
26, 100-Concert Band, Mc: Lincoln MS, TEA:, McAllen, Santiago Chapa,CC,Varsity ,2015,97110,1,1,1,1,1,1,2,1,C, Andalucia (Victor Lopez), Kingstree Overture  (McGinty/ ), Adrenaline Engines  (Standridge/ ),DATE of EVENT 03/05/2015 ,Region: 15,1. Maria Coronado,2. Mark Buley,3. Jeremy Spicer,1. Eddie Benitez,2. William McKinney,3. David Solis
27, 100-Concert Band, Mc: Morris MS, TEA:, McAllen, Alexa Yunes,CC,Varsity ,2015,97532,1,2,1,1,1,1,1,1,C, Radetzky March (Strauss/Balent), Heaven's Light (Reineke), Steel (Standridge),DATE of EVENT 03/05/2015 ,Region: 15,1. Maria Coronado,2. Mark Buley,3. Jeremy Spicer,1. Eddie Benitez,2. William McKinney,3. David Solis
28, 100-Concert Band, Mc: Morris MS, TEA:, McAllen, Oscar Medina,CC,Non-Varsity ,2015,101126,2,2,2,2,1,2,1,1,2," Omega March (Edmondson, John)", Dance Celebration  (Smith/ ), Colliding Visions  (Balmages/ ),DATE of EVENT 03/05/2015 ,Region: 15,1. Maria Coronado,2. Mark Buley,3. Jeremy Spicer,1. Eddie Benitez,2. William McKinney,3. David Solis
29, 100-Concert Band, Mc: Travis MS, TEA:, McAllen, A. Nefi Olivares,CC,Varsity ,2015,96839,1,1,1,1,1,2,1,1,C, Aldergate March (Ralph and Jack Hale), Cascadia Celebration (Steve Hodges), Knights of Dunvagen (Richard Meyer),DATE of EVENT 03/05/2015 ,Region: 15,1. Maria Coronado,2. Mark Buley,3. Jeremy Spicer,1. Eddie Benitez,2. William McKinney,3. David Solis
30, 100-Concert Band, PSJA Murphy MS, TEA:, Alamo, Catherine Cantu / Joseph A. Torres,CC,Non-Varsity ,2015,99748,3,3,3,3,3,3,3,3, , Union March (Rogers), Ghost Ship  (Story/ ), Crusade (Gassi),DATE of EVENT 03/05/2015 ,Region: 15,1. Maria Coronado,2. Mark Buley,3. Jeremy Spicer,1. Eddie Benitez,2. William McKinney,3. David Solis
31, 100-Concert Band, PSJA: Alamo MS, TEA:, Alamo, James Murray,CC,Varsity ,2015,101154,1,2,3,2,1,1,2,1,2, Fire Dance  (Akey/ ), Contempo  (Story/ ), March of the Palace Guards (Williams),DATE of EVENT 03/05/2015 ,Region: 15,1. Maria Coronado,2. Mark Buley,3. Jeremy Spicer,1. Eddie Benitez,2. William McKinney,3. David Solis
32, 100-Concert Band, PSJA: Alamo MS, TEA:, Alamo, Joseph Rush,CC,Non-Varsity ,2015,100361,1,2,2,2,1,3,2,2, , Playground Parade (Comp. Joseph Compello), Little Brazil Suite  (Arr. Andrew Balent), Crusade  (Vince Gassi),DATE of EVENT 03/05/2015 ,Region: 15,1. Maria Coronado,2. Mark Buley,3. Jeremy Spicer,1. Eddie Benitez,2. William McKinney,3. David Solis
33, 100-Concert Band, PSJA: Austin MS, TEA:, San Juan, Arturo Cano,CC,Varsity ,2015,97266,1,1,2,1,2,1,2,2,2, Rough Riders  (Karl L. King/Swearingen), A Childhood Hymn  (Holsinger/ ), Adrenaline Engines  (Standridge/ ),DATE of EVENT 03/05/2015 ,Region: 15,1. Maria Coronado,2. Mark Buley,3. Jeremy Spicer,1. Eddie Benitez,2. William McKinney,3. David Solis
34, 100-Concert Band, PSJA: Austin MS, TEA:, San Juan, Michael S Craft,CC,Non-Varsity ,2015,101013,2,2,2,2,2,2,2,2, , Synergy March (Owens), Cahokia  (Spears), Nottingham Castle (Daehn),DATE of EVENT 03/05/2015 ,Region: 15,1. Maria Coronado,2. Mark Buley,3. Jeremy Spicer,1. Eddie Benitez,2. William McKinney,3. David Solis
35, 100-Concert Band, PSJA: Escalante MS, TEA:, Pharr, Guadalupe Elizondo,CC,Non-Varsity ,2015,100878,1,2,1,1,3,3,2,3,2, Manitoba March (John O'Reilly), Sakura (Mike Story), Elizabethan Dance (Mark Williams),DATE of EVENT 03/05/2015 ,Region: 15,1. Maria Coronado,2. Mark Buley,3. Jeremy Spicer,1. Eddie Benitez,2. William McKinney,3. David Solis
36, 100-Concert Band, PSJA: Escalante MS, TEA:, Pharr, Joe Rodriguez,CC,Varsity ,2015,100875,2,2,2,2,2,2,1,2, , El Conquistador  ( Owens), Majestica  (Gazlay/ ), Adrenaline Engines  (Standridge/ ),DATE of EVENT 03/05/2015 ,Region: 15,1. Maria Coronado,2. Mark Buley,3. Jeremy Spicer,1. Eddie Benitez,2. William McKinney,3. David Solis
37, 100-Concert Band, PSJA: Kennedy MS, TEA:, Pharr, Eugenio Castellanos / Allyson Mendoza,CC,Non-Varsity ,2015,99525,2,2,3,2,3,3,3,3, , Manitoba March (Sandy Feldstein & John O'Reilly), Sakura  (Story/ ), Nottingham Castle  (Daehn/ ),DATE of EVENT 03/05/2015 ,Region: 15,1. Maria Coronado,2. Mark Buley,3. Jeremy Spicer,1. Eddie Benitez,2. William McKinney,3. David Solis
38, 100-Concert Band, PSJA: LBJ MS, TEA:, Pharr, Jaime Medina,CC,Varsity ,2015,99195,1,1,2,1,2,1,2,2,2, La Madre de los Gatos  (Beck/ ), Two British Folk Songs  (Anon. or Trad./Del Borgo), Project March (Bennett/Clark),DATE of EVENT 03/05/2015 ,Region: 15,1. Maria Coronado,2. Mark Buley,3. Jeremy Spicer,1. Eddie Benitez,2. William McKinney,3. David Solis
39, 100-Concert Band, PSJA: LBJ MS, TEA:, Pharr, Vina C. Dornbusch,CC,Non-Varsity ,2015,99190,2,2,3,2,1,1,1,1,2, Aquia Landing (Murtha), Cahokia  (Spears), Fire Dance  (Akey),DATE of EVENT 03/05/2015 ,Region: 15,1. Maria Coronado,2. Mark Buley,3. Jeremy Spicer,1. Eddie Benitez,2. William McKinney,3. David Solis
40, 100-Concert Band, PSJA: Liberty MS, TEA:, Pharr, Adolfo Cortez III,CCC,Non-Varsity ,2015,96955,2,3,3,3,2,2,2,2, , Bell Canyon March (John O'Reilly), Crusade (Vince Gassi), Courtlandt County Festival (William Owens),DATE of EVENT 03/05/2015 ,Region: 15,1. Maria Coronado,2. Mark Buley,3. Jeremy Spicer,1. Eddie Benitez,2. William McKinney,3. David Solis
41, 100-Concert Band, PSJA: Liberty MS, TEA:, Pharr, Michael Harig,CC,Varsity ,2015,97035,2,2,2,2,3,3,3,3, , Colliding Visions (Brian Balmages), The High School Cadets (), Legend of Knife River (Stephen Bulla),DATE of EVENT 03/05/2015 ,Region: 15,1. Maria Coronado,2. Mark Buley,3. Jeremy Spicer,1. Eddie Benitez,2. William McKinney,3. David Solis
42, 100-Concert Band, PSJA: Yzaguirre middle school, TEA:, San Juan, Barbara J. Keller,CC,Non-Varsity ,2015,98189,1,2,2,2,1,2,1,1,2, Darklands March (Randall Standridge), Mythos  (Bernotas/ ), Odyssey  (Branchfield/ ),DATE of EVENT 03/05/2015 ,Region: 15,1. Maria Coronado,2. Mark Buley,3. Jeremy Spicer,1. Eddie Benitez,2. William McKinney,3. David Solis
43, 100-Concert Band, PSJA: Yzaguirre Middle School, TEA:, San Juan, Lucio Gutierrez Jr.,CC,Varsity ,2015,98285,2,2,2,2,1,2,1,1,2, Our Kingsland Spring  (Hazo/ ), Toccata for Band  (Erickson/ ), Marche Diabolique (Brian Balmages),DATE of EVENT 03/05/2015 ,Region: 15,1. Maria Coronado,2. Mark Buley,3. Jeremy Spicer,1. Eddie Benitez,2. William McKinney,3. David Solis
44, 100-Concert Band, PSJA: Yzaguirre Middle School, TEA:, San Juan, Lucio Gutierrez Jr. / Barbara J. Keller,CC,Sub Non-Varsity ,2015,98282,2,3,3,3,2,1,1,1,2, The Seventh Summit (Joseph Compello), Two English Dances  (Anon. or Trad./O'Reilly), Cahokia  (Spears/ ),DATE of EVENT 03/05/2015 ,Region: 15,1. Maria Coronado,2. Mark Buley,3. Jeremy Spicer,1. Eddie Benitez,2. William McKinney,3. David Solis
45, 100-Concert Band, Valley View JH, TEA:, Pharr, David Marinez,CC,Non-Varsity ,2015,97135,1,1,1,1,1,1,1,1,D, Streets of Madrid (John Moss), Crusade  (Gassi/ ), Japanese Pictures  (Mixon/ ),DATE of EVENT 03/05/2015 ,Region: 15,1. Maria Coronado,2. Mark Buley,3. Jeremy Spicer,1. Eddie Benitez,2. William McKinney,3. David Solis
46, 100-Concert Band, Valley View MS, TEA:, Hidalgo, Jose Juarez / Victor Garza,CC,Varsity ,2015,97245,2,1,2,2,1,1,1,1,2, New Castle March (Johnnie Vinson), Accolade (William Himes), Bartok Variations (Timothy Broege),DATE of EVENT 03/05/2015 ,Region: 15,1. Maria Coronado,2. Mark Buley,3. Jeremy Spicer,1. Eddie Benitez,2. William McKinney,3. David Solis
47, 100-Concert Band, Valley View MS, TEA:, Pharr, Kevin Hess,CC,Sub Non-Varsity ,2015,96907,1,2,2,2,2,1,1,1,2, North Point March (Joseph Compello), Exhortation (Gary Gazlay), Dance Celebration (Robert W. Smith),DATE of EVENT 03/05/2015 ,Region: 15,1. Maria Coronado,2. Mark Buley,3. Jeremy Spicer,1. Eddie Benitez,2. William McKinney,3. David Solis
