,Event,School,TEA,City,Directors,Conference,Classification,Year,ID,Stage Judge 1,Stage Judge 2,Stage Judge 3,Stage Final,SR Judge 1,SR Judge 2,SR Judge 3,SR Final,Award,Selection 1,Selection 2,Selection 3
0, 100-Concert Band, Bellville Junior High, TEA:, Bellville," Aaron Rettig / Kenny Peters, KC Stockman",CC,Varsity ,2021,163040,2,1,1,1,1,1,1,1,C, Bridgewater March (Hodges), Expectations (Clark), Red Giant (Vargas)
1, 100-Concert Band, Bellville Junior High School, TEA:, Bellville," KC Max Stockman / Aaron Rettig, Kenny Peters",CC,Non-Varsity ,2021,163043,1,1,2,1,1,1,1,1,D, Ming Court (Pitter), Atlantis (McGinty), Cadet's Cavalcade (Joseph Compello)
2, 100-Concert Band, Brenham Junior High School, TEA:, Brenham, Joshua Turnipseed,CCC,Non-Varsity ,2021,162391,2,1,2,2,2,1,1,1,2, March of the Syncopated Penguins (Rudgers), Elizabethan Dance  (Williams), Exhortation  (Gazlay)
3, 100-Concert Band, Brenham Junior High, TEA:, Brenham, Karla Rettig,CCC,Varsity ,2021,162390,1,1,1,1,1,1,1,1,C, Vivo! Galop (William H. Kiefer/Andrew Glover), Tanchozuru (Randall D. Standridge), Four Short Festive Dances (Dennis Eveland)
4, 100-Concert Band, Navasota Junior High, TEA:, Navasota, Dylan Williams,CC,Varsity ,2021,162558,2,2,1,2,3,3,2,3, , March of the Champions (Loest), First Light (Ticheli), Dance Celebration (Smith)
5, 100-Concert Band, Royal Middle School, TEA:, Brookshire, Adolfo Garca / Gary Miller Jr.,CC,Non-Varsity ,2021,162381,2,3,3,3,2,2,3,2, , Nottingham March (Jerry Williams), Dance Celebration (Robert W. Smith), Fortis (Gary Gazlay)
6, 100-Concert Band, Sealy JH, TEA:, Sealy, Sterling Burton,CC,Varsity ,2021,162552,1,1,1,1,1,2,1,1,C, Grand Galop (Circus March) (Vinson/), Loch Lomond (Black/), Armory (Standridge/)
