,Event,School,TEA,City,Directors,Conference,Classification,Year,ID,Stage Judge 1,Stage Judge 2,Stage Judge 3,Stage Final,SR Judge 1,SR Judge 2,SR Judge 3,SR Final,Award,Selection 1,Selection 2,Selection 3
0, 100-Concert Band, Central High School, TEA:, San Angelo," Joey Ashbrook / Michael Barry, Stephanie Dearborn, Kristin Ellis",AAAAAA,Varsity ,2016,116228,1,1,1,1,1,1,1,1,A, Florentiner March (Fucik/Lake), Second Suite for Band in F Major  (Holst/Fennell), Themes from Green Bushes  (Grainger/Daehn)
1, 100-Concert Band, Central High School, TEA:, San Angelo," Kristin Ellis / Joey Ashbrook, Michael Barry, Stephanie Dearborn",AAAAAA,Sub Non-Varsity ,2016,116215,2,2,1,2,1,1,1,1,2, True Blue (King/Swearingen), Fortress  (Ticheli/ ), Satiric Dances (play mvt 3) (Dello Joio/ )
2, 100-Concert Band, Central High School, TEA:, San Angelo, Mike Barry,AAAAAA,Non-Varsity ,2016,116241,1,1,1,1,1,1,1,1,C, Arsenal (Van der Roost), Highland Celebration  (Silva/ ), Cumberland Cross  (Strommen/ )
3, 100-Concert Band, Greenwood HS, TEA:, Midland," Suzanne Rhynes / Gabe Hernandez, Lauren Fritz",AAAA,Varsity ,2016,111694,1,1,1,1,1,1,1,1,A, The Pride of the Wolverines (Sousa/Fennell), When the Stars Began to Fall  (Allen/ ), Variations on a Korean Folk Song  (Chance/ )
4, 100-Concert Band, Lake View HS, TEA:, San Angelo, Cindy Costello,AAAAA,Varsity ,2016,112493,2,1,1,1,1,1,1,1,A, Florentiner ( Fucik)," Suite of Old American Dances (Cake Walk,Schottische, Western One Step) (Bennett/ )", In the Center Ring  (Sheldon/ )
5, 100-Concert Band, Lake View HS, TEA:, San Angelo," Lance Mosley / Cindy Costello, Nick Alberts",AAAAA,Non-Varsity ,2016,112943,2,2,1,2,1,1,1,1,2, A Sailor's Odyssey  (Bobrowitz/ ), Little Suite for Band (play mvt. 3 and two additional mvts.) (Standridge/ ), Trafalgar Square (Jack Bullock)
6, 100-Concert Band, Lamesa High School, TEA:, Lamesa, Mario Aguirre / Sonia Saldana,AAAA,Varsity ,2016,115902,2,2,2,2,2,3,2,2, , Salvation is Created  (Tschesnokoff/Houseknecht), Crest of Nobility  (Sheldon/ ), High School Cadets March (Sousa/Balent)
7, 100-Concert Band, Lamesa HS, TEA:, Lamesa, Sonia Saldana / Mario Aguirre,AAAA,Non-Varsity ,2016,116232,3,2,3,3,3,3,3,3, , Lexington March (Edmondson), Song of Hope  (Swearingen/ ), Fortis  (Gazlay/ )
8, 100-Concert Band, Lee Freshman High School, TEA:, Midland, Estephan Quintela,AAAAAA,Non-Varsity ,2016,112321,1,1,1,1,2,1,1,1,C, Bonds of Unity (King/Swearingen), Crest of Nobility (Sheldon), Fantasy on a Fiddle Tune  (LaPlante/ )
9, 100-Concert Band, Lee HS, TEA:, Midland, Jason Brents,AAAAAA,Varsity ,2016,116412,1,1,1,1,1,1,1,1,A, Variations on America  (Ives/Schuman/Rhoads), Strange Humors  (Mackey/ ), The Black Horse Troop (Sousa/Fennell)
10, 100-Concert Band, Midland Freshman High School, TEA:, Midland, Pricilla Marruffo,AAAAAA,Non-Varsity A,2016,116584,1,1,2,1,1,1,2,1,C, Greenwillow Portrait  (Williams/ ), La Madre de los Gatos  (Beck/ ), Hosts of Freedom (King)
11, 100-Concert Band, Midland High School, TEA:, Midland, Brian Collins,AAAAAA,Varsity ,2016,116630,1,2,1,1,1,1,1,1,A, Valdres March (Hanssen/Schissel), With Heart and Voice  (Gillingham/ )," Carmina Burana (play mvts 1, 2, 13, plus four other mvts) (Orff/Krance)"
12, 100-Concert Band, Midland High School, TEA:, Midland, Mande Gragg / Stephanie Griffith,AAAAAA,Non-Varsity ,2016,116536,1,1,1,1,1,2,1,1,C, Normandy Beach  (John Edmondson), Abracadabra  (Ticheli/ ), Fantasy on a Fiddle Tune  (LaPlante/ )
13, 100-Concert Band, Odessa High School, TEA:, Odessa, Billy Harden,AAAAAA,Varsity ,2016,116782,1,1,1,1,1,1,1,1,A, Pepita Greus (Chovi), Festivo  (Gregson/ ), Variations on a Theme of Robert Schumann  (Jager/ )
14, 100-Concert Band, Odessa High School, TEA:, Odessa, Tyler Elvidge,AAAAAA,Sub Non-Varsity ,2016,116776,3,3,2,3,3,3,2,3, , New Forest March (Johnnie Vinson), Little Suite for Band (play all) (Standridge/ ), Sparks  (Balmages/ )
15, 100-Concert Band, Odessa HS - BAND, TEA:, Odessa, Jimmy Olague,AAAAAA,Sub Non-Varsity ,2016,116773,3,3,2,3,1,3,2,2, , Havendance (Holsinger), An Irish Interlude (Barker), Rough Riders (King)
16, 100-Concert Band, Odessa HS - BAND, TEA:, Odessa, Steven Dojahn,AAAAAA,Non-Varsity A,2016,114176,1,1,2,1,1,1,1,1,C, Glaciers  (Director), The Seal Lullaby  (Whitacre), Amparito Roca (Texidor/Winter)
17, 100-Concert Band, Permian HS, TEA:, Odessa," Jeff Whitaker / John Carroll, Trey Burns, Lyndsay Eiben",AAAAAA,Varsity ,2016,116781,1,1,1,1,1,1,1,1,A, The Boys of the Old Brigade (W. Paris Chambers/ed. Claude T. Smith), A Movement for Rosa  (Mark Camphouse), Danzon No. 2  (Arturo Marquez/arr. Oliver Nickel)
18, 100-Concert Band, Permian HS, TEA:, Odessa," John Carroll / Jeff Whitaker, Trey Burns, Lyndsay Eiben",AAAAAA,Non-Varsity ,2016,116718,1,1,1,1,1,1,1,1,C, The American Way (King/Swearingen), Fantasy on an African-American Spiritual  (Preuninger/ ), Glaciers  (Director/ )
19, 100-Concert Band, Permian HS, TEA:, Odessa," Lyndsay Eiben / Jeff Whitaker, John Carroll and Trey Burns",AAAAAA,Sub Non-Varsity B,2016,116791,1,1,1,1,2,2,2,2,2, Alamo March (Karl King/James Swearingen), In The Shining Of The Stars  (Sheldon/ ), Adrenaline Engines  (Standridge/ )
20, 100-Concert Band, Permian HS, TEA:, Odessa," Trey Burns / Jeff Whitaker, John Carroll, Lyndsay Eiben",AAAAAA,Sub Non-Varsity A,2016,116790,1,1,1,1,2,2,1,2,2, Gallant Marines (King/Swearingen), Our Kingsland Spring  (Hazo), Joy Revisited  (Ticheli)
21, 100-Concert Band, Robert E. Lee High School, TEA:, Midland," Jordan Frazier / Jason Brents, Estephan Quintela, Cameron Connell",AAAAAA,Non-Varsity ,2016,116485,1,1,1,1,1,1,1,1,C, Prelude and Fugue in Bb Major (Bach/Moehlmann), Joy Revisited (Ticheli/ ), Big Four March  (King/Swearingen)
