,0,1,2,3,4,5,6,7,8,9,10,11,12,13,14,15,16,17,18,19,20,21,22,23,24,25,26,27,28
0, 100-Concert Band, Alvin JH, TEA:, Alvin, Jessicah Saldana / Kyle Norman/Lee Willis,CC,Non-Varsity ,2018,138619,1,2,1,1,2,2,2,2,2, American Spirit March (John Higgins), Majestica (Gary Gazlay), Serengeti Dreams (Robert W. Smith),DATE of EVENT 04/18/2018 ,Region: 17,1. James Marioneaux,2. Sharon Kalisek,3. Trent Cooper,1. Charlotte Royall,2. Matt Fehl,3. Amy Bennett
1, 100-Concert Band, Alvin JH, TEA:, Alvin, Kyle Norman / Jessicah Saldana/Lee Willis,CC,Varsity ,2018,138404,1,2,1,1,1,1,1,1,C, His Honor (Henry Fillmore/Frederick Fennell), Hypnotic Fireflies (Brian Balmages), A Longford Legend (Robert Sheldon),DATE of EVENT 04/18/2018 ,Region: 17,1. James Marioneaux,2. Sharon Kalisek,3. Trent Cooper,1. Charlotte Royall,2. Matt Fehl,3. Amy Bennett
2, 100-Concert Band, Angleton Junior High, TEA:, Angleton, Cristina Barrera,CCC,Non-Varsity ,2018,135589,1,1,1,1,1,1,1,1,D, Courtlandt County Festival  (Owens), Plaza de Toros  (Story), Highlander Regiment (Ployhar),DATE of EVENT 04/18/2018 ,Region: 17,1. James Marioneaux,2. Sharon Kalisek,3. Trent Cooper,1. Charlotte Royall,2. Matt Fehl,3. Amy Bennett
3, 100-Concert Band, Angleton Junior High, TEA:, Angleton, James Frasier,CCC,Varsity ,2018,135580,2,1,1,1,2,3,3,3,2, The Gladiator (Sousa/Shaffer), Our Kingsland Spring  (Hazo)," Simple Gifts, Four Shaker Songs (play mvt 1, 2, or 4) (Ticheli)",DATE of EVENT 04/18/2018 ,Region: 17,1. James Marioneaux,2. Sharon Kalisek,3. Trent Cooper,1. Charlotte Royall,2. Matt Fehl,3. Amy Bennett
4, 100-Concert Band, Austin Middle School, TEA:, Galveston," Brandi Swann / Steven Farrell, Andrew Vowell",CC,Non-Varsity ,2018,138560,1,2,2,2,1,1,1,1,2, Crosswinds March (Swearingen), Ghost Ship  (Story), Night Fury  (Chambers),DATE of EVENT 04/18/2018 ,Region: 17,1. James Marioneaux,2. Sharon Kalisek,3. Trent Cooper,1. Charlotte Royall,2. Matt Fehl,3. Amy Bennett
5, 100-Concert Band, Bayside Intermediate, TEA:, League City, Kyle Mapp,CC,Varsity ,2018,129482,2,1,1,1,1,1,1,1,C, Children's March  (Grainger/ Arr. Wagner), English Folk Song Suite: II: Intermezzo  (Vaughn Williams ), Arabian Dances  (Balmages),DATE of EVENT 04/18/2018 ,Region: 17,1. James Marioneaux,2. Sharon Kalisek,3. Trent Cooper,1. Charlotte Royall,2. Matt Fehl,3. Amy Bennett
6, 100-Concert Band, Bayside Intermediate, TEA:, League City, Mark Walls,CC,Non-Varsity ,2018,130788,2,1,1,1,1,1,1,1,D, Circus Time  (David Shaffer ), Little Brazil Suite  (Balent), Egyptique  (Owens),DATE of EVENT 04/18/2018 ,Region: 17,1. James Marioneaux,2. Sharon Kalisek,3. Trent Cooper,1. Charlotte Royall,2. Matt Fehl,3. Amy Bennett
7, 100-Concert Band, Blocker Middle School, TEA:, Texas City, Ernest Bottlinger,CCC,Varsity ,2018,132497,2,1,1,1,3,3,3,3,2, Darklands March (Standridge), Sketches of Canada (play all) (Story), Danza de Espana  (Chambers),DATE of EVENT 04/18/2018 ,Region: 17,1. James Marioneaux,2. Sharon Kalisek,3. Trent Cooper,1. Charlotte Royall,2. Matt Fehl,3. Amy Bennett
8, 100-Concert Band, Brookside Intermediate, TEA:, Friendswood, Andie Troutman / Jennifer Rogers,CC,Varsity ,2018,130477,1,1,1,1,1,1,1,1,C, March To Castle Rock (Hodges), Tanchozuru  (Standridge)," Moscow, 1941  (Balmages)",DATE of EVENT 04/18/2018 ,Region: 17,1. James Marioneaux,2. Sharon Kalisek,3. Trent Cooper,1. Charlotte Royall,2. Matt Fehl,3. Amy Bennett
9, 100-Concert Band, Brookside Intermediate, TEA:, Friendswood, Jennifer Rogers / Andie Troutman,CC,Non-Varsity ,2018,138899,1,1,1,1,1,1,1,1,D, March Primo (Eveland), Sakura  (Story), Dorian Chant  (Calhoun),DATE of EVENT 04/18/2018 ,Region: 17,1. James Marioneaux,2. Sharon Kalisek,3. Trent Cooper,1. Charlotte Royall,2. Matt Fehl,3. Amy Bennett
10, 100-Concert Band, Clear Creek Intermediate, TEA:, League City, John Stuart / Austin Scott,CC,Non-Varsity ,2018,129449,1,1,1,1,1,1,1,1,D, Infinity (Curnow), Dance Celebration (Smith), Plaza de Toros  (Story),DATE of EVENT 04/18/2018 ,Region: 17,1. James Marioneaux,2. Sharon Kalisek,3. Trent Cooper,1. Charlotte Royall,2. Matt Fehl,3. Amy Bennett
11, 100-Concert Band, Clear Creek Intermediate, TEA:, League City, John Stuart / Austin Scott,CC,Varsity ,2018,129442,2,1,2,2,1,1,1,1,2, Fleur-De-Lis March (Feldstein/Clark), Joy  (Ticheli), Two British Folk Songs (Del Borgo),DATE of EVENT 04/18/2018 ,Region: 17,1. James Marioneaux,2. Sharon Kalisek,3. Trent Cooper,1. Charlotte Royall,2. Matt Fehl,3. Amy Bennett
12, 100-Concert Band, Clear Lake Intermediate School, TEA:, Houston, Christopher C Davis / Doug Parmer,CC,Non-Varsity ,2018,130500,2,2,2,2,1,1,2,1,2, Mythos  (Bernotas), Egyptique  (Owens), Cedar Valley March (Hodges),DATE of EVENT 04/18/2018 ,Region: 17,1. James Marioneaux,2. Sharon Kalisek,3. Trent Cooper,1. Charlotte Royall,2. Matt Fehl,3. Amy Bennett
13, 100-Concert Band, Clear Lake Intermediate, TEA:, Houston," Doug Parmer / Chris Davis, Andrew Keller",CCC,Varsity ,2018,130484,2,2,3,2,1,2,1,1,2, Peacemaker March (King/Swearingen), Spoon River (Grainger/Sheldon), Undertow (Mackey),DATE of EVENT 04/18/2018 ,Region: 17,1. James Marioneaux,2. Sharon Kalisek,3. Trent Cooper,1. Charlotte Royall,2. Matt Fehl,3. Amy Bennett
14, 100-Concert Band, Clute Intermediate School, TEA:, Clute," Daniel Fernandez / Erin Funk, Aundray Edwards",CC,Varsity ,2018,133193,3,2,2,2,2,1,2,2, , Streets of Madrid  (John Moss), Irish Air and Dance  (Story), Australian Folk Fantasy  (Williams),DATE of EVENT 04/18/2018 ,Region: 17,1. James Marioneaux,2. Sharon Kalisek,3. Trent Cooper,1. Charlotte Royall,2. Matt Fehl,3. Amy Bennett
15, 100-Concert Band, Clute Intermediate School, TEA:, Clute," Erin Funk / Daniel Fernandez, Aundray Edwards",CC,Non-Varsity ,2018,135484,3,3,3,3,2,2,2,2, , Courtlandt County Festival  (Owens), Big Sky Round-Up  (Sheldon), Langham Creek (Stevens),DATE of EVENT 04/18/2018 ,Region: 17,1. James Marioneaux,2. Sharon Kalisek,3. Trent Cooper,1. Charlotte Royall,2. Matt Fehl,3. Amy Bennett
16, 100-Concert Band, Collegiate Academy @ Weis, TEA:, Galveston, Justin Davis,CC,Non-Varsity ,2018,135185,4,3,4,4,2,2,3,2, , Andalucia (Victor Lopez), Mystery Ride ( Terry White), Dorian Chant (Bill Calhoun),DATE of EVENT 04/18/2018 ,Region: 17,1. James Marioneaux,2. Sharon Kalisek,3. Trent Cooper,1. Charlotte Royall,2. Matt Fehl,3. Amy Bennett
17, 100-Concert Band, Creekside Intermediate School, TEA:, League City, Ana Tran / Thomas Macias,CC,Varsity ,2018,130443,1,1,2,1,1,1,1,1,C, Our Kingsland Spring  (Hazo)," Moscow, 1941  (Balmages)", Monterey March (King),DATE of EVENT 04/18/2018 ,Region: 17,1. James Marioneaux,2. Sharon Kalisek,3. Trent Cooper,1. Charlotte Royall,2. Matt Fehl,3. Amy Bennett
18, 100-Concert Band, Creekside Intermediate, TEA:, League City, Thomas Macias / Ana Tran,CC,Non-Varsity ,2018,130444,2,1,2,2,2,2,2,2,2, Courtlandt County Festival  (Owens), Elizabethan Dance  (Williams), Spitfire (Michael Story),DATE of EVENT 04/18/2018 ,Region: 17,1. James Marioneaux,2. Sharon Kalisek,3. Trent Cooper,1. Charlotte Royall,2. Matt Fehl,3. Amy Bennett
19, 100-Concert Band, Fairview Junior High, TEA:, Alvin, Jeremy Kitchens / Katie Batchelor & Lee Willis,CC,Non-Varsity ,2018,137346,1,1,1,1,1,1,1,1,D, Crosswinds March (Swearingen), Kenya Contrasts  (Himes), Fireball!  (Beck),DATE of EVENT 04/18/2018 ,Region: 17,1. James Marioneaux,2. Sharon Kalisek,3. Trent Cooper,1. Charlotte Royall,2. Matt Fehl,3. Amy Bennett
20, 100-Concert Band, Fairview Junior High, TEA:, Alvin, Katie Batchelor / Jeremy Kitchens & Lee Willis,CC,Varsity ,2018,137347,1,1,1,1,1,1,1,1,C, Rough Riders (King/Swearingen), Abracadabra  (Ticheli), J. S. Jig  (Karrick),DATE of EVENT 04/18/2018 ,Region: 17,1. James Marioneaux,2. Sharon Kalisek,3. Trent Cooper,1. Charlotte Royall,2. Matt Fehl,3. Amy Bennett
21, 100-Concert Band, Friendswood Junior High, TEA:, Friendswood, Jason Abbott,CCC,Non-Varsity ,2018,137619,1,1,1,1,1,1,1,1,D, Mad Dash (Loest), Portsmouth Reflections  (Oare), Little Suite for Band (play all) (Standridge),DATE of EVENT 04/18/2018 ,Region: 17,1. James Marioneaux,2. Sharon Kalisek,3. Trent Cooper,1. Charlotte Royall,2. Matt Fehl,3. Amy Bennett
22, 100-Concert Band, Friendswood Junior High, TEA:, Friendswood, Sarah Bennett,CCC,Varsity ,2018,137401,1,1,1,1,1,1,1,1,C, J. S. Jig  (Karrick), Fantasy on an Early American Marching Tune  (Sheldon), Sound Off (Sousa/Bourgeois ),DATE of EVENT 04/18/2018 ,Region: 17,1. James Marioneaux,2. Sharon Kalisek,3. Trent Cooper,1. Charlotte Royall,2. Matt Fehl,3. Amy Bennett
23, 100-Concert Band, Friendswood Junior High, TEA:, Friendswood, Thomas Landfried,CCC,Sub Non-Varsity ,2018,137624,2,2,2,2,1,2,1,1,2, Eagle Command March (Quincy C. Hilliard), Journey Down Niagara  (Tucker), Contempo  (Story),DATE of EVENT 04/18/2018 ,Region: 17,1. James Marioneaux,2. Sharon Kalisek,3. Trent Cooper,1. Charlotte Royall,2. Matt Fehl,3. Amy Bennett
24, 100-Concert Band, Harby Junior High, TEA:, Alvin, David Richard,CC,Varsity ,2018,138673,2,1,2,2,1,1,1,1,2, Pulsar (Eric Osterling), Journey Down Niagara (Christopher Tucker), Broken Bow (Carl Strommen),DATE of EVENT 04/18/2018 ,Region: 17,1. James Marioneaux,2. Sharon Kalisek,3. Trent Cooper,1. Charlotte Royall,2. Matt Fehl,3. Amy Bennett
25, 100-Concert Band, Harby Junior High, TEA:, Alvin, Rebecca Schreiber / David Richard,CC,Non-Varsity ,2018,138884,1,1,1,1,1,1,1,1,D, Kensington March (Edmondson), Skylight (Hodges), Night Fury (Chambers),DATE of EVENT 04/18/2018 ,Region: 17,1. James Marioneaux,2. Sharon Kalisek,3. Trent Cooper,1. Charlotte Royall,2. Matt Fehl,3. Amy Bennett
26, 100-Concert Band, Lake Jackson Intermediate School, TEA:, Lake Jackson," Taylor Mahlandt / Amy Laney, Walter Anderson, Adam Swan",CCC,Non-Varsity ,2018,136836,3,3,4,3,3,2,3,3, , Cardinals (Bradley), Our Kingsland Spring (Hazo), Black Forest Overture (Sweeney),DATE of EVENT 04/18/2018 ,Region: 17,1. James Marioneaux,2. Sharon Kalisek,3. Trent Cooper,1. Charlotte Royall,2. Matt Fehl,3. Amy Bennett
27, 100-Concert Band, Lake Jackson Intermediate, TEA:, Lake Jackson, Amy Laney,CCC,Varsity ,2018,137407,2,2,1,2,2,2,1,2, , Emblem of Unity (Richards/Swearingen), Chanteys  (Sheldon), Abracadabra  (Ticheli),DATE of EVENT 04/18/2018 ,Region: 17,1. James Marioneaux,2. Sharon Kalisek,3. Trent Cooper,1. Charlotte Royall,2. Matt Fehl,3. Amy Bennett
28, 100-Concert Band, League City Intermediate, TEA:, League City, Amy Cupitt,CCC,Non-Varsity ,2018,129507,1,1,1,1,1,1,1,1,D, Japanese Pictures  (Mixon), Heroes Triumphant  (Owens), General Greene (Edmondson),DATE of EVENT 04/18/2018 ,Region: 17,1. James Marioneaux,2. Sharon Kalisek,3. Trent Cooper,1. Charlotte Royall,2. Matt Fehl,3. Amy Bennett
29, 100-Concert Band, League City, TEA:," League City,", Rick Brockway,CCC,Varsity ,2018,129453,1,1,1,1,2,2,2,2,2, National Fencible March (Sousa), Choreography  (Sheldon), Fantasy on an African-American Spiritual  (Preuninger),DATE of EVENT 04/18/2018 ,Region: 17,1. James Marioneaux,2. Sharon Kalisek,3. Trent Cooper,1. Charlotte Royall,2. Matt Fehl,3. Amy Bennett
30, 100-Concert Band, Manvel Junior High, TEA:, Manvel," Hannah Fry / Jane Maloy, Stefan Munoz, Alex Kang",CCC,Non-Varsity ,2018,138871,2,2,2,2,1,2,1,1,2, The Golden Eagle March (Edmondson), Cloud Dancing  (Clark), Majestica  (Gazlay),DATE of EVENT 04/18/2018 ,Region: 17,1. James Marioneaux,2. Sharon Kalisek,3. Trent Cooper,1. Charlotte Royall,2. Matt Fehl,3. Amy Bennett
31, 100-Concert Band, Manvel Junior High, TEA:, Manvel," Jane Maloy / Hannah Fry, Stefan Munoz, Alex Kang",CCC,Varsity ,2018,138872,1,1,1,1,1,1,1,1,C, Loch Lomond  (Black), Foundry  (Mackey), Coast Guards (King),DATE of EVENT 04/18/2018 ,Region: 17,1. James Marioneaux,2. Sharon Kalisek,3. Trent Cooper,1. Charlotte Royall,2. Matt Fehl,3. Amy Bennett
32, 100-Concert Band, McAdams Junior High, TEA:, Dickinson, John Hinojosa,CCC,Sub Non-Varsity C,2018,138583,2,1,1,1,2,2,2,2,2, Sousa's Cadets (John Philip Sousa/Loest), Sakura (Michael Story), Dorian Chant (Calhoun),DATE of EVENT 04/18/2018 ,Region: 17,1. James Marioneaux,2. Sharon Kalisek,3. Trent Cooper,1. Charlotte Royall,2. Matt Fehl,3. Amy Bennett
33, 100-Concert Band, McAdams Junior High, TEA:, Dickinson, John Hinojosa,CCC,Varsity ,2018,138579,1,1,1,1,1,1,1,1,C, Prestissimo (K. L. King), Fantasy On A Theme By Samuel Barber (Samuel Barber/Saucedo)," Procession Of The Nobles - Cortege from the Opera ""Mlada"" (Nicholas Rimsky-Korsakov/Leidzen ed. by Ragsdale)",DATE of EVENT 04/18/2018 ,Region: 17,1. James Marioneaux,2. Sharon Kalisek,3. Trent Cooper,1. Charlotte Royall,2. Matt Fehl,3. Amy Bennett
34, 100-Concert Band, McAdams Junior High, TEA:, Dickinson, Kelby Koch,CCC,Sub Non-Varsity B,2018,137768,1,1,1,1,1,2,1,1,D, Union March (Rogers), Elizabethan Dance (Williams), Plaza de Toros (Story),DATE of EVENT 04/18/2018 ,Region: 17,1. James Marioneaux,2. Sharon Kalisek,3. Trent Cooper,1. Charlotte Royall,2. Matt Fehl,3. Amy Bennett
35, 100-Concert Band, McAdams Junior High, TEA:, Dickinson, Mary Santarelli,CCC,Non-Varsity ,2018,137763,1,1,1,1,1,1,1,1,D, El Spiritu de Valencia (Robert W. Smith), Accolade (Himes), Tanchoruzu (Standridge),DATE of EVENT 04/18/2018 ,Region: 17,1. James Marioneaux,2. Sharon Kalisek,3. Trent Cooper,1. Charlotte Royall,2. Matt Fehl,3. Amy Bennett
36, 100-Concert Band, McAdams Junior High, TEA:, Dickinson, Michelle Bilek,CCC,Sub Non-Varsity A,2018,137769,2,2,1,2,1,1,1,1,2, Lone Eagle March (Edmondson), Courtlandt County Festival  (Owens), Night Fury  (Chambers),DATE of EVENT 04/18/2018 ,Region: 17,1. James Marioneaux,2. Sharon Kalisek,3. Trent Cooper,1. Charlotte Royall,2. Matt Fehl,3. Amy Bennett
37, 100-Concert Band, Nolan Ryan Junior High, TEA:, Pearland, Julie Jezek,CCC,Varsity ,2018,138841,1,1,1,1,1,1,1,1,C, Kentucky Sunrise (Karl L. King/Robert Foster), The Lowlands of Scotland  (Vaughan Williams/Daehn), Choreography  (Sheldon),DATE of EVENT 04/18/2018 ,Region: 17,1. James Marioneaux,2. Sharon Kalisek,3. Trent Cooper,1. Charlotte Royall,2. Matt Fehl,3. Amy Bennett
38, 100-Concert Band, Nolan Ryan Junior High, TEA:, Pearland, Nicholas Almeda,CCC,Sub Non-Varsity ,2018,138897,1,2,1,1,2,1,1,1,D, Kitty Hawk March (John Edmondson), Night Fury  (Chambers), Big Sky Round-Up  (Sheldon),DATE of EVENT 04/18/2018 ,Region: 17,1. James Marioneaux,2. Sharon Kalisek,3. Trent Cooper,1. Charlotte Royall,2. Matt Fehl,3. Amy Bennett
39, 100-Concert Band, Nolan Ryan Junior High, TEA:, Pearland, Wayne Steinke,CCC,Non-Varsity ,2018,138862,1,1,1,1,1,1,1,1,D, The Big Circus March (Robert E. Foster), A Joyful Journey  (Robert Sheldon), Portsmouth Reflections  (Michael Oare),DATE of EVENT 04/18/2018 ,Region: 17,1. James Marioneaux,2. Sharon Kalisek,3. Trent Cooper,1. Charlotte Royall,2. Matt Fehl,3. Amy Bennett
40, 100-Concert Band, Rodeo Palms Junior High, TEA:, Manvel, Brian Wood,CC,Non-Varsity ,2018,137309,2,1,2,2,1,2,1,1,2, Big Sky Round-Up  (Sheldon), Two Minute Symphony  (Margolis), Mount Vernon March  (),DATE of EVENT 04/18/2018 ,Region: 17,1. James Marioneaux,2. Sharon Kalisek,3. Trent Cooper,1. Charlotte Royall,2. Matt Fehl,3. Amy Bennett
41, 100-Concert Band, Rodeo Palms Junior High, TEA:, Manvel, Theron Sharp / Brian Wood,CC,Varsity ,2018,136770,2,1,2,2,1,1,1,1,2, Blue Ridge Saga  (Swearingen), Highland Legend  (Moss), Mighty Mite (March) (Mesang/O'Loughhlin),DATE of EVENT 04/18/2018 ,Region: 17,1. James Marioneaux,2. Sharon Kalisek,3. Trent Cooper,1. Charlotte Royall,2. Matt Fehl,3. Amy Bennett
42, 100-Concert Band, Santa Fe JH, TEA:, Santa Fe, Daniel Pendergrass / Harold Payne,CCC,Varsity ,2018,138844,2,2,1,2,2,2,2,2, , Cape Breton March (John O'Reilly), Contempo (Story), Black Forest Overture (Sweeney),DATE of EVENT 04/18/2018 ,Region: 17,1. James Marioneaux,2. Sharon Kalisek,3. Trent Cooper,1. Charlotte Royall,2. Matt Fehl,3. Amy Bennett
43, 100-Concert Band, Seabrook Intermediate, TEA:, Seabrook, Austin Tran / Matthew McCoy,CCC,Varsity ,2018,129659,1,1,1,1,1,1,1,1,C, Marching Through Georgia (Sousa/ Brion), Innisfree (Strommen), Imaginarium (Standridge),DATE of EVENT 04/18/2018 ,Region: 17,1. James Marioneaux,2. Sharon Kalisek,3. Trent Cooper,1. Charlotte Royall,2. Matt Fehl,3. Amy Bennett
44, 100-Concert Band, Seabrook Intermediate, TEA:, Seabrook, Matthew McCoy / Austin Tran,CCC,Non-Varsity A,2018,129669,1,1,1,1,1,1,1,1,D, Matrix March (Ed Huckeby), Plaza de Toros (Michael Story), Night Fury (Carol Brittin Chambers),DATE of EVENT 04/18/2018 ,Region: 17,1. James Marioneaux,2. Sharon Kalisek,3. Trent Cooper,1. Charlotte Royall,2. Matt Fehl,3. Amy Bennett
45, 100-Concert Band, Space Center Intermediate, TEA:, Houston, Bernadette Walls,CC,Varsity ,2018,130448,1,1,1,1,1,1,1,1,C," Simple Gifts, Four Shaker Songs (play mvt 1,2,or 4) (Ticheli)", The Old Red Mill  (Karrick), The Crown of Castile  (Johnnie Vinson ),DATE of EVENT 04/18/2018 ,Region: 17,1. James Marioneaux,2. Sharon Kalisek,3. Trent Cooper,1. Charlotte Royall,2. Matt Fehl,3. Amy Bennett
46, 100-Concert Band, Space Center Intermediate, TEA:, Houston, Dylan Dann,CC,Non-Varsity ,2018,130602,1,1,1,1,2,1,1,1,D, Omega March (John Edmondson), The Spacious Firmament on High (Sharp), Courtlandt County Festival  (Owens),DATE of EVENT 04/18/2018 ,Region: 17,1. James Marioneaux,2. Sharon Kalisek,3. Trent Cooper,1. Charlotte Royall,2. Matt Fehl,3. Amy Bennett
47, 100-Concert Band, Victory Lakes Intermediate School, TEA:, League City, Bennett Parsons / Karen Young,CCC,Varsity ,2018,129477,1,1,1,1,1,1,1,1,C, Spirit of Liberty March  (William Owens ), Tanchozuru (Standridge), La Madre de los Gatos  (Beck),DATE of EVENT 04/18/2018 ,Region: 17,1. James Marioneaux,2. Sharon Kalisek,3. Trent Cooper,1. Charlotte Royall,2. Matt Fehl,3. Amy Bennett
48, 100-Concert Band, Victory Lakes Intermediate School, TEA:, League City, Karen Young / Bennett Parsons,CCC,Non-Varsity ,2018,129478,1,1,1,1,1,2,1,1,D, Exhortation (Gazlay), Plaza de Toros  (Story), Fortitude (Concert March) (Owens),DATE of EVENT 04/18/2018 ,Region: 17,1. James Marioneaux,2. Sharon Kalisek,3. Trent Cooper,1. Charlotte Royall,2. Matt Fehl,3. Amy Bennett
49, 100-Concert Band, Westbrook Intermediate, TEA:, Friendswood, Michael Krueger / Teri Brockway and Nancy Nelson,CCC,Non-Varsity ,2018,129494,1,1,1,1,1,1,1,1,D, Marche Diabolique (Balmages), Under an Irish Sky (Neeck), Medieval Legend (Story),DATE of EVENT 04/18/2018 ,Region: 17,1. James Marioneaux,2. Sharon Kalisek,3. Trent Cooper,1. Charlotte Royall,2. Matt Fehl,3. Amy Bennett
50, 100-Concert Band, Westbrook Intermediate, TEA:, Friendswood, Teri Brockway / Carlton Marsh & Dusty Norris,CCC,Sub Non-Varsity ,2018,130586,2,1,1,1,1,1,1,1,D, March Primo (Dennis Eveland), Dance Celebration  (Smith), Ming Court (Pitter),DATE of EVENT 04/18/2018 ,Region: 17,1. James Marioneaux,2. Sharon Kalisek,3. Trent Cooper,1. Charlotte Royall,2. Matt Fehl,3. Amy Bennett
51, 100-Concert Band, Westbrook Intermediate, TEA:, Friendswood, Teri Brockway / Michael Krueger/Nancy Nelson,CCC,Varsity ,2018,129502,1,1,1,1,1,1,1,1,C, The Trombone King (King/Paynter)," Simple Gifts, Four Shaker Songs (play at least three mvts) (Ticheli)", Choreography  (Sheldon),DATE of EVENT 04/18/2018 ,Region: 17,1. James Marioneaux,2. Sharon Kalisek,3. Trent Cooper,1. Charlotte Royall,2. Matt Fehl,3. Amy Bennett
