,0,1,2,3,4,5,6,7,8,9,10,11,12,13,14,15,16,17,18,19,20,21,22,23,24,25,26,27,28,29
0, 100-Concert Band, Banquete HS, TEA:, Banquete, David Torch,AA,Varsity ,2013,85434,1,1,1,1,3,3,2,3,1, Pinnacle  (Grice/ )," Moscow, 1941  (Balmages/ )", El Relicario (Micheal Story),DATE of EVENT 04/10/2013 ,Region: 14,1. Frank Foster,2. JJ Meave,3. Roger Olivarez,1. Ben Chasan,2. Bob Howard,3. Juan Sosa,
1, 100-Concert Band, Banquete JH, TEA:, Banquete, Angelica Galvan / David Torch,C,Varsity ,2013,85416,2,1,2,2,3,4,3,3, , Atlantis  (McGinty/ ), Serengeti Dreams  (Smith/ ), American Spirit March (John Higgins),DATE of EVENT 04/10/2013 ,Region: 14,1. Frank Foster,2. JJ Meave,3. Roger Olivarez,1. Ben Chasan,2. Bob Howard,3. Juan Sosa,
2, 100-Concert Band, Ben Bolt HS, TEA:, Ben Bolt, Joe Angel Soliz / Miss Mendoza, Acc:n/a,A,Var-Composite ,2013,83853,1,1,1,1,2,2,2,2,1, New Forest March (Vinson), Sakura (Story), Challenger Point (Johnson),DATE of EVENT 04/10/2013 ,Region: 14,1. Frank Foster,2. JJ Meave,3. Roger Olivarez,1. Ben Chasan,2. Bob Howard,3. Juan Sosa
3, 100-Concert Band, Bernarda Jaime JH, TEA:, San Diego, Santiago Ochoa / Mr. John A. Vela, Acc:n/a,C,Varsity ,2013,83303,1,1,1,1,2,2,2,2,2, Nottingham March (Jerry Williams), Nottingham Castle  (Daehn/ ), Fire Dance  (Akey/ ),DATE of EVENT 04/10/2013 ,Region: 14,1. Frank Foster,2. JJ Meave,3. Roger Olivarez,1. Ben Chasan,2. Bob Howard,3. Juan Sosa
4, 100-Concert Band, Bishop HS, TEA:, Bishop, Carlos E Martinez / Elizabeth Martinez,AA,Varsity ,2013,82762,3,2,2,2,3,2,3,3, , Portrait of a Clown  (Ticheli/ ), Shalom Chaverim  (Johnson/ ), Hello Sunshine March  (Yoshio Matsuo),DATE of EVENT 04/10/2013 ,Region: 14,1. Frank Foster,2. JJ Meave,3. Roger Olivarez,1. Ben Chasan,2. Bob Howard,3. Juan Sosa,
5, 100-Concert Band, de la Paz MS, TEA:, Riviera, Arthur Sholtis / Bobby Salazar,C,Varsity ,2013,82487,1,1,2,1,2,2,2,2,2, The Spacious Firmament on High  (Sharp/ ), Elizabethan Dance  (Williams/ ), March of the Champions (Timothy Loest),DATE of EVENT 04/10/2013 ,Region: 14,1. Frank Foster,2. JJ Meave,3. Roger Olivarez,1. Ben Chasan,2. Bob Howard,3. Juan Sosa,
6, 100-Concert Band, Falfurrias HS, TEA:, Falfurrias, Roel Saenz,AA,Varsity ,2013,85770,1,1,1,1,1,1,1,1,A, Santa Fe Trail (Concert March) (Tom O'Connor), Adrenaline Engines  (Standridge/ ), Sparks  (Balmages/ ),DATE of EVENT 04/10/2013 ,Region: 14,1. Frank Foster,2. JJ Meave,3. Roger Olivarez,1. Ben Chasan,2. Bob Howard,3. Juan Sosa,
7, 100-Concert Band, Falfurrias JH, TEA:, Falfurrias, Richard Rodriguez / Victor Cardenas & Roel Saenz,C,Varsity ,2013,85538,2,2,2,2,3,2,2,2, , Fort Canterbury March (David Holsinger), Cascadia Celebration (Steve Hodges), Colliding Visions (Brian Balmages),DATE of EVENT 04/10/2013 ,Region: 14,1. Frank Foster,2. JJ Meave,3. Roger Olivarez,1. Ben Chasan,2. Bob Howard,3. Juan Sosa,
8, 100-Concert Band, Falfurrias JH, TEA:, Falfurrias, Victor Cardenas,C,Non-Varsity ,2013,85364,2,2,2,2,4,2,4,4, , Theme and Variations  (Broege/ ), Two Minute Symphony  (Margolis/ ), Discovery March (John Edmondson),DATE of EVENT 04/10/2013 ,Region: 14,1. Frank Foster,2. JJ Meave,3. Roger Olivarez,1. Ben Chasan,2. Bob Howard,3. Juan Sosa,
9, 100-Concert Band, Freer HS, TEA:, Freer, Omar Garza,AA,Varsity ,2013,83493,3,3,3,3,4,3,4,4, , Modal Song and Dance  (Eliott Del Borgo), Crest of Nobility  (Sheldon ), March for a Festive Occasion (Eric Osterling),DATE of EVENT 04/10/2013 ,Region: 14,1. Frank Foster,2. JJ Meave,3. Roger Olivarez,1. Ben Chasan,2. Bob Howard,3. Juan Sosa,
10, 100-Concert Band, Freer JH, TEA:, Freer, Omar Garza,C,Non-Varsity ,2013,85002,3,5,4,4,5,4,5,5, , Allegretto (from Symphony No. 7)  (Beethoven/Court), Nottingham Castle  (Daehn/ ), Bell Canon March (John O'Riley),DATE of EVENT 04/10/2013 ,Region: 14,1. Frank Foster,2. JJ Meave,3. Roger Olivarez,1. Ben Chasan,2. Bob Howard,3. Juan Sosa,
11, 100-Concert Band, H.M. King HS, TEA:, Kingsville, Porfirio Mendez Jr.,AAA,Non-Varsity ,2013,85739,1,1,1,1,1,1,1,1,C, Spirit Of The Fleet (William Owens), Black Forest Overture  (Sweeney), Steel  (Standridge/ ),DATE of EVENT 04/10/2013 ,Region: 14,1. Frank Foster,2. JJ Meave,3. Roger Olivarez,1. Ben Chasan,2. Bob Howard,3. Juan Sosa,
12, 100-Concert Band, H.M. King HS, TEA:, Kingsville, Rolando Molina,AAA,Varsity ,2013,84666,1,1,1,1,1,1,1,1,A, The Gum-Suckers March (Grainger), Pompeii (Yagisawa), Seis Manuel from Islas y Montanas (Hanson),DATE of EVENT 04/10/2013 ,Region: 14,1. Frank Foster,2. JJ Meave,3. Roger Olivarez,1. Ben Chasan,2. Bob Howard,3. Juan Sosa,
13, 100-Concert Band, H.M. King HS, TEA:, Kingsville, S. Mae Trevino-Mendez,AAAA,Sub Non-Varsity ,2013,83020,1,1,1,1,1,2,1,1,C, Barnum Woods (Carl Strommen), Alpine Meadow  (Hodges/ ), A Joyful Journey  (Sheldon/ ),DATE of EVENT 04/10/2013 ,Region: 14,1. Frank Foster,2. JJ Meave,3. Roger Olivarez,1. Ben Chasan,2. Bob Howard,3. Juan Sosa,
14, 100-Concert Band, Hebbronville HS, TEA:, Hebbronville, Paul Saenz / David Alvarez,AA,Varsity ,2013,86796,1,1,1,1,4,3,3,3,1, Fire Dance (Douglas Akey), Accolade (Himes), Gallant Marines (King/Swearingen),DATE of EVENT 04/10/2013 ,Region: 14,1. Frank Foster,2. JJ Meave,3. Roger Olivarez,1. Ben Chasan,2. Bob Howard,3. Juan Sosa,
15, 100-Concert Band, Hebbronville JH, TEA:, Hebbronville, David Alvarez,C,Varsity ,2013,86795,2,1,2,2,3,3,2,3, , Majestica (Gary Gazlay), Canon of Peace (Paul Jennings), Lone Eagle March (John Edmondson),DATE of EVENT 04/10/2013 ,Region: 14,1. Frank Foster,2. JJ Meave,3. Roger Olivarez,1. Ben Chasan,2. Bob Howard,3. Juan Sosa,
16, 100-Concert Band, Kaufer HS, TEA:, Riviera, Arthur Sholtis / Bobby Salazar,AA,Varsity ,2013,82130,1,1,1,1,1,1,2,1,A, Dolce and Dance  (Fagan/ ), Blue Ridge Saga  (Swearingen/ ), Circus Days (King/Schissel),DATE of EVENT 04/10/2013 ,Region: 14,1. Frank Foster,2. JJ Meave,3. Roger Olivarez,1. Ben Chasan,2. Bob Howard,3. Juan Sosa,
17, 100-Concert Band, Luehrs JH, TEA:, Bishop, Carlos Martinez / Elizabeth martinez,C,Varsity ,2013,82917,3,3,4,3,4,3,4,4, , Heaven's Light  (Reineke/ ), Sakura  (Story/ ), March Zuma (John O'Reilly),DATE of EVENT 04/10/2013 ,Region: 14,1. Frank Foster,2. JJ Meave,3. Roger Olivarez,1. Ben Chasan,2. Bob Howard,3. Juan Sosa,
18, 100-Concert Band, Mathis HS, TEA:, Mathis," Charles Cabrera, Jr. / Rick Varela, Miguel Cabrera",AA,Varsity ,2013,82871,1,1,1,1,1,1,1,1,A, Rough Riders (Karl King), Dona Nobis Pacem  (Sudduth/ ), Undertow  (Mackey/ ),DATE of EVENT 04/10/2013 ,Region: 14,1. Frank Foster,2. JJ Meave,3. Roger Olivarez,1. Ben Chasan,2. Bob Howard,3. Juan Sosa,
19, 100-Concert Band, Mathis MS, TEA:, Mathis," Miguel R Cabrera / Charles Cabrera Jr., Rick Varela",C,Varsity ,2013,84450,1,1,1,1,1,1,1,1,C, Infinity Concert March (Curnow), Fortis  (Gazlay), Dance Celebration  (Smith),DATE of EVENT 04/10/2013 ,Region: 14,1. Frank Foster,2. JJ Meave,3. Roger Olivarez,1. Ben Chasan,2. Bob Howard,3. Juan Sosa,
20, 100-Concert Band, Memorial MS, TEA:, Kingsville, Eli Lopez,CC,Sub Non-Varsity ,2013,83538,1,1,2,1,4,3,3,3,2, March Madness (John Kinyon), Ming Court (Donald Pitter), Exhortation (Gary Gazlay),DATE of EVENT 04/10/2013 ,Region: 14,1. Frank Foster,2. JJ Meave,3. Roger Olivarez,1. Ben Chasan,2. Bob Howard,3. Juan Sosa,
21, 100-Concert Band, Memorial MS, TEA:, Kingsville, Raymond E. Mendez,CC,Varsity ,2013,82649,1,1,1,1,1,1,1,1,C, March of the Belgian Paratroopers (Wiley/Swearingen), Be Thou My Vision  (Clark/ ), Steel  (Standridge/ ),DATE of EVENT 04/10/2013 ,Region: 14,1. Frank Foster,2. JJ Meave,3. Roger Olivarez,1. Ben Chasan,2. Bob Howard,3. Juan Sosa,
22, 100-Concert Band, Memorial MS, TEA:, Kingsville, S. Mae Trevino-Mendez,CC,Non-Varsity ,2013,83019,1,1,1,1,1,1,1,1,D, March Zuma (John O'Reilly), Colliding Visions  (Balmages/ ), Shenandoah (Smith),DATE of EVENT 04/10/2013 ,Region: 14,1. Frank Foster,2. JJ Meave,3. Roger Olivarez,1. Ben Chasan,2. Bob Howard,3. Juan Sosa,
23, 100-Concert Band, Orange Grove JH, TEA:, Orange Grove, Abelardo Perez,CC,Varsity ,2013,82544,1,1,1,1,1,2,1,1,C, Prestissimo (King/Swearingen), We Gather  (Vertoske/ ), Steel  (Standridge/ ),DATE of EVENT 04/10/2013 ,Region: 14,1. Frank Foster,2. JJ Meave,3. Roger Olivarez,1. Ben Chasan,2. Bob Howard,3. Juan Sosa,
24, 100-Concert Band, Orange Grove JH, TEA:, Orange Grove, Belinda Garza,CC,Non-Varsity ,2013,81800,1,1,1,1,2,2,1,2,2, Wedgwood March (Owens), Iroquois Sunrise  (Rudgers), Majestica  (Gazlay),DATE of EVENT 04/10/2013 ,Region: 14,1. Frank Foster,2. JJ Meave,3. Roger Olivarez,1. Ben Chasan,2. Bob Howard,3. Juan Sosa,
25, 100-Concert Band, Premont HS, TEA:, Premont, Ernesto Cortez / Hector Cantu,A,Varsity ,2013,83453,1,1,1,1,2,2,2,2,1, New Forest March  (J. Vinson), Challenger Point  (Johnson/ ), Knights of Dunvegan  (Meyer/ ),DATE of EVENT 04/10/2013 ,Region: 14,1. Frank Foster,2. JJ Meave,3. Roger Olivarez,1. Ben Chasan,2. Bob Howard,3. Juan Sosa,
26, 100-Concert Band, Ricardo MS, TEA:, Kingsville, Jesus D. Rios,C,Varsity ,2013,82208,1,1,1,1,1,1,1,1,C, Tall Cedars Concert March (Eric Osterling)," Lux Prima (Come, My Soul, Thou Must Be Awakening)  (Haydn/Ford)", Corps of Discovery  (Owens/ ),DATE of EVENT 04/10/2013 ,Region: 14,1. Frank Foster,2. JJ Meave,3. Roger Olivarez,1. Ben Chasan,2. Bob Howard,3. Juan Sosa,
27, 100-Concert Band, San Diego HS, TEA:, San Diego, John A. Vela,AA,Varsity ,2013,82574,1,1,2,1,2,2,1,2,1, Winchester March (Edmondson), Canon of Peace  (Jennings), The Steppes of Russia  (Del Borgo),DATE of EVENT 04/10/2013 ,Region: 14,1. Frank Foster,2. JJ Meave,3. Roger Olivarez,1. Ben Chasan,2. Bob Howard,3. Juan Sosa,
28, 100-Concert Band, Seale Junior High, TEA:, Robstown, Norma Jean Martinez,CC,Varsity ,2013,81950,2,2,2,2,3,2,3,3, , Black Is the Color... (Sheldon), Fire Dance (Akey), Miracle at Dunkirk (Edmondson),DATE of EVENT 04/10/2013 ,Region: 14,1. Frank Foster,2. JJ Meave,3. Roger Olivarez,1. Ben Chasan,2. Bob Howard,3. Juan Sosa,
29, 100-Concert Band, Zapata HS, TEA:, Zapata," Amado E. Martinez / Cindy Martinez, James Segovia, Oscar Martinez, and Myrna Saldana",AAA,Varsity ,2013,84492,1,1,1,1,1,1,2,1,A, Americans Lost (Tucker), Ave Maria (Schubert/Ticheli), Aces of the Air (King/Swearingen),DATE of EVENT 04/10/2013 ,Region: 14,1. Frank Foster,2. JJ Meave,3. Roger Olivarez,1. Ben Chasan,2. Bob Howard,3. Juan Sosa,
30, 100-Concert Band, Zapata MS, TEA:, Zapata, Cynthia Martinez,CC,Non-Varsity ,2013,84717,1,1,1,1,3,3,2,3,2, Bayview March (Gorham), In The Bleak Midwinter  (Holst/Bullock), Pinnacle  (Grice/ ),DATE of EVENT 04/10/2013 ,Region: 14,1. Frank Foster,2. JJ Meave,3. Roger Olivarez,1. Ben Chasan,2. Bob Howard,3. Juan Sosa,
31, 100-Concert Band, Zapata MS, TEA:, Zapata, James Segovia,CC,Varsity ,2013,84788,1,1,1,1,3,3,2,3,2, New South Wales March (John Edmondson), Voodoo Dance  (Del Borgo/ ), Spirit of an Eagle  (Clark/ ),DATE of EVENT 04/10/2013 ,Region: 14,1. Frank Foster,2. JJ Meave,3. Roger Olivarez,1. Ben Chasan,2. Bob Howard,3. Juan Sosa,
