,Event,School,TEA,City,Directors,Conference,Classification,Year,ID,Stage Judge 1,Stage Judge 2,Stage Judge 3,Stage Final,SR Judge 1,SR Judge 2,SR Judge 3,SR Final,Award,Selection 1,Selection 2,Selection 3
0, 100-Concert Band, Boling High School, TEA:, Boling, Alan Edge / Fred Drennan,AA,Varsity ,2014,90380,2,3,2,2,1,2,1,1,1, Circus Days (King/Schissel), Slane  (Anon. or Trad./Wagner), Songs Of The Whalemen  (Del Borgo/ )
1, 100-Concert Band, Columbia High School, TEA:, West Columbia, Fred Meyer / Randy Marble,AAA,Non-Varsity ,2014,90410,2,2,2,2,2,2,2,2, , Miracle at Dunkirk (Edmondson), Heroes Triumphant (Owens/ ), Pinnacle  (Grice/ )
2, 100-Concert Band, Columbia High School, TEA:, West Columbia, Randy D. Marble / Fred Meyer,AAA,Varsity ,2014,90512,1,2,1,1,2,1,2,2,1, Steel  (Standridge/ ), Earth Song  (Ticheli/ ), Torch of Liberty (King/Swearingen)
3, 100-Concert Band, Edna High School, TEA:, Edna, Joshua Partida / Adrian Carrizales,AA,Varsity ,2014,90513,2,1,2,2,1,1,1,1,1, Big Four March (King/Swearingen), Our Kingsland Spring  (Hazo/ ), Joy Revisited  (Ticheli/ )
4, 100-Concert Band, Ganado High School, TEA:, Ganado, Patrick Flaniken / Mandy Keen,A,Varsity ,2014,90775,2,1,2,2,1,2,1,1,1," Moscow, 1941 (Balmages/)", Foundry  (Mackey/ ), El Gato Salveje (Paso Doble) (Foster/)
5, 100-Concert Band, Palacios High School, TEA:, Palacios, Jim Popham,AA,Varsity ,2014,89464,2,2,1,2,1,1,1,1,1, Escapada (David Moore), Hypnotic Fireflies  (Balmages/ ), New Horizons  (Corrigan/ )
6, 100-Concert Band, Palacios Junior High, TEA:, Palacios, Michael Schurtz / Jim Popham,C,Varsity ,2014,90180,1,1,1,1,1,1,1,1,C, Union March (Mekel Rogers), Spirit of an Eagle  (Clark/ ), Summit Fanfare  (Owens/ )
