,Event,School,TEA,City,Directors,Conference,Classification,Year,ID,Stage Judge 1,Stage Judge 2,Stage Judge 3,Stage Final,SR Judge 1,SR Judge 2,SR Judge 3,SR Final,Award,Selection 1,Selection 2,Selection 3
0, 100-Concert Band, Brownfield Middle SChool, TEA:, Brownfield," Brock Mellinger / Adam Flores, Barry Wiseman, Dusty Balderas",C,Varsity ,2020,155985,1,1,1,1,1,1,1,1,C, Forward March  (Murtha), Armory  (Standrige ), Danza De Espana  (Chambers )
1, 100-Concert Band, Idalou Middle School, TEA:, Idalou, Brian Gruben / Patrick Pantleo,C,Varsity ,2020,153820,2,2,2,2,1,1,1,1,2, Andalucia (Victor Lopez), In The Bleak Midwinter (Gustav Holst/Jack Bullock), Armory (Randall D. Standridge)
2, 100-Concert Band, Littlefield JH, TEA:, Littlefield, Talitha Cook / Gina Muela & Bonnie Anderson,C,Non-Varsity A,2020,153612,1,1,1,1,2,1,2,2,2," ""Synergy March"" (William Owens)", Nottingham Castle  (Larry Daehn), Big Sky Round-Up (Robert Sheldon)
3, 100-Concert Band, Littlefield Junior High, TEA:, Littlefield, Gina Muela / Talitha Cook & Bonnie Anderson,C,Varsity ,2020,152925,1,1,1,1,1,1,1,1,C, Broadway!  (Johnnie Vinson), The Tears of Arizona (Brian Balmages), Synchronized Energy (Greg Fhiaras)
4, 100-Concert Band, Roosevelt Middle School, TEA:, Lubbock, Michael Burcham / Jimmy Cannon,C,Varsity ,2020,156199,2,1,1,1,1,1,1,1,C, March Supreme (John O'Reilly), The Spacious Firmament on High (17494)  (Sharp), Night Fury (20593)  (Chambers)
5, 100-Concert Band, Shallowater Middle School, TEA:, Lubbock," Donovan Ashcraft / Tammy Summersgill, Don Summersgill, and Jalanya Hooten",C,Varsity ,2020,154410,1,2,1,1,1,1,1,1,C, Aquia Landing (Gateway to Freedom March) (Paul Murtha ), Korean Hill Song  (Mark Williams), Expectations (Larry Clark)
6, 100-Concert Band, Shallowater Middle School, TEA:, Shallowater," Tammy Summersgill / Don Summersgill, Donovan Ashcraft, Jalayna Hooten",C,Non-Varsity ,2020,154421,1,1,1,1,1,1,1,1,D, Andalucia (Lopez), Scarborough Fair (642)  (Moss), Majestica (17490)  (Gazlay)
7, 100-Concert Band, Slaton Jr. High, TEA:, Slaton, Antonio Garcia,C,Non-Varsity ,2020,156229, , , , , , , , , , Spring Song (Nowak), Serengeti Dreams (Smith), El Conquistador (William Owens and Gene Williams)
