,Event,School,TEA,City,Directors,Conference,Classification,Year,ID,Stage Judge 1,Stage Judge 2,Stage Judge 3,Stage Final,SR Judge 1,SR Judge 2,SR Judge 3,SR Final,Award,Selection 1,Selection 2,Selection 3
0, 100-Concert Band, Ballinger HS, TEA:, Ballinger, Janet Wilson / Brian Owen,AA,Varsity ,2009,48097,1,1,1,1,1,1,1,1,A, Lexington March (King/Swearingen), Legend of Knife River  (Bulla)," Moscow, 1941  (Balmages)"
1, 100-Concert Band, Ballinger Junior High, TEA:, Ballinger, Brian Owen / Janet Wilson,C,Varsity ,2009,48860,1,2,1,1,1,1,1,1,C, Tipperary March (Edmondson), Capriol Suite  (Warlock/Longfeld), Two British Folk Songs  (Anon. or Trad./Del Borgo)
2, 100-Concert Band, Bangs HS, TEA:, Bangs, Tommy Perkins / Charla Bretzke,AA, ,2009,43637,1,1,1,1,1,1,1,1,A, Monterey March (LaPlante), Two British Folk Songs  (Anon. or Trad./Del Borgo), A Hymn for Band  (Stuart)
3, 100-Concert Band, Brady High School, TEA:, Brady, Robert Halamicek,AA,Non-Varsity ,2009,48270,4,3,3,3,2,1,1,1,2, Southern Star (Gorham), Dolce and Dance (Fagan), Portrait of a Clown  (Ticheli)
4, 100-Concert Band, Brady HS, TEA:, Brady, Berry Crudgington,AA,Varsity ,2009,49229,2,1,1,1,1,1,1,1,A, March of the Roughnecks (Ed Huckeby)," Simple Gifts, Four Shaker Songs (play at least three mvts) (Ticheli)", English Country Settings  (La Plante)
5, 100-Concert Band, Brady Middle School, TEA:, Brady, Robert Halamicek,C,Varsity ,2009,48219,3,2,1,2,1,1,1,1,2, St. Petersburg March (Vinson), Pevensey Castle  (Sheldon), Norwegian Legend  (Grieg/Forsblad)
6, 100-Concert Band, Bronte HS, TEA:, Bronte, Wayne Dannheim,A,Varsity ,2009,49224,1,2,2,2,1,2,1,1,1, March Of The Minutemen (Early American Melody/arr.James Ployhar), Pinnacle (Grice), Medieval Legend  (Story)
7, 100-Concert Band, Brownwood HS, TEA:, Brownwood, Richard Graham,AAA,Varsity ,2009,47889,1,1,1,1,1,1,1,1,A, The Klaxon (Fillmore/Fennell), On a Hymnsong of Philip Bliss  (Holsinger), Vesuvius  (Ticheli)
8, 100-Concert Band, Brownwood Middle School, TEA:, Brownwood, Leslie Krischke,CC,Varsity ,2009,48452,1,1,1,1,1,2,1,1,C, Valley Forge March (Edmondson), The Red Balloon  (McGinty), Serengeti Dreams  (Smith)
9, 100-Concert Band, Coleman High School, TEA:, Coleman, Jerry Everett / Liz Braquet,AA,Varsity ,2009,49676,2,3,2,2,1,1,1,1,1, Lexington March (King/Swearingen), Pinnacle (Rob Grice)," Moscow, 1941 (Brian Balmages)"
10, 100-Concert Band, Comanche ISD, TEA:, Comanche, Kim Reedy,AA,Varsity ,2009,49611,2,2,2,2,1,1,2,1,1, Alamo March (King/arr. Swearingen), Contempo (Story), American Riversongs (LaPlante)
11, 100-Concert Band, Cross Plains HS, TEA:, Cross Plains, Matthew Sowell,A,Varsity ,2009,49187,3,3,3,3,3,3,3,3, , American Dream (Ken Harris), A Joyful Journey  (Sheldon), Pinnacle  (Grice)
12, 100-Concert Band, De Leon HS, TEA:, De Leon, Chuck Miller,A,Varsity ,2009,45531,2,1,1,1,2,1,2,2,1, Rough Riders (King/ Swearingen), Band in the Square on the Fourth of July (La Plante), Cumberland Cross (Strommen)
13, 100-Concert Band, Dublin HS, TEA:, Dublin, Rodney Parker / Becky Jorgensen,AA,Varsity ,2009,45295,3,2,2,2,1,1,1,1,1, Monterey March (LaPlante), Barbarossa  (Himes), Dona Nobis Pacem  (Sudduth)
14, 100-Concert Band, Early High School, TEA:, Early, Michael Hall,AA,Varsity ,2009,50491,3,3,2,3,1,2,2,2, , Fort Canterbury March (David Holsinger), Knights of Dunvegan  (Meyer), Songs Of The Whalemen  (Del Borgo)
15, 100-Concert Band, Eastland HS, TEA:, Eastland, Terry Everts / Cari Harmon,AA,Varsity ,2009,47636,1,1,1,1,1,1,1,1,B, Alamo March (King / Swearingen), Legend of Knife River  (Bulla)," Moscow, 1941  (Balmages)"
16, 100-Concert Band, Eden HS, TEA:, Eden, Kathy Brock,A,Varsity ,2009,49577,1,2,1,1,1,1,1,1,B, Spania (Shaffer), Canticle  (Wagner), Fanfare for a New Age  (Story)
17, 100-Concert Band, Eldorado HS, TEA:, Eldorado, Jerry Barker,A,Varsity ,2009,46422,1,1,1,1,1,1,1,1,A, New South Wales March (John Edmondson), Spring Song  (Nowak), The Steppes of Russia  (Del Borgo)
18, 100-Concert Band, Goldthwaite HS, TEA:, Goldthwaite, Susan Reynolds,A,Var-Composite ,2009,48643,DQ,DQ,DQ,DQ,2,1,1,1,1, A Joyful Journey  (Sheldon), Pevensey Castle  (Sheldon), The Streets of Madrid (Moss)
19, 100-Concert Band, Goldthwaite Middle School, TEA:, Goldthwaite, Susan Reynolds,C,Varsity ,2009,48645,2,2,2,2,1,2,1,1,2, Atlantis  (McGinty), In The Bleak Midwinter  (Holst/Bullock), Infinity March (Curnow)
20, 100-Concert Band, Grandview HS, TEA:, Grandview, Floy McKinnerney / Rick Webb,AA,Varsity ,2009,49395,1,1,2,1,1,1,1,1,A, Old Dominion March (Edmonson), Barcarolle (Erickson), Blue Ridge Saga (Swearingen)
21, 100-Concert Band, hamlin, TEA:, Hamlin, mike brady / None,Var-Composite ,2009,48661,1,1,1,1,1,1,1,1,B, Drums of Daruma (Williams Himes), Serengeti Dreams (Robert W. Smith), Crusade (Vince Gassi),
22, 100-Concert Band, HR Jefferies JH, TEA:, Comanche, Christopher Newby / Kim Reedy,C,Varsity ,2009,50050,3,3,3,3,2,1,2,2, , Pevensey Castle  (Sheldon), Cedar Canyon Round Up  (Williams), Lone Eagle March (Edmondson)
23, 100-Concert Band, Junction ISD, TEA:, Junction, Dan Wynn,A,Var-Composite ,2009,49933,1,1,1,1,1,1,1,1,A, Miracle at Dunkirk (Edmondson), Songs Of The Whalemen  (Del Borgo), Pinnacle  (Grice)
24, 100-Concert Band, Llano High School, TEA:, Llano, Forrester Halamicek,AAA,Non-Varsity ,2009,48529,1,3,2,2,1,1,1,1,2, A March on the King's Highway (La Plante), An Irish Air  (Anon. or Trad./Sheldon), Contempo  (Story)
25, 100-Concert Band, Llano HS, TEA:, Llano, Wilburn Meier,AAA,Varsity ,2009,48930,1,1,1,1,1,1,1,1,A, Pride of the Western Reserve (Milford), Nemu-Susato  (Van der Roost), American Riversongs  (La Plante)
26, 100-Concert Band, Llano Middle School, TEA:, Llano, Carol Meier,CC,Varsity ,2009,48558,3,2,1,2,1,1,1,1,2, New South Wales March (Edmondson), Pioneer Songs  (Daehn), Crest of Nobility  (Sheldon)
27, 100-Concert Band, Mason ISD, TEA:, Mason, Pat Ruiz,A,Varsity ,2009,47900,4,4,3,4,1,1,1,1,1, March of the Belgian Paratroopers (Leemans/Swearingen), Ghost Fleet  (Sheldon), Knights of Dunvegan  (Meyer)
28, 100-Concert Band, Mason MS, TEA:, Mason, Pat Ruiz,C,Varsity ,2009,50805,3,2,2,2,1,1,1,1,2, Guardian of Liberty March (Paul Murtha), A Childhood Hymn  (Holsinger), Dance Celebration  (Smith)
29, 100-Concert Band, May High School, TEA:, May, Brian Flenniken,A,Var-Composite ,2009,50266,2,3,2,2,1,1,2,1,1, Hogan's Heroes March (arr. Eric Osterling), Modal Song and Dance  (Del Borgo), Sea Song Trilogy  (McGinty)
30, 100-Concert Band, Menard HS, TEA:, Menard, Chans Moellendorf,A,Var-Composite ,2009,49206,1,3,2,2,1,2,1,1,1, Military Escort (Bennett/Balent), Maesong  (Owens), Pevensey Castle  (Sheldon)
31, 100-Concert Band, MILES HIGH SCHOOL, TEA:, Miles, Jason Yarbrough,A,Varsity ,2009,50140,2,3,3,3,3,3,3,3, , A March on the King's Highway (La Plante), Ayrshire Portrait  (Story), Atlantis  (McGinty)
32, 100-Concert Band, Ranger HS, TEA:, Ranger, Jim Strahan,A,Varsity ,2009,44466,1,1,1,1,1,1,1,1,B, All The Pretty Little Horses  (McGinty), Symphony No. 15 - Finale  (Mozart/Daehn), Mighty Mite March (Mesang/O'Loughlin)
33, 100-Concert Band, San Saba High School, TEA:, San Saba, Jason Howard / Emily Andrews,AA,Varsity ,2009,49683,2,2,3,2,2,2,2,2, , Joy  (Ticheli), Fire Dance  (Akey), Miss Liberty March (King/ Swearingen)
34, 100-Concert Band, San Saba Middle School, TEA:, San Saba, Emily Andrews / Jason Howard,C,Varsity ,2009,49726,3,3,3,3,3,3,3,3, , Cahokia  (Spears), Fanfare for a New Age  (Story), Apollo March (Kinyon)
35, 100-Concert Band, Wall High School, TEA:, Wall, Travis Hobson,AA,Varsity ,2009,45206,1,1,1,1,1,1,1,1,A, Emblem of Unity (Richards/Swearingen), Prelude to Act I (from La Traviata)  (Verdi/Falcone)," Moscow, 1941  (Balmages)"
36, 100-Concert Band, Winters High School, TEA:, Winters, Phil Mooney / Karen Mooney,A,Varsity ,2009,49882,1,1,2,1,2,1,1,1,A, Brandy Station March (John Edmondson), Crusade  (Gassi), Fire Dance  (Akey)
