,0,1,2,3,4,5,6,7,8,9,10,11,12,13,14,15,16,17,18,19,20,21,22,23,24,25,26,27,28
0, 100-Concert Band, Aragon Middle School, TEA:, Houston, Adam Hymel,CCC,Sub Non-Varsity ,2011,65062,1,1,1,1,1,1,1,1,D, American Spirit March (John Higgins), Theme and Variations  (Broege), Voodoo Dance  (del Borgo),DATE of EVENT 04/01/2011 ,Region: 27,1. Mike Brashear,2. Nancy Caston,3. Jennifer Dillard,1. Sharon Kalisek,2. Joe Pruitt,3. Jill Yancey
1, 100-Concert Band, Aragon Middle School, TEA:, Houston, Beth Wiebe,CCC,Non-Varsity ,2011,65064,1,1,1,1,1,1,1,1,D, Kitty Hawk March (Huckeby), Songs Of The Whalemen  (Del Borgo), The Band in the Square on the Fourth of July  (LaPlante),DATE of EVENT 04/01/2011 ,Region: 27,1. Mike Brashear,2. Nancy Caston,3. Jennifer Dillard,1. Sharon Kalisek,2. Joe Pruitt,3. Jill Yancey
2, 100-Concert Band, Arnold Middle School, TEA:, Cypress, Meredith Bilberry,CCC,Non-Varsity ,2011,63137,1,1,1,1,1,1,1,1,D, Valley Vista March (Steve Hodges), Modal Song and Dance  (Del Borgo), Pinnacle  (Grice),DATE of EVENT 04/01/2011 ,Region: 27,1. Mike Brashear,2. Nancy Caston,3. Jennifer Dillard,1. Sharon Kalisek,2. Joe Pruitt,3. Jill Yancey
3, 100-Concert Band, Bleyl Middle School, TEA:, Houston, Kelly Huffman,CCC,Non-Varsity ,2011,63975,1,2,1,1,1,1,1,1,D, The Steppes of Russia  (Del Borgo), Nottingham Castle  (Daehn), Lone Eagle March (Edmondson),DATE of EVENT 04/01/2011 ,Region: 27,1. Mike Brashear,2. Nancy Caston,3. Jennifer Dillard,1. Sharon Kalisek,2. Joe Pruitt,3. Jill Yancey
4, 100-Concert Band, Brenham Junior High, TEA:, Brenham, Karla Rettig,CCC,Sub Non-Varsity ,2011,64661,1,1,1,1,1,1,1,1,D, Eagle Command March (Hilliard), Nottingham Castle (Daehn), Ming Court (Pitter),DATE of EVENT 04/01/2011 ,Region: 27,1. Mike Brashear,2. Nancy Caston,3. Jennifer Dillard,1. Sharon Kalisek,2. Joe Pruitt,3. Jill Yancey
5, 100-Concert Band, Brenham Junior High, TEA:, Brenham, Shelley Smith,CCC,Non-Varsity ,2011,64663,2,3,3,3,1,1,1,1,2, Voodoo Dance  (del Borgo), Soldiers' Processsion and Sword Dance  (Margolis), Parade of the Gladiators (William Owens),DATE of EVENT 04/01/2011 ,Region: 27,1. Mike Brashear,2. Nancy Caston,3. Jennifer Dillard,1. Sharon Kalisek,2. Joe Pruitt,3. Jill Yancey
6, 100-Concert Band, Campbell MS, TEA:, Houston, Matthew Utter / Scott McAdow,CCC,Non-Varsity ,2011,65131,2,2,1,2,2,2,2,2, , Emblem of Victory (Del Borgo), Chorale and Variation  (Bach/McGinty), Canadian Sketches  (Curnow),DATE of EVENT 04/01/2011 ,Region: 27,1. Mike Brashear,2. Nancy Caston,3. Jennifer Dillard,1. Sharon Kalisek,2. Joe Pruitt,3. Jill Yancey
7, 100-Concert Band, Cook Middle School, TEA:, Houston, Aaron Buntin,CCC,Non-Varsity ,2011,63260,1,1,1,1,1,1,1,1,D, The Lone Eagle March (Edmondson), Legend of Knife River  (Bulla), Cascadia Celebration  (Hodges),DATE of EVENT 04/01/2011 ,Region: 27,1. Mike Brashear,2. Nancy Caston,3. Jennifer Dillard,1. Sharon Kalisek,2. Joe Pruitt,3. Jill Yancey
8, 100-Concert Band, Cook Middle School, TEA:, Houston, Mario A. Prado,CCC,Sub Non-Varsity ,2011,63390,1,2,1,1,1,2,1,1,D, Atlantis  (McGinty), Nottingham Castle  (Daehn), Kingsbury March (Elledge/Pearson),DATE of EVENT 04/01/2011 ,Region: 27,1. Mike Brashear,2. Nancy Caston,3. Jennifer Dillard,1. Sharon Kalisek,2. Joe Pruitt,3. Jill Yancey
9, 100-Concert Band, Dean Middle School, TEA:, Houston, Crissie Warne,CCC,Non-Varsity ,2011,65629,3,3,3,3,2,2,2,2, , Copper Creek March (John Edmondson), Sea Song Trilogy  (McGinty), Two Minute Symphony  (Margolis),DATE of EVENT 04/01/2011 ,Region: 27,1. Mike Brashear,2. Nancy Caston,3. Jennifer Dillard,1. Sharon Kalisek,2. Joe Pruitt,3. Jill Yancey
10, 100-Concert Band, Goodson Middle School, TEA:, Cypress, Lauren Kaminski,CCC,Sub Non-Varsity ,2011,63363,1,1,1,1,1,1,1,1,D, The Lone Eagle March (Edmondson), Wolseys Wilde  (Byrd/McGinty), Fire Dance  (Akey),DATE of EVENT 04/01/2011 ,Region: 27,1. Mike Brashear,2. Nancy Caston,3. Jennifer Dillard,1. Sharon Kalisek,2. Joe Pruitt,3. Jill Yancey
11, 100-Concert Band, Goodson Middle School, TEA:, Cypress, Nicole Stern,CCC,Non-Varsity ,2011,63892,2,2,1,2,1,1,1,1,2, El Conquistador (William Owens and Gene Williams), Gathering In The Glen  (Sweeney), Quintology  (Meyer),DATE of EVENT 04/01/2011 ,Region: 27,1. Mike Brashear,2. Nancy Caston,3. Jennifer Dillard,1. Sharon Kalisek,2. Joe Pruitt,3. Jill Yancey
12, 100-Concert Band, Hamilton Middle School, TEA:, Cypress, Amy Josefy,CCC,Sub Non-Varsity ,2011,63013,2,2,1,2,1,1,1,1,2, Glenwood March (Gorham), A New World Adventure  (Court), Ming Court  (Pitter),DATE of EVENT 04/01/2011 ,Region: 27,1. Mike Brashear,2. Nancy Caston,3. Jennifer Dillard,1. Sharon Kalisek,2. Joe Pruitt,3. Jill Yancey
13, 100-Concert Band, Hamilton Middle School, TEA:, Cypress, Evelyn Sarabia,CCC,Non-Varsity ,2011,63383,1,1,1,1,1,1,1,1,D, March of Freedom (John Edmondson), Russian Sailor's Dance  (Gliere/Williams), Pinnacle  (Grice),DATE of EVENT 04/01/2011 ,Region: 27,1. Mike Brashear,2. Nancy Caston,3. Jennifer Dillard,1. Sharon Kalisek,2. Joe Pruitt,3. Jill Yancey
14, 100-Concert Band, Hopper Middle School, TEA:, Cypress, Ruben Escobar,CCC,Non-Varsity ,2011,65447,2,2,2,2,1,2,2,2, , Atlantis (McGinty), Theme and Variations (Broege), Liberty March (Edmondson),DATE of EVENT 04/01/2011 ,Region: 27,1. Mike Brashear,2. Nancy Caston,3. Jennifer Dillard,1. Sharon Kalisek,2. Joe Pruitt,3. Jill Yancey
15, 100-Concert Band, Kahla Middle School, TEA:, Houston, Carlos Cabrera,CCC,Non-Varsity A,2011,65474,2,1,1,1,1,1,1,1,D, Copper Creek March (John Edmondson), Distant Horizons  (Sweeney), Little Brazil Suite  (Balent),DATE of EVENT 04/01/2011 ,Region: 27,1. Mike Brashear,2. Nancy Caston,3. Jennifer Dillard,1. Sharon Kalisek,2. Joe Pruitt,3. Jill Yancey
16, 100-Concert Band, Labay Middle School, TEA:, Houston, Spencer Little,CCC,Sub Non-Varsity ,2011,64890,1,3,2,2,1,1,2,1,2, Courtlandt County Festival  (Owens), Rise and Shine March (Edmondson), Atlantis  (McGinty),DATE of EVENT 04/01/2011 ,Region: 27,1. Mike Brashear,2. Nancy Caston,3. Jennifer Dillard,1. Sharon Kalisek,2. Joe Pruitt,3. Jill Yancey
17, 100-Concert Band, Labay Middle School, TEA:, Houston, Jonathan Rees,CCC,Non-Varsity ,2011,64913,1,1,1,1,1,1,1,1,D, Valley Forge March (Edmondson), Chorale Prelude  (McGinty), Legend of Knife River  (Bulla),DATE of EVENT 04/01/2011 ,Region: 27,1. Mike Brashear,2. Nancy Caston,3. Jennifer Dillard,1. Sharon Kalisek,2. Joe Pruitt,3. Jill Yancey
18, 100-Concert Band, Memorial Middle School, TEA:, Houston, Michael Moreau,CCC,Non-Varsity ,2011,63719,2,1,2,2,1,1,1,1,2, Lexington March (Edmondson), Canon of Peace  (Jennings), Soldiers' Processsion and Sword Dance  (Margolis),DATE of EVENT 04/01/2011 ,Region: 27,1. Mike Brashear,2. Nancy Caston,3. Jennifer Dillard,1. Sharon Kalisek,2. Joe Pruitt,3. Jill Yancey
19, 100-Concert Band, Smith Middle School, TEA:, Cypress, Adam Schmitz / Steve Silva,CCC,Sub Non-Varsity B,2011,65327,2,3,2,2,2,2,2,2, , Infinity March (James Curnow), Little Brazil Suite  (Balent), Starship  (O'Reilly),DATE of EVENT 04/01/2011 ,Region: 27,1. Mike Brashear,2. Nancy Caston,3. Jennifer Dillard,1. Sharon Kalisek,2. Joe Pruitt,3. Jill Yancey
20, 100-Concert Band, Smith Middle School, TEA:, Cypress, Adam Schmitz / Steve Silva,CCC,Sub Non-Varsity A,2011,65320,1,1,1,1,1,1,1,1,D, Lexington March (John Edmondson), Pinnacle  (Grice), American Folk Tune Adventure  (Gorham),DATE of EVENT 04/01/2011 ,Region: 27,1. Mike Brashear,2. Nancy Caston,3. Jennifer Dillard,1. Sharon Kalisek,2. Joe Pruitt,3. Jill Yancey
21, 100-Concert Band, Smith Middle School, TEA:, Cypress, Steven E. Silva,CCC,Non-Varsity ,2011,65176,1,1,1,1,1,1,1,1,D, Alamo March (King / Swearingen), A Farnaby Prelude  (Akey),  Choreography  (Sheldon),DATE of EVENT 04/01/2011 ,Region: 27,1. Mike Brashear,2. Nancy Caston,3. Jennifer Dillard,1. Sharon Kalisek,2. Joe Pruitt,3. Jill Yancey
22, 100-Concert Band, Spillane Middle School, TEA:, Cypress, Amy Denham,CCC,Non-Varsity ,2011,64743,1,1,1,1,1,1,1,1,D, Fanfare for a New Age  (Story), Phantom Ship  (Del Borgo), March on a Welsh Air (Edmondson),DATE of EVENT 04/01/2011 ,Region: 27,1. Mike Brashear,2. Nancy Caston,3. Jennifer Dillard,1. Sharon Kalisek,2. Joe Pruitt,3. Jill Yancey
23, 100-Concert Band, Thornton Middle School, TEA:, Katy, Kyle Mapp,CCC,Non-Varsity ,2011,64644,2,2,2,2,1,1,2,1,2, Nottingham Castle  (Daehn), Theme and Variations  (Broege), Mount Royal (Edmondson),DATE of EVENT 04/01/2011 ,Region: 27,1. Mike Brashear,2. Nancy Caston,3. Jennifer Dillard,1. Sharon Kalisek,2. Joe Pruitt,3. Jill Yancey
24, 100-Concert Band, Truitt Middle School, TEA:, Houston, Kimberly Pfeffer,CCC,Non-Varsity ,2011,65274,1,1,1,1,1,1,1,1,D, Mount Vernon March (Edmondson), Wildwind Overture  (Kinyon), Sea Song Trilogy  (McGinty),DATE of EVENT 04/01/2011 ,Region: 27,1. Mike Brashear,2. Nancy Caston,3. Jennifer Dillard,1. Sharon Kalisek,2. Joe Pruitt,3. Jill Yancey
25, 100-Concert Band, Watkins Middle School, TEA:, Houston, Amy Gonzalez,CCC,Non-Varsity ,2011,64625,2,2,2,2,1,1,1,1,2, Tunbridge Meadows  (Williams), Sea Song Trilogy  (McGinty), Yorktown March (Edmondson),DATE of EVENT 04/01/2011 ,Region: 27,1. Mike Brashear,2. Nancy Caston,3. Jennifer Dillard,1. Sharon Kalisek,2. Joe Pruitt,3. Jill Yancey
