,Event,School,TEA,City,Directors,Conference,Classification,Year,ID,Stage Judge 1,Stage Judge 2,Stage Judge 3,Stage Final,SR Judge 1,SR Judge 2,SR Judge 3,SR Final,Award,Selection 1,Selection 2,Selection 3,oops
0, 100-Concert Band, Ann Richards High School, TEA:, Austin," Amanda Elizondo / Stephen Howard, Emily Bingham",CC,Varsity ,2019,142163,1,1,1,1,1,1,1,1,C, March of the Hyperion Guards (Sheldon), Colliding Visions  (Balmages), Mythos  (Bernotas),
1, 100-Concert Band, Burton High School, TEA:, Burton, Larry Silcox,AA,Var-Composite ,2019,141780,3,2,3,3,2,2,3,2, , The Red Cape (Meredith), Chorale and Variation  (Bach/McGinty), Kenya Contrasts  (Himes),
2, 100-Concert Band, Caldwell Middle School, TEA:, Caldwell, Nikki Moore / Cody Knott,CC,Non-Varsity ,2019,140719,2,1,1,1,1,1,1,1,D, Infinity March (Curnow), Two Minute Symphony  (Margolis), Plaza de Toros  (Story),
3, 100-Concert Band, Columbus Junior High School, TEA:, Columbus, Amanda Robison / Robert Eaton,C,Varsity ,2019,142115,1,1,1,1,1,1,1,1,C, Fighting Falcon March (Stalter), Theme and Variations  (Broege), Night Fury  (Chambers),
4, 100-Concert Band, Flatonia High School, TEA:, Flatonia, Bob Hansen / Tim Ludtman,AA,Var-Composite ,2019,141725,2,1,1,1,1,1,1,1,A, Marzo Zingaro (Standridge), Danza de Espana  (Chambers), The Tears of Arizona  (Balmages),
5, 100-Concert Band, Giddings Middle School (26), TEA:, GIDDINGS, Anthony Tiger / Brian Stewart,CC,Varsity ,2019,142282,2,1,2,2,2,1,1,1,2, March of the Scots Guard Robert E. Foster (), Danza de Espana Carol Brittin Chambers (), Japanese Pictures Kevin Mixon (),
6, 100-Concert Band, Gonzales Jr. High, TEA:, Gonzales, Jerry Scoggin / Ian McDaniel,CC,Non-Varsity ,2019,139748,3,4,3,3,2,3,3,3, , Union March (Mekel Rogers), Dance Celebration (Robert Smith), The Spacious Firmament On High (Chris Sharp),
7, 100-Concert Band, Gonzales Jr. High, TEA:, Gonzales, Jerry Scoggin / Ian McDaniel,CC,Varsity ,2019,139747,3,3,4,3,2,3,2,2, , Nottingham March (Jerry Williams), Fireball! (Brian Beck), Corps of Discovery (William Owens),
8, 100-Concert Band, Granger High School, TEA:, Granger, Harvey Davidson,AA,Varsity ,2019,139752,2,3,3,3,2,1,2,2, , Stratosphere  (Beckham), Sparks  (Balmages), Colonel Bogey (Alford/Williams),
9, 100-Concert Band, Granger Middle School, TEA:, Granger, Harvey Davidson,C,Non-Varsity ,2019,142893,3,3,2,3,2,1,1,1,2, Armory  (Standridge), Colliding Visions  (Balmages), Valdres (Hanssen/Smith),
10, 100-Concert Band, Hallettsville Junior High, TEA:, Hallettsville, Jessica Carter / Mark Halamicek,C,Varsity ,2019,142367,1,1,1,1,1,1,1,1,C, Wedgwood March (William Owens), Dorian Chant (Bill Calhoun), Plaza de Toros (Michael Story),
11, 100-Concert Band, La Grange ISD, TEA:, La Grange," Dana Parker / Mark Kesselring, Ramon Parker",CC,Non-Varsity ,2019,142193,1,1,1,1,1,1,1,1,D, And the Trumpets Sound (Turner), Song of Hope (Swearingen), Challenger Point (Johnson),
12, 100-Concert Band, La Grange ISD, TEA:, La Grange," Mark Kesselring / Dana Parker, Ramon Parker",CC,Varsity ,2019,142232,1,1,1,1,2,1,2,2,2, Tall Cedars (Osterling), Egyptique  (Owens), Japanese Pictures  (Mixon),
13, 100-Concert Band, Rockdale Jr. High School (26), TEA:, Rockdale, Marco Estrada / Adrian A. Acevedo,C,Varsity ,2019,140004,1,1,1,1,1,1,1,1,C, Spitfire (Michael Story), Fortis  (Gazlay), Tanchozuru  (Standridge),
14, 100-Concert Band, Schulenburg High School, TEA:, Schulenburg, Luis de la Garza,AAA,Var-Composite ,2019,140392,1,1,1,1,1,2,2,2,1, The Big Circus March (Foster), Crusade  (Gassi), Barbarossa  (Himes),
15, 100-Concert Band, Shiner High School, TEA:, Shiner," Whitney Sims / Jacob Schulte, Zachary Sims",AA,NVar-Composite ,2019,141479,2,2,1,2,1,1,1,1,2, Summit March (Bennett/Clark), Colliding Visions  (Balmages), Majestica  (Gazlay),
16, 100-Concert Band, Shiner High School, TEA:, Shiner, Zachary Sims / Jacob Schulte,AA,Var-Composite ,2019,141427,1,1,1,1,1,1,1,1,A, Cincinnatus (Vandercook), Abracadabra  (Ticheli), West Highlands Sojourn  (Sheldon),
17, 100-Concert Band, Smithville Jr. High School, TEA:, Smithville, Dianna King,CC,Varsity ,2019,141494,1,1,1,1,1,1,1,1,C, Parade of the Wooden Soldiers (Ralph Ford), River of Dreams  (Lopez), Bazaar  (Standridge),
18, 100-Concert Band, Taylor Middle School (26), TEA:, TAYLOR, Brianna Perry / Emily Gazeley and Jared Perry,CC,Varsity ,2019,141666,1,1,1,1,1,1,1,1,C, Heroes Triumphant  (Owens), In a Quiet Place  (Calhoun), Marche Diabolique (Balmages),
19, 100-Concert Band, Taylor Middle School (26), TEA:, Taylor," Emily Gazeley / Brianna Perry, Jared Perry",CC,Non-Varsity ,2019,141757,1,2,2,2,1,2,2,2, , Canon of Peace  (Jennings), Colliding Visions  (Balmages), March for a Norwegian Penguin (Wagner),
20, 100-Concert Band, Thorndale HS, TEA:, THORNDALE, Michael Powers / Kendall Freeman, Acc:N/A,AA,Var-Composite ,2019,141738,1,1,1,1,1,1,1,1,A, Marzo Zingaro (Standridge), Mosswood Lullaby  (Beck)," Moscow, 1941  (Balmages)"
21, 100-Concert Band, Thrall high School, TEA:, Thrall, Elizabeth Morrison / Bana Estes,AA,Varsity ,2019,141712,1,1,1,1,1,1,1,1,A, Emblem of Unity (Richards/Swearingen), The Rowan Tree  (Standridge), Eagles Awake!  (Saucedo),
22, 100-Concert Band, Weimar High School, TEA:, Weimar, Henry Dreitner / Caitlin Dreitner,AA,Var-Composite ,2019,140488,1,1,1,1,1,1,1,1,B, Flying Tigers (David Shaffer), Ave Verum Corpus  (Mozart/Williams), Night Fury  (Chambers),
23, 100-Concert Band, Wimberley Junior High, TEA:, Wimberley," Rance Mosley / John Winebrenner, Ryan Hall",CC,Varsity ,2019,140446,1,1,1,1,1,1,1,1,C, Fleur-de-lis March  (Feldstein / Clark), Colliding Visions  (Brian Balmages), Bazaar  (Randall D. Standridge ),
