,0,1,2,3,4,5,6,7,8,9,10,11,12,13,14,15,16,17,18,19,20,21,22,23,24,25,26,27,28
0, 100-Concert Band, Ann Richards Middle School, TEA:, Austin, Ann Peace,CC,Non-Varsity ,2014,87993,1,1,2,1,1,1,1,1,D, Medal of Freedom (Roland Barrett), Shepherd's Hey  (Traditional/Roszell), Exhortation  (Gazlay/ ),DATE of EVENT 03/04/2014 ,Region: 18,1. Rocky Harris,2. Robert Rubio,"3. Ralph Zamarippa, Jr.",1. Mike Brady,2. Kenneth Griffin (Chrmn.),3. Matt Knight
1, 100-Concert Band, Burnet Middle School (26), TEA:, Burnet, Abby Wood,CC,Non-Varsity ,2014,88148,1,2,1,1,1,1,1,1,D, Confidence March (Larry Clark), Elizabethan Dance  (Williams/ ), Courtlandt County Festival  (Owens/ ),DATE of EVENT 03/04/2014 ,Region: 18,1. Rocky Harris,2. Robert Rubio,"3. Ralph Zamarippa, Jr.",1. Mike Brady,2. Kenneth Griffin (Chrmn.),3. Matt Knight
2, 100-Concert Band, Burnet Middle School, TEA:, Burnet, Dusty Rhea / Abby Wood,CC,Varsity ,2014,88150,1,1,1,1,1,1,1,1,C, Big Circus March (Robert E. Foster), Colliding Visions  (Balmages/ ), Japanese Pictures  (Mixon/ ),DATE of EVENT 03/04/2014 ,Region: 18,1. Rocky Harris,2. Robert Rubio,"3. Ralph Zamarippa, Jr.",1. Mike Brady,2. Kenneth Griffin (Chrmn.),3. Matt Knight
3, 100-Concert Band, Jarrell Middle School, TEA:, Jarrell, Jesus Ibarra / Cheryl Guy,C,Varsity ,2014,90788,2,2,2,2,2,1,2,2, , Crown Point March (Bruce Pearson), Dance Celebration (Robert W. Smith), Storm Mountain Jubilee (Carl Strommen),DATE of EVENT 03/04/2014 ,Region: 18,1. Rocky Harris,2. Robert Rubio,"3. Ralph Zamarippa, Jr.",1. Mike Brady,2. Kenneth Griffin (Chrmn.),3. Matt Knight
4, 100-Concert Band, Johnson City Middle School, TEA:, Johnson City, Bryan Anders / Chelsea Herring,C,Varsity ,2014,90943,3,3,2,3,4,3,3,3, , Tenderfoot (March) (Leroy Jackson), Sakura (Cherry Blossoms) (Mike Story), Atlantis (Anne McGinty),DATE of EVENT 03/04/2014 ,Region: 18,1. Rocky Harris,2. Robert Rubio,"3. Ralph Zamarippa, Jr.",1. Mike Brady,2. Kenneth Griffin (Chrmn.),3. Matt Knight
5, 100-Concert Band, Liberty Hill Junior High, TEA:, Liberty Hill," Jared Clarkson / John Perrin, Andy Anker, Kevin Baird",CC,Non-Varsity ,2014,87759,2,2,1,2,2,1,1,1,2, March of the Aliens (Gott), Atlantis (McGinty/), Cascadia Celebration (Hodges/ ),DATE of EVENT 03/04/2014 ,Region: 18,1. Rocky Harris,2. Robert Rubio,"3. Ralph Zamarippa, Jr.",1. Mike Brady,2. Kenneth Griffin (Chrmn.),3. Matt Knight
6, 100-Concert Band, Liberty Hill Junior High, TEA:, Liberty Hill," Jared Clarkson / John Perrin, Andy Anker, Kevin Baird",CC,Varsity ,2014,87758,2,2,1,2,1,2,1,1,2, Winchester March (Edmonson), Knights of Dunvegan  (Meyer/ ), Fire Dance (Akey/ ),DATE of EVENT 03/04/2014 ,Region: 18,1. Rocky Harris,2. Robert Rubio,"3. Ralph Zamarippa, Jr.",1. Mike Brady,2. Kenneth Griffin (Chrmn.),3. Matt Knight
7, 100-Concert Band, Smithville Junior High, TEA:, Smithville, Dianna King,CC,Varsity ,2014,88284,2,2,2,2,1,3,1,1,2, Newcastle March (Vinson), First Light  (Ticheli/ ), Marching Song  (Holst/Moss),DATE of EVENT 03/04/2014 ,Region: 18,1. Rocky Harris,2. Robert Rubio,"3. Ralph Zamarippa, Jr.",1. Mike Brady,2. Kenneth Griffin (Chrmn.),3. Matt Knight
8, 100-Concert Band, Wimberley Junior High, TEA:, Wimberley, Buford Robins,CC,Varsity ,2014,88207,3,2,2,2,1,1,1,1,2, Winchester March (Edmondson), Ariodante Suite (play all) (Handel/Elledge), Sea Song Trilogy (McGinty/ ),DATE of EVENT 03/04/2014 ,Region: 18,1. Rocky Harris,2. Robert Rubio,"3. Ralph Zamarippa, Jr.",1. Mike Brady,2. Kenneth Griffin (Chrmn.),3. Matt Knight
