,0,1,2,3,4,5,6,7,8,9,10,11,12,13,14,15,16,17,18,19,20,21,22,23,24,25,26,27,28
0, 100-Concert Band,  Nimitz High School, TEA: 101902005, Houston," Emilio Reyna / Gabrielle Landeros, Brendan Friday",AAAAAA,Non-Varsity ,2022,178211,1,1,2,1,2,2,2,2,1, Conquista (Shaffer), Alligator Alley (15877)  (Daugherty), Japanese Pictures (18467)  (Mixon),DATE of EVENT 04/28/2022 ,Region: 33,1. Rick Yancy,2. Greg Hames,3. Rey Meza,1. Kevin Woods,2. Larry Brown,3. Darla McBride
1, 100-Concert Band,  Nimitz High School, TEA: 101902005, Houston," Emilio Reyna / Gabrielle Landeros, Brendan Friday",AAAAAA,Varsity ,2022,174530,1,1,1,1,1,1,1,1,A, Bandancing (15837)  (Stamp), Shadow Rituals (15822)  (Markowski), March Chagu Chagu (Yagisawa),DATE of EVENT 04/28/2022 ,Region: 33,1. Rick Yancy,2. Greg Hames,3. Rey Meza,1. Kevin Woods,2. Larry Brown,3. Darla McBride
2, 100-Concert Band, Aldine High School, TEA: 101902, Houston," Jeremy Gray / Lee Redfearn, Jose Navarette, Dominic Dawkins",AAAAAA,Varsity ,2022,178197,1,1,1,1,1,1,1,1,A, Guide Right March (John Phillip Sousa), Fantasy on a Japanese Folk Song (15853)  (Hazo), What Goes in the Night (15827)  (Giroux),DATE of EVENT 04/28/2022 ,Region: 33,1. Rick Yancy,2. Greg Hames,3. Rey Meza,1. Kevin Woods,2. Larry Brown,3. Darla McBride
3, 100-Concert Band, Atascocita High School, TEA: 101913008, Humble," Anthony Hicks / Doug Grice, Haley Cook",AAAAAA,Non-Varsity ,2022,177693,2,1,1,1,1,1,1,1,B, Undertow (Mackey), Kalos Eidos (Chambers), The American Red Cross (Panella/Glover),DATE of EVENT 04/28/2022 ,Region: 33,1. Rick Yancy,2. Greg Hames,3. Rey Meza,1. Kevin Woods,2. Larry Brown,3. Darla McBride
4, 100-Concert Band, Atascocita High School, TEA: 101913008, Humble," Douglas Grice / Anthony Hicks, Hailey Cook",AAAAAA,Varsity ,2022,177543,1,1,1,1,1,1,1,1,A, Vesuvius (418)  (Ticheli), First Suite in Eb for Military Band (514)  (Holst/Matthews/Fennell), The Fairest of the Fair (Sousa/Fennell),DATE of EVENT 04/28/2022 ,Region: 33,1. Rick Yancy,2. Greg Hames,3. Rey Meza,1. Kevin Woods,2. Larry Brown,3. Darla McBride
5, 100-Concert Band, C. E. King High School, TEA: 101924001, Houston," Liz Boone / Alejandro Cruz, Josh Bretzke",AAAAAA,Non-Varsity A,2022,174990,1,1,1,1,1,1,1,1,B, Gallito (Santiago Lope), A Hymn for Band (155) (Stuart/), Dancing at Stonehenge (16672) (Suter/),DATE of EVENT 04/28/2022 ,Region: 33,1. Rick Yancy,2. Greg Hames,3. Rey Meza,1. Kevin Woods,2. Larry Brown,3. Darla McBride
6, 100-Concert Band, Davis HS, TEA: 101902, Houston, Rod Soto / Angela Klinkner,AAAAAA,Varsity ,2022,178043,2,2,1,2,1,1,1,1,1, Invercargill March (Lithgow/arr. Glover), Shadow Rituals (15822)  (Markowski), Suite of Old American Dances (449) (play at least four mvts) (Bennett),DATE of EVENT 04/28/2022 ,Region: 33,1. Rick Yancy,2. Greg Hames,3. Rey Meza,1. Kevin Woods,2. Larry Brown,3. Darla McBride
7, 100-Concert Band, Davis HS, TEA: 443644, Houston, Nick Draper,AAAAAA,Non-Varsity ,2022,178045,2,1,1,1,2,2,1,2,1, Espana Cani (Narro/Story), Rippling Watercolors (Balmages), Spoon River (Grainger/Sheldon),DATE of EVENT 04/28/2022 ,Region: 33,1. Rick Yancy,2. Greg Hames,3. Rey Meza,1. Kevin Woods,2. Larry Brown,3. Darla McBride
8, 100-Concert Band, Dekaney HS, TEA: 101-919-003, Houston," Chase Giddings / Tabatha Cooper, Abraham Nunez, Israel Lopez",AAAAAA,Varsity ,2022,178219,1,1,1,1,1,2,1,1,A," Cyrus The Great (King, Karl. L/Glover)"," Elegy for a Young American (376)  (LoPresti, Ronald)"," The Sorcerer's Apprentice (487)  (Dukas, Paul/Hindsley)",DATE of EVENT 04/28/2022 ,Region: 33,1. Rick Yancy,2. Greg Hames,3. Rey Meza,1. Kevin Woods,2. Larry Brown,3. Darla McBride
9, 100-Concert Band, Dekaney HS, TEA: 101919003, Tomball," Tabatha Cooper / Chase Giddings, Abraham Nunez, Israel Lopez",AAAAAA,Non-Varsity A,2022,177663,1,2,1,1,1,1,2,1,B, Brave Spirit  (Standridge ), Songs of the Whalemen (Del Borgo), Grand Galop  (Vinson),DATE of EVENT 04/28/2022 ,Region: 33,1. Rick Yancy,2. Greg Hames,3. Rey Meza,1. Kevin Woods,2. Larry Brown,3. Darla McBride
10, 100-Concert Band, Eisenhower HS, TEA: 101-902-004, Houston, Timothy Richardson,AAAAAA,Non-Varsity ,2022,178207,1,2,1,1,1,1,1,1,C, Summer Dances (704)  (Balmages), Chanteys (697)  (Sheldon), Don Hanna  (Musella),DATE of EVENT 04/28/2022 ,Region: 33,1. Rick Yancy,2. Greg Hames,3. Rey Meza,1. Kevin Woods,2. Larry Brown,3. Darla McBride
11, 100-Concert Band, Humble HS, TEA: 101-913-001, Humble, Cory Roberts,AAAAAA,Varsity ,2022,178126,2,1,1,1,2,1,1,1,A, Amparito Roca (Texidor/Winter), In the Center Ring (16683) (Sheldon/), Canarios Fantasia (680) (Akey/),DATE of EVENT 04/28/2022 ,Region: 33,1. Rick Yancy,2. Greg Hames,3. Rey Meza,1. Kevin Woods,2. Larry Brown,3. Darla McBride
12, 100-Concert Band, Humble HS, TEA: 101-913-001, Humble," Jon Whitelock / Cory Roberts, Doug Maake",AAAAAA,Non-Varsity ,2022,178158,1,2,2,2,2,1,1,1,1, Circus Days  (King/Schissel), Lone Eagle (24129)  (Sheldon), Contempo (16202)  (Story),DATE of EVENT 04/28/2022 ,Region: 33,1. Rick Yancy,2. Greg Hames,3. Rey Meza,1. Kevin Woods,2. Larry Brown,3. Darla McBride
13, 100-Concert Band, Kingwood HS, TEA: 101913002, Kingwood," Tyler Morrison / Hannah Scott, Kameron Landes",AAAAAA,Non-Varsity ,2022,178012,2,2,1,2,1,1,1,1,1, The Big Cage March (K.L. King), Summer Dances (704)  (Balmages)," Prelude, Siciliano and Rondo (317)  (Arnold/Paynter)",DATE of EVENT 04/28/2022 ,Region: 33,1. Rick Yancy,2. Greg Hames,3. Rey Meza,1. Kevin Woods,2. Larry Brown,3. Darla McBride
14, 100-Concert Band, Kingwood HS, TEA: 101913002, Kingwood," Tyler Morrison / Hannah Scott, Kameron Landes",AAAAAA,Varsity A,2022,178010,1,1,1,1,1,1,1,1,A, Cyrus the Great March (K.L. King), La Procession du Rocio (606)  (Turina/Reed), Niagara Falls (481)  (Daugherty),DATE of EVENT 04/28/2022 ,Region: 33,1. Rick Yancy,2. Greg Hames,3. Rey Meza,1. Kevin Woods,2. Larry Brown,3. Darla McBride
15, 100-Concert Band, MacArthur HS, TEA: 480771000076, Houston," James DeBose / Jose Funes, Catherine Ruiz",AAAAAA,Non-Varsity ,2022,178175,1,1,1,1,3,2,2,2,1, Crusade (16224)  (Gassi)," Moscow, 1941 (15892)  (Balmages)", Plaza de Toros (20709)  (Story),DATE of EVENT 04/28/2022 ,Region: 33,1. Rick Yancy,2. Greg Hames,3. Rey Meza,1. Kevin Woods,2. Larry Brown,3. Darla McBride
16, 100-Concert Band, MacArthur HS, TEA: 480771000076, Houston," James DeBose / Jose Funes, Catherine Ruiz",AAAAAA,Varsity ,2022,178174,1,1,1,1,2,1,1,1,A, Undertow (17456)  (Mackey), Blue and Green Music (18199)  (Hazo), The Slavic Woman's Farewell (Agapkin/Rhea),DATE of EVENT 04/28/2022 ,Region: 33,1. Rick Yancy,2. Greg Hames,3. Rey Meza,1. Kevin Woods,2. Larry Brown,3. Darla McBride
17, 100-Concert Band, North Shore Senior High School, TEA: 101910, Houston," Michael Tenaglio / Shane Goforth, Brandon Laird, Jay Davis",AAAAAA,Non-Varsity ,2022,178052,1,1,1,1,1,1,1,1,B, Rough-Riders (Karl L. King/Swearingen), A Longford Legend (Robert Sheldon), The Old Red Mill (Brant Karrick),DATE of EVENT 04/28/2022 ,Region: 33,1. Rick Yancy,2. Greg Hames,3. Rey Meza,1. Kevin Woods,2. Larry Brown,3. Darla McBride
18, 100-Concert Band, North Shore Sr HS, TEA: 101910, Houston," Shane Goforth / Michael Tenaglio, Brandon Laird, and Jay Davis",AAAAAA,Varsity ,2022,178048,1,1,1,1,1,1,1,1,A, Glory of the Yankee Navy (John Philip Sousa), Irish Tune from County Derry AND Shepherds Hey (501)  (Grainger), Symphonic Movement (546)  (Nelhybel),DATE of EVENT 04/28/2022 ,Region: 33,1. Rick Yancy,2. Greg Hames,3. Rey Meza,1. Kevin Woods,2. Larry Brown,3. Darla McBride
19, 100-Concert Band, Spring High School, TEA: 1019019001, Spring," Terri Risinger Clemons / Jason Andrew Smith, Austin Swack",AAAAAA,Varsity ,2022,176751,1,1,1,1,1,1,1,1,A, Symphony for Band (565)  (Persichetti), Blue Shades (600)  (Ticheli), Solid Men To The Front (Sousa),DATE of EVENT 04/28/2022 ,Region: 33,1. Rick Yancy,2. Greg Hames,3. Rey Meza,1. Kevin Woods,2. Larry Brown,3. Darla McBride
20, 100-Concert Band, Summer Creek High School, TEA: 101913014, Houston, Lisa Brown / Rachael Sitka,AAAAAA,Non-Varsity ,2022,178176,1,1,1,1,1,1,1,1,B, Kalos Eidos (Chambers), Benediction (Stevens), Circus Days (King/Schissel),DATE of EVENT 04/28/2022 ,Region: 33,1. Rick Yancy,2. Greg Hames,3. Rey Meza,1. Kevin Woods,2. Larry Brown,3. Darla McBride
21, 100-Concert Band, Summer Creek High School, TEA: 101913014, Houston, Rachael Sitka / Lisa Brown,AAAAAA,Varsity ,2022,178177,1,1,1,1,1,1,1,1,A, Amparito Roca (Texidor/Winter), Shepherds Hey (355) (Grainger/Rogers), Festivo (505) (Gregson/),DATE of EVENT 04/28/2022 ,Region: 33,1. Rick Yancy,2. Greg Hames,3. Rey Meza,1. Kevin Woods,2. Larry Brown,3. Darla McBride
22, 100-Concert Band, Westfield HS, TEA: 101919002, Houston," Joe Falcon / Bethany Smith, Ryan Culotta",AAAAAA,Non-Varsity ,2022,178191,1,1,1,1,1,1,2,1,B, Colliding Visions (17502)  (Balmages)," Simple Gifts, Four Shaker Songs (676) (play mvt 2) (Ticheli)", Spania (Shaffer),DATE of EVENT 04/28/2022 ,Region: 33,1. Rick Yancy,2. Greg Hames,3. Rey Meza,1. Kevin Woods,2. Larry Brown,3. Darla McBride
23, 100-Concert Band, Westfield HS, TEA: 101919002, Houston," Joe Falcon / Bethany Smith, Ryan Culotta",AAAAAA,Varsity ,2022,178190,1,1,1,1,1,1,1,1,A, Symphonic Dance No. 3 (Fiesta) (430)  (Williams), Lux Aurumque (16207)  (Whitacre), The Fairest of the Fair (Sousa/Fennell),DATE of EVENT 04/28/2022 ,Region: 33,1. Rick Yancy,2. Greg Hames,3. Rey Meza,1. Kevin Woods,2. Larry Brown,3. Darla McBride
