,0,1,2,3,4,5,6,7,8,9,10,11,12,13,14,15,16,17,18,19,20,21,22,23,24,25,26,27,28
0, 100-Concert Band, Archer City HS, TEA:, Archer City, Karen Brunker / Kevin Elliston,AA,Varsity ,2019,147198,2,2,2,2,1,1,1,1,2, Spania (David Shaffer), Fanfare for a New Age  (Story), The Tears of Arizona  (Balmages),DATE of EVENT 04/03/2019 ,Region: 7,1. Jim Bode,2. Forrester Halamicek,3. Ray Portillo,1. Patrick Dietz,2. Rustin Honeycut,3. Keith Zuehlke
1, 100-Concert Band, Brownwood HS, TEA:, Brownwood," David A Lambert / Lesley Lambert, MaryAnn Spurlock",AAAA,Varsity ,2019,143886,1,1,1,1,1,1,1,1,A, Peacemaker March  (King / Swearingen), Benediction (Stevens), Accolade (Himes ),DATE of EVENT 04/03/2019 ,Region: 7,1. Jim Bode,2. Forrester Halamicek,3. Ray Portillo,1. Patrick Dietz,2. Rustin Honeycut,3. Keith Zuehlke
2, 100-Concert Band, Brownwood HS, TEA:, Brownwood," David A Lambert / Lesley Lambert, MaryAnn Spurlock, Joshua Carroll",AAAA,NVar-Composite ,2019,146495,1,1,1,1,1,1,1,1,C, Forward March (Paul Murtha), Armory  (Standridge), Plaza de Toros  (Story),DATE of EVENT 04/03/2019 ,Region: 7,1. Jim Bode,2. Forrester Halamicek,3. Ray Portillo,1. Patrick Dietz,2. Rustin Honeycut,3. Keith Zuehlke
3, 100-Concert Band, Cisco HS, TEA:, Cisco, Tony Dorsey / Brett Batchelor,AAA,Var-Composite ,2019,146991,2,2,2,2,2,1,2,2, , Alamo March (King/Swearingen), Joy (Ticheli), The Steppes of Russia  (Del Borgo),DATE of EVENT 04/03/2019 ,Region: 7,1. Jim Bode,2. Forrester Halamicek,3. Ray Portillo,1. Patrick Dietz,2. Rustin Honeycut,3. Keith Zuehlke
4, 100-Concert Band, City View HS, TEA:, Wichita Falls," Terah Shawver / Robert Thomas, Gene Osburn, Vicki Seigler",AAA,Varsity ,2019,145715,1,1,1,1,1,1,1,1,A, Monterey March (La Plante), As Twilight Falls (Sheldon), Eagles Awake! (Saucedo),DATE of EVENT 04/03/2019 ,Region: 7,1. Jim Bode,2. Forrester Halamicek,3. Ray Portillo,1. Patrick Dietz,2. Rustin Honeycut,3. Keith Zuehlke
5, 100-Concert Band, Cross Plains HS, TEA:, Cross Plains, Richard Murrow,AA,Var-Composite ,2019,145293,2,3,3,3,3,2,3,3, , Medieval Legend  (Story), Song of Hope  (Swearingen), Newcastle March (Vinson),DATE of EVENT 04/03/2019 ,Region: 7,1. Jim Bode,2. Forrester Halamicek,3. Ray Portillo,1. Patrick Dietz,2. Rustin Honeycut,3. Keith Zuehlke
6, 100-Concert Band, Dublin HS, TEA:, Dublin," Ronny Luedke / Cathryn Rasbury, Paul Higgins",AAA,Varsity ,2019,146562,2,2,1,2,1,2,2,2, , Winchester March (Edmondson), As Twilight Falls  (Sheldon)," Moscow, 1941  (Balmages)",DATE of EVENT 04/03/2019 ,Region: 7,1. Jim Bode,2. Forrester Halamicek,3. Ray Portillo,1. Patrick Dietz,2. Rustin Honeycut,3. Keith Zuehlke
7, 100-Concert Band, Early HS, TEA:, Early, Bill Blackburn / Charla Garcia,AAA,Varsity ,2019,143743,2,2,2,2,3,3,2,3, , Cape Breton March (O'Reilly), Pinnacle  (Grice), Two British Folk Songs  (Del Borgo),DATE of EVENT 04/03/2019 ,Region: 7,1. Jim Bode,2. Forrester Halamicek,3. Ray Portillo,1. Patrick Dietz,2. Rustin Honeycut,3. Keith Zuehlke
8, 100-Concert Band, Eastland High School, TEA:, Eastland," Jett Lowrance / Stephen Cox, Juan Hernandez",AAA,Non-Varsity ,2019,148156,2,2,1,2,1,1,1,1,2, Pink Lemonade (Contorno), Lullaby in the Mirror  (Saucedo), Sparks  (Balmages),DATE of EVENT 04/03/2019 ,Region: 7,1. Jim Bode,2. Forrester Halamicek,3. Ray Portillo,1. Patrick Dietz,2. Rustin Honeycut,3. Keith Zuehlke
9, 100-Concert Band, Eastland HS, TEA:, Eastland," Stephen Cox / Jett Lowrance, Juan Hernandez",AAA,Varsity ,2019,148143,1,1,1,1,1,1,1,1,A, Easter Monday on the White House Lawn (J P Sousa / Mark Rogers), On a Hymnsong of Philip Bliss (David R. Holsinger), Vesuvius (Frank Ticheli),DATE of EVENT 04/03/2019 ,Region: 7,1. Jim Bode,2. Forrester Halamicek,3. Ray Portillo,1. Patrick Dietz,2. Rustin Honeycut,3. Keith Zuehlke
10, 100-Concert Band, Electra HS, TEA:, Electra, Priscilla G Gibson,AA,Var-Composite ,2019,149832,2,2,2,2,1,2,1,1,1, Laredo March (Higgins), Broken Bow  (Strommen), Pinnacle  (Grice),DATE of EVENT 04/03/2019 ,Region: 7,1. Jim Bode,2. Forrester Halamicek,3. Ray Portillo,1. Patrick Dietz,2. Rustin Honeycut,3. Keith Zuehlke
11, 100-Concert Band, Henrietta HS, TEA:, Henrietta, Alan Barnett / Kevin Gilpatrick,AAA,Varsity ,2019,146949,2,2,2,2,2,3,2,2, , Conquista Spanish March (David Shaffer), Black Forest Overture  (Sweeney), Brave Spirit  (Standridge),DATE of EVENT 04/03/2019 ,Region: 7,1. Jim Bode,2. Forrester Halamicek,3. Ray Portillo,1. Patrick Dietz,2. Rustin Honeycut,3. Keith Zuehlke
12, 100-Concert Band, Mineral Wells HS, TEA:, Mineral Wells," Elton Ball / David Baggett, Brittany DeLaVergne",AAAA,Varsity ,2019,146509,1,1,1,1,2,2,2,2,1, The Black Horse Troop (Sousa/Fennell), In The Shining of the Stars (Sheldon), Arabian Dances (Balmages),DATE of EVENT 04/03/2019 ,Region: 7,1. Jim Bode,2. Forrester Halamicek,3. Ray Portillo,1. Patrick Dietz,2. Rustin Honeycut,3. Keith Zuehlke
13, 100-Concert Band, Olney HS, TEA:, Olney," Rodney D Bennett / Marilyn K. Bennett, Mike Shelton",AA,Varsity ,2019,145862,1,1,1,1,1,1,1,1,A, Marche Diabolique (Balmages), The Seal Lullaby  (Whitacre), Concert Variations  (Smith),DATE of EVENT 04/03/2019 ,Region: 7,1. Jim Bode,2. Forrester Halamicek,3. Ray Portillo,1. Patrick Dietz,2. Rustin Honeycut,3. Keith Zuehlke
14, 100-Concert Band, Stephenville High School, TEA:, Stephenville," Meghan Lockwood / Michael Childs, Michel Wimberly",AAAA,Non-Varsity ,2019,146769,1,1,1,1,1,1,1,1,C, Brave Spirit  (Standridge), Amparito Roca (Texor/Fagan), Brookshire Suite  (Barnes),DATE of EVENT 04/03/2019 ,Region: 7,1. Jim Bode,2. Forrester Halamicek,3. Ray Portillo,1. Patrick Dietz,2. Rustin Honeycut,3. Keith Zuehlke
15, 100-Concert Band, Stephenville HS, TEA:, Stephenville," Michael Childs / Meghan Lockwood, Michel Wimberly",AAAA,Varsity ,2019,146763,1,1,1,1,1,1,1,1,A, Bullets and Bayonets (Sousa/Fennell), Rest  (Ticheli), Magnolia Star  (Danyew),DATE of EVENT 04/03/2019 ,Region: 7,1. Jim Bode,2. Forrester Halamicek,3. Ray Portillo,1. Patrick Dietz,2. Rustin Honeycut,3. Keith Zuehlke
