,Event,School,TEA,City,Directors,Conference,Classification,Year,ID,Stage Judge 1,Stage Judge 2,Stage Judge 3,Stage Final,SR Judge 1,SR Judge 2,SR Judge 3,SR Final,Award,Selection 1,Selection 2,Selection 3
0, 100-Concert Band, Arlington High School, TEA:, Arlington, Dimas Delgado,AAAAA,Non-Varsity ,2005,15500,3,2,2,2,2,2,1,2, , Rough Riders (King/Swearingin), Ghost Fleet (Sheldon), Prelude Siciliano and Rondo (Arnold)
1, 100-Concert Band, Arlington High School, TEA:, Arlington, Jennifer Cartlidge,AAAAA,Non-Varsity ,2005,15509,3,3,4,3,3,3,3,3, , Rough Riders (King/Swearingin), Steppes of Russia (DelBorgo), The Fire of Eternal Glory (Shostakovich/Rhea)
2, 100-Concert Band, Boswell High School, TEA:, Ft. Worth, Rebecca Rexroat,AAAAA,Non-Varsity ,2005,16911,1,1,2,1,2,2,2,2,H, Rough-Riders (King/Swearingen), Deir in De (Barker (arr)), Encanto (Smith)
3, 100-Concert Band, Carroll High School, TEA:, Southlake, Ron Behrends,AAAAA,Sub Non-Varsity A,2005,15474,1,1,2,1,2,1,1,1,C, The Gladiator (Sousa/Shaffer), Aria Cantabile (Erickson), Encanto (Smith)
4, 100-Concert Band, Carroll High School, TEA:, Southlake, Ron Behrends,AAAAA,Sub Non-Varsity B,2005,15463,3,3,3,3,3,2,3,3, , Officer of the Day (Hall/Edmondson), Harvesting The Fields of Russia (Lucas), The Battle of Jericho (Spinney)
5, 100-Concert Band, Carroll High School, TEA:, Southlake, Ron Behrends,AAAAA,Non-Varsity ,2005,15457,1,1,2,1,1,1,1,1,C, As Summer Was Just Beginning (Daehn), Balkanya (play mvts 1 & 2) (Van der Roost), On the Mall (Goldman/Lisk)
6, 100-Concert Band, Fossil Ridge High School, TEA:, Keller, Tony Storer,AAAAA,Non-Varsity A,2005,16698,1,1,1,1,1,1,1,1,C," Black Horse Troop,The (Sousa/Fennell)", Salvation is Created (Tschesnokoff/Houseknecht)," Prelude, Siciliano and Rondo (Arnold/Paynter)"
7, 100-Concert Band, Haltom High School, TEA:, Haltom City, Ben Maughmer,AAAAA,Sub Non-Varsity ,2005,14054,2,2,2,2,2,2,1,2, , A Santa Cecilia (Radaelli/Elledge), I'm Seventeen Come Sunday (Grainger/Daehn), Dedicatory Overture (Williams)
8, 100-Concert Band, Haltom High School, TEA:, Haltom City, Van Mathews,AAAAA,Non-Varsity ,2005,14108,1,1,1,1,1,1,1,1,C," Carmina Burana (play mvts 1, 2, 13, plus four other mvts) (Orff/Krance)", Be Thou My Vision (Gillingham), His Honor (Fillmore)
9, 100-Concert Band, James Bowie High School, TEA:, Arlington, Larry Brown,AAAAA,Non-Varsity B,2005,16758,2,1,2,2,1,2,2,2, , Alamo (King), Quintology (Meyer), Heatherwood Portrait (Barnes)
10, 100-Concert Band, James Bowie High School, TEA:, Arlington, Larry Brown,AAAAA,Non-Varsity ,2005,14829,1,1,1,1,1,1,1,1,C, Boys of the Old Brigade (Chambers), Irish Tune from County Derry (Grainger/Rogers/SMC), Festivo (Gregson)
11, 100-Concert Band, James Martin High School, TEA:, Arlington, Gordon Hart,AAAAA,Non-Varsity ,2005,15945,1,1,2,1,1,1,1,1,C, Suite of Old American Dances (play three mvts) (Bennett), Early Light (Bremer), Our Flirtations (Sousa/Watson)
12, 100-Concert Band, Keller High School, TEA:, Keller, Sam Henderson,AAAAA,Non-Varsity ,2005,16402,2,2,1,2,1,1,1,1,H, Big Cage (King/Glover)," Armenian Dances, Set I (Reed, A.)", Spoon River (Grainger/Sheldon/Bar Bainum/GS(POP))
13, 100-Concert Band, Keller High School, TEA:, Keller, Sam Henderson,AAAAA,Sub Non-Varsity B,2005,16387,2,1,2,2,2,2,2,2, , United Nations (King), West Highlands Sojourn (Sheldon), Marching Song (Holst/Moss)
14, 100-Concert Band, Keller High School, TEA:, Keller, Sherri Untz,AAAAA,Sub Non-Varsity A,2005,14310,1,2,2,2,2,1,2,2, , Three Ayres from Gloucester (Stuart), Concord (Grundman), Rough Riders (King/Swearingen)
15, 100-Concert Band, L.D. Bell High School, TEA:, Hurst, Chris Ferrell,AAAAA,Non-Varsity ,2005,16109,1,1,1,1,1,1,1,1,C, The Liberty Bell (Sousa/Brion/Schissel), O Cool is the Valley (Persichetti), Chorale and Alleluia (Hanson)
16, 100-Concert Band, L.D. Bell High School, TEA:, Hurst, John Pollard,AAAAA,Sub Non-Varsity ,2005,16127,1,2,1,1,1,1,1,1,C, Kentucky Pride (Edmondson), On a Hymnsong of Philip Bliss (Holsinger), Legend of Knife River (Bulla)
17, 100-Concert Band, Lamar High School, TEA:, Arlington, Angela Caviness,AAAAA,Non-Varsity A,2005,15575,1,1,1,1,1,1,1,1,C, British Eighth (Zo Elliott), A Tribute to Grainger (play all) (Grainger/Ragsdale), Concert Variations (Smith)
18, 100-Concert Band, Martin High School, TEA:, Arlington, BrianLowe,AAAAA,Sub Non-Varsity A,2005,16519,1,1,1,1,1,1,1,1,C, British Folk Song March (Hiroki Takahashi), Down a Country Lane (Copland/Patterson)," Simple Gifts, Four Shaker Songs (play movement 1, 2, or 4) (Ticheli)"
19, 100-Concert Band, Martin High School, TEA:, Arlington, Jennifer Hay,AAAAA,Sub Non-Varsity B,2005,16520,2,2,3,2,2,3,2,2, , Valdres (Hanssen arr. Smith), Two British Folk Songs (Del Borgo (arr)), Fantasy on an African-American Spiritual (Preuninger)
20, 100-Concert Band, Paschal High School, TEA:, Ft. Worth, Mario Casanova,AAAAA,Non-Varsity ,2005,16727,2,2,3,2,3,2,3,3, , Peacemaker (Karl King), Deir In De (arr. Warren Barker), Encanto (Robert W. Smith)
21, 100-Concert Band, Richland High School, TEA:, North Richland Hills, Kevin McNulty,AAAAA,Sub Non-Varsity ,2005,14874,1,1,1,1,1,1,1,1,C, Invercargill (Alex Lithgow/Calvin Custer), Suite Provencale (Van der Roost), Whitewater Festival (Shaffer)
22, 100-Concert Band, Richland High School, TEA:, North Richland Hills, Mikel Burress,AAAAA,Non-Varsity ,2005,14868,1,1,2,1,1,1,1,1,C, Pas Redouble (Saint-Saens/Frackenpohl), Rhosymedre (Vaughan Williams/Beeler), La Procession du Rocio (Turina/Reed)
23, 100-Concert Band, Sam Houston High School, TEA:, Arlington, Marta O. Ocampo,AAAAA,Non-Varsity ,2005,14491,3,3,2,3,3,3,3,3, , La Banda Nascente (Sbraccia/Fennell), As Summer Was Just Beginning (Larry D. Daehn), Cajun Folksongs (Frank Ticheli)
24, 100-Concert Band, Trinity High School, TEA:, Euless, Jason Bird,AAAAA,Non-Varsity ,2005,13013,3,3,2,3,1,1,2,1,H," English Dances, Set 1 (Arnold/Johnstone)", Salvation is Created (Tschesnokoff/Houseknecht), The Big Cage (K. L. King)
