,0,1,2,3,4,5,6,7,8,9,10,11,12,13,14,15,16,17,18,19,20,21,22,23,24,25,26,27,28
0, 100-Concert Band, Barbara Bush Middle School, TEA:, Irving, Eleanor Macias / Evan Dabbs,CC,Non-Varsity ,2021,165532,1,1,1,1,1,1,1,1,D, Andalucia (Victor Lopez), Qin Shi`s Stone Army  (Arcari), Ghost Ship  (Story),DATE of EVENT 04/15/2021 ,Region: 31,1. Katie Lewis,2. Kim Cooley,3. Rylon Guidry,1. Barbara Lambrecht,2. Steve Madsen,3. Jed Maus
1, 100-Concert Band, Blalack MS, TEA:, Carrollton, Keith Marshall / Hannah Thiessen & Abigail Robinson,CCC,Varsity ,2021,163746,1,1,1,1,1,1,1,1,C," Macarena (Monterde, Bernardino; arr. Micheal Story)", Cascadia Celebration  (Hodges), Two British Folk Songs  (Del Borgo),DATE of EVENT 04/15/2021 ,Region: 31,1. Katie Lewis,2. Kim Cooley,3. Rylon Guidry,1. Barbara Lambrecht,2. Steve Madsen,3. Jed Maus
2, 100-Concert Band, Colleyville Middle School, TEA:, Colleyville, Joey Prescott / Lauren Jones,CC,Non-Varsity ,2021,165368,1,1,1,1,1,1,1,1,D, Colliding Visions  (Balmages), Night Fury  (Chambers), Heroes on Parade (Hillis),DATE of EVENT 04/15/2021 ,Region: 31,1. Katie Lewis,2. Kim Cooley,3. Rylon Guidry,1. Barbara Lambrecht,2. Steve Madsen,3. Jed Maus
3, 100-Concert Band, Colleyville Middle School, TEA:, Colleyville, Lauren Jones / Joey Prescott,CC,Varsity ,2021,165219,1,1,1,1,1,1,1,1,C, Salvation is Created  (Tschesnokoff/Houseknecht), Pablo!  (Meyer), Army of the Nile (Alford/Fennell),DATE of EVENT 04/15/2021 ,Region: 31,1. Katie Lewis,2. Kim Cooley,3. Rylon Guidry,1. Barbara Lambrecht,2. Steve Madsen,3. Jed Maus
4, 100-Concert Band, Dewitt Perry Middle School, TEA:, Carrollton, Julia Lawson,CCC,Varsity ,2021,165630,1,1,1,1,1,1,1,1,C,  The Streets of Madrid (John Moss), Song of Hope  (Swearingen), Bazaar  (Standridge),DATE of EVENT 04/15/2021 ,Region: 31,1. Katie Lewis,2. Kim Cooley,3. Rylon Guidry,1. Barbara Lambrecht,2. Steve Madsen,3. Jed Maus
5, 100-Concert Band, Field Middle School, TEA:, Farmers Branch, Neil Haag / Greg Leutwyler,CCC,Non-Varsity ,2021,164836,1,1,2,1,3,2,1,2,2, Recognition (Larry Clark), Nottingham Castle  (Daehn), Atlantis  (McGinty),DATE of EVENT 04/15/2021 ,Region: 31,1. Katie Lewis,2. Kim Cooley,3. Rylon Guidry,1. Barbara Lambrecht,2. Steve Madsen,3. Jed Maus
6, 100-Concert Band, Long MS, TEA:, Dallas, Jonathan Adamo / Brandon Jones / Brittany Baptista,CC,Non-Varsity ,2021,163870,1,1,1,1,1,1,1,1,D, Valor March (Larry Clark), Serengeti Dreams  (Smith), Mythos  (Bernotas),DATE of EVENT 04/15/2021 ,Region: 31,1. Katie Lewis,2. Kim Cooley,3. Rylon Guidry,1. Barbara Lambrecht,2. Steve Madsen,3. Jed Maus
7, 100-Concert Band, Perry MS, TEA:, Carrollton, Amanda Krause,CCC,Non-Varsity ,2021,166349,1,1,1,1,1,1,1,1,D, Spitfire (Story), Skylight  (Hodges), Colliding Visions  (Balmages),DATE of EVENT 04/15/2021 ,Region: 31,1. Katie Lewis,2. Kim Cooley,3. Rylon Guidry,1. Barbara Lambrecht,2. Steve Madsen,3. Jed Maus
8, 100-Concert Band, Polk MS, TEA:, Carrollton, Brian Palmer,CCC,Varsity ,2021,166193,1,1,1,1,2,1,1,1,C, The Capitol March  (Foden/Stalter), Dancing Kites  (Bernotas), Colliding Visions  (Balmages),DATE of EVENT 04/15/2021 ,Region: 31,1. Katie Lewis,2. Kim Cooley,3. Rylon Guidry,1. Barbara Lambrecht,2. Steve Madsen,3. Jed Maus
