,Event,School,TEA,City,Directors,Conference,Classification,Year,ID,Stage Judge 1,Stage Judge 2,Stage Judge 3,Stage Final,SR Judge 1,SR Judge 2,SR Judge 3,SR Final,Award,Selection 1,Selection 2,Selection 3
0, 100-Concert Band, Byron Nelson HS, TEA:, Trophy Club," Jed Weeks / Brad Toth, Michael Moore",AAAAAA,Varsity ,2016,114607,1,1,1,1,1,1,1,1,A, Children's March: Over the Hills and Far Away (Grainger), Awayday  (Gorb/ ), Candide Suite  (Bernstein/Grundman)
1, 100-Concert Band, Byron Nelson HS, TEA:, Trophy Club, Brad Toth / Jed Weeks John Bingaman Michael Moore,AAAAAA,Non-Varsity ,2016,114702,2,2,2,2,1,1,1,1,2, Boys of the Old Brigade  (Chambers/Glover), Sleep  (Whitacre), Vesuvius  (Ticheli/ )
2, 100-Concert Band, Central High School, TEA:, Keller," Kevin McNulty / Kai Rudnick, Jessica Muas, Matt Stephens",AAAAAA,Varsity ,2016,113035,1,1,1,1,1,1,1,1,A, Marche Hongroise  (Berlioz/Takahashi ), Jupiter  (Holst/ ), Russlan and Ludmilla Overture  (Glinka/Hindsley)
3, 100-Concert Band, Fossil Ridge High School, TEA:, Keller," Brad Allen / Kris Quaale, Blake Warren, Ben Moore",AAAAAA,Varsity ,2016,114289,1,1,1,1,1,1,1,1,A, Commando March (Barber), Give Us This Day (play all) (Maslanka/ ), La Procession du Rocio  (Turina/Reed)
4, 100-Concert Band, Keller High School, TEA:, Keller, Mark McGahey,AAAAAA,Varsity ,2016,111670,1,1,1,1,1,1,1,1,A, Bells For Stokowski  (Daugherty), Buckaroo Holiday  (Copland/Megan), Semper Fidelis (Sousa/Bourgeois)
5, 100-Concert Band, Northwest HS, TEA:, Justin, Jim Boulet,AAAAAA,Varsity ,2016,113350,2,2,2,2,1,1,1,1,2, March Grandioso (Seitz/Glover), Festal Scenes  (Ito/ ), Instinctive Travels  (Markowski/ )
6, 100-Concert Band, Ryan High School, TEA:, Denton, Edward Russell,AAAAAA,Varsity ,2016,114321,1,2,2,2,1,1,1,1,2, British Eighth (Elliott/Luckhart), Symphonic Dance No. 3 (Fiesta)  (Williams), Second Suite in F for Military Band  (Holst/Matthews)
7, 100-Concert Band, Timber Creek HS, TEA:, Keller, Darla McBryde,AAAAAA,Varsity ,2016,112841,1,1,1,1,1,1,1,1,A, Valdres (Hanssen/Schissel), Suite of Old American Dances (play at least four movements) (Bennett), Turbo Scramjet (Pitts)
8, 100-Concert Band, Timber Creek HS, TEA:, Keller, Kayla Nelson,AAAAAA,Non-Varsity ,2016,112953,1,1,1,1,1,1,1,1,C, Zacatecas (Genaro Codina), Rikudim  (Van der Roost/ ), Concord  (Grundman/ )
