,Event,School,TEA,City,Directors,Conference,Classification,Year,ID,Stage Judge 1,Stage Judge 2,Stage Judge 3,Stage Final,SR Judge 1,SR Judge 2,SR Judge 3,SR Final,Award,Selection 1,Selection 2,Selection 3
0, 100-Concert Band, Aledo HS, TEA:, Aledo," Jake Albin / Joey Paul, Tanner Trigg",AAAA,Non-Varsity ,2013,85698,1,1,1,1,1,1,1,1,C, March Juno (John D. Stewart), Sheltering Sky  (Mackey), Khan  (Giroux/ )
1, 100-Concert Band, Aledo HS, TEA:, Aledo," Joey Paul / Jake Albin, Tanner Trigg",AAAA,Sub Non-Varsity ,2013,85700,1,1,1,1,1,1,1,1,C, Circus Bee  (Fillmore/Custer ), Variations on a Korean Folk Song  (Chance/ ), Chanteys  (Sheldon/ )
2, 100-Concert Band, Aledo HS, TEA:, Aledo," Joey Paul / Jake Albin, Tanner Trigg",AAAA,Varsity ,2013,85699,1,1,1,1,1,1,1,1,A, Symphonic Metamorphosis (March) (Hindemith/Wilson), Finale (from Symphony No. 5)  (Shostakovich/Righter), J'ai ete au bal  (Grantham/ )
3, 100-Concert Band, Arlington Heights HS, TEA:, Fort Worth, David Wiebers,AAAA,Non-Varsity ,2013,83903,3,4,4,4,4,4,4,4, , Burnished Brass (John Cacavas), Ye Banks and Braes O' Bonnie Doon  (Grainger), Havendance  (Holsinger)
4, 100-Concert Band, Burleson Centennial High School, TEA:, Burleson, Andrew Klein / Michael Cox,AAAA,Non-Varsity ,2013,83117,1,1,1,1,1,1,1,1,C, Gallant Marines (King/Swearingen), Prospect  (La Plante/ ), Foundry  (Mackey/ )
5, 100-Concert Band, Burleson Centennial High School, TEA:, Burleson, Michael Cox,AAAA,Varsity ,2013,81859,1,1,2,1,1,1,2,1,A, Army of the Nile (Alford/Fennell), Molly On The Shore  (Grainger/Rogers/SMC), Pineapple Poll  (Sullivan/Mackerras/Duthoit)
6, 100-Concert Band, Burleson HS, TEA:, Burleson, Joe McGee,AAAA,Varsity ,2013,83659,2,1,1,1,1,1,1,1,A, British Eighth March (Elliott/Hilliard ed.)," Armenian Dances, Set I  (Reed/ )", Festival in Russia  (Liadov/Wilcox)
7, 100-Concert Band, Burleson HS, TEA:, Burleson, Michael Moscoso,AAAA,Non-Varsity ,2013,84403,2,2,2,2,2,2,2,2, , Costa Brava (Eric Osterling), Three Ayres from Gloucester (Hugh M. Stuart), La Madre de los Gatos (Brian Beck)
8, 100-Concert Band, Carter Riverside HS, TEA:, Fort Worth, Rosendo Sanchez,AAAA,Varsity ,2013,83844,3,3,3,3,4,4,4,4, , Circus Days (King/Swearingen), Salvation is Created (Tschesnokoff), Ballet and Galliard for Band (Hudadoff/ )
9, 100-Concert Band, Cleburne High School, TEA:, Cleburne, Brock Feller,AAAA,Non-Varsity ,2013,85134,2,1,2,2,1,1,1,1,2, Circus Days (King/Schissel), Fantasy on an Early American Marching Tune (Sheldon/ ), Winter on Emerald Bay (Silva)
10, 100-Concert Band, Cleburne High School, TEA:, Cleburne, Jason Jones,AAAA,Varsity ,2013,85129,2,2,1,2,1,1,1,1,1, A Slavic Farewell (Agagpkin/Bourgeois), Incantation and Dance  (Chance), Molly On The Shore  (Grainger/Rogers/SMC)
11, 100-Concert Band, Cleburne High School, TEA:, Cleburne, Jason Jones / Brock Feller,AAAA,Sub Non-Varsity ,2013,85125,3,3,3,3,3,3,3,3, , Aline (Bennett/Clark), Shepherd's Hey  (Roszell/ ), Adrenaline Engines  (Standridge/ )
12, 100-Concert Band, Crowley High School, TEA:, Crowley, Benjamin Brown,AAAA,Sub Non-Varsity ,2013,84164,2,1,1,1,2,2,3,2,2, Spania (David Shaffer), Slane (Douglas Wagner), Accolade (William Himes)
13, 100-Concert Band, Crowley High School, TEA:, Crowley, Ken Danforth,AAAA,Non-Varsity ,2013,84162,2,1,1,1,1,2,2,2,2, Alamo (Karl King), Cumberland Cross (Carl Strommen), Steel (Randall Standridge)
14, 100-Concert Band, Crowley High School, TEA:, Crowley, Rudy Salazar,AAAA,Varsity ,2013,84161,2,2,2,2,1,1,1,1,1, Circus Days (King/Schissel), Deir In De (Warren Barker), Angel Band (Walter Hartley)
15, 100-Concert Band, Eastern Hills HS, TEA:, Fort Worth, Kathy Bernal,AAAA,Varsity ,2013,83454,2,3,3,3,4,4,3,4, , Rough Riders (King/Swearingen), Rhosymedre  (Vaughan Williams/Beeler), Steel (Standridge)
16, 100-Concert Band, Everman HS, TEA:, Everman, Clifford Spires,AAAA,Non-Varsity ,2013,82877,2,2,2,2,4,5,4,4, , Winchester March (John Edmondson), Atlantis (McGinty/ ), Contempo  (Story/ )
17, 100-Concert Band, Everman HS, TEA:, Everman," Clifford Spires / William Chapman, William Hildreth",AAAA,Varsity ,2013,82874,1,2,1,1,3,3,3,3,1, Domingo Ortega (Ledesma and Oropesa), Salvation is Created  (Tschesnokoff/Houseknecht), Chant and Jubilo  (McBeth/ )
18, 100-Concert Band, Granbury High School, TEA:, Granbury, Mark Eastin,AAAA,Non-Varsity ,2013,82905,1,1,1,1,1,2,1,1,C, Alamo March (King/Swearingen), Sparks (Balmages/ ), Blue and Green Music (Hazo/ )
19, 100-Concert Band, Granbury High School, TEA:, Granbury, Mark Eastin,AAAA,Varsity ,2013,82903,1,1,1,1,1,1,1,1,A, Fantasia in G Major  (Bach/Goldman), Give Us This Day (play all) (Maslanka/ ), The Klaxon (Fillmore)
20, 100-Concert Band, Joshua High School, TEA:, Joshua, Dan Richardson,AAAA,Sub Non-Varsity ,2013,83877,2,2,2,2,2,2,2,2, , A Sailor's Odyssey  (Bobrowitz/ ), Kenya Contrasts  (Himes/ ), Spartons of Tomorrow (Balent)
21, 100-Concert Band, Joshua High School, TEA:, Joshua, Lonnie Foster,AAAA,Non-Varsity A,2013,83875,2,2,1,2,1,1,1,1,2, Winter on Emerald Bay  (Silva/ ), A Joyful Journey (Sheldon/ ), Under the Double Eagle (Wagner/Custer)
22, 100-Concert Band, Joshua High School, TEA:, Joshua, Stephen Smoot,AAAA,Varsity ,2013,82994,2,1,2,2,2,2,2,2, , Brighton Beach (William P Latham), Undertow  (Mackey/ )," O Waly, Waly (Rhapsody for Band)  (Bocook/ )"
23, 100-Concert Band, North Crowley High School, TEA:, Fort Worth, David Walker,AAAAA,Sub Non-Varsity ,2013,85357,2,2,2,2,3,3,3,3, , Soldier's Chorus from Faust (Gounod), In The Shining Of The Stars  (Sheldon/ ), Tricycle  (Boysen/ )
24, 100-Concert Band, North Crowley High School, TEA:, Ft. Worth, Andrew Williams,AAAAA,Varsity ,2013,85332,1,1,1,1,1,1,1,1,A, El Relicario (Padilla/Longfield), Ride  (Hazo/ ), Symphony No. 6 - Third Movement  (Tchaikovsky/Daehn)
25, 100-Concert Band, North Crowley HS, TEA:, Fort Worth, Stephanie Ballaro,AAAAA,Non-Varsity ,2013,85329,1,1,1,1,1,2,1,1,C, Mustang! Concert March (Eric Osterling), As Summer Was Just Beginning (Larry Daehn), Abracadabra (Frank Ticheli)
26, 100-Concert Band, North Side High School, TEA:, Fort Worth, Ramon Nino,AAAA,Varsity ,2013,85715,4,3,3,3,3,4,4,4, , Scenes from Terezin  (Stamp/ ), Prelude to Act I (from La Traviata)  (Verdi/Falcone), Valdres (Hanssen/Smith)
27, 100-Concert Band, O.D. Wyatt HS, TEA:, Fort Worth, Hollis Gordon,AAAA,Non-Varsity A,2013,83889,2,2,2,2,3,3,3,3, , Torch Of Liberty Concert March ( Karl King), Prospect (Pierre La Plante), Three Folk Miniatures mvts. 1&3 (Jutras)
28, 100-Concert Band, Paschal HS, TEA:, Fort Worth, Bryan Wright,AAAAA,Varsity ,2013,83571,1,1,2,1,1,1,1,1,A, Pepita Greus (Chovi/Weger), Blue Shades  (Ticheli/ ), La Procession du Rocio  (Turina/Reed)
29, 100-Concert Band, Paschal HS, TEA:, Fort Worth, Mark De Hertogh,AAAAA,Sub Non-Varsity A,2013,83250,2,3,3,3,3,3,3,3, , Miracle at Dunkirk March (John Edmondson), A Quiet Music (Douglas E. Wagner), Our Kingsland Spring (Samuel R. Hazo)
30, 100-Concert Band, Paschal HS, TEA:, Fort Worth, Travis Treadwell,AAAAA,Non-Varsity ,2013,83157,2,1,2,2,1,1,1,1,2, The Billboard March (Klohr/ Glover), The Whispering Tree  (Farmer/ ), Foundry  (Mackey/ )
31, 100-Concert Band, Polytechnic High School, TEA:, Fort Worth, Michael A. Cruz / Paul Rosales,AAAA,Varsity ,2013,84891,2,2,1,2,3,3,2,3, , Alamo March (King/Swearingen), A Simple Song (Bernstein/Sweeney), Steel (Standridge)
32, 100-Concert Band, South Hills High School, TEA:, Fort Worth, Richard De La Riva,AAAA,Non-Varsity ,2013,81979,1,1,1,1,2,2,2,2,2, Shepherd's Hey  (Roszell/ ), Colliding Visions  (Balmages/ ), Make Way for Melody ()
33, 100-Concert Band, Southwest HS, TEA:, Fort Worth, Jeff De Maagd,AAAA,Non-Varsity ,2013,83865,1,1,1,1,1,1,1,1,C, Orgullo De Los Torros (E. R. Griffin), Salvation is Created  (Tschesnokoff/Houseknecht), Shadow Rituals  (Markowski/ )
34, 100-Concert Band, Southwest HS, TEA:, Fort Worth, Stacey Dunn,AAAA,Varsity ,2013,84596,1,1,1,1,1,1,1,1,A, Funeral March (Edvard Grieg/Jan Eriksen), Passacaglia and Fugue in c minor  (Bach/Falcone), Dionysiaques  (Schmitt/Duker)
35, 100-Concert Band, Trimble Tech HS, TEA:, Fort worth, Earnest Colvin,AAAA,Varsity ,2013,84260,1,1,1,1,1,1,1,1,B, In Heaven's Air  (Samuel Hazo ), Shadow Rituals  (Michael Markowski), El Alamo  (Howard E. Akers )
36, 100-Concert Band, Weatherford High School, TEA:, Weatherford, Brian Gill,AAAAA,Non-Varsity ,2013,84439,2,2,1,2,2,2,1,2, , La Banda Nascente (Sbraccia/Fennell), Blue and Green Music (Samuel Hazo)," Satiric Dances, Mvt. 3 (Norman Dello Joio)"
37, 100-Concert Band, Weatherford High School, TEA:, Weatherford, James Buckner,AAAAA,Varsity ,2013,84345,1,2,1,1,1,1,1,1,A, The Black Horse Troop (John Philip Sousa/Fennell), Chorale and Alleluia (Howard Hanson), Festive Overture (Dmitri Shostakovich/Hunsberger)
38, 100-Concert Band, Western Hills HS, TEA:, Fort Worth," Eric Mullins / Kristen Hall, Ben Hall",AAAA,Varsity ,2013,83181,1,2,1,1,1,1,1,1,A, La Oreja de Oro (San Miguel/Fennell), Vesuvius (Ticheli)," Enigma Variations, Opus 36 (play Theme, Variation 1, & at least two from Variations 4, 5, 9, 11, & 14) (Elgar/Patterson)"
39, 100-Concert Band, Western Hills HS, TEA:, Fort Worth, Kristen Hall / Benjamin Hall,AAAA,Non-Varsity ,2013,84442,2,2,2,2,2,1,1,1,2, National Emblem (E.E. Bagley/Andrew Balent), Russian Folk Fantasy  (Curnow/ ), Quintology  (Meyer/ )
40, 100-Concert Band, Young Womens Leadership Acad, TEA:, Fort Worth, Veronica Villegas,A,Non-Varsity A,2013,82106,1,2,1,1,2,2,2,2,2," Rose Hill March (Owens, William)"," Big Sky Round-Up (Sheldon, Robert)"," Distant Horizons (Sweeney, Michael)"
