,0,1,2,3,4,5,6,7,8,9,10,11,12,13,14,15,16,17,18,19,20,21,22,23,24,25,26,27,28
0, 100-Concert Band, Aledo HS, TEA:, Aledo," Jake Albin / Joey Paul, Olivia Ramirez",AAAAA,Non-Varsity ,2016,116626,1,1,1,1,1,1,1,1,C, The Trombone King (King/Paynter), A Drop of Rain N/A (Hernandez/ ), Oracle  (Rath/ ),DATE of EVENT 04/19/2016 ,Region: 7,1. Barbara Lambrecht,2. Mark Poole,3. Danny Prado,1. Tammy Fedynich,2. Ross Grant,3. Cody Newman
1, 100-Concert Band, Aledo HS, TEA:, Aledo," Joey Paul / Jake Albin, Olivia Ramirez",AAAAA,Varsity ,2016,116672,1,1,1,1,1,1,1,1,A, The Melody Shop  (Karl L.King/Andrew Glover ), Give Us This Day (play all) (Maslanka/ ), Overture to Colas Breugnon  (Kabalevsky/Hunsberger),DATE of EVENT 04/19/2016 ,Region: 7,1. Barbara Lambrecht,2. Mark Poole,3. Danny Prado,1. Tammy Fedynich,2. Ross Grant,3. Cody Newman
2, 100-Concert Band, Aledo HS, TEA:, Aledo," Joey Paul / Jake Albin, Olivia Ramirez",AAAAA,Sub Non-Varsity ,2016,116671,1,1,1,1,1,1,1,1,C, Rough Riders  (Karl L. King/James Swearingen), The Willows of Winter  (Brooks/ ), Fantasy on a Fiddle Tune  (LaPlante/ ),DATE of EVENT 04/19/2016 ,Region: 7,1. Barbara Lambrecht,2. Mark Poole,3. Danny Prado,1. Tammy Fedynich,2. Ross Grant,3. Cody Newman
3, 100-Concert Band, Arlington Heights HS, TEA:, Fort Worth, David Wiebers,AAAAA,Varsity ,2016,110984,2,2,2,2,2,2,2,2, , Radetzky March (Strauss/Balent), Variations on a Korean Folk Song  (Chance/ ), Choreography  (Sheldon/ ),DATE of EVENT 04/19/2016 ,Region: 7,1. Barbara Lambrecht,2. Mark Poole,3. Danny Prado,1. Tammy Fedynich,2. Ross Grant,3. Cody Newman
4, 100-Concert Band, Burleson HS, TEA:, Burleson, Jaime Ezersky,AAAAA,Sub Non-Varsity ,2016,115488,2,1,2,2,2,2,2,2, , Joy  (Ticheli/ ), Barbarossa  (Himes/ ), His Honor  (Fillmore/Balent),DATE of EVENT 04/19/2016 ,Region: 7,1. Barbara Lambrecht,2. Mark Poole,3. Danny Prado,1. Tammy Fedynich,2. Ross Grant,3. Cody Newman
5, 100-Concert Band, Burleson HS, TEA:, Burleson, Joe McGee,AAAAA,Varsity ,2016,115491,1,1,1,1,1,1,1,1,B, Valdres March (Hanssen/Schissel), Elsa's Procession to the Cathedral  (Wagner/Patterson/Cailliet), Molly On The Shore  (Grainger/Rogers/SMC),DATE of EVENT 04/19/2016 ,Region: 7,1. Barbara Lambrecht,2. Mark Poole,3. Danny Prado,1. Tammy Fedynich,2. Ross Grant,3. Cody Newman
6, 100-Concert Band, Burleson HS, TEA:, Burleson, Michael Moscoso,AAAAA,Non-Varsity ,2016,115507,1,1,1,1,1,1,1,1,C, Three Chinese Miniatures  (Jager/ ), Appalachian Morning  (Sheldon/ ), Domingo Ortega (Ledesma/Oropesa),DATE of EVENT 04/19/2016 ,Region: 7,1. Barbara Lambrecht,2. Mark Poole,3. Danny Prado,1. Tammy Fedynich,2. Ross Grant,3. Cody Newman
7, 100-Concert Band, Carter Riverside HS, TEA:, Fort Worth, Rosendo Sanchez / Cody Haccock,AAAAA,Varsity ,2016,116101,3,3,4,3,3,3,3,3, , Rough Riders (Kind/Swearingen), Havendance  (Holsinger/ ), Sarabande and Polka  (Arnold/Paynter),DATE of EVENT 04/19/2016 ,Region: 7,1. Barbara Lambrecht,2. Mark Poole,3. Danny Prado,1. Tammy Fedynich,2. Ross Grant,3. Cody Newman
8, 100-Concert Band, Centennial High School, TEA:, Burleson," Andrew Klein / Kim Murphy, Richard Kearns, Shawn Murphy",AAAAA,Non-Varsity ,2016,116918,1,1,1,1,1,1,1,1,C, Tahoka Galop (Owens), Abracadabra  (Ticheli/ ), Choreography  (Sheldon/ ),DATE of EVENT 04/19/2016 ,Region: 7,1. Barbara Lambrecht,2. Mark Poole,3. Danny Prado,1. Tammy Fedynich,2. Ross Grant,3. Cody Newman
9, 100-Concert Band, Centennial High School, TEA:, Burleson," Shawn Murphy / Andrew Klein, Kim Murphy, Richard Kearns",AAAAA,Varsity ,2016,116917,1,1,1,1,1,1,1,1,A, Marche des Parachutistes Belges (Pierre Leemans/Arr. Wiley), Dusk  (Bryant/ ), Incantation and Dance  (Chance/ ),DATE of EVENT 04/19/2016 ,Region: 7,1. Barbara Lambrecht,2. Mark Poole,3. Danny Prado,1. Tammy Fedynich,2. Ross Grant,3. Cody Newman
10, 100-Concert Band, Cleburne High School, TEA:, Cleburne," Brock Feller / Jason Jones, Nicholas Mercer",AAAAA,Sub Non-Varsity ,2016,116152,2,1,2,2,2,1,1,1,C, Darklands March (Randall Standridge), New Horizons (Bruce Corrigan), Greenbrier Legacy (Michael Oare),DATE of EVENT 04/19/2016 ,Region: 7,1. Barbara Lambrecht,2. Mark Poole,3. Danny Prado,1. Tammy Fedynich,2. Ross Grant,3. Cody Newman
11, 100-Concert Band, Cleburne High School, TEA:, Cleburne," Brock Feller / Jason Jones, Nicholas Mercer",AAAAA,Non-Varsity ,2016,116148,1,1,1,1,1,1,1,1,C," Mighty Mite March (Ted Mesang, arr. Sean O'Laughlin)", Abracadabra  (Frank Ticheli), Steel  (Randall Standridge),DATE of EVENT 04/19/2016 ,Region: 7,1. Barbara Lambrecht,2. Mark Poole,3. Danny Prado,1. Tammy Fedynich,2. Ross Grant,3. Cody Newman
12, 100-Concert Band, Cleburne High School, TEA:, Cleburne, Jason Jones,AAAAA,Varsity ,2016,111754,1,1,1,1,1,1,1,1,A, Pas Redouble (Saint-Saens/ Frackenpohl), Shepherd's Hey  (Grainger/Rogers), Blue Shades  (Ticheli/ ),DATE of EVENT 04/19/2016 ,Region: 7,1. Barbara Lambrecht,2. Mark Poole,3. Danny Prado,1. Tammy Fedynich,2. Ross Grant,3. Cody Newman
13, 100-Concert Band, Crowley High School, TEA:, Crowley, Anthony Vasquez / Rudy Salazar,AAAA,Sub Non-Varsity ,2016,116638,1,1,2,1,2,1,1,1,C, Lexington March (Edmondson), Colliding Visions  (Balmages/ ), Egyptique  (Owens/ ),DATE of EVENT 04/19/2016 ,Region: 7,1. Barbara Lambrecht,2. Mark Poole,3. Danny Prado,1. Tammy Fedynich,2. Ross Grant,3. Cody Newman
14, 100-Concert Band, Crowley High School, TEA:, Crowley, Ken Danforth,AAAA,Non-Varsity ,2016,116636,2,2,2,2,1,1,1,1,2, Lexington March (King/Sweringen), Cumberland Cross  (Strommen/ ), Adrenaline Engines (Standridge),DATE of EVENT 04/19/2016 ,Region: 7,1. Barbara Lambrecht,2. Mark Poole,3. Danny Prado,1. Tammy Fedynich,2. Ross Grant,3. Cody Newman
15, 100-Concert Band, Crowley High School, TEA:, Crowley, Romulo Salazar,AAAAA,Varsity ,2016,116640,2,1,2,2,1,1,1,1,1, Pathfinder of Panama (Sousa), Armenian Dances  (Khachaturian/Satz), Spoon River  (Grainger/Sheldon/Bainum/Carson-Naylor),DATE of EVENT 04/19/2016 ,Region: 7,1. Barbara Lambrecht,2. Mark Poole,3. Danny Prado,1. Tammy Fedynich,2. Ross Grant,3. Cody Newman
16, 100-Concert Band, Eastern Hills HS, TEA:, Fort Worth," Arun Bhatt / Margaret Granado, Nathan Moore",AAAAA,Non-Varsity ,2016,109514,2,3,2,2,2,3,2,2, , Crosswinds March (Swearingen), Blue Ridge Reel  (Balmages), New Horizons  (Corrigan),DATE of EVENT 04/19/2016 ,Region: 7,1. Barbara Lambrecht,2. Mark Poole,3. Danny Prado,1. Tammy Fedynich,2. Ross Grant,3. Cody Newman
17, 100-Concert Band, Everman High School, TEA:, Everman, Clifford Spires,AAAAA,Varsity ,2016,114525,1,1,2,1,2,2,2,2,1, Gallant Marines (King/Swearingen), Fantasy on a Japanese Folk Song  (Hazo/ ), La Madre de los Gatos  (Beck/ ),DATE of EVENT 04/19/2016 ,Region: 7,1. Barbara Lambrecht,2. Mark Poole,3. Danny Prado,1. Tammy Fedynich,2. Ross Grant,3. Cody Newman
18, 100-Concert Band, Everman HS, TEA:, Everman," John Spann / Clifford Spires, William Hildreth",AAAAA,Non-Varsity ,2016,114158,1,2,2,2,1,1,1,1,2, New Forest March (Johnnie Vinson), Irish Air and Dance (Michael Story), Adrenaline Engines (Randall Standridge),DATE of EVENT 04/19/2016 ,Region: 7,1. Barbara Lambrecht,2. Mark Poole,3. Danny Prado,1. Tammy Fedynich,2. Ross Grant,3. Cody Newman
19, 100-Concert Band, Granbury High School, TEA:, Granbury, Mark Eastin,AAAAA,Non-Varsity ,2016,110308,1,1,2,1,1,1,1,1,C, His Honor March (Filmore), As Summer Was Just Beginning  (Daehn/ ), English Folk Song Suite (play one mvt) (Vaughan Williams/ ),DATE of EVENT 04/19/2016 ,Region: 7,1. Barbara Lambrecht,2. Mark Poole,3. Danny Prado,1. Tammy Fedynich,2. Ross Grant,3. Cody Newman
20, 100-Concert Band, Granbury High School, TEA:, Granbury, Mark Eastin,AAAAA,Varsity ,2016,110307,1,1,1,1,1,1,1,1,A, The Melody Shop March (Karl King/Glover), Lincolnshire Posy (play at least five mvts) (Grainger/ ), Kingfisher's Catchfire  (Mackey/ ),DATE of EVENT 04/19/2016 ,Region: 7,1. Barbara Lambrecht,2. Mark Poole,3. Danny Prado,1. Tammy Fedynich,2. Ross Grant,3. Cody Newman
21, 100-Concert Band, Joshua High School, TEA:, Joshua, Lonnie Foster,AAAA,Non-Varsity ,2016,112618,2,2,2,2,1,1,1,1,2, Hosts Of Freedom (King/Glover), Foundry  (Mackey/ ), Cumberland Cross  (Strommen/ ),DATE of EVENT 04/19/2016 ,Region: 7,1. Barbara Lambrecht,2. Mark Poole,3. Danny Prado,1. Tammy Fedynich,2. Ross Grant,3. Cody Newman
22, 100-Concert Band, Joshua High School, TEA:, Joshua, Stephen Smoot,AAAAA,Varsity ,2016,112581,1,1,1,1,2,2,2,2,1, Brighton Beach (William Latham), Butterfly's Ball  (Fraley/ ), A Longford Legend (play all) (Sheldon/ ),DATE of EVENT 04/19/2016 ,Region: 7,1. Barbara Lambrecht,2. Mark Poole,3. Danny Prado,1. Tammy Fedynich,2. Ross Grant,3. Cody Newman
23, 100-Concert Band, North Crowley High School, TEA:, Fort Worth," Alex Descoteaux / David Trewitt, Christopher Sample",AAAAAA,Sub Non-Varsity ,2016,116606,1,2,2,2,1,1,1,1,2, Rough Riders (King/Swearingen), Radiant Moonbeams  (Gillingham/ ), Sparks  (Balmages/ ),DATE of EVENT 04/19/2016 ,Region: 7,1. Barbara Lambrecht,2. Mark Poole,3. Danny Prado,1. Tammy Fedynich,2. Ross Grant,3. Cody Newman
24, 100-Concert Band, North Crowley High School, TEA:, Fort Worth," Chris Sample / David Trewitt, Alex Descoteaux",AAAAAA,Non-Varsity ,2016,116009,2,1,1,1,1,2,2,2,2, Prestissimo (King/Swearingen), Benediction  (Stevens/ ), Adrenaline Engines  (Standridge/ ),DATE of EVENT 04/19/2016 ,Region: 7,1. Barbara Lambrecht,2. Mark Poole,3. Danny Prado,1. Tammy Fedynich,2. Ross Grant,3. Cody Newman
25, 100-Concert Band, North Crowley High School, TEA:, Fort Worth," David Trewitt / Chris Sample, Alex Descoteaux",AAAAAA,Varsity ,2016,116000,2,1,2,2,1,2,2,2, , Washington Grays March (Grafulla/Ed. by Gore)," Watchman, Tell Us of the Night  (Camphouse)", Molly On The Shore  (Grainger/Rogers/SMC),DATE of EVENT 04/19/2016 ,Region: 7,1. Barbara Lambrecht,2. Mark Poole,3. Danny Prado,1. Tammy Fedynich,2. Ross Grant,3. Cody Newman
26, 100-Concert Band, North Side HS, TEA:, Fort Worth, Eric Short,AAAAA,Non-Varsity ,2016,117144,2,2,2,2,2,2,3,2, , Miss Liberty March (John Edmondson), Capriol Suite (Warlock/Longfield), Medieval Legend (Michael Story),DATE of EVENT 04/19/2016 ,Region: 7,1. Barbara Lambrecht,2. Mark Poole,3. Danny Prado,1. Tammy Fedynich,2. Ross Grant,3. Cody Newman
27, 100-Concert Band, O.D. Wyatt HS, TEA:, Fort Worth," Hollis Gordon / Marcus Brookins, Ralph Rogers, Kassandra Osborne",AAAAA,Non-Varsity A,2016,116540,1,2,2,2,1,1,1,1,2, Toccata For Band (Frank Erickson), As Twilight Falls (Robert Sheldon), Loyalty Concert March (Larry Clark),DATE of EVENT 04/19/2016 ,Region: 7,1. Barbara Lambrecht,2. Mark Poole,3. Danny Prado,1. Tammy Fedynich,2. Ross Grant,3. Cody Newman
28, 100-Concert Band, Paschal HS, TEA:, Fort Worth, Brian Taylor,AAAAAA,Sub Non-Varsity A,2016,115934,1,2,2,2,1,1,1,1,2, J. S. Jig  (Karrick/ ), Aria Cantabile  (Erickson/ ), The American Way (King/Swearingen),DATE of EVENT 04/19/2016 ,Region: 7,1. Barbara Lambrecht,2. Mark Poole,3. Danny Prado,1. Tammy Fedynich,2. Ross Grant,3. Cody Newman
29, 100-Concert Band, Paschal HS, TEA:, Fort Worth, Bryan Wright,AAAAAA,Varsity ,2016,111885,1,2,2,2,1,1,1,1,1, March of the Women Marines (Saverino), Molly On The Shore  (Grainger/Rogers/SMC), Symphony No. 3 for Band (play at least two mvts) (Giannini/ ),DATE of EVENT 04/19/2016 ,Region: 7,1. Barbara Lambrecht,2. Mark Poole,3. Danny Prado,1. Tammy Fedynich,2. Ross Grant,3. Cody Newman
30, 100-Concert Band, Paschal HS, TEA:, Fort Worth, Mark De Hertogh,AAAAAA,Non-Varsity ,2016,116023,1,2,1,1,1,1,1,1,C, Bonds of Unity (King/Swearingen), Joy Revisited  (Ticheli/ ), A Longford Legend (play all) (Sheldon/ ),DATE of EVENT 04/19/2016 ,Region: 7,1. Barbara Lambrecht,2. Mark Poole,3. Danny Prado,1. Tammy Fedynich,2. Ross Grant,3. Cody Newman
31, 100-Concert Band, Polytechnic HS, TEA:, Fort Worth, Albert Canales,AAAAA,Non-Varsity ,2016,117116,3,2,3,3,3,3,4,3, , In Heaven's Air  (Hazo/ ), Torch of Liberty (K.L. King), La Madre de los Gatos  (Beck/ ),DATE of EVENT 04/19/2016 ,Region: 7,1. Barbara Lambrecht,2. Mark Poole,3. Danny Prado,1. Tammy Fedynich,2. Ross Grant,3. Cody Newman
32, 100-Concert Band, South Hills HS, TEA:, Fort Worth, Andy Shears / Garrett Adams,AAAAA,Non-Varsity ,2016,110315,2,2,2,2,2,1,2,2, , Conquista (David Shaffer), Black Forest Overture (Michael Sweeney), Sparks (Brian Balmages),DATE of EVENT 04/19/2016 ,Region: 7,1. Barbara Lambrecht,2. Mark Poole,3. Danny Prado,1. Tammy Fedynich,2. Ross Grant,3. Cody Newman
33, 100-Concert Band, Southwest HS, TEA:, Fort Worth," Armando Vera / Emmanuel Flores, Stacey Dunn, Jeff Demaagd",AAAAA,Sub Non-Varsity A,2016,116965,1,1,1,1,1,1,1,1,C, The Expert March (H.A. VanderCook / Mark Grauer), Mosswood Lullaby (Brian Beck), Black Forest Overture (Michael Sweeney),DATE of EVENT 04/19/2016 ,Region: 7,1. Barbara Lambrecht,2. Mark Poole,3. Danny Prado,1. Tammy Fedynich,2. Ross Grant,3. Cody Newman
34, 100-Concert Band, Southwest HS, TEA:, Fort Worth," Jeff De Maagd / Stacey Dunn, Armando Vera, Manny Flores",AAAAA,Non-Varsity ,2016,116955,1,1,1,1,1,1,1,1,C, Kiefer's Special (Kiefer/Rhea), October  (Whitacre/ ), Euphoria  (Frantzen/ ),DATE of EVENT 04/19/2016 ,Region: 7,1. Barbara Lambrecht,2. Mark Poole,3. Danny Prado,1. Tammy Fedynich,2. Ross Grant,3. Cody Newman
35, 100-Concert Band, Southwest HS, TEA:, Fort Worth, Stacey Dunn,AAAAA,Varsity ,2016,116971,1,1,1,1,1,1,1,1,A, Rolling Thunder (Fillmore), Irish Tune (from County Derry)  (Grainger/Rogers/SMC), Symphony No. 3 Slavyanskaya  (Kozhevnikov/Bourgeois),DATE of EVENT 04/19/2016 ,Region: 7,1. Barbara Lambrecht,2. Mark Poole,3. Danny Prado,1. Tammy Fedynich,2. Ross Grant,3. Cody Newman
36, 100-Concert Band, Southwest HS, TEA:, Fort Worth, Stacey Dunn,AAAAA,Sub Non-Varsity B,2016,116963,1,1,1,1,2,2,2,2,2, Testament Fanfare (William Owens), Song of Hope  (Swearingen ), Atlantis  (McGinty ),DATE of EVENT 04/19/2016 ,Region: 7,1. Barbara Lambrecht,2. Mark Poole,3. Danny Prado,1. Tammy Fedynich,2. Ross Grant,3. Cody Newman
37, 100-Concert Band, Trimble Tech HS, TEA:, Fort worth, Earnest Colvin / Travis Ball,AAAAA,Varsity ,2016,115815,2,1,2,2,1,1,1,1,1, Come Sweet Death  (Bach/Reed), Chester Overture for Band  (Schumann/Billings ), Suspiros de Espana (Alvarez/Wiley),DATE of EVENT 04/19/2016 ,Region: 7,1. Barbara Lambrecht,2. Mark Poole,3. Danny Prado,1. Tammy Fedynich,2. Ross Grant,3. Cody Newman
38, 100-Concert Band, Weatherford High School, TEA:, Weatherford, Brian Gill,AAAAAA,Non-Varsity ,2016,115279,2,1,1,1,1,1,1,1,C, The Black Horse Troop (Sousa/Fennell), Steel  (Standridge/ ), Summer Dances  (Balmages/ ),DATE of EVENT 04/19/2016 ,Region: 7,1. Barbara Lambrecht,2. Mark Poole,3. Danny Prado,1. Tammy Fedynich,2. Ross Grant,3. Cody Newman
39, 100-Concert Band, Weatherford High School, TEA:, Weatherford, James Buckner,AAAAAA,Varsity ,2016,111272,1,1,1,1,1,1,1,1,A, The Battle of Shiloh (Barnhouse/Paynter), Rocky Point Holiday  (Nelson)," Symphony in Bb, mvt. I (Hindemith)",DATE of EVENT 04/19/2016 ,Region: 7,1. Barbara Lambrecht,2. Mark Poole,3. Danny Prado,1. Tammy Fedynich,2. Ross Grant,3. Cody Newman
40, 100-Concert Band, Weatherford High School, TEA:, Weatherford, Luvin Villarreal,AAAAAA,Sub Non-Varsity A,2016,115144,2,3,3,3,2,2,1,2, , St. Petersburg March (Vinson), Journey Down Niagara  (Tucker), Fantasy on a Fiddle Tune  (LaPlante),DATE of EVENT 04/19/2016 ,Region: 7,1. Barbara Lambrecht,2. Mark Poole,3. Danny Prado,1. Tammy Fedynich,2. Ross Grant,3. Cody Newman
41, 100-Concert Band, Western Hills HS, TEA:, Fort Worth," Meggan Hinds / Phillip Cadenhead, Spencer Crawford",AAAAA,Non-Varsity ,2016,116916,3,3,3,3,3,2,2,2, , The Streets of Madrid  (John Moss), The Wexford Carol  (Anne McGinty), Dolce and Dance (Gary Fagan),DATE of EVENT 04/19/2016 ,Region: 7,1. Barbara Lambrecht,2. Mark Poole,3. Danny Prado,1. Tammy Fedynich,2. Ross Grant,3. Cody Newman
42, 100-Concert Band, Western Hills HS, TEA:, Fort Worth," Phillip Cadenhead / Meggan Hinds, Spencer Crawford",AAAAA,Varsity ,2016,116915,1,2,2,2,1,1,1,1,1, Manhattan Beach (Sousa/ Fennell), A Longford Legend (play all) (Sheldon/ ), Sun Dance  (Ticheli/ ),DATE of EVENT 04/19/2016 ,Region: 7,1. Barbara Lambrecht,2. Mark Poole,3. Danny Prado,1. Tammy Fedynich,2. Ross Grant,3. Cody Newman
