,0,1,2,3,4,5,6,7,8,9,10,11,12,13,14,15,16,17,18,19,20,21,22,23,24,25,26,27,28
0, 100-Concert Band, Cade MS, TEA:, Victoria, Miranda Partida,CC,Non-Varsity ,2019,143003,2,2,2,2,1,1,1,1,2, Nottingham Castle  (Daehn), Elizabethan Dance  (Williams), Spitfire (Story),DATE of EVENT 03/06/2019 ,Region: 14,"1. Blaylock, Richard","2. Page, April","3. Strickland, George","1. Cantu, Rolando","2. Duran, Roger","3. Ewing, Craig"
1, 100-Concert Band, Cade MS, TEA:, Victoria, Miranda Partida,CC,Varsity ,2019,141565,1,1,1,1,1,1,1,1,C, Cold Brook March  (John O'Reilly),  A Joyful Journey (Robert Sheldon), Fireball! (Brian Beck),DATE of EVENT 03/06/2019 ,Region: 14,"1. Blaylock, Richard","2. Page, April","3. Strickland, George","1. Cantu, Rolando","2. Duran, Roger","3. Ewing, Craig"
2, 100-Concert Band, Howell Middle School, TEA:, Victoria, Paula Smolik,CC,Varsity ,2019,141099,1,1,1,1,1,1,1,1,C, Darklands March (Randall Standridge), Down by the Salley Gardens (Michael Sweeney)," Moscow, 1941 (Brian Balmages)",DATE of EVENT 03/06/2019 ,Region: 14,"1. Blaylock, Richard","2. Page, April","3. Strickland, George","1. Cantu, Rolando","2. Duran, Roger","3. Ewing, Craig"
3, 100-Concert Band, Howell Middle School, TEA:, Victoria, Paula Smolik,CC,Non-Varsity ,2019,141097,1,1,1,1,2,1,1,1,D, March Primo (Dennis Eveland), Night Fury (Carol Brittin Chambers), Armory (Randall Standridge),DATE of EVENT 03/06/2019 ,Region: 14,"1. Blaylock, Richard","2. Page, April","3. Strickland, George","1. Cantu, Rolando","2. Duran, Roger","3. Ewing, Craig"
4, 100-Concert Band, Patti Welder Magnet MS, TEA:, Victoria, Jennings Gonzalez,CC,Non-Varsity ,2019,141267,3,2,3,3,3,1,2,2, , Dance Celebration  (Smith), Big Sky Round-Up  (Sheldon), March for Freedom (James Swearingen),DATE of EVENT 03/06/2019 ,Region: 14,"1. Blaylock, Richard","2. Page, April","3. Strickland, George","1. Cantu, Rolando","2. Duran, Roger","3. Ewing, Craig"
5, 100-Concert Band, Patti Welder Magnet MS, TEA:, Victoria, Jennings Gonzalez,CC,Varsity ,2019,141264,1,2,1,1,1,1,1,1,C, Bazaar  (Standridge), Kenya Contrasts  (Himes), Pinnacle of Distinction (Clark),DATE of EVENT 03/06/2019 ,Region: 14,"1. Blaylock, Richard","2. Page, April","3. Strickland, George","1. Cantu, Rolando","2. Duran, Roger","3. Ewing, Craig"
6, 100-Concert Band, Stroman Middle School, TEA:, Victoria," Michael Cason / Carlos Gonzalez, Philip Welder",CC,Varsity ,2019,142261,3,2,2,2,2,2,1,2, , The Screaming Eagles (Concert March) (John Edmondson), Sea Song Trilogy  (McGinty), Expectations  (Clark),DATE of EVENT 03/06/2019 ,Region: 14,"1. Blaylock, Richard","2. Page, April","3. Strickland, George","1. Cantu, Rolando","2. Duran, Roger","3. Ewing, Craig"
7, 100-Concert Band, Travis MS, TEA:, Port Lavaca," Kathryn Myers / Chris Hamelwright, Brian Hecimovich",CC,Non-Varsity ,2019,142825,2,1,1,1,1,2,2,2,2, Ming Court  (Pitter), Plaza de Toros  (Story), Fortitude (Owens),DATE of EVENT 03/06/2019 ,Region: 14,"1. Blaylock, Richard","2. Page, April","3. Strickland, George","1. Cantu, Rolando","2. Duran, Roger","3. Ewing, Craig"
8, 100-Concert Band, Travis MS, TEA:, Victoria, Chris Hamelwright,CC,Varsity ,2019,141756,1,1,1,1,1,1,1,1,C, Two Renaissance Sketches  (Stalter), The Rowan Tree  (Standridge), Fort Canterbury March (Holsinger),DATE of EVENT 03/06/2019 ,Region: 14,"1. Blaylock, Richard","2. Page, April","3. Strickland, George","1. Cantu, Rolando","2. Duran, Roger","3. Ewing, Craig"
